Username,location,date,content,Rating
Barbra,US,"Nov 12, 2024Verified","I received my kit promptlyI received my kit promptly.   The instructions were clear. Everything I needed was included in the kit and my test results were sent quickly.I will certainly use Let'sGetChecked again in the future.Date of experience: November 12, 2024",5
Kathryn,US,"Dec 24, 2024Verified","Test is accurateTest is accurate. Questions always answered promptly. Date of experience: December 19, 2024",5
Pamela V,US,"Dec 11, 2024Verified","Quick AnswerThe results arrived quickly. Very  easy to understand. Great report formatDate of experience: December 06, 2024",5
James,US,"Jan 2, 2025Verified","Quick and easy Quick, convenient and easyDate of experience: December 28, 2024",5
Braidon,US,"Oct 6, 2024Verified","Almost perfect!Would be 5 stars, but the amount of bloof needed to full the sample vile is quite a lot. This would be more reasonable if I received more than 3 lancers. Thankfully my partner is a nurse and she was able to draw my blood once I ran out of lancers. Otherwise fast and easy results!Date of experience: October 01, 2024",4
Kailey,US,"Nov 22, 2024Verified","The peace of mind The peace of mind knowing that my test will be processed quickly and accurately is unmatched. Date of experience: November 22, 2024",5
James,US,"Dec 5, 2024Verified","My test was delivered on timeMy test was delivered on time, and results were available within a few days. Date of experience: November 30, 2024",5
Jennifer,US,"Nov 16, 2024Verified","100% recommend Fast shipping both ways. Detailed instructions. Results within a day, so faster than expected results. Online results with offers to communicate with a professional if needed. Date of experience: November 15, 2024",5
Naomi,US,"Oct 5, 2024Verified","I'm not sure if this blood test is…I'm not sure if this blood test is worthwhile because cortisol does go up and down. I'm appreciative of the quick turnaround time. Date of experience: September 30, 2024",5
PATRICK,US,"Sep 27, 2024Verified","I was happy to get the report for my…I was happy to get the report for my test, but the package apparently got lost in transit, though the UPS app said it was delivered to LetsGetChecked.  I felt that the activation process using the QR code was confusing.  By ""confusing"" I mean that to me it appeared I had activated my test (Colon Test), but apparently I did not.  I tried to find out if I had done something incorrectly, but I'm still not sure if I made a mistake.  I probably won't use the QR code in the future.  There was also some confusion about the status of my test ... so that when I made an inquiry I was told that the test results were available, but they were not.  It took an extra email or two to straighten that out.  I had just decided to forget about the report for the test results, and that I'd just buy another test in a few months, when I received an email that my test had been found and that the report would be available soon.  I was very happy to get the report. Date of experience: September 16, 2024",3
Vicki Warden,US,"Oct 31, 2024Verified","Detailed and thoroughThe instructions for completing the sample are thorough and detailed. I was surprised at how quickly I received the results. Date of experience: October 30, 2024",5
Lisa ,US,"Nov 14, 2024Verified","Would highly recommend for any testing…Would highly recommend for any testing needs! Quick results and someone available to speak with if need be!Date of experience: November 14, 2024",5
Brandon,US,"Nov 23, 2024Verified","The process was so fast and easyThe process was so fast and easy. I had my results 48 hours after dropping off my package at the post office!Date of experience: November 23, 2024",5
Svetlana,US,"Nov 10, 2024Verified","It was a great experienceIt was a great experience! Fast delivered easy instructions and fast lab results. Thank you!Date of experience: November 05, 2024",5
Judith,US,"Sep 26, 2024Verified","Collection tube is trickyVery quick to results. Reports written clearly. Easy to use website. Only issue is you should emphasize that to close the collection tube to push down. I turned it then it promptly fell over and spilled out the sample. That removed a star. Date of experience: September 26, 2024",4
Denis Cronin,IE,"Dec 24, 2024Verified","Very easy to understand and access.Date of experience: December 24, 2024",5
A Loyal Customer,US,"Oct 4, 2024Verified","I am so impressedI am so impressed! The speed of kit delivery, the quality of the kit, the rapid test results and updates have all been amazing!Date of experience: October 04, 2024",5
Robert,US,"Sep 30, 2024Verified","The instructions were clearThe instructions were clear.  There was a UPS center nearby.  The tracking told me exactly when the kit arrived in the lab.  The lab results are easy to access.  Date of experience: September 27, 2024",5
carmen myers,US,"Dec 4, 2024Verified","Fast Results! Much appreciated holiday delayed delivery To lab but…The holiday delayed delivery To lab but once it did, it was very fast. Thanks so muchDate of experience: December 04, 2024",5
Stacey JB,US,"Oct 27, 2024Verified","Site & results Easy direction on how to use the tests & results in a timely manner. Site is very easy to navigate as well. Date of experience: October 22, 2024",5
BONNIE,US,"Dec 1, 2024Verified","Instructions were easy to followInstructions were easy to follow. Very easy process. Quick results.Date of experience: November 26, 2024",5
Peter,US,"Sep 26, 2024Verified","Great overall experienceInstructions in the package and on the site were very clear. Results were received much quicker than I expected!Date of experience: September 26, 2024",5
August J Mosco,US,"Dec 27, 2024Verified","speed and professionalismYour speed and professionalism made my experience meaningful. I'll continue to use you.Date of experience: December 27, 2024",5
Junior,US,"Oct 12, 2024Verified","Was very easy and smooth processWas very easy and smooth process.  Got test results in about two days. You get what you pay for.  Absolutely wonderful!!!!Date of experience: October 12, 2024",5
Stacey,US,"Oct 31, 2024Verified","Testing results were back sooner than…Testing results were back sooner than expected.  The whole process was seamless.  I would definitely recommend them.Date of experience: October 31, 2024",5
Happy Consumer ✨️,US,"Oct 16, 2024Verified","Ordering from Let's Get Checked was…Ordering from Let's Get Checked was quick and easy. The results were received from a trusting medical professional.Date of experience: October 16, 2024",5
Bruno Lombard,US,"Nov 11, 2024Verified","Did the test with the same sample used…Did the test with the same sample used for my physical.LDL (with lab) was 125 and yours was 142.Not sure it's you or them (or both) but they did draw blood versus the drip. So I don't know who's accurate!Date of experience: November 08, 2024",3
Kam,US,"Oct 19, 2024Verified","Great experience Fast shipping of the test. Easy explanations and I was able to follow the process through every step.Date of experience: October 19, 2024",5
James,US,"Nov 24, 2024Verified","I got my results quicklyI got my results quickly, almost the very same day that they received the kitDate of experience: November 24, 2024",5
David,US,"Oct 10, 2024Verified","My test results were returned quickly…My test results were returned quickly (within two days) and when I called in with a question I was kindly helped. My thanks to the people at Let's Get Checked.Date of experience: October 04, 2024",5
Julie,US,"Nov 27, 2024Verified","Extremely fast resultsExtremely fast results! I love being able to test at home and view the results on my phone. Date of experience: November 22, 2024",5
Amy,US,"Sep 25, 2024Verified","Positive! The whole process is fast and convenient! Please offer more tests like iron and estrogens.Date of experience: September 25, 2024",5
Ervin,US,"Nov 21, 2024Verified","The privacy and the speed of execution…The privacy and the speed of execution of getting my results back quickly. Date of experience: November 21, 2024",5
William,US,"Nov 27, 2024Verified","Fast and easy to use with no hassle…Fast and easy to use with no hassle return shipping.  Easy to access results. Date of experience: November 26, 2024",5
Mrs Rose Evans,GB,"Sep 26, 2024Verified","Very prompt serviceVery prompt service. Posted test on Tuesday and had results back late Wednesday.Date of experience: September 26, 2024",5
Earl Evans,CA,"Oct 17, 2024Verified","Very satisfiedVery satisfied with the service and the responses that I received from Let's get checked. Date of experience: October 17, 2024",5
Sonia ,IE,"Nov 6, 2024Verified","Efficient, easy and fantastic serviceLet's get checked is a fantastic service. Very efficient and easy Date of experience: November 01, 2024",5
Elizabeth,US,"Oct 26, 2024Verified","Fast resultsFast results - I took the sample to a UPS store Monday afternoon,  October 21, and received my results on October 24. Date of experience: October 26, 2024",5
Bob,US,"Nov 6, 2024Verified","Easy process to useEasy process to use, tracking and follow up was well performed.Date of experience: November 06, 2024",5
Logan,US,"Nov 28, 2024Verified","SimpleSimple, easy to follow instructions and fast results.Date of experience: November 28, 2024",5
Archie,US,"Oct 12, 2024Verified","The kit was turnkeyThe kit was turnkey! I had all the materials needed and the process was simply and easy to followDate of experience: October 12, 2024",5
Pam  Olmeda,US,"Dec 6, 2024Verified","Perfect numbers all the timePerfect numbers all the time. Very accurate Date of experience: December 02, 2024",5
Tyler,US,"Sep 27, 2024Verified","Mostly GoodThe results were great, though the nurse I asked to explain my results was very unhelpful.Date of experience: September 27, 2024",4
Richard,US,"Dec 18, 2024Verified","This was easy fast and accurateThis was easy fast and accurate. Thank you  LGCDate of experience: December 18, 2024",5
George Playle,GB,"Oct 30, 2024Verified","So efficient So easy to use the kits and very quick…So easy to use the kits and very quick turnaround. Have used them before and will continue to use them Date of experience: October 30, 2024",5
Ruth,US,"Sep 24, 2024Verified","QuickQuick, easy,effective,  reliable! Loved the ease and simplicity! Thank you!Date of experience: September 24, 2024",5
Mary,IE,"Nov 19, 2024Verified","The instructions were clear and test…The instructions were clear and test results prompt. Thanks.Date of experience: November 19, 2024",5
James E,US,"Nov 2, 2024Verified","Great process and updated my test…Great process and updated my test status almost daily Date of experience: November 02, 2024",5
BERLY JOSEPH,IE,"Nov 5, 2024Verified","Really Quick and straight forward…Really Quick and straight forward service.All steps explained well.Date of experience: November 05, 2024",5
Kristen,US,"Nov 22, 2024Verified","I would use this company again! The instructions were clear and the results were fast.Date of experience: November 22, 2024",5
DFP,US,"Sep 27, 2024Verified","Easy steps for the collection processEasy steps for the collection process. Very fast with results.Date of experience: September 27, 2024",5
Duke,US,"Oct 3, 2024Verified","Super Fast and Easy Super fast and easy.  The results are clear, concise, and complete.  Date of experience: October 03, 2024",5
Robert Van Gilder,US,"Nov 14, 2024Verified","Easy to follow instructionsEasy to follow instructionsVery fast resultsDate of experience: November 14, 2024",5
Roger,US,"Nov 15, 2024Verified","Accurate analysisYou analyzed the blood and gave results for the eact tests I asked for.Date of experience: November 08, 2024",5
April Lilly,US,"Nov 20, 2024Verified","Fast resultsFast, Efficiant, accurate results but could be less costly.  Date of experience: November 20, 2024",5
Traci,US,"Dec 24, 2024Verified","Easy to do and very quick resultsEasy to do and very quick results. Thank You! Date of experience: December 24, 2024",5
STEPHEN,US,"Oct 25, 2024Verified","easy and FASTvery easy to complete.  rapid turn around with resultsDate of experience: October 25, 2024",5
customer,US,"Oct 16, 2024Verified","Fast resultsFast results and the kit was very easy and straightforward to use. Date of experience: October 11, 2024",5
Sa,US,"Nov 26, 2024Verified","Very easy instructionsVery easy instructions.  Quick results. Date of experience: November 26, 2024",5
Raymond McKee,GB,"Nov 11, 2024Verified","Fast with good turnaround timesRapid dispatch of sampling material; fast turnaround and clear display of results.Date of experience: November 11, 2024",5
Jordan,US,"Dec 10, 2024Verified","Got my test resultsGot my test results. Great way to keep a check on things. Will do again Date of experience: December 05, 2024",5
Henry,US,"Dec 5, 2024Verified","Fast service and updates.Date of experience: December 05, 2024",5
customer,US,"Nov 27, 2024Verified","Fast turnaround and easy readingDate of experience: November 27, 2024",5
Ward,US,"Oct 4, 2024Verified","Very good serviceVery good service. Highly recommend these folks.Date of experience: October 04, 2024",5
Sherie  Kelly,US,"Oct 18, 2024Verified","Good experienceQuick results!  Much quicker than I expected.Date of experience: October 17, 2024",5
Theresa,US,"Oct 25, 2024Verified","Great service and an awesome way to…Great service and an awesome way to keep your health in check Date of experience: October 25, 2024",5
Harry,US,"Oct 16, 2024Verified","Good experienceTimely results & follow up call from nurse. I think it’s a good first step. Would do it again too.Date of experience: October 16, 2024",5
A.D. ,US,"Nov 7, 2024Verified","Very thorough and clear instructions to…Very thorough and clear instructions to follow Date of experience: November 07, 2024",5
Marina,IE,"Nov 10, 2024Verified","Superb serviceSuperb service, rapid response from nurse if results are abnormal. Date of experience: November 05, 2024",5
Lexi,US,"Dec 16, 2024Verified","Easy to follow instructionsEasy to follow instructions, discrete mailing envelope and good customer serviceDate of experience: December 10, 2024",5
heather harster,US,"Oct 7, 2024Verified","Quick results and the process is easy…Quick results and the process is easy and painless!Date of experience: October 05, 2024",5
Geraldine,US,"Nov 9, 2024Verified","Fast delivery of result and easy to…Fast delivery of result and easy to understand the resultDate of experience: November 09, 2024",5
Thomas Hollingsworth,US,"Nov 22, 2024Verified","Fast return of the resultsDate of experience: November 22, 2024",5
Chas,US,"Nov 23, 2024Verified","Great serviceGreat service.  Very discreet.  Very private. Date of experience: November 23, 2024",5
Fabian,US,"Nov 14, 2024Verified","Great instructions. Easy and discrete. Quick test results. Discrete and simple. Date of experience: November 07, 2024",5
suzanne s,US,"Oct 16, 2024Verified","Easy to doVery easy to do and instructions were easy to follow.Date of experience: October 11, 2024",4
Sean,GB,"Nov 9, 2024Verified","Great service Easy to collect sample. Results came back very quickly. Date of experience: November 09, 2024",5
Caitriona,IE,"Sep 24, 2024Verified","Quick turnaround with detailed report…Quick turnaround with detailed report for resultsDate of experience: September 24, 2024",5
Rudy C.,US,"Oct 15, 2024Verified","Amazing quick turnaround and easy to…Amazing quick turnaround and easy to follow instructions Date of experience: October 10, 2024",5
Andrew,US,"Dec 7, 2024Verified","Well priced, fast and easy.The service was very well priced, fast and easy.Date of experience: December 07, 2024",5
Ted,US,"Nov 7, 2024Verified","Fast resultsFast results.  Easy and simple process.Date of experience: November 07, 2024",5
Kathleen,US,"Nov 15, 2024Verified","Super easy and more affordable.Date of experience: November 10, 2024",5
Sarah,US,"Oct 25, 2024Verified","So easySo easy. Results available very quickly. Date of experience: October 25, 2024",5
robert,US,"Oct 19, 2024Verified","I got my results one day after sending…I got my results one day after sending it. Date of experience: October 19, 2024",5
Brandon,US,"Sep 27, 2024Verified","Very quick turnaroundVery quick turnaround! Timely response. Date of experience: September 27, 2024",5
KJ,US,"Oct 24, 2024Verified","Easy and seamless process.Easy and seamless process. Date of experience: October 24, 2024",5
T. Craig,US,"Oct 30, 2024Verified","The customer is greatThe customer is great Date of experience: October 30, 2024",5
Paul,US,"Oct 16, 2024Verified","FastFast, easy and hopefully accurate. Date of experience: October 16, 2024",5
Jill,US,"Oct 18, 2024Verified","Excellent service prompt and fastDate of experience: October 13, 2024",5
KW,US,"Oct 9, 2024Verified","Shipping was very fastShipping was very fast.  Results came back fast too.Date of experience: October 09, 2024",5
garry,IE,"Dec 4, 2024Verified","very easy test and very quick resultsDate of experience: November 29, 2024",5
Jill,US,"Nov 1, 2024Verified","Great experience It was great to get the results so quick and it was easy Date of experience: November 01, 2024",5
Joey Robertson,US,"Sep 28, 2024Verified","EasyEasy, fast, and accurate!Date of experience: September 28, 2024",5
Matt,US,"Sep 23, 2024Verified","Very fast and convenient!Date of experience: September 18, 2024",5
brian bailey,US,"Dec 6, 2024Verified","Fast and efficient processFast and efficient process Date of experience: December 06, 2024",5
Ed,US,"Nov 13, 2024Verified","Great serviceThe test was easy and the results came quickly.Date of experience: November 08, 2024",5
Jim McCulley,US,"Nov 25, 2024Verified","Very easy and fast resultsVery easy and fast results.  Thank you!Date of experience: November 24, 2024",5
John,US,"Nov 22, 2024Verified","Quick and easy process.Date of experience: November 22, 2024",5
John,US,"Nov 14, 2024Verified","Fast as usual!Date of experience: November 14, 2024",5
kikicurtis,US,"Oct 25, 2024Verified","Easy peasyEasy peasy. Got my results in less than 3 days Date of experience: October 25, 2024",5
Ac,US,"Nov 27, 2024Verified","Quick and easy and discreetDate of experience: November 22, 2024",5
customer,US,"Oct 19, 2024Verified","Fast serviceFast service Date of experience: October 19, 2024",5
Kimberly,US,"Oct 9, 2024Verified","Quick response!Date of experience: October 04, 2024",5
Anto Miscio,US,"Nov 19, 2024Verified","Easy and QuickQuick and easy experience.  Date of experience: November 14, 2024",5
Mary Madrid,US,"Nov 23, 2024Verified","testing is too complicatedDate of experience: November 23, 2024",2
Rain,US,"Nov 13, 2024Verified","SimpleFast and easy service.Date of experience: November 08, 2024",5
Jack,US,"Nov 12, 2024Verified","Confidential Medical ScreenIt was easy, affordable, and confidentially secure. Date of experience: November 12, 2024",5
Cynthia,US,"Oct 19, 2024Verified","Excellent prompt follow upExcellent prompt follow up.  Great directions. Date of experience: October 19, 2024",5
david,US,"Oct 26, 2024Verified","easy and direct resultseasy and direct Date of experience: October 26, 2024",5
Bob,US,"Oct 9, 2024Verified","Fast turnaroundFast turnaround. Easy instructions. Date of experience: October 04, 2024",5
Chris McDonald,US,"Nov 13, 2024Verified","Professional and timelyVery professional and timely results.Date of experience: November 13, 2024",5
Anthony,US,"Oct 2, 2024Verified","Quick turnaround time was greatQuick turnaround time was great. Easy to use kitDate of experience: September 27, 2024",5
Sa,US,"Oct 9, 2024Verified","Thumbs up.Easy, with quick results. Date of experience: October 04, 2024",5
customer,US,"Sep 23, 2024Verified","Amazing The product and results came back fast. Date of experience: September 18, 2024",5
Chris,US,"Oct 25, 2024Verified","Easy instructions and excellent…Easy instructions and excellent response timeDate of experience: October 24, 2024",5
Ryan Rostine,US,"Nov 24, 2024Verified","Very timelyVery timely. Easy to test. Easy to mail back. Date of experience: November 24, 2024",5
Derek,US,"Oct 10, 2024Verified","Easy directionsEasy directions, fast results!Date of experience: October 10, 2024",5
customer,US,"Sep 26, 2024Verified","EasyEasy, straight forward directions!Date of experience: September 21, 2024",5
ALTON GILBERT,US,"Sep 22, 2024Verified","Results took four days.Results took four days. Date of experience: September 22, 2024",3
Robin,US,"Nov 28, 2024Verified","Great communicationGreat communication, great instructions, quick processing.Date of experience: November 28, 2024",5
mandyshep,GB,"Nov 12, 2024Verified","Fast & efficient serviceFast & efficient service. Would definitely recommend. Date of experience: November 12, 2024",5
patrick rini,US,"Dec 7, 2024Verified","Easy instructionsDate of experience: December 07, 2024",5
John,US,"Dec 10, 2024Verified","It was simple.It was simple. Date of experience: December 05, 2024",4
Matt,GB,"Nov 14, 2024Verified","Very easy and very quickDate of experience: November 14, 2024",5
Payton,US,"Nov 28, 2024Verified","Fast and easy!Date of experience: November 28, 2024",5
Michael,US,"Oct 25, 2024Verified","Quick resultsGood turn around time. Date of experience: October 25, 2024",5
mark,US,"Nov 28, 2024Verified","Thank you!!!!!!Date of experience: November 28, 2024",5
Matt Lovell,US,"Oct 26, 2024Verified","Very fast thank you!!Date of experience: October 26, 2024",5
Todd,US,"Nov 21, 2024Verified","AwesomeExcellent customer service Date of experience: November 21, 2024",5
AG,US,"Nov 14, 2024Verified","EasyEasy, convenient, reliable. Date of experience: November 12, 2024",5
GINGER ROBINSON,US,"Sep 30, 2024Verified","CaringCaring, efficient, informative, professional. Date of experience: September 28, 2024",5
Natalie Stewart,US,"Nov 7, 2024Verified","Easy and fastDate of experience: November 07, 2024",5
Kurtis,US,"Oct 17, 2024Verified","Incredibly fast.Date of experience: October 17, 2024",5
Holly,US,"Sep 22, 2024Verified","Quick and easy way to test without…Quick and easy way to test without messing with appointments and missed time from work Date of experience: September 17, 2024",5
Corey,US,"Sep 21, 2024Verified","Ease of taking the test and getting…Ease of taking the test and getting results Date of experience: September 21, 2024",5
Beata,US,"Sep 21, 2024Verified","Great and quick!Great and quick!Date of experience: September 20, 2024",5
DB,US,"Sep 20, 2024Verified","Good service only thing I struggled…Good service only thing I struggled with was getting enough blood to fill test tube to right level.Date of experience: September 20, 2024",4
Laura,US,"Sep 20, 2024Verified","Easy and quick to take a colon cancer…Easy and quick to take a colon cancer test from home! Date of experience: September 20, 2024",5
ANDREW PAPENHAGEN,US,"Sep 20, 2024Verified","Very simple process and quick resultsVery simple process and quick results. Highly recommend!Date of experience: September 20, 2024",5
Theresa,US,"Sep 20, 2024Verified","Every step of the process was easy to…Every step of the process was easy to understand and follow.  The results were quick and clearly defined.Date of experience: September 20, 2024",5
Steven,GB,"Sep 20, 2024Verified","This is my third time with Let's Get…This is my third time with Let's Get Checked, and as usual, everything from start to finish was effortless. I would highly recommend this company.Date of experience: September 20, 2024",5
Lele,US,"Sep 19, 2024Verified","Great instructions, ease of use and quick resultsGreat instructions, ease of use and quick results. Will use again!Date of experience: September 14, 2024",5
Joyce,US,"Sep 19, 2024Verified","The past several kits I have used…vibratorThe past several kits I have used included a little vibrator that really helped me get a good sample quickly.This kit didn't have it and I had a really hard time getting enough blood.Date of experience: September 16, 2024",4
Heather,US,"Sep 18, 2024Verified","Simple and easyDate of experience: September 18, 2024",5
Terri Hall,US,"Sep 18, 2024Verified","I love doing my own home blood testI love doing my own home blood test, it was quick and easy to use and send back. I saved so much time and money doing it myself.Date of experience: September 18, 2024",5
Louise Tamayo,US,"Sep 18, 2024Verified","Drawing the blood was so challengingDrawing the blood was so challenging, the collection method was difficult.   Date of experience: September 18, 2024",3
Pete,US,"Sep 18, 2024Verified","The urine collection was eaasyThe urine collection was eaasy, but the collection of the blood was horrible. Pricking the finger was fine, but getting ithe blood into the collection tube was HORRIBLE.. Perhaps a pipett for the blood..Date of experience: September 18, 2024",3
Kurt,US,"Sep 18, 2024Verified","Exceptionally quick results and great…Exceptionally quick results and great communication about the process and timelines.Date of experience: September 18, 2024",5
Tom S,US,"Sep 16, 2024Verified","Customer service was very helpful.Customer service was very helpful.  Date of experience: September 15, 2024",5
Brenda,US,"Sep 15, 2024Verified","we really appreciated how speedy…we really appreciated how speedy everything was!!  and also how easy it was to do everything our self!!Date of experience: September 13, 2024",5
Ruth,US,"Sep 14, 2024Verified","The test is very easy to takeThe test is very easy to take. The the shipping is quick and results a few days after they receive it.  I like that a lab reviews the results. I would recommend this test. Date of experience: September 09, 2024",5
