Username,location,date,content,Rating
Sarah  Cote,CA,3 days ago,"Great value, great product, amazing service The entire process was very easy and the product quality is amazing for the price. Very happy with my purchase. The customer support is also amazing. They forgot to send my second pair of glasses and sent them with no hesitation. Everything arrived within a few business days. 10/10 would recommend Date of experience: January 10, 2025",5
Amanda Yoh Klingenberger,US,6 days ago,"Great pricing until you go to check out…Great pricing until you go to check out and they add $160 processing fee. This is the pop-up ""Dear valued customers,In recent times, we’ve noticed a trend among our competitors, who are displaying extremely low upfront prices online to appear more competitive. Despite our initial reluctance, we’ve needed to adopt this practice at OptiContacts.com due to the impact it had on our traffic and orders, despite our competitive pricing.We want to assure you that OptiContacts.com remains committed to offering the most competitive prices online. Your savings and satisfaction are paramount to us. We invite you to compare our bottom line prices with those of our competitors, confident that we’ll continue to exceed your expectations.Your continued support means everything to us.Warm regards,OptiContacts.com Team""Not a single online provider does this so I'm not sure what ""trend"" they think others are following but I call BS. Complete bait and switch. Date of experience: January 07, 2025",2
Ranzie,US,2 days ago,"Customer Service 2nd to none. Awesome experienceI can not say how very pleased I am with Opticontacts.  This was my 2nd order with them since my 14 year daughter started wearing contacts a few months ago.   My daughter had a special event for this weekend. We had been asking her about her contacts and she kept telling us she had plenty.   Well Sunday night 5 days before the event she tells us she only has 2 of the left eye/RX  none for the right.  We immediately placed an order, and requested that whatever upgrades could be done we would pay.    They responded first thing Monday morning that they would upgrade and get them out ASAP.   Then that afternoon I got a message saying they had to order out for the contacts and I knew then they weren't going to make it.  Well around lunch time Tuesday, I get an email saying your order has shipped and is coming 2 day FEDEX.  We had the contacts on Thursday afternoon.  Unfortunately her event was cancelled as a result of the winter storm in the south, but just the fact that they did all of this to ensure we had what we needed.   This type of customer service exist slim to none these days.   They have made me a long term customer. I am just so pleased with them.   Date of experience: January 01, 2025",5
Sandra Zalik,US,"Jan 4, 2025","Francis was so helpful and…Francis was so helpful and knowledgeable and was able to resolve my issue quickly and without any stress - even though my problem was MY fault due to incorrect selection of my prescription.  Give that man a raise.  Great customer service seems so hard to find these days, so when you find it, it is even more greatly appreciated.  Thanks also go to Opticontacts for their generosity in replacing my entire order.Date of experience: January 04, 2025",5
Christi McLin,US,"Jan 4, 2025","Better prices than anywhere elseThey matched my price from previous order(from 2019). Their contacts are a lot cheaper than 1-800 contacts. I use Bausch and Lomb Ultra contacts. I paid $27 per box, whereas at 1-800 contacts it would have been $40 per box. Shipping was also fast. Even though they charge a processing fee, with the special pricing they have, they were still cheaper than anywhere else.            Date of experience: December 19, 2024",5
Michael Cahill,US,"Jan 4, 2025","I had a problem with an OrderI had a problem with an Order. Ultimately it was My fault, I to entered a wrong character on the order form and then reordered from That wrong order.The Customer Service I recieved was beyond expectation. My service rep (Dennis) was very professional & very easy to understand. Not only did he get the order information corrected he expidited the order and fixed my keystroke mistakes in my order to prevent mishaps from happening in the future .I Highly recomend useing opticontacts. Other companies could Learn a thing or two from how this customer service dept operates.Date of experience: January 04, 2025",5
Customer,US,7 days ago,"Great servicePlaced order today and realized afterwards I ordered wrong lenses, called and Emma was wonderful helping me virtectDate of experience: January 06, 2025",5
Celeste,US,"Dec 24, 2024","Customer service is very responsiveCustomer service is very responsive, helpful and polite. I got a great deal on the contacts I ordered and they shipped super fast. The contacts have very good expiration dates. I am a very happy customer. My only criticism is the handling fee they add at the end of check out. The price you first see is not the price you are actually going to pay. Regardless, I am still happy with the price I paid in comparison to what other places are selling the contacts for. I would have no problem ordering from this company again in the future if they continue to beat out their competition in prices. Thank you opticontacts! Date of experience: December 07, 2024",5
Monique Terrazas-Reaves,US,"Dec 28, 2024","Recommend OptiContacts above any other…Recommend OptiContacts above any other place for your glasses and/or contact needs. Order my daughter’s contacts here and I’ve always received great, fast customer service. Date of experience: December 20, 2024",5
Yvette Williams,US,4 days ago,"Frances is exemplary of an excellent…Frances is exemplary of an excellent customer service representative. He was extremely knowledgeable with the products, fast and patient.Date of experience: January 09, 2025",5
Agatha W,US,"Dec 19, 2024","I’m so fortunate to have ordered thru…I’m so fortunate to have ordered thru Opticontacts.com. First it was very quick ordering process & great price. Secondly, the contacts was sent to an old address on my PayPal account & luckily I had a great representative who assisted in replacing the order. I’m so grateful for them to do this. I will definitely be a loyal customer because they could have easily said no. Not many companies left that have morals and high standards. A+ for customer service! Date of experience: December 19, 2024",5
Kate,US,"Nov 28, 2024","Price Increases Are UnreasonableI have ordered the same contacts from OptiContacts for the last two years. Here's the all in price history for an annual supply of daily 1 lenses: 2022=$555.01, 2023=$593.78 (a 6.5% increase), 2024=$775.96 (a 31% increase, includes black Friday pricing and a $20 gift voucher). This type of increase is uncalled for. I shopped around and found the same contacts at a competitor for a total of $640. Am not likely to check OptiContacts in the future after this experience.Date of experience: November 28, 2024",1
Geebz,US,"Dec 5, 2024","Great Customer ServiceThe glasses I ordered didn’t sit properly on my face and I needed to change the frames for a better fit. When I called customer service, James was extremely helpful (ref#18642405) in fixing the problem. I found him to be very knowledgeable and patient in assessing what size and shape would be best. Choosing frames online can be tricky and I appreciate how much easier and more efficient James made the whole process.Date of experience: December 03, 2024",5
Mary Bradford,US,"Dec 3, 2024","Top Tier Customer Service Contacts are expensive no matter where you shop now so at least this can be a little break here and there. The 5 stars though is for the excellent customer service. It's so few and far between you interact with customer service and don't leave even more frustrated. Service with Opticontacts is efficien, kind and relieving. And that is priceless. Date of experience: November 21, 2024",5
Diane Grayber,US,"Dec 12, 2024","Incredible customer service!Tommy was so helpful!  My prescription was changed in both eyes so I needed to return 2 boxes of contacts and order 2 new boxes of the new prescription. I had tried to place an order earlier and the charge was much higher than I expected. Tommy straightened out the order, gave me a sizable discount, and explained how to return the unopened boxes. Very much appreciated!  This is a great company to work with!Date of experience: December 11, 2024",5
brad wattenberg,US,"Dec 19, 2024","Thanks Tommy!Tommy was extremely helpful. My order wouldn't go through but Tommy was able to place the order and get everything verified manually. He made the process painless for me. Thank you Tommy!Reference #18685448. Date of experience: December 19, 2024",5
Shakira Nicholas,US,"Dec 2, 2024","Always a quick & easy transition when…Always a quick & easy transition when dealing with opti contacts, a wide variety of products to choose from, as well as great deals. I especially want to shout them out for assisting me with some incorrect prescription, I provided to them. They reached out and worked with me to make sure I got my contacts, I was very pleased with overall service!Date of experience: December 02, 2024",5
MMP,US,"Dec 3, 2024","Great customer service!!!!I just got off the phone with your representative James and I was very impressed in how he resolved my situation. He was able to give me a lower price (instead of a price match from another company) and also offer me free shipping!!! He was pleasant, and eager to assist and he exceeded my expectations with my issue. Thank you James and Opticontacts!Date of experience: December 03, 2024",5
Benny Tran,US,"Dec 24, 2024","Scammy as hellScammy as hell. Prices for contacts are cheap but charged $195 for a handling fee after submittingDate of experience: December 23, 2024",1
Karin,US,"Nov 27, 2024","I shopped around for contact lenses and…I shopped around for contact lenses and OptiContacts was by far the least expensive company to get my contacts from. The chat option works wonders and the staff super friendly. Tommy the customer service helped me to get an additional discount for another set of contacts I needed. I didn't have to ask him and to me that's going above and beyond. Thank you OptiContacts and Tommy!Date of experience: November 27, 2024",5
Derek Rizzo,US,"Nov 15, 2024","The shipping company they are partnered…The shipping company they are partnered with is terrible, I ordered my contacts over 2 weeks ago. There was no update on the tracking and I had to email the shipping company to figure out where my contacts were. They said the delivery “failed” so they were too lazy to find my house in a new neighborhood.Date of experience: November 15, 2024",1
Gennifer,US,"Dec 7, 2024","First Time Ordering Contacts Went GreatThis was my first time ordering contacts online. I gave them a call and they provided great customer service. Shout out to Francis 18642370 for helping me with my order. He was efficient, and I was left feeling satisfied and grateful for the products I received and the price I paid for them, so I plan on ordering from Opti Contacts again.Date of experience: December 02, 2024",5
Christopher Carlo Celi,US,"Nov 20, 2024","Friendly Customer Service I wish the company were more transparent about the fact that the error message one gets when trying to receive the promotional price is due to the fact that it can only be used one time per household. I also don't know why more than one box ordered at a time significantly increases your total to more than double the price for a single box. Having said that, Emma at customer service was very helpful and sweet and I'm glad that I made her laugh today. She deserves a raise :)Date of experience: November 18, 2024",5
Darline ,US,"Dec 12, 2024","I had a great hassle free order change…I had a great hassle free order change with Tommy(18646976). Call took less than 5 minutes and he fixed my order to reflect the changes I needed. Best customer service hands down and best prices as well! This was second order with them and definitely not be my last! Thank you for making the process for buying contacts so easy!Date of experience: December 11, 2024",5
Geebz,US,"Nov 27, 2024","Customer service when I calledThis review is solely for customer service (ref#18595305) I experienced when calling about someone else’s order that was accidentally shipped to me along with my own. The agent apologized and promptly emailed a return label, politely asking if I would drop the box off at the post office. For the inconvenience and to thank me for informing them of the mix up, he offered me a free pair of basic KITS prescription glasses from their site. Will see how that turns out… The customer service was good - he was courteous and did what he could to deal with the problem.Date of experience: November 25, 2024",5
Crystal Coulter,US,"Nov 10, 2024","no hassle replacementMy glasses arrived and need adjustments. They're sending me a new pair while I'm sending these back, no waiting !I'm beyond pleased at how helpful Robert was, he even helped me trouble shoot which lens was off and get expedited shipping. I'm hopefully the replacement pair arrives with no hitch, and I don't think this hiccup on the first pair would ever deter me from their service because so far it is still a stellar customer experience. Robert was thorough, patient and helpful as well as kind. I hope he gets the recognition he deservesDate of experience: November 09, 2024",5
Rae StJacques,US,"Nov 24, 2024","I wanted to become a customer thinking…I wanted to become a customer thinking I was getting a discount then to only be paying the same amount as other sites even after trying to do auto ship at the checkout and 15.79 in fees Date of experience: November 24, 2024",4
Duane Lee,US,"Dec 11, 2024","SastisfiedI have used Opti Contacts before and was assisted this time with James (18662991) which help me with my prescription download.  I thank him for his patients and getting it done.Date of experience: December 10, 2024",5
Deanna Davis,US,"Nov 4, 2024","never got my products even though site…never got my products even though site says they delivered.  So they re-send them - but did not expedite, so i must wait another week or more, hoping they arrive.Date of experience: November 04, 2024",1
Maryanne Ganim,US,"Dec 5, 2024","I called rather than using the on line…I called rather than using the on line ordering.  Francis was my customer rep.  I personally don't wear contact but have ordered for my husband a few months ago.  Today I wanted to order a years worth for my grandson for his Christmas present.  Francis made the ordering very easy and in a few minutes we were finished and he provided me with a great price.  Thank you Francis!Date of experience: December 04, 2024",5
Yasmeen Shaban,US,"Dec 19, 2024","I had a great interaction with EmmaI had a great interaction with Emma. Reference 18683902. She was patient and understanding. Very helpful in getting my contacts reordered when the package was lostDate of experience: December 18, 2024",5
Joseph,US,"Nov 14, 2024","James helped me resolve a minor problem…James helped me resolve a minor problem on the phone. Website didn't allow it. Official prescription was sent separately. This is my first contact with this online lens provider. Likely we will be longterm customers. Coupons and discounts seem available all the timeDate of experience: November 14, 2024",5
Amy,US,"Nov 18, 2024","I see clearly now!I am a First Timer with Opti Contacts and in my excitement, I ordered two extra boxes. I contacted your Support Team and Francis was outstanding in assisting me! He not only took care of my mistake and made sure that my order was correct, but also provided me peace and mind in understanding that i would be re-imbursed for the additional cost that was charged.  His clarity and professionalism was exemplified in helping me with my issue.  I was also amazed as I received my order in three days.  Outstanding Opti Contacts!Date of experience: November 12, 2024",5
SCOTT MCLEAN,US,"Nov 21, 2024","I have been ordering on and off from…I have been ordering on and off from Opticcontacts.... 4 months ago I ordered 2 boxes of 90 contacts. Then all of a sudden on 11/14/2024 a box with 360 contacts just showed up at my door that I did not order. They just charged my credit card and shipped them to me. They said I was on auto ship. I never signed up for auto ship. I did not like my experience at all. I will never do business with them again..Date of experience: November 14, 2024",1
James,US,"Dec 12, 2024","Actual people to help fix an issueThere were some delivery problems, but I was pleased that when I called them, someone picked up and genuinely showed an interest to fix the problem and eventually did fix the problem.Date of experience: December 11, 2024",5
Gloria,US,"Nov 18, 2024","MY EXPERIENCE WAS MADE GREAT BECAUSE OF FRANCIS F…MY EXPERIENCE WAS MADE GREAT BECAUSE OF THE INDIVIDUAL REPRESENTATIVE THAT i WORKED WITH NAMELY FRANCIS CASE 18592131. EXTREMELY CUSTOMER FRIENDLY , HE GOES OUT OF HIS WAY TO ASSIST ME , VERY KNOWLEDGABLE , RETURNS MY CALL , AND JUST OVERALL AN ASSET TO YOUR COMPANY. IF OTHER COMPANIES WOULD HAVE A FRANCES THINGS WOULD RUN VERY SMOOTHLY. HE IS DEFINITELY A KEEPER   Date of experience: November 18, 2024",5
Edward Savka,US,"Nov 22, 2024","Very helpfulVery helpful, I accidentally ordered bifocal lenses which were not needed and didn’t fill in the right prescription. The company called to correct the order and made everything right. I will be ordering from opticontacts for now on!Date of experience: November 22, 2024",5
Jamie Clay,US,"Oct 21, 2024","Excellent customer serviceDennis went above and beyond to assist me in ordering my contacts today.  I had my contacts on autoship and needed them a month earlier than scheduled.  I am moving next week and needed them shipped to my current address as soon as possible. Also, I was using two cards to make payment.  Dennis excelled in helping me to receive my new contacts before my move.Date of experience: October 21, 2024",5
Diane,US,"Nov 19, 2024","I am a first time user of opticontacts…I am a first time user of opticontacts and not only were they the best price but when I was having trouble ordering online Alexandra was very patient with me and stayed on the phone the whole time.  She even helped me with what i need to do to submit the information to my insurance company for reimbursement. Thank you for your help!Date of experience: November 18, 2024",5
Selene,US,"Nov 15, 2024","Awesome Company A+++I'm very happy with my experience with OptiContacts.Com. The product is great, the customer service is excellent, and my order arrived on time.  I would definitely recommend OptiContacts.com to anyone looking for contact lenses.My first order was incorrect because I entered my prescription wrong. The company quickly corrected my mistake and sent me the correct lenses at no additional cost. I was very impressed with their customer service and willingness to make things right even though it was my fault!  THANK YOU! Date of experience: November 14, 2024",5
Barbieisadoll,US,"Sep 23, 2024","I have ordered for my daughter on…I have ordered for my daughter on september 5th and it said i would recive them in 3 to5 business days. On september 11th i received an email saying i would receive them in 3 to 7 business days. Still have not received. And i called this morning and had to leave a voicemail for call back...no customer service available. What if i jacked them around on payment?? Im giving them till 10 cst before i take further actionDate of experience: September 05, 2024",1
Steve,US,"Nov 2, 2024","Justin was Absolutely Excellent all the…Justin was Absolutely Excellent all the way around! WOW what great Customer Service!Sensational Experience from beginning to End. What a breath of fresh air dealing with Justin!Can’t wait to order my contacts again in a year from Justin at Opti Contacts!Thank you very muchDate of experience: November 01, 2024",5
Iyonna Hibbler,US,"Oct 28, 2024","Exceptional customer service!!The ordering process was easy and shipping was fast. I did run into a problem (totally my fault!). I put in my prescription incorrectly (+ instead of -), but when I called to see what I needed to do to get the right lens, Justin handled everything swiftly. I was expecting to pay something to get a new set, but no, a new order was placed and expedited FOR FREE! I literally almost cried!! Date of experience: October 28, 2024",5
KATHLEEN,US,"Dec 12, 2024","Tommy is an asset to your companyTommy is an asset to your company!  He was extremely helpful and one of the reasons why I use your company. Excellent customer service.!Date of experience: December 12, 2024",5
Amy,US,"Dec 13, 2024","Contacts orderContacts very delayed, perhaps lost in mail. New box being expedited today! Great customer service Date of experience: December 12, 2024",5
Scjohn99,US,"Nov 8, 2024","Impressed with Customer ServiceDid not expect such a smooth a call. The representative obviously realized I was truthful and sincere and he was quick to exchange an unopened box and replace an opened box of contact lenses. Thank you. This goes a long way to create a loyalty. Date of experience: November 08, 2024",5
Paula Lavidor,US,"Oct 24, 2024","Correcting my mistakeI placed my original order, but had chosen the wrong product - fortunately, before any charges were processed the company emailed me to notify me.  I called and spoke with a VERY PATIENT gentleman named Francis, who explained my options and offered me the same on-line discount for my corrected order.  And my order shipped the same day!  Thank you!Date of experience: October 23, 2024",5
ROSANNA VAZQUEZ,US,"Nov 8, 2024","Exceptional serviceExceptional service! Connected with Tony B. via chat as my doctor provided a contact lens script with the incorrect base curve. I only realized this error after using a few lens and being unable to see. Thankfully, I had a sample lens I could compare to the script and what I ordered. I thought I would have to eat the cost but Tony worked it out that I could get a replacement with the correct strength at no cost. I wasn't expecting this, as I reached out to customer service to return the remainder of the contacts since I couldn't use it. But instead Tony got my replacement submitted and recommended donating the rest of the contacts to my doctor to be used as trials for other patients. I am so very pleased with my experience and this company. Thanks again!Date of experience: November 08, 2024",5
Tim Weisgerber,US,"Oct 30, 2024","Great ExperienceFirstly, What a great deal! I ordered a years worth of contacts for a fraction of the price that ******** Eye Care could get them for. Secondly, I accidentally ordered the wrong prescription. I reached out to OptiContacts and asked if there was anything we could do, and their first reply was the shipping label to exchange my mistake. I responded and asked a few questions - their customer service team responded immediately with a warm and human tone. In a world of bots and automated customer service, it was a real pleasure getting to work with this company. I know where I'm ordering my contacts from here on out!   Date of experience: October 27, 2024",5
Caroline Gonçalves,US,"Nov 22, 2024","I received everything in perfect…I received everything in perfect condition, and I couldn’t be more pleased! It has been a long time since I’ve been trying to find this specific brand of contact lenses, which is the only one that adapts perfectly to my eyes. Every time I attempted to order my lenses elsewhere, I was informed that they were unavailable because the manufacturer no longer produced lenses with my prescription strength.Your team went above and beyond by reaching out to the manufacturer to arrange a special order for me. I truly appreciate the effort and care you took to make this possible. Your exceptional customer service has made all the difference, and I am incredibly grateful.Without a doubt, I will continue to purchase my contact lenses from you in the future. Thank you again for your outstanding service!Date of experience: November 14, 2024",5
ANTHONY ALBERT,US,"Nov 22, 2024","REF 18601561 REF 18601561 Diana did a MARVOLOUS job helping me navigate my way through the online purchase process. She was very polite and helpful and made it simple!!!Thank you!!Date of experience: November 21, 2024",5
Dooby Doo,US,"Nov 30, 2024","Excellemt Customer Service: Stolen Package Issue (RESOLVED)The representative (Gabriela) who helped me understood my situation quickly and helped me resolve it. My package was stolen and she helped me place a replacement order and refunded my order that was stolen as well (excluding shipping). Good prices and excellent customer service! Would recommend getting contacts here!Date of experience: November 30, 2024",5
Yolanda,US,"Oct 1, 2024","James was incredibly friendly and…James was incredibly friendly and thoughtful. He recognized the urgency of getting my order processed and was able to offer a couple options and expedited it.  He not onlt provided me with excellent customer service, he went on and beyond.  I'm really grateful James took my call. Wish there were many people more like him.Looking forward to getting my contacts this week.Thank you James!Date of experience: September 30, 2024",5
A KK,US,"Nov 22, 2024","Customer Respresentative JamesThe Customer Representative, James, was quick to resolve my issue. My doctor had sent me an old contact prescription, so I wanted to exchange them. James was very quick in processing the exchangeDate of experience: November 21, 2024",5
