Username,location,date,content,Rating
Reynaldo,US,"Oct 25, 2024","100 PERCENT EXCELENT I didn't recieve my contact lenses, So I call to verify if they were delivered. A gentleman named robert confirmed that they had been delivered. I explained to him that it might have been a postal mistake since I had the key to the box but no package. Without hesitation he offered to send  me a new order and figure out what happened with the previous order. We got Disconnect to during the phone call and he immediately called me back. He then proceeded with the order and sent me the confirmation number. He was quick and kind and extremely helpful and understanding. I've never had any issues with my orders but my first experience having to call was excellent. Definitely going to continue using this company for my co tact lense needs!! Thank you Robert!!Date of experience: October 25, 2024",5
Arlene Lane,US,"Nov 26, 2024","reference number 18612175 reference number 18612175 Hello,I feel compelled to leave positive feedback in reference to Mike’s excellent customer service today. He was an exceptional representative for your company and I was very satisfied with the professional service he provided. It was a pleasure speaking with him and having him respond to my questions and needs in an efficient, caring, and complete manner. My interaction with Mike far surpassed my expectations and I was extremely satisfied with his customer service, meeting my needs, and his assistance in placing my order. I hope in the future OptiContacts can offer me the same standard of service as Mike was able to provide today.Thank you to Mike and OptiContacts. ArleneDate of experience: November 25, 2024",5
Mary Avalon,US,"Nov 18, 2024","Best customer service!This is my first time ordering from Opticontacts and I times my order to arrive a week before I was leaving for military training. In an incredible display of operator error, I did not put the numbers in front of my address and my mail carrier decided to arbitrarily choose a random house to drop my contacts at. I called and Justin never made me feel stupid he just shipped a new set and told me if I got the original to please return the replacements. I did get the original order and the best customer service experience ever. I'm going to stay a loyal customer because of Justin!Date of experience: October 28, 2024",5
Marie Palmer,US,"Oct 18, 2024","I was accidentally sent two boxes of…I was accidentally sent two boxes of the same rx for my contacts when I have a different rx for each eye. I contacted customer service and they got back to me within an hour. They sent me a shipping label to return one box and already had a new box with the correct rx ready to ship the next business day. Excellent customer service!! Date of experience: October 16, 2024",5
Jeff Jones,US,"Oct 26, 2024","My error was correctedI made an error when placing my order online and Chad was able to quickly correct it and get the right contact lens ordered for me.  He exceeded my expectation by including an offer that was on the website.  I'm totally satisfied with Chad and OptiContacts!Date of experience: October 25, 2024",5
Anthony,US,"Nov 29, 2024","Great customer service!I had to call to insure that my order had the proper prescription.  I spoke to Diana and She was the exemplar of professionalism and helpfulness.  She listened well, and had a pleasant, professional phone demeanor that made the call a successful breeze.  Date of experience: November 28, 2024",5
Kylie Wise,US,"Dec 19, 2024","Incredibly helpful and attentiveIncredibly helpful and attentive, solved my issue in a matter of minutes! Thank you! Date of experience: December 19, 2024",5
Claude,US,"Oct 12, 2024","Super pleasedSuper pleased. I have had contact with a number of customer service representatives in the last week. All patient, kind and thorough. Mark, Paul and Emma are the names I recall. I believe there was one other, but I neglected to write down her name. I ordered a year supply of contact lens. If the rest of the process goes as well, I will be a returning customer.Date of experience: October 12, 2024",5
April Nichols,US,"Nov 8, 2024","I never received my orderI never received my order.  I contacted customer service and they was quick to start a trace on my package.  Instead of me having to wait to find my package, they went ahead and processed another order, so I wouldn't be without contacts. Date of experience: November 07, 2024",5
Patti,US,"Oct 16, 2024","A pleasant experience!I recently had only my left eye prescription change. I told Justin that I had an unopened box of the old prescription and he said I could return it and promptly sent me an email with the shipping label. He set up a replacement order and updated the Rx on the auto-ship. I was unable to access my personl email from work and he was able to update my email address and re-send the request for my new prescription and the shipping label immediately. Date of experience: October 15, 2024",5
Jess B.,US,"Oct 2, 2024","James is a wonderful wonderful asset to…James is a wonderful wonderful asset to this company. He was so helpful and knowledgeable, I must say I’m quite impressed with his personable demeanor AND professionalism. Excellent customer service. If I could give him 20 stars I would. He’s such a great representative of opticontacts that they get 20 stars too for being smart and hiring James :D. Ive only had great experiences with opticontacts and if theres ever an issue, I know now that I can simply call and they will instantly take care of it. This was the only issue I’ve had and it wasn’t even their fault. Love the company even more after James helped me!  Date of experience: October 01, 2024",5
Alyse Trinch,US,"Sep 18, 2024","Above and BeyondChris did a fantastic job helping me today. He was polite, spoke English, and listened to the reason for my call. He took care of my concern and went above and beyond by upgrading my shipping. Thank you, Chris! If this is representative of OptiContacts’ customer service, then the processing fee is worth it!Date of experience: September 18, 2024",5
bonnie novak,US,"Dec 4, 2024","Great customer serviceGreat customer service! I was able to get assistance with placing my order without any difficulty which is very rare.  Date of experience: December 04, 2024",5
Janice Varvell,US,"Oct 4, 2024","Justin was amazing!Justin was amazing!! I only have one left contact so ordered more and then panicked as what if the left contact breaks!!! I have glasses but hate to wear them.Justin was professional and took the time to research and expedite my order as I really need a supply of left contacts.Thanks Justin and Opticontacts as excellent customer service is hard to find these day and you exceeded my expectations!!Great job!!Date of experience: October 04, 2024",5
Ericka Goodlin,US,"Oct 6, 2024","EXCEPTIONAL SERVICE Exceptional service.  Chad was extremely patient while I searched for my current prescription and other important information to complete my order.  He also honored the price I found, which was cheaper than what I found on the website.I’m very pleased, that’s for sure.Date of experience: October 05, 2024",5
William Williamson,US,"Nov 7, 2024","She was very helpfulShe was very helpful! She went ahead and reordered my contacts and glasses no charge and expedited the shipment as I should have had the original orders by now! Very courteous and respectful! Date of experience: November 07, 2024",5
Kim France,US,"Oct 23, 2024","Exceptional Customer ServiceI ordered contacts right before going away on a trip. There was plenty of time for them to arrive. However, the type of contacts I ordered were not in stock. Justin from Customer Service went out of his way to contact the manufacturer and have my contacts drop shipped directly from them with overnight shipping so that I would receive them in time to go on my trip. You don’t get that type of Customer Service very often! Date of experience: October 22, 2024",5
Laura Di Donato,US,"Nov 19, 2024","My order got lostMy order got lost, so I called OptiContacts and spoke with James. He was extremely helpful, courteous and knowledgeable. He was able to get a new order out to me and I am expecting it any day now.LDate of experience: November 19, 2024",5
Andrea Schaefer,US,"Oct 12, 2024","I had several issues with my contact…I had several issues with my contact order and was getting frustrated, although not necessarily Opti Contacts fault.  I worked with an AMAZING customer service rep, James, and he did what reps SHOULD DO...FIX THE PROBLEM, MAKE ME HAPPY!Folks this is a rare guy, wish all reps were this good and caring to fix the issues.  I have to say, I was frustrated after a very long day, but he talked me down, did his thing,  and I thanked him over and over again.  HE NEEDS A HUGE RAISE!Date of experience: October 09, 2024",5
Zach,US,"Oct 19, 2024","Robert was tremendously helpfulRobert was tremendously helpful. Super kind, accommodating and easy to work with. I think I like this company and I’m fairly certain their contacts are real and not replicas, but can’t be sure. Date of experience: October 17, 2024",5
Sidney,US,"Sep 22, 2024","5 stars service!I've accidentally ordered wrong contact lenses (from negative to positive lenses). I called in and Francis took care of the error free of charge. Francis is extremely helpful and I can't believe I had a blond moment when placing my order.  Thank you so much for fixing my error.Date of experience: September 21, 2024",5
OpticLens,US,"Oct 15, 2024","Robert listened fully and knew what to…Robert listened fully and knew what to do without hesitation. I feel very relieved by his exceptional service. Option contacts provides economic pricing and great service. Kudos to Robert!Date of experience: October 15, 2024",5
Reg,US,"Oct 24, 2024","Manufacturer Delay RightedThere was a problem with the manufacturer on one of my lenses and customer service went beyond to make right the delay. We switched brands and they gave me a free pair of glasses, everything priority shipped. Very helpful and very kind service. Yaaay! Date of experience: October 24, 2024",5
Customer,US,"Dec 6, 2024","Very Helpful Customer Service RepresentativeEmma was extremely helpful in placing my contacts order.  She gave me a terrific price.Date of experience: December 06, 2024",5
Happy Customer,US,"Dec 10, 2024","Excellent Customer Service!Francis was my Customer Service Representative and he was a pleasure to work with and provided excellent service!  Thank you so much!  Date of experience: December 09, 2024",5
dcstraz,US,"Nov 6, 2024","Frances was super helpfulFrances was fast, helpful, and quickly understood the issue whereby I made a mistake in a large order. He had it corrected immediately and made it seamless for me. Great customer service.Date of experience: November 06, 2024",5
Jeneil Magloire,US,"Oct 26, 2024","Great Customer Service!""I recently ordered contacts from Opticontacts.com, but when they arrived, I couldn’t see clearly with them. After contacting customer service, a representative named Francis assisted me. He was incredibly helpful and patient as he worked through the issue. When a second order arrived with the same problem, Francis was there again, offering the same high level of support and understanding.After carefully going over the details, he identified that the issue was actually due to an error in my prescription, not the company. Francis made sure everything was resolved, and he arranged for the correct lenses to be sent promptly. His commitment to helping me find a solution and ensuring I was satisfied showed impeccable service! Highly recommend Opticontacts.com, and a big thanks to Francis for his excellent customer care.""Date of experience: October 25, 2024",5
Esther Sayles,US,"Sep 23, 2024","Great prices and even better customer serviceThis site had one of the lowest prices online for my contacts.  They shipped quickly, my prescription was correct, and customer service even helped me solve an error that was completely my fault.  I can't recommend them enough!Date of experience: August 20, 2024",5
Rory Markham,US,"Sep 20, 2024","Clark helped me with an error made with…Clark helped me with an error made with an auto shipment for order 18426729. Clark was very calm and collected in assuring me that all would be handled and I look forward to using OptiContacts for all my future contact purchases. They have a great customer service department.Date of experience: September 20, 2024",5
Clare O'Connell,US,"Sep 20, 2024","Great customer serviceChris helped me place an order for a 3 month supply of contacts.  He was patient, courteous and informative about available discounts.  I wish all representatives I deal with at different companies were as professional as Chris. He is a great asset to OptiContacts and I hope I get to deal with him in the future! Date of experience: September 20, 2024",5
Babz,US,"Nov 7, 2024","The person I spoke to quickly helped me…The person I spoke to quickly helped me submit my order. He accommodated an issue I had with payment and helped me get as much discount as possible. Great service!Date of experience: November 07, 2024",5
Durwood Kirby,US,"Dec 20, 2024","James made it rightInitially had a discount rejected when ordering online. Called the customer service number and James remedied the situation. Most profession and polite, an excellent representative for the company.Date of experience: December 19, 2024",5
Jim,PR,"Nov 10, 2024","Great Customer Service I inadvertently ordered incorrect lenses for my wife. They worked with me to correct the order, quickly. This is the type of customer service we all hope for.Date of experience: November 08, 2024",5
Stu,US,"Oct 17, 2024","It took a whileIt took a while, but a lot is on me because I had to figure out which glasses I could get the way I wanted.Two of their agents were exceptional.   I don't have the first gentleman's name, sorry, but Emma was outstanding and PLEASANT.Their search engine needs some tweaking to help with specific requests.   One of the prices I received, even with the discount, was a bit…Ill put that on me.    They are easy to work with too.Date of experience: October 16, 2024",5
Katherine Holt,US,"Sep 19, 2024","Stolen PackageMy package was stolen and James was so helpful in sending new contacts at no charge. They arrived within 2 days right at my doorstep. Thank you for being so understanding and helpful!Date of experience: September 17, 2024",5
Daniel,US,"Oct 17, 2024","Products are always top notchProducts are always top notch. They easily have the lowest prices available. And when I made a mistake in my prescription, they quickly exchanged my contacts. Great customer service!Date of experience: October 16, 2024",5
NELSON CRUZ,US,"Nov 2, 2024","I am grateful for your service.Hello Everyone, My order #18545963. I am Nelson Cruz. Your #1 Satisfied Customer and would like to recognize Emma for her fabulous and exceptional customer service and attentiveness. Thank you very much. XOXODate of experience: November 01, 2024",5
Sandee Carver,US,"Nov 18, 2024","My representative James was excellentMy representative James was excellent, very nice, and helpful with my order. This is my first time ordering with opticontacts.Thank you!Date of experience: November 18, 2024",5
Lorena Maria,US,"Nov 26, 2024","Very professional and great customer great customer service…Very professional and great customer service. I had made a mistake on my order and they were able to fix it quickly. Date of experience: November 25, 2024",5
M McGugan,US,"Oct 14, 2024","I received an email explaining I had an error in my order.I received an email explaining I had ordered the wrong contacts according to my prescription. I called and was helped by Emma who was able to correct the order for me and also helped with affordability.Date of experience: October 14, 2024",5
LESLIE BRADY,US,"Nov 11, 2024","Francis assisted me with an order…Francis assisted me with an order issue. He listened carefully, answered questions clearly and was very helpful. Date of experience: November 11, 2024",5
Grace Ashland,US,"Oct 18, 2024","Great customer service!Great customer service!I had an issue with my order and called customer service to cancel but they were able to resolve the issue and I got my order on time. They are very responsive and the deals are great. Date of experience: October 17, 2024",5
Marita Emperado,US,"Oct 9, 2024","There was a mistake with my shipping…There was a mistake with my shipping address and caught it when I got the shipment confirmation notifying me that it was en route. I called Emma and she resolved it quickly. Date of experience: October 09, 2024",5
Camie Kern,US,"Oct 21, 2024","Emma was a huge help in getting the…Emma was a huge help in getting the contact lens order corrected.  within minutes, she had set up the return and placed the new order for the correct lenses.!thank youDate of experience: October 18, 2024",5
Rick T,US,"Dec 13, 2024","Great Customer ServiceEmma was great, she solved my problem and made the resolution painless.Date of experience: December 12, 2024",5
amber self,US,"Oct 21, 2024","Amazing customer serviceAmazing customer service. I ordered the wrong prescription and did not realize until after my order was shipped. I needed to return them. They sent the new ones at no cost right away! Date of experience: October 21, 2024",5
Joel Nisson,US,"Dec 3, 2024","What can I sayWhat can I say. He was courteous, respectful and extremely helpful. Took care of my issue in minutes.Thank you.Date of experience: December 03, 2024",5
Traci Ford,US,"Oct 22, 2024","Excellent customer serviceJames was excellent and helped fix a situation. Really appreciate him going above and beyond. Will definitely order from Opti contacts again.Date of experience: October 21, 2024",5
Jim Kuglics,US,"Dec 18, 2024","Great customer serviceGreat customer service. Contacts have always come quick too.Date of experience: December 18, 2024",5
James,US,"Oct 10, 2024","Exceptional service, easy shopping I  had an excellent experience with Opticontacts.com! Their customer service is extremely responsive and their staff is friendly and genuinely committed to ensuring customer satisfaction. The website is easy to navigate, making it simple to explore their wide range of products. When I needed support, they provided prompt assistance and offered great alternatives. I highly recommend Opticontacts.com for anyone in need of quality products and outstanding service!Date of experience: October 02, 2024",5
Cali,US,"Nov 4, 2024","Customer Service is AmazingRobert listened to everything I said. I did not need to repeat myself, he got it all right. He told me the next steps, and when I could expect a response. USPS made the same mistake twice, and Robert corrected it. Every time I called, whomever answered the phone was customer service gold. Will use again as they are so easy to work with.Date of experience: November 01, 2024",5
Jayne Fronk,US,"Oct 3, 2024","I have called customer service twice…I have called customer service twice and both times the people I spoke with have been super friendly and resolved my issue immediately.  I will be using them again.Date of experience: October 03, 2024",5
kimberly Alvarado,US,"Nov 5, 2024","Great customer serviceGreat customer service, they assisted me in a timely manner and to full satisfaction. I usually use another source, but this provider has gained my on going service. Date of experience: November 04, 2024",5
Bert Q,US,"Oct 2, 2024","Easy exchange for new Rx I needed to exchange several boxes of my last order for new ones with my new prescription. Francis made it extremely easy for me. 10/10 would recommend!Date of experience: October 02, 2024",5
Mandi Goins,US,"Oct 23, 2024","Have continuously ordered from themHave continuously ordered from them. Made an error with order and they were able to quickly fix it for me before shipment! Highly recommend!Date of experience: October 22, 2024",5
Mac Pizzi,US,"Dec 3, 2024","Emma was fantastic Emma was fantastic ! Answered all my questions and was courteous & caring throughout are interaction. Date of experience: December 03, 2024",5
Kelly Heath,US,"Sep 27, 2024","Friendly & Efficient Customer Service I noticed my auto-fill managed to combine my billing with my shipping address AND that my order shipped shortly after I'd ordered it, which I thought was great. A call to Customer Service was necessary. The wait time was less than 1 minute and Francis took my call and made sure that the problem was remedied within another 3 minutes. He was very friendly and professional, explaining that my order will most likely be returned to them because of the error, which is understandable, but I was completely satisfied with how this was handled and ended my interaction with Francis in a cheerful mood due to his manner and professionalism. Date of experience: September 26, 2024",5
Angelina Galindo,US,"Nov 30, 2024","France’s was professionalFrance’s was professional, polite and offered a great solution to my issue. Thank you. Date of experience: November 30, 2024",5
Sophie,US,"Oct 9, 2024","Great customer service thanks to JamesGreat customer service thanks to James.  I was having trouble loading my prescription on the website and James helped me over the phone.  James was patient and professional!Date of experience: October 09, 2024",5
Andy Block,US,"Oct 29, 2024","My prescription changed and I needed to replace lensesMy prescription changed and OptiContacts allowed for an easy no cost exchange of unopened boxes of lenses I had.  Stress free and simple.  One phone call.Thank you.Date of experience: October 29, 2024",5
David (from the U.S.),US,"Dec 2, 2024","The process was quick and reasonably pricedThe process was quick and very reasonably priced. The customer service agent was very helpful.Date of experience: December 02, 2024",5
Charles Gordon,US,"Nov 25, 2024","He made sure I was getting all the…He made sure I was getting all the available promotions and was very helpful with the payment activity.Date of experience: November 25, 2024",5
Mark Schmunk,US,"Oct 5, 2024","These guys are legit!I recently purchased contacts from OptiContacts.com, and the entire experience was great!I was a bit hesitant due to some of the reviews expressing concerns about the expiration dates, customer service, etc., but I can tell you all was good.  The contacts may have expired a bit before other sources, but way beyond what you would wear them for anyway.  i.e. you should wear them within six months and they expired years in the futureI was also skeptical about their prices.  They were lower than about anyone else I could find, so I thought there could be problems.  However it was just the opposite.  I did have an issue where my doctor gave me the wrong PX, but OptiContacts was great about refunding my money on the unopened boxes and were quick to help me get the right ones.This may sound like a fake review, because it is all good, but I can tell you it is totally legit.  Actually, I rarely take the time to do a review, but this experience was so good, I felt I needed to.I have found a source for all my contact needs as long as they are in business, and continue with their competitive pricing and outstanding customer service.Date of experience: October 04, 2024",5
Kelly Gagnon,US,"Sep 25, 2024","I called customer service for an issue…I called customer service for an issue with my receipt for my contacts.  James very quickly and courteously was able to remedy the situation.  Great job and happy customer.  Thank youDate of experience: September 25, 2024",5
Barbara O'Hare,US,"Sep 24, 2024","Wow...this is the best experience I've…Wow...this is the best experience I've had with a company in a long time.  Tony B. helped me with a question about my return and within a 10 minute call I had a label for the return and the correct lenses were ordered.  You cannot beat that service!Date of experience: September 24, 2024",5
sunday oce,US,"Oct 15, 2024","I got an order replacement without…I got an order replacement without contest after asking for help through the chat feature. Very pleased with my service! Date of experience: October 15, 2024",5
jackie macalindong,US,"Sep 18, 2024","Great customer serviceChad helped me with my order when I was having issue ordering online. He was able to put in an order for me in like 2 minutes. Thank you Chad. Great customer serviceDate of experience: September 17, 2024",5
Aisha K,US,"Sep 18, 2024","Thank you Francis for understanding my…Thank you Francis for understanding my issue at this time. It was a relief that you were able to assist me and it didn't take alot of time either. I'm very grateful ! Date of experience: September 18, 2024",5
Mr. Miner,US,"Dec 17, 2024","🔥11/10 the features work great and…🔥11/10 the features work great and cannot wait to see the future advancements in lens-related technologies when looking onward. The product is versatile in utilizing essential user-related functionalities. Date of experience: December 16, 2024",5
kirk bryant,US,"Oct 3, 2024","Emma was very helpful and professionalEmma was very helpful and professional. My contact order was not correct and she took care of the mistakepromptly. Thank you Emma for your help and kindness.Date of experience: October 03, 2024",5
Stephanie Roosendaal,US,"Nov 2, 2024","AWESOME service and customer careI had an issue that was immediately resolved and handled so well, I was impressed with how they handled it, and it made me feel important as a customer! Date of experience: November 01, 2024",5
