Username,location,date,content,Rating
Stephanie,US,2 days agoVerified,"Perfect imperfection I ordered the “imperfect hearts” and they were absolutely PERFECT!  I lost a beautiful friend, and I ordered the hearts as a special reminder to share with the friends and sisters that cared for her during her illness. The hearts came with an unexpected message card that summed up beautifully how we are all perfectly imperfect!  I just loved how unique each heart was, just like each one of the special ladies that cared so deeply for our friend. Date of experience: December 11, 2024",5
Lana Michalski,US,3 days agoVerified,"""Just Beautiful.""   I personally spoke with Bonnie (one of…I personally spoke with Bonnie (one of the owners) about my order.  She is so kind and personable.  You would never get that from a huge corporation.  That's why small businesses MATTER!  I ordered the olive wood hand cross and two of the chunky olive wood hearts.  They are BEAUTIFUL!  They are so smooth to the touch and the variations in the shades of the wood show the beauty of nature. She also included one of the painted hearts.  I will always use Dennehey Design.  Thank you!Date of experience: December 13, 2024",5
RAL,US,2 days agoVerified,"Great service and quality productMy order was processed quickly and the product (wooden hearts) was as pictured. Very lovely and the grain in each one was so unique. Will order other products in the future.Date of experience: December 14, 2024",5
Ginger,US,6 days agoVerified,"Sweet little cross hand painted with…Sweet little cross hand painted with sunflowers was given to my sister in California for Christmas. I was surprised to receive a free heart along with the cross ♥️Date of experience: December 11, 2024",5
Helen Cope,US,"Jan 1, 2025Verified","High quality, hand crafted itemsI am impressed by the variety of high quality, hand crafted items offered by Dennehey Design!  I love hearts of all kinds and enjoy ordering different hearts created here. Customer service, prices and shipping are excellent. I highly recommend the products at Dennehey Design!Date of experience: December 04, 2024",5
Patricia  Stevens,US,2 days agoVerified,"I always love the Dennehey productsI always love the Dennehey products, very unique and expertly designed and crafted.Date of experience: December 14, 2024",5
Wheaton MD customer,US,2 days agoVerified,"Love the quality of your productsLove the quality of your products!  I give as gifts and reminders thst I am think of my friends!  They are always well received.  Date of experience: December 14, 2024",5
Michelle Gould,US,"Jan 2, 2025Verified","I have bought several small items from…I have bought several small items from this company and decided to treat a friend to one of the small cheese boards. It took a few weeks (they ship those items when they make a batch, I believe) but boy, was it worth the wait! Beautifully crafted and almost too pretty to use. My friend loved it! Shane and Bonnie are always very responsive to any requests/concerns and even included a couple of hearts to make up for an item that had a small defect. Excellent customer service! Date of experience: December 04, 2024",5
Barbara Carruthers,US,"Jan 1, 2025Verified","Your product is beautiful and exactly…Your product is beautiful and exactly as you say it is.  I ordered 5 of the interlocking hearts as Christmas Gifts!  The symbolism can be used in many ways.  My mother passed away in July and I purchased them to give to 4 women that helped me through that difficult time.  Our bond will never be broken and I could never thank them enough for their constant presence in my life. I kept 1 for myself.  Date of experience: December 04, 2024",5
Mam Selle,US,"Dec 28, 2024Verified","Perfect in Every Way!Absolutely gorgeous. I couldn’t be more pleased with the three crosses and the three hearts. Excellent craftsmanship and so reasonably priced as a bundle. I gave these sets as Christmas gifts which included a cross and a heart for each recipient. It was a beautiful gift and so incredibly special. Very, very pleased with the items and the shipping time. Everything was wrapped and packaged very professionally. I will definitely purchase another 2 sets for upcoming gifts. Date of experience: November 29, 2024",5
Pamela Selby,US,6 days agoVerified,"Dennehey is greatDennehey is great! So helpful and understanding when I get things mixed up. They just fix it! I am so happy with all my purchases. Unique and different and filled with care. Date of experience: December 10, 2024",5
Dana Lynn,US,"Dec 30, 2024Verified","The gifts that I ordered were fantastic…The gifts that I ordered were fantastic and so wonderfully crafted. There was a bit of a problem with shipping and I contacted Mr Dennehey's customer service. They upgraded my delivery to next day shipping with no cost to me. This company appears to really care about their customers and I will definitely use them again for unique gift ideas. Date of experience: December 02, 2024",5
customer,US,"Jan 1, 2025Verified","Creative and unique itemsCreative and unique items. Great photos of their products and fast shipping. Unique and cleaver. Lived my “connected hearts” ornaments as a keepsake for my granddaughter. A+Date of experience: December 04, 2024",5
Carrie Parra,US,5 days agoVerified,"Lovely giftThe hearts that I got for my husband are very unique and beautiful.  He absolutely loved them.Date of experience: December 11, 2024",5
Alicen C,US,"Dec 18, 2024Verified","The LUVUMOR sign made from recycled…The LUVUMOR sign made from recycled license plates was even more beautiful than the product I saw on Instagram!!  There was also a cute little notecard included which was a very nice personal touch!  I love supporting small businesses like Dennehy Design for these reasons.  Also, my email inquiries were answered immediately and professionally.  I am sure my husband will treasure this gift for years to come!Date of experience: November 19, 2024",5
Lynda Diamondis,US,"Jan 2, 2025Verified","Beautifully made!Beautifully made! These hearts will be treasured by my friends, especially since they are made from the resources of the Holy Land. Date of experience: December 04, 2024",5
Cheri Steinbronn,US,"Jan 4, 2025Verified","My mom loves her Christmas piano starMy mom loves her Christmas piano star! The communication during the ordering and shipping was exceptional. Packaging was carefully done to protect the star, which was much appreciated. Highly recommend! Date of experience: December 06, 2024",5
Rachel Primus,US,"Dec 25, 2024Verified","I enjoy supporting small companies and… I enjoy supporting small companies and yours is truly special. I love the detail you put into each design. Each item is personal. I can find something for every person and event in my life  Date of experience: November 26, 2024",5
JOSEPH INZERILLO,US,"Dec 25, 2024Verified","The perfect gift for special people !I saw the photo of the conjoined wooden hearts and knew it would be the perfect gifts for my pastor and his new wife.  BUT . . . would it be as well-made and as beautiful in real-life ?   Well, you did not disappoint !It is a wonderful piece and I look forward to speaking to  Pastor Michael on Sunday !   It was the perfect gift for a fitting circumstance !   Thank you ! Date of experience: November 27, 2024",5
Customer,US,"Jan 1, 2025Verified","I have gifted your holy land hearts a…I have gifted your holy land hearts a few times over and they are always well received. A beautiful product and quick shipping.Date of experience: December 04, 2024",5
SS,US,"Dec 23, 2024Verified","Very disappointed in box I purchased to…Very disappointed in box I purchased to hold the heart cards. Top fit too tightly to remove with ease. Distressed appearance looked like tape had been used to hold to & bottom together & when removed left lighter color where tape was - did NOT look like naturally distressed wood. Junked the box. Date of experience: November 25, 2024",1
Darla Achey,US,"Dec 18, 2024Verified","Wonderful ProductsI have placed two orders now and I am absolutely thrilled with all the products.  So far I've purchased various heart designs all for gifts for my family.  The small engraved and fabric hearts are a perfect token gift for family and friends who stood by me during my three year heart trauma.  Also the holy land hearts are beautiful!  Date of experience: November 20, 2024",5
william master,US,"Jan 2, 2025Verified","Beautiful wood and detailsBeautiful wood and details.  I loved the shapes.  The card detailing the wood was from Isreal made this specialDate of experience: December 04, 2024",5
Carol Douglas,US,"Dec 26, 2024Verified","Beautiful items - quality to the utmost We ordered 2 of the music box nativity’s. My husband got me the wooden Christmas trees. I ordered the 3 olive tree hearts and the 3 key chains. Everything is excellent quality. Lots of these went into Christmas gift bags. Date of experience: November 27, 2024",5
Vicki Gizowski,US,"Dec 25, 2024Verified","Connected Hearts From The Holy Land!Dennehey Design carries unique and quality products. Their customer service is 5 star all the way, even when they had a fire they were determined to get their ordered out as soon as possible and did. Bonnie assisted me on the phone to take my order and answer  questions. She took a personal interest in my order from my first question about the item I was interested in, to little details like the items wood grain because it was going to be engraved. She also sent me a picture of several items for me to pick the item to be engraved and pictures of the lettering style to be used. I was able to approve it before It wasn't graved. It turned out beautifully! It was an anniversary gift for my son and his wife.I was able to order it wrapped in a gift box. It came with a certificate of authenticity,in the time frame, I was quoted. There website and detail of the items they carry made it easy to shop. Rather you email text or call,they will respond very quickly. I highly recommend this company. I look forward to working with them in the future!Date of experience: November 13, 2024",5
Mario Rangel,US,5 days agoVerified,"I just love your olive wooden hearts!I just love your olive wooden hearts!Everyone I’ve given them to, really loves them as well!Date of experience: December 11, 2024",5
Nicole P,US,"Jan 3, 2025Verified","Arrived quicklyArrived quickly. Nice updates from the seller. A cute extra was included in my order.Date of experience: December 06, 2024",5
GM,US,"Dec 17, 2024Verified","Unique products great customer service…Unique products and awesome customer service makes this a business that will see me buying from again and again. The gifts that I bought for my in-laws brought tears to their eyes because of the customized message that I was able to order!!!Date of experience: November 18, 2024",5
Rae Kozinsky,US,"Updated Dec 30, 2024Verified","Made with loveI have ordered many times from Dennehey Design and I am so very pleased with all the items I've purchased. Each piece is beautiful and has obviously been designed and crafted with love. I look forward to receiving notification of new products!Date of experience: November 10, 2024",5
Walter Rogers,US,3 days agoVerified,"Great experience with this company!Great experience with this company!! Highly recommended!!! Great product! Date of experience: December 13, 2024",5
Karen Fuller,US,"Jan 4, 2025Verified","Love theseLove these. The hearts make a beautiful addition to any gift!Date of experience: December 06, 2024",5
"Betty A, United States",US,"Dec 19, 2024","Over the MOON! I just received my piano heart and I’m over the moon!!! THANK YOU THANK YOU THANK YOU!!!This piece makes me so happy! The resin is so thick and that shows off the ivory and wood parts of the keys. And I wasn’t expecting numbers written on the ivory and wood and there’s even a bit of red on the wood. Your designs are so creative and top quality. I adore this art and cannot wait to find the perfect place to hang it. I recommend Dennehey Design not only for their unique art but the customer service is outstanding. I will be returning to this shop again and again!BettyDate of experience: December 16, 2024",5
Tom Johnson,US,6 days agoVerified,"Laser-engraved wooden boxThe laser-engraved wooden box was absolutely wonderful!  It was personalized and unique to the individual,  Very special indeed!!Date of experience: December 10, 2024",5
Christine,US,"Dec 13, 2024Verified","I ordered the connected hearts in…I ordered the connected hearts in memory of my mother and as a gift to my father. I love them and cannot wait to give my father his gift. They are smaller than expected, but I’m sure that is on me. They are beautifully crafted and the shipping was expedient ❤️Date of experience: November 15, 2024",5
Donna Fearnow,US,"Jan 1, 2025Verified"," a prayer crossI ordered a prayer cross. This will allow me to focus on Jesus and his mission.Date of experience: December 04, 2024",5
Christine Koenings Hull,US,"Dec 31, 2024Verified","beautiful and uniqueThe piece is beautiful and unique. Would have loved to give it 5*, but there were several spots of white paint on it that I had to try to remove myself. Date of experience: December 02, 2024",4
Tonda King,US,"Jan 1, 2025Verified","These hearts were absolutely beautifulThese hearts were absolutely beautiful. My mom and grandma loved them.Date of experience: December 04, 2024",5
Bruce Dillahunty,US,"Jan 3, 2025Verified","Prompt communications/good productPrompt communications, on-time delivery and a top end product - would recommend them for your gift shopping.Date of experience: December 06, 2024",5
Mary Pryles,US,5 days agoVerified,"Beautiful designsBeautiful designs - love the cross and the hearts!Date of experience: December 11, 2024",5
Syreda Jessee,US,"Nov 13, 2024Verified"," Great experience I had a great experience with this company. Confirmation of my order came quickly. Notifications about shipping of my order were sent regularly.The product, olive wood hand carved hearts, exceeded my expectations. I gave them as gifts and everyone was surprised and grateful. We all feel blessed to be able to own a part of the Holy Land.Date of experience: October 11, 2024",5
Linda  Burnett,US,"Nov 12, 2024Verified","Great artistic piecesGreat artistic pieces, lovingly created, packed carefully. We received everything in beautiful shape. We’ve ordered many times and we love the people who own this little company. They’re always creating new pieces that you must have for yourself or for gifts for your friends and families. Date of experience: October 14, 2024",5
Jacqueline McNeil,US,"Dec 18, 2024Verified","BeautifulEverything I order from Dennehey Design is BEAUTIFUL!! Also, it is delivered so quickly.  I am a return customer.Date of experience: November 19, 2024",5
Janet Jayo,US,"Jan 1, 2025Verified","Do you know if UPS was able to deliver…Do you know if UPS was able to deliver it! I can’t thank you enough for all of your help and support!Happy New Year!🤗❤️❤️❤️Date of experience: December 03, 2024",5
mary kennedy,US,"Nov 15, 2024Verified","Lovely but expensive The hearts were lovely and my sister-in-law loved them. Too expensive though, I won’t be buying again. She wanted to know where I had gotten them from because she wanted to order 3 for a friend’s birthday and dismissed them immediately when she saw the price. Date of experience: October 17, 2024",5
Tracy Slone,US,"Nov 8, 2024Verified","Olive wood, intertwined heartsI ordered the two intertwined olive wood hearts. My husband just passed away and I couldn’t wait to receive them. Unfortunately, they were on backorder, but they reached out to me to let me know that and when a new order would be shipped out. Wonderful customer service and an absolutely wonderful product. I truly love my hearts.Date of experience: October 11, 2024",5
Angela Kleist,US,"Jan 2, 2025Verified","I ordered the three pack of Bethlehem…I ordered the three pack of Bethlehem hearts. One for me and one each for my sisters. They loved them as much as I do.Date of experience: December 04, 2024",5
Maggie,US,"Nov 20, 2024Verified","Everything I have ordered from these…Everything I have ordered from these folks has been lovely, beautifully made, and if given as a gift, gratefully accepted. The wood, the colors, the finishing, the safe packaging, it’s all lovely. Date of experience: October 23, 2024",5
Lisa ,US,"Dec 31, 2024Verified","Beautiful cross and key chainBeautiful cross and key chain - came as pictured Date of experience: December 03, 2024",5
Jennifer Webb,US,"Dec 4, 2024Verified","This store is amazing!!! The owner is amazing. My order was missing an item so I emailed and the next morning which was a Saturday she called me personally and had the item I was missing to me a few days later. She was very friendly. Great customer service!!!Date of experience: November 05, 2024",5
Al,US,"Nov 15, 2024Verified","Disappointing heart products!Loved the wood hearts, although, they are very light and airy, not substantial felt poorly made, not great quality. The Resin and wood combo hearts were a big disappointment, super light weight and not great materials, edges and shape not nice to the touch, at all. Wish I could return them, but too much trouble. Definitely not worth the purchase, can get MUCH better quality elsewhere. Felt like online images were misleading, they looked so nice, but were really underwhelming to say the least once they arrived (it took awhile to receive and they were really pricy)!! :(Date of experience: October 17, 2024",3
Amy,US,"Oct 23, 2024Verified","We will always be connected.I bought two of the connected hearts with wood from Israel. One will go with my Dad when he is buried in Arlington, the other will stay with me. He was my world, my hero, best friend, travel companion, and awesome Dad. He was a non-practicing Jew but one of our favorite trips was to parts of Israel. Date of experience: September 25, 2024",5
Simeon Mackrides,US,"Oct 18, 2024Verified","Great Service Great service.  Bonnie kept me informed about the order’s progress and shipping.   The charcuterie board templates were as advertised and intact when I received them. I will be doing business with Dennehy Design again.  Date of experience: September 20, 2024",5
Robert Bruns,US,"Dec 9, 2024Verified","Great productsGreat products, rapidly delivery, and high quality and friendly customer service.  You can feel comfortable with this company!Date of experience: November 11, 2024",5
Shane,US,"Sep 24, 2024Verified","Quality I appreciate this company and the beautiful products you sell! My recent Beach heart box is truly absolutely beautiful! I’m very impressed with the quality and craftsmanship! Will definitely return to purchase more items soon! Thank you and may God bless you! Date of experience: August 26, 2024",5
marsha downey,US,"Nov 15, 2024Redirected","Artistic and well made!I received my “M” today. I was so excited. Because of the fire they had, it took a bit to receive it, but they let me know about all of that along the way. It is absolutely beautiful and extremely well made! Bonnie & Shane, thank you for the love and workmanship that went into this piece. I’m sure I will be a customer again in the future. ❤️Date of experience: November 15, 2024",5
Stacey Griffith,US,"Dec 4, 2024Verified","I have bought quite a few pieces for…I have bought quite a few pieces for him. Your company and I have loved every one that I've received. They are beautiful and well-made, and when I walked past them in my front room or going to the front door, they make me smile.Date of experience: November 05, 2024",5
Ronda Greene,US,"Dec 24, 2024Verified","Excellent qualityExcellent quality! I’m really satisfied with the items I purchased. Date of experience: November 26, 2024",5
Keely Combs,US,"Nov 28, 2024Verified","AMAZING!!! AMAZING!!! From every single item to customer service I could not love this company more! I have been purchasing from them for years and I can not say enough about about how great they are! ❤️❤️❤️❤️❤️ Date of experience: October 30, 2024",5
Merry Ward,US,"Dec 6, 2024Verified","Great company!I love this company! Their products are great quality and I always get my order in a timely manner. Highly recommend! Date of experience: November 05, 2024",5
Janet Hughes,US,"Oct 15, 2024Verified","Beautiful workmanship They make the most beautiful stuff. Wonderful craftsmanship and so nice and responsive when you email them. Ask how I was when realized I was in NC after Helene. They go above and beyond. Great company with great products I love my heart map I got for my brother and sister in law as a house warming gift. Date of experience: September 14, 2024",5
Melvin Brink,US,"Dec 25, 2024Verified","More than a trinket Nicely designed piece delivered in a timely manner. Happy camper.Date of experience: November 27, 2024",5
Catalina Gray,US,"Dec 18, 2024Verified","It was probably one of the nicest gifts…It was probably one of the nicest gifts that you could give. Especially since they were made out of the Olive tree branches.Date of experience: November 20, 2024",5
Bridget Crews,US,"Oct 18, 2024Verified","Love the GA/FL tag heart!Love the GA/FL tag heart I ordered! It’ll look great inside our garage with our other signs…wonderful quality and super fast shipping! Very happy customer! 😁Date of experience: September 20, 2024",5
kathleen vigil,US,"Dec 1, 2024Verified","Five starsI have made 8 orders from Dennehey Design. All of the orders are shipped quickly and excellent are quality products. I love love their little wooden houses and olive wood hearts. Date of experience: November 02, 2024",5
Carol Montalbano,US,"Sep 14, 2024Verified","A BEAUTIFUL FIND!My initial thought was to just order a small cross. It was so beautiful that not only did I go back to order more for Christmas gifts, I have ordered other items, as well. The workmanship that is put into their pieces are exquisite!  Whatever you choose, you will not be disappointed. I also had the pleasure to speak with Bonnie (Owner) who helped me locate a piece that I was looking for. She was so kind and helpful. It was such a pleasure chatting with her. Whatever you choose, you won’t be disappointed!Date of experience: August 16, 2024",5
LORRAINE CARLISLE,US,"Oct 26, 2024Verified","I have ordered 8 different items from…I have ordered 8 different items from this amazing company. Each item comes in perfect shape and very timely. I would recommend this company to everyone. When I open my package it puts a smile on my face. Thank you for your beautiful work. Date of experience: September 25, 2024",5
Lana Williamson,US,"Dec 1, 2024Verified","Love it!I ordered the tiny church and absolutely love it! I took one star off because I had to contact them after three long weeks when I hadn’t received my order. They finally shipped it out the next day and I received it promptly. Guess my order was overlooked…?Date of experience: November 02, 2024",4
Karen Richter,US,"Jan 1, 2025Verified","Just simply beautiful product.Just simply beautiful product.Timely deliveryDate of experience: December 04, 2024",5
Conrad Farley,US,"Nov 29, 2024Redirected","Unfortunately wouldn’t buy again Great idea and concept but quality very average and the time it took to receive my items was several weeks each time. Placed 2 nice orders and very disappointed. Date of experience: November 25, 2024",2
Denise Winston,US,"Sep 26, 2024Verified","Worth the Wait!I like that the company set my expectations for how long it would take to get my products. Sometimes when you order from a new (new to you) company you don’t know what to expect and they told me from the beginning how each product was handmade and it would take a few weeks to receive my order. I bought hearts, a couple of hand painted crosses and some stickers. Everything was the highest quality. I’m glad I found this company. Date of experience: August 28, 2024",5
Trish E,US,"Dec 20, 2024Verified","Beautiful productBeautiful product, promptly shipped. I highly recommend this company.Date of experience: November 21, 2024",5
Robin Gedge,US,"Dec 18, 2024Verified","Great itemsGreat items. exactly as pictured.  Special gift/extra gift for loved ones.Date of experience: November 20, 2024",5
Susan,US,"Nov 2, 2024Verified","Exceptional CompanyMy order came quickly & in perfect condition. They are beautiful! Great company to do business with and they care about their customers. Date of experience: October 04, 2024",5
Carrie P,US,"Dec 18, 2024Verified","Great jobGreat job! The crosses are beautiful and arrived super quickly Date of experience: November 20, 2024",5
Janet Sass,US,"Dec 5, 2024Verified","Love these folks and their productsLove these folks and their products!  Everything I've ever ordered has been made with care and the workmanship is incredible!Date of experience: November 05, 2024",5
