Username,location,date,content,Rating
Jane C,US,"Sep 2, 2024Verified","Awesome! Gifts or treat yourself!!Awesome!!  This is an incredible business! Always going above and beyond with every purchase.  Attention to detail is amazing and have made several items that have been personalized for the gift recipient.  Listens to my request and everything has been exceptional!! Their follow through with me has always been outstanding.  If things are not right the company makes it right without any issue.  Love their rewards points to use on future purchases and they add up quickly.  One of the BEST companies to do business with.  Frequently offer a discount coupon that I use!  My promise to you is that one purchase will lead to future items for gift giving or treating yourself to something special!  Outstanding selection of items to purchase.  You will NOT be disappointed!!  Fantastic company that is succeeding with values, outstanding customer service, fair pricing, quality products, timely delivery and the list goes on and on!!  Date of experience: August 05, 2024",5
Leenie,US,"Oct 5, 2024Verified","A great experience off of Instagram!Had a little issue with an upsell while ordering, emailed Bonnie, who actually called me regarding the issue, she assured me what I thought happened that I duplicated my order, was just my 1 single order but the additional upsell was not listed which was ok as I wasn't charged either. I could not believe she took the time to call. The items are as described and what I also liked is that since my item came as 3, there were 3 separate letters of authenticity if giving as separate gifts I can include 1 with each instead of receiving just 1 verifying authenticity just to the buyer. Allover, just a great experience.Date of experience: September 06, 2024",5
Tanya Quinn,US,"Nov 15, 2024Verified","Easy to orderEasy to order, fast delivery and great craftmanship.  My gift receivers are loving the conjoined hearts.  Thank youDate of experience: October 11, 2024",5
Me Shell,US,"Nov 25, 2024Verified","The Hearts spoke just the message I wanted! It was wonderful to talk to Bonnie in person on the phone! What service! ❤️My sister loved the 7 hearts I sent her for her 70th birthday! So much more than just a card! It spoke the message of love I wanted it to! Thanks so much!!!😍Date of experience: October 24, 2024",5
Joyce Laux,US,"Sep 27, 2024Verified","Everything I’ve ordered has been…Everything I’ve ordered has been beautifully made, sent quickly and followed up with excellent customer service! I love this wonderful company and their handmade and Heart-made creations!Date of experience: August 29, 2024",5
Michael Young,US,"Sep 3, 2024Verified","These folks are fantastic There was a small issue and when I reached out Bonnie took care of it right away and was very apologetic.  I’ve made several purchases and have always been very happy.  Date of experience: August 05, 2024",5
Betty,US,"Sep 28, 2024Verified","Understanding customer serviceUnderstanding customer service, I inadvertently ordered two patterns exactly alike and ask, they removed one from my order.  Pretty things to have and great folks to work with.Date of experience: August 07, 2024",5
Jacee T.,US,"Oct 19, 2024Verified","Arrived quickly, great qualityMy order came quickly and was the quality I expected. I ordered the olive woods hearts and prayer crosses. I can’t wait to put a little piece of the Holy Land in each of my family’s stockings this Christmas. Date of experience: September 20, 2024",5
Shonna Walker,US,"Dec 13, 2024Verified","Beautiful Heart's Beautiful quality hearts! I ordered 3 and each one is so pretty and unique in the wood design! Fast shipping also!Date of experience: November 06, 2024",5
Tracey,US,"Nov 15, 2024Verified","Hearts are beautifulHearts are beautiful, order shipped quickly and the company reached out to ensure I was happy with my purchase.Date of experience: October 18, 2024",5
Dena Kozak,US,"Oct 27, 2024Verified","Great gift and use of our old plates!The license plate heart was a wonderful gift to my husband on our anniversary!  You all were so great to work with and have been praying for you since the fire!  Date of experience: September 13, 2024",5
Tom Klein,US,"Sep 5, 2024Verified","Great products made with care at an…Great products made with care at an affordable price. So easy to support great American businesses like Dennehey Design.Date of experience: August 08, 2024",5
Leah Ronan,US,"Oct 24, 2024Verified","Two become one…My daughter and her future husband loved the intertwined hearts. Well made and a perfect gift for newlyweds.Date of experience: September 25, 2024",5
Bernie Marcin VanGorden,US,"Nov 19, 2024Redirected","Cat mystery bix…I ordered the cat mystery box and was very disappointed. There were approximately 20 hearts inside the box but only 6 had a cat design. The rest were just plain heartsDate of experience: September 22, 2024",3
Harriett,US,"Oct 23, 2024Verified","I’ve always been pleased with my…I’ve always been pleased with my purchases from Dennehey !  They hearts are a perfect gift just to let someone special know you care! Date of experience: September 25, 2024",5
Tami Golobic,US,"Sep 27, 2024Verified","Beautiful quality product made by…Beautiful quality product made by wonderful people! I’m a frequent customer and have absolutely loved every item I’ve purchased ❤️😊Date of experience: August 30, 2024",5
Christopher Stone,US,"Sep 17, 2024Verified","I made the 3 ft crossI made the 3 ft cross, it was a great experience and have had literally hundreds of compliments! Thank you for tihe great working prints. Date of experience: August 20, 2024",5
Donna Gregg,US,"Oct 5, 2024Verified","Uniquely Crafted, American MadeLove the products your company offers, unique and beautifully crafted. I love that you make many from recycled materials. Date of experience: September 06, 2024",5
Stephanie Drouet,US,"Dec 26, 2024Verified","Beautiful product- very pleased!Date of experience: November 27, 2024",5
Susan Hughes,US,"Nov 7, 2024Verified","Loved the beautiful carved hearts from…Loved the beautiful carved hearts from Jerusalem.  Gave them as a gift and for comfort.Date of experience: October 09, 2024",5
Gayle Bridgeman,US,"Sep 4, 2024Verified","Israel Hearts!I purchased several orders of the wooden hearts made in Israel. They are beautiful! And those who received as gifts love them! Thank you! Date of experience: August 07, 2024",5
Lisa Raisbeck,US,"Nov 15, 2024Verified","They had some building difficulties but…They had some building difficulties but I received my order ASAP. Thank youDate of experience: October 17, 2024",5
Tracy,US,"Dec 5, 2024Verified","Beautifully doneBeautifully done! A treasure to have. I bought quite a few to give out at Christmas. Love the little card that comes with it tooDate of experience: November 06, 2024",5
Nina,US,"Aug 30, 2024Verified","This company is amazingThis company is amazing! I ordered the 3 wooded hearts and they are just beautiful. Everything was packaged so nice, sweet little thank you note, and cards for each heart on the history. The shipping was fast too. I plan on ordering more. Thank you so much! Date of experience: August 02, 2024",5
Ruth,US,"Nov 6, 2024Verified","Unique giftThe company provided great communication with me to create a unique map heart for my husband and me. Date of experience: October 08, 2024",5
Darlene Willett ,US,"Sep 4, 2024Verified","HeartsThis company,  Dennehey Design, goes up and over the great experience, they are wonderful to work with, kind and treat you like you are the best customer!Date of experience: August 07, 2024",5
Hope K.,US,"Oct 29, 2024Verified","I Highly RecommendTheir work is beautiful and of high quality.  I highly recommend.  You won't be disappointed. Date of experience: October 01, 2024",5
Dana Welch,US,5 days agoVerified,"Loved my painted crossLoved my painted cross. Unique piece. Date of experience: December 11, 2024",5
Patricia Vincent,US,"Nov 28, 2024Verified","Imperfect HeartsGreat customer service, great product.  Love doing business with themDate of experience: October 30, 2024",5
Russ Lange,US,"Nov 18, 2024Verified","Bonnie is fast to respond and friendlyThey have always been responsive and friendly when every I have contacted them.  A joy to work with.Date of experience: October 20, 2024",5
Tracey,US,"Sep 30, 2024Verified","What a perfect gift!The hearts I received are so beautiful . I got them for my granddaughters Baptism and it was the perfect gift. The story of where the wood came from is also perfect. Thank you so much! Date of experience: September 02, 2024",5
Elizabeth Garcia,US,"Nov 26, 2024Verified","Beautiful gift for my husband for our…Beautiful gift for my husband for our 30th anniversary. Thank you. Date of experience: October 29, 2024",5
LaWanna Lincoln,US,"Sep 10, 2024Redirected","I ordered a cross from the holy land…I ordered a cross from the holy land for my 91 year old mother,  they were kind enough to include a note for me and she absolutely loves it.  Took it to church to show all of her friends.  Highly recommend them!Date of experience: September 07, 2024",5
Michael McLaughlin,US,"Sep 23, 2024Verified","I bought the plans for the 3-D crossesI bought the plans for the 3-D crosses. I was amazed at how thorough they were. Any questions I might have had about construction were answered in the plans. I have made a number of the crosses so far and given them away as gifts. They have been warmly received.Date of experience: August 25, 2024",5
Bonnie Nesbit,US,"Nov 9, 2024Verified","The product was exactly as described…The product was exactly as described and I can't wait to give them as Christmas gifts this year!Date of experience: October 11, 2024",5
Julie Guzinski,US,"Oct 9, 2024Verified","Love my wooden hearts that I purchased.  Love my wooden hearts that I purchased. I had bought a 2nd set and gave them to a friend and can’t stop complimenting on how pretty they are. Date of experience: September 11, 2024",5
Tina M,US,"Sep 24, 2024Verified","SHIPPING WAS FAST AND THE HEARTS ARE…SHIPPING WAS FAST AND THE HEARTS ARE MAGNIFICENT!  WILL BE BUYING MORE FOR CHRISTMAS PRESENTSDate of experience: August 27, 2024",5
Lightwater,US,"Nov 19, 2024Verified","Great communicationGreat communication!  Great willingness to go above and beyond!  Great tiny homes!Date of experience: October 22, 2024",5
Lindsay Key,US,"Nov 15, 2024Verified","Beautiful HeartsThe hearts are beautiful and I love that they come with their own card to explain where they came from! Such a sweet little gift!Date of experience: October 18, 2024",5
Annette E,US,"Oct 18, 2024Verified","Handheld CrossesI really love the handheld crosses made from olive tree in Israel. I carry it every day and hold it while I pray. I've been buying them for my friends and family.Date of experience: September 20, 2024",5
Cathy Gummy,US,"Oct 27, 2024Verified","Product was exactly as described and I…Product was exactly as described and I received in a timely manner! Good company.Date of experience: September 28, 2024",5
Jennifer Walden,US,"Sep 3, 2024Verified","I absolutely love my wooden crosses I absolutely love my wooden crosses and thank you for the kind thank you gift, the wooden heart.  I will be ordering gifts for Christmas from you too!Date of experience: August 05, 2024",5
CeeCee  Brannon,US,"Aug 31, 2024Verified","Love this local business—it’s a…Love this local business—it’s a pleasure supporting them, and their products are the best!Date of experience: August 02, 2024",5
Johnny Celey,US,"Nov 14, 2024Verified","Wonderful company to work withWonderful company to work with! I would highly recommend them.Date of experience: October 04, 2024",5
John Engrassia,US,"Oct 5, 2024Verified","Got a custom box that is beautiful and…Got a custom box that is beautiful and wooden hearts that my girlfriend loves. Date of experience: September 03, 2024",5
Heather Mueller,US,"Oct 3, 2024Verified","The Olive branch hearts are absolutely…The Olive branch hearts are absolutely beautiful    Giving them as Christmas gifts. Date of experience: September 04, 2024",5
Dawn K,US,"Sep 6, 2024Verified","Beautiful HeartsThe hearts and cross are even more beautiful  than I imagined. My order came very quickly. I will be ordering more!Date of experience: August 09, 2024",5
Tricia Frazer-Flynn,US,"Oct 25, 2024Verified","What a beautiful marriage crossWhat a beautiful marriage cross with two hearts. It was beyond imagination Date of experience: September 27, 2024",5
Nana Renee,US,"Nov 9, 2024Verified","The items are high quality and arrived quickly. The items are high quality and arrived in a timely manner. I am very impressed. Date of experience: October 11, 2024",5
Missm ,US,"Nov 27, 2024Verified","Beautiful Was so excited to see them. Now I cannot wait to see my friends face when she opens her gift.Date of experience: October 30, 2024",5
Robert Riley,US,"Nov 28, 2024Verified","Very happy with my overall shopping experience My order arrived in a timely manner,  and communication about my order was very thorough. Date of experience: October 31, 2024",5
Angie Newton,US,"Sep 7, 2024Verified","Beautiful work!Thrilled with my order. Did not disappoint.  Absolutely love the hearts from the Holy Land!Date of experience: August 09, 2024",5
David G Knight,US,"Nov 15, 2024Verified","Arrived in perfect condition in a…Arrived in perfect condition in a timely manner!  Thanks!Date of experience: October 17, 2024",5
Kelly,US,"Nov 14, 2024Verified","Beautiful productBeautiful product. Quick shipping. Quality top notch!!!Date of experience: October 17, 2024",5
Kathleen,US,"Nov 20, 2024Verified","Hearts were perfect.Order arrived quickly. The items were just as shown on website.Date of experience: October 23, 2024",5
Marita Morrow,US,"Sep 11, 2024Verified","Beautiful heartsBeautiful hearts! Quick delivery. So excited to share them with others.Date of experience: August 14, 2024",5
Patricia G. Gervell,US,"Sep 3, 2024Verified","Beautiful Crosses and HeartsThe Crosses and hearts I ordered are beautiful and will make nice gifts for my family and friendsDate of experience: August 05, 2024",5
Gerald Boehle,US,"Nov 10, 2024Verified","Exactly as advertisedExactly as advertised. I really enjoy the product Date of experience: October 13, 2024",5
Diane Lunsford,US,"Dec 13, 2024Verified","Little HousesI love all of my little houses.  They are so enjoyable.Date of experience: October 29, 2024",5
Don Bloomfield,US,"Oct 19, 2024Verified","Very good BlueprintsVery good Blueprints. Easy to read with color added to the diagrams.Date of experience: September 21, 2024",5
Aimee Armenta,US,"Oct 30, 2024Verified","High qualityHigh quality.  Quick receipt of product.  Packaged nicely.  Date of experience: October 02, 2024",5
Debra Grant,US,"Nov 15, 2024Verified","The hearts that I ordered are…The hearts that I ordered are beautiful. I plan to give them as Christmas gifts. Date of experience: October 18, 2024",5
Ellen Winner,US,"Sep 12, 2024Verified","Your customer service is outstandingYour customer service is outstanding. A minor glitch was quickly and satisfyingly resolved.  I am delighted with the beautiful hearts.Date of experience: August 14, 2024",4
Sara Emir,US,"Nov 15, 2024Verified","Special and Beautiful Gifts!I appreciate the personalized experience of shopping at Dennehey Design. The pieces are beautiful, unique, and intentional, and they make wonderful gifts! Date of experience: October 18, 2024",5
Jackie ,US,"Oct 5, 2024Verified","Beautiful gifts.The hearts Are beautiful! I have given many as gifts and everyone loves them.Date of experience: September 06, 2024",5
Juli N,US,"Dec 13, 2024Verified","Excellent service Service was excellent… Bonnie was so helpful with my customer order Date of experience: November 12, 2024",5
Pammygrammy,US,"Nov 15, 2024Verified","Easy to order…great products and nicely…Easy to order…great products and nicely made. I am always proud to give one of your products as a gift. Date of experience: October 18, 2024",5
Don Cammarata,US,"Oct 18, 2024Verified","Olive wood heartsGave olive wood  hearts to family and friends as gift when visiting. All loved themDate of experience: September 20, 2024",5
Darlene,US,"Aug 31, 2024Redirected","I love hearts…have collected them for…I love hearts…have collected them for most of my life. I’m from near Detroit, and this is my back door (main) entry to my home!Date of experience: August 31, 2024",5
Lynn Massi,US,"Nov 8, 2024Verified","Wonderfully made and deliveredWonderfully made and delivered. Also very kind Date of experience: October 11, 2024",5
Emily Scott,US,"Sep 20, 2024Verified","Beautiful product and well made!Beautiful product and well made!!  Carry it in my purse and gave one to my husband and sister!Date of experience: August 23, 2024",5
Marguerite Baker,US,"Sep 20, 2024Verified","I am very pleased with the prayer bowlI am very pleased with the prayer bowl. It is well made and beautiful. I was a little disappointed in the length of time for me to receive it. Date of experience: August 19, 2024",4
John McInnes,US,"Sep 20, 2024Verified","I thought I’d get a current New Jersey…I thought I’d get a current New Jersey license plate but I got one that was from the 80sDate of experience: August 23, 2024",3
Liz Epsteen,US,"Nov 11, 2024Verified","nice jobIt arrived on time and it was very nicely made. I bought the double heart and its a special piece.Date of experience: October 11, 2024",5
James Royals,US,"Oct 24, 2024Verified","The product is a great design and good quality.The company has great communications and fast delivery. I really enjoy their Christian theme.Date of experience: September 25, 2024",5
Angela,US,"Oct 30, 2024Verified","They were beautifully madeThey were beautifully made. I gave them as gifts. Everyone LOVED them!Date of experience: October 02, 2024",5
Karen Ebeling,US,"Sep 17, 2024Verified","Purchased the heart keychainsPurchased the heart keychains.  Quality product with a lovely olive tree scent!Date of experience: August 20, 2024",5
Tim Nold,US,"Dec 1, 2024Verified","Easy to follow patterns.Date of experience: November 03, 2024",5
"moniz, maria",US,"Dec 1, 2024Verified","My gift purchase was terrific.Date of experience: October 30, 2024",5
Brooke ,US,"Sep 10, 2024Verified","I love the products I purchasedI love the products I purchased! And the sweet little hand written note inside made my day! Thank you so much! Date of experience: August 12, 2024",5
Cary Calvert,US,"Nov 15, 2024Verified","gift for our daughter and it’s perfectgift for our daughter and it’s perfect!  Came quickly as wellDate of experience: October 17, 2024",5
Judith,US,"Oct 2, 2024Verified","BeautifulBeautiful! They’ve made cherished gifts!Date of experience: September 04, 2024",5
Linda,US,"Dec 30, 2024Verified","Loved the products and their craftDate of experience: December 02, 2024",5
Kristi Hamlik,US,"Sep 17, 2024Verified","The quality of their products are…The quality of their products are wonderful…Date of experience: August 20, 2024",5
June Sutherland,US,"Nov 16, 2024Verified","Beautiful pieces and fast shipping.Beautiful pieces and fast shipping. Date of experience: October 18, 2024",5
Paul,US,"Dec 21, 2024Verified","The personal touch when orderingDate of experience: November 22, 2024",5
Sandra Lewis,US,"Sep 13, 2024Verified","Patterns were easy to order and…Patterns were easy to order and download. Immediate turnaround. Great service.Date of experience: August 16, 2024",5
Billy,US,"Sep 12, 2024Verified","I enjoyed making a few crossesI enjoyed making a few crosses. The plans were clear and thorough.Date of experience: August 13, 2024",5
Peter Shangraw,US,"Sep 12, 2024Verified","My questions were answered quickly and…My questions were answered quickly and professionally. Date of experience: August 14, 2024",5
Larry ,US,"Dec 12, 2024Verified","I always get good stuff from you.I always get good stuff from you. Date of experience: November 14, 2024",5
Felecia Jones,US,"Sep 20, 2024Verified","Ease of ordering and quality products.Ease of ordering and quality products. Date of experience: August 22, 2024",5
Brenda,US,"Nov 8, 2024Verified","Beautiful product and great service!Date of experience: October 10, 2024",5
Deborah,US,"Nov 9, 2024Verified","Well made, beautiful items!Beautiful, handmade items. Quality construction. Great price. Quick delivery!Date of experience: October 11, 2024",5
Amy Jack,US,"Oct 23, 2024Verified","Love the heartsLove the hearts and the idea behind it. Will probably buy more. Date of experience: September 25, 2024",5
Sharon v,US,"Oct 5, 2024Verified","Beautiful products !Beautiful products !! Love them. Date of experience: September 06, 2024",5
Stacy Wilson,US,"Dec 4, 2024Verified","Great product Great product Quick shippingDate of experience: November 05, 2024",5
Happy customer,US,"Sep 4, 2024Verified","Wood crossesThe product arrived quickly and with no issues.Date of experience: August 07, 2024",5
Tom Ferrara,US,"Sep 20, 2024Verified","The items are exactly as describedThe items are exactly as described. Will be back soon Date of experience: August 23, 2024",5
Ron Hagberg,US,"Sep 1, 2024Verified","Beautiful variety of designsBeautiful variety of designs, wonderful DIY instructions. Very responsive to questions and issues.Date of experience: August 04, 2024",5
Max Wall,US,"Sep 20, 2024Verified","The oil canvas was wrapped and packaged…The oil canvas was wrapped and packaged well . Very pleasedDate of experience: August 23, 2024",5
Kelly McCain,US,"Sep 4, 2024Verified","Highly recommended Excellent product and quick shipping! Date of experience: August 07, 2024",5
Sharon Knoth Kight,US,"Sep 3, 2024Verified","Very high quality and gorgeous…Very high quality and gorgeous workmanship.Date of experience: August 05, 2024",5
Jann Kalawa,US,"Sep 6, 2024Verified","I wish I had a place for everything…I wish I had a place for everything they make. I have crosses and hearts…love them allDate of experience: August 09, 2024",5
Sheri Casali,US,"Oct 23, 2024Verified","I’m disappointed as I never received my…I’m disappointed as I never received my order. Date of experience: September 25, 2024",1
Kathryn Olson,US,"Sep 21, 2024Verified","Loved my three olive wood hearts. The little hearts are smooth and perfect. Just what I wanted! Date of experience: August 23, 2024",5
Andrea,US,"Oct 23, 2024Verified","Beautifully craftedBeautifully crafted. Will order more!!Date of experience: September 25, 2024",5
Robin Crockett,US,"Oct 5, 2024Verified","Quick service and great products.Date of experience: September 06, 2024",5
AL,US,"Sep 27, 2024Verified","A+ on quality and A+ on customer…A+ on quality and A+ on customer interaction! Date of experience: August 30, 2024",5
MH,US,"Nov 9, 2024Verified","Size was misleadingSize was misleading Date of experience: October 11, 2024",3
DIBYENDU,BI,"Oct 26, 2024","It’s not so good,,It’s not so good,,, Don’t belive it....❌❌❌ ScamerDate of experience: October 23, 2024",1
Candy Huffmeyer,US,"Oct 12, 2024Verified","Great product and great company.Date of experience: September 14, 2024",5
Dawn,US,"Sep 26, 2024Verified","So very special to me!Date of experience: August 27, 2024",5
Lynn Rubin,US,"Dec 16, 2024Verified","Fantastic product.Fantastic product. Date of experience: November 18, 2024",5
Paul Dufner,US,"Oct 16, 2024Verified","Takes a few to know the little tricksDate of experience: September 18, 2024",5
Bing,US,"Nov 22, 2024Verified","Love it!!Great communication from sellerDate of experience: October 25, 2024",5
Swankysilver,US,"Oct 26, 2024Verified","Clear communication and beautiful…Clear communication and beautiful product!Date of experience: September 28, 2024",5
Jennifer H,US,"Nov 28, 2024Verified","Beautiful gift.Date of experience: October 30, 2024",5
Marlee Milke,US,"Nov 15, 2024Verified","Beautiful and well made Quality and beautiful Date of experience: October 18, 2024",5
Harold Levy,US,"Nov 21, 2024Verified","BeautifulBeautiful, creative jobs Date of experience: October 23, 2024",5
Michelle,US,"Sep 16, 2024Verified","It was a ripoffIt was a ripoff.   Save your money.  ScamDate of experience: August 19, 2024",1
Patricia Cazabon,US,"Nov 8, 2024Verified","Love my cross.Love my cross. Date of experience: October 11, 2024",5
KC,US,"Sep 3, 2024Verified","Absolute beautiful reminder of God!Absolute beautiful reminder of God! Date of experience: August 06, 2024",5
Christie Carter,US,"Oct 22, 2024Verified","Beautiful product.Beautiful product. Date of experience: September 23, 2024",5
M.A.,US,"Sep 20, 2024Verified","Excellent customer service.Excellent customer service. Date of experience: August 23, 2024",5
Klim KlimKlim,UA,"Sep 9, 2024","Good.Goooooooooooooooood.Date of experience: September 10, 2024",5
E Hernandez,US,"Aug 30, 2024Verified","Courtesy and reliability I ordered a set of 12 small crosses meant for a special project. Required a varied lot. Unfortunately, the crosses were very similar in finish which meant I would have had to redo finishes for a majority. I return the items and was quickly issued a refund. The crosses are well done with good material. Just not what I needed for the project. I will definitely do business again with this company because of the quality of their products, their courtesy and reliability Date of experience: August 01, 2024",4
Doreen,US,"Aug 30, 2024Verified","Thanks.....but no thanks!The order was received in a timely fashion.  Unfortunately, it was not exactly what I was looking for.I give high stars because the service was good and it was a quality product....just not what I wanted.  I was looking for plain unfinished (but sanded) wooden pocket cross, no paint, varnish or other decorations. The paint, varnish etc has an odor to it.  I will give them away.  Thank you. Date of experience: August 01, 2024",5
