Username,location,date,content,Rating
Jays Mommy,US,"Jun 24, 2024","Not good Every time I order from Walmart delivery something goes wrong. I ordered some mandarin oranges and all of them were gushy. I also ordered a seedless watermelon but received a small mini sized watermelon. One time after I placed my order and I edited my items they charged me for the items and said I would get a credit  but I never got the credit and it’s been three weeks. Also, they say they put a hold on your account but when I use my debit card after I hit send the money comes directly out of my account so it’s not actually a hold on a debit card. I can order $38 Worth of items and somehow my bill ends up being $60 it just never adds up when there’s a $10 delivery fee.I will just go in and buy my groceries. Employees also pick the worst items. I received some bad chicken that smelled horrible as soon as I opened the pack it expired that’s same exact day. Date of experience: June 23, 2024",1
Brenda McClure,US,"Dec 21, 2022","No communication.First time using delivery and last time. First, no communication. Did they get my order? We’re there substitutions? What is going on? Then when delivered, the substitutions were absurd. I ordered sausage biscuits, they substituted chicken biscuits. Other things, just weren’t there. Since no receipt was included, no way to check my order.  I will continue to order and pick up,if that continues tobe decent.   Some kind of communication is needed.A text saying you got my order, would be nice.Date of experience: December 20, 2022",1
Brittain Reinmuth,US,"Jul 2, 2024","Crappy delivery driver Delivery driver stepped outside his vehicle and canceled my order. I saw him outside and ran to get my order. He says he knocked. I have cameras that say otherwise. Now my money is somewhere in limbo. I have no groceries (and no money). I hate it more that there is no recourse against that lying driverDate of experience: July 01, 2024",1
Kimberly Boone,US,"Feb 6, 2023","Always something.Every other order I place has some issue, missing multiple things, being delivered to my neighbors house, or simply not showing up at all. On this current order it was scheduled to be delivered between 4 pm and 5 pm, it is now 8:10 pm, but support assured me that it will arrive before EOD. I would be shocked if it did. Walmart is dealing with groceries and household items - necessities - not luxuries. What is the point of paying for the plus service if they cannot deliver?  Amazon it is I guess.Date of experience: February 05, 2023",1
Dion Beals,US,"Aug 14, 2024","Can’t get rightAlways some type of issues with your delivery order. Every time I order I can never get what I’m ordering something is always missing or unavailable. I payed for 3 hour delivery never received my order. You will never receive the correct order you will always have to substitute some item. They always blaming on the delivery service they use. Date of experience: August 14, 2024",1
Kimberly Wiser,US,"Dec 17, 2022","Don't use Walmart in-homeThe Walmart in-home is terrible. I've had it for almost two months. My groceries have only been delivered within the 4 hour window twice. I had another grocery delivery scheduled for 9-1 yesterday (12/16/22). I finally reached out to Walmart at 5pm when I hadn't received them. They said a driver still hadn't been assigned. It's 6 am the following day and they still haven't been delivered. My order just continues to say delayed. There is zero communication and the in-home app is totally useless. I will not be renewing in-home or Walmart plus. It totally defeats the purpose if they can't guarantee they will deliver groceries within the order window or even the same day.Date of experience: December 16, 2022",1
Mark Bee,US,"Jun 19, 2024","Been a Member for just over a year nowBeen a Member for just over a year now. getting about 2 or 3 orders a month , about a $100 to $150 each.   I figure about 30% have something wrong. Minor issues. A missing item, late delivery.   About one out of ten its major, like missing half the order.    When you use the website for a refund, some item dont even have the ""missing item"" option so you are force to call,  Where someone with a foreign accent will tell you they will take measures to insure in never happens again...And next week my order arrives minus the milk i order.Date of experience: June 19, 2024",1
Martha MacMaster,US,"Jul 30, 2024","It is so hit or miss with service with themIt is so hit or miss with them. My last grocery order was on Sunday. It was supposed to be delivered by O’clock 7 o’clock and there was the usual delay which I knew was going to turn into not getting my groceries so I canceled them. They were delivered to my door on Monday only to rot and attract ants. They gave me a refund but not the first time they have messed up, so I am done with Walmart.Date of experience: July 28, 2024",1
toni sams,US,"Dec 24, 2022","More than likely I won't be using…More than likely I won't be using Walmart grocery delivery. I put my order in  24 hours early and set the time for 11 am.  I got the first message that the time had been changed to 1  pm, then it was 1-3 pm., I stopped looking at it at 5 pm. Around 7 pm.,  a Walmart representative called saying they had no delivery people available and wouldn't have anyone for the next day and could I come and pick the groceries up.I appreciated the call, but my car is having issues and that is why I needed the home delivery. I understood the problem and all is well. I think Walmart needs to invest in delivery vans to deliver as Hy-Vee uses.  I do have to say that the weather was horrid. It truly is a much need service.Date of experience: December 22, 2022",4
JK Lowe,US,"Sep 20, 2024","Delivery Failure/Customer service is a jokeMy delivery was dropped off at the wrong house. The photo is clearly NOT my house. When I contacted customer service they said that the photo is proof of delivery and my only recourse is to contact my bank to dispute the charges. Useless. Date of experience: September 19, 2024",1
Susie Terry,US,"Nov 15, 2022","Great Except When It's NotOverall it is great - however, I would really appreciate it if an accurate picture of what is and what IS NOT actually available were presented.  It is extremely frustrating to plan based on what appears to be available only to find out, too late, that it's not.Date of experience: November 15, 2022",4
Sandra Douglas,US,"Jan 9, 2024","My grocery order was scheduled to be…My grocery order was scheduled to be delivered 4:00-5:00 on 01/08/2023. It was delivered to the wrong address. I reported it right away and all I got from Walmart chat, email & phone call to their 800 number was ""we're sorry"". My husband (we are senior citizens} had to go our in our neighborhood in the rain to find our groceries. I question why the delivery person doesn't have to go back and pick up the order and deliver it to the correct address. After several chats, emails & 2 phone calls I finally managed to get my delivery fee back and that's all. Had to complain numerous times to get that. Don't use Walmart delivery!! They don't care about you! It's all about putting your money in their pocket for them.Date of experience: January 08, 2024",1
Ross Poling,US,"Sep 15, 2024","I ordered on line and did not want a…I ordered on line and did not want a substitute because they do not have a good one. I ordered there large 2% cottage cheese and when I ordered there was no notations the product was out . They took my order and 1 hour later emailed me and was stustuting  a smaller size less oz for more money. That where it began the bait and switch. I emailed back and they had already put a hold on my money and the order never was filedDate of experience: September 14, 2024",1
Chachi ,US,"Nov 2, 2022","Since June I have consistently been…Since June I have consistently been having issues when items on my orders are not in stock and told at time of p/u or delivery. Walmart authorizes the charges and the authorizations do not drop from our banks for a week and if it is on the new Healthy Benefits Plan From United Health Care , funds are not credited for 10+ days plus if they are at all . Walmart should not do this. They should charge when they ship or process the correct payment minus items missing, the moment the order gets delivered. Such an inconvenience and not to mention the time on the phone for this happening now all the time.Date of experience: October 31, 2022",1
Surfshark Customer,US,"Aug 12, 2024","About WALMART on 886…I am talking about WALMART on 886 Niagara Falls Blvd, North Tonawanda, N.Y. 14120. I was a regular shopper there until a store employee 1. refused to give me a full refund on anything new I returned, 2. Had someone go around the store and hide items I was going to buy, 3. The cashier would over pack the paper bags, rip them and charge me for everyone she ripped!! 4. Some woman approached me and said ""I know what you did"" I replied, AND then SO WHAT?? She must have thought I was so hard up I would settle for anyone, she is all wrong compared to what I am looking for. She then ran over and talk to some guy to tell him what happened. 5. Some employee was trying to put something on my coat while I was going threw the checkout lane. 6. Store employees tell all the customers NOT to talk to me (violating my civil rights).Date of experience: September 07, 2023",1
anngroen,US,"Apr 13, 2024","Order is 17 hours late so far…We had a delivery scheduled for Friday, April 12 between 4-5pm.  We were traveling that day.  I ordered food because we would be tired from airline travel.  At 5 Walmart indicated that the order was ‘delayed’.  It is noon the following day & no food yet.  No phone call or email either.  Very bad customer service.  I called their help line.  They offered no help.Date of experience: April 12, 2024",1
Honeybee,US,"Mar 2, 2023","No communicationNo communication. Take my money and tell me lies. Delivery either don't show at all or always late. It hasn't been a week since I signed up for Wal-Mart delivery and I'm running into too many issues. Today was the last for me. I ordered groceriesin the morning so I have it in time for dinner and it was delayed twice. My patience has run out. I'm going back to Amazon. I rather pay the extra fee for quality food and better service.Date of experience: March 02, 2023",1
Eileen,US,"Jul 15, 2024","Zero StarsI watched the driver on the map stop all around my place and wait there for sometime, but never came to my home since I was waiting for her. Then she claimed the order could not be delivered. She never even tried. So I have no groceries before my work week. I’m canceling this membership with Walmart now. Date of experience: July 14, 2024",1
elsa,US,"Feb 26, 2023","Not worth it $$$$!I order at least twice a week for delivery but out of 10 items, 3 items are substituted. Or more. And ordering fresh bread, or lettuce mixes, they stick you with the ones that expire tomorrow or same day. Or they forget to deliver several items. Low stock on chips, kefir, Greek yoghurt, breads, cookies so I can’t get the minimum of $35. Don’t do it!Date of experience: February 26, 2023",1
Kiera Jackson,US,"Dec 1, 2022","Walmart delivery services are trash 🚮If I could rate zero stars I would,ordered a video game for my son’s Christmas present at a discounted rate on cyber Monday and it was delivered to the wrong address. Instead of replacing it which would be the best option they processed a refund and now I’m having to pay full price for the video game🤬Date of experience: November 30, 2022",1
SARA KHARAL,CA,"Jan 20, 2023","I'd give zero stars if possibleI'd give zero stars if possible. I've ordered from them 3 times hoping the next would be better. I don't know why I pay delivery charges. They don't send more than half the items and refuse to cancel it beforehand as well. Their website never mention's what's in stock. And they they refuse to return money because of too many returns. It's not the customers fault they mess up EVERY single time.Date of experience: January 17, 2023",1
Bill Did It,US,"Dec 8, 2022","Walmart In Home…Taking a Turn for the WorseWe have been using Walmart In Home delivery since it started and it has somehow become worse.  Our In Home time slot was 2pm - 6pm and here it is 8pm and it still has yet to be set out.  It showed on the website that it was ""on the way"" at 1:40pm and still shows ""delivery by 2pm"".  We recieved a email from Walmart In Home at 6pmstating that the order was delayed but, and I quote from the email, ""We’ll also send a notification when your order is out for delivery."".  I think Walmart needs to take a step back and work on the logistics of ""their"" delivery platform.Date of experience: December 07, 2022",1
Val Lee,US,"Dec 30, 2022","We took advantage of this twice and…We took advantage of this twice and both times they sent our groceries to the wrong home. When I called Walmart, the lady stated it was not Walmart's fault or responsibility, it was the person who delivers. Well, does not Walmart get the booty and hire the person?Date of experience: November 10, 2022",1
Linda Stanton,US,"Jan 1, 2023","I was super pleased with my first…I was super pleased with my first Walmart delivery experience. Only 2 substitutions out of over 30 items and they were fine. The driver showed up exactly at 700 for a 700 to 8pm window. Live on third floor and have sprained ankle so was very grateful. Will definately do again.Date of experience: December 31, 2022",5
Laura Sands,US,"Sep 3, 2023","Order Not DeliveredOrdered items for a small gathering I was having, once again receive notification order was delivered, but the photo is not of my home! You cant resolve on their website, must call and then an automated response tells you to wait 48 hours in case it might still be delivered. How could it still be delivered when I have a photo of where it was delivered. They need to get a more reliable third party delivery service. This happens more and more! Now I have to go to the store and do it myself, it does not save me time or money spending an hour trying to resolve the issue.Date of experience: September 03, 2023",1
Jo Pfeiffer Watson,US,"Oct 7, 2024","I put my delivery order in on October 5…I put my delivery order in on October 5 for the 4-6 time slot.  6:30pm came and it said there would be a delay of 2 hours.  I just rescheduled for October 6 at the 4-6 time slot.  It came to almost 7pm and app said they were preparing my order still.  I am a Senior living in Senior housing.  I need my groceries.  I called the Walmart where the delivery comes from.  I ended up talking to the operator, as that's the only line that answered.  She talked to the Manager that told her to tell me they didn't have any drivers.  I could just come and pick it up.  I am disabled and that's not an option.  I ended up cancelling the order.  I see my SNAP has been refunded, but will have to wait for my credit card to be refunded.  I live on Social Security and this makes it tough on me.  Now I have to figure out another way to get my groceries.Also, I have never been able to get the Paramount plus to work on my Roku TV .  There is no where to enter the code.  Paramount plus just goes to the default payment.  Date of experience: October 06, 2024",1
Yvonne Brewster,US,"Aug 24, 2024","Happy Customer I have been using Walmart for only a short while, but I must say that I am so happy with it. My orders have been correct and on time. Using this service has really been so convenient for me. Date of experience: August 23, 2024",5
Gin B,US,"Jan 18, 2023","Delivery is awful and unreliableDelivery is awful and unreliable. I can honestly say I’ve given it a good run and I am done after several failures, which include late delivery, items missing, delivery not even showing up, and having someone else’s orders delivered instead of mine! Not sure how they are still alive in the delivery world.Date of experience: January 14, 2023",1
crystal,US,"Dec 13, 2022","Stolen packageThis wasn’t a grocery deliver however it was a Walmart same day delivery. The driver stole the package. Walmart did process a refund however the driver should face some sort of reprimand for stealing. All drivers should be held accountable for this sort of things because they are representing Walmart and this type of behavior is unacceptable.Date of experience: December 12, 2022",1
Heath Jefferson,US,"May 11, 2024","I you ever need to reschedule your…I you ever need to reschedule your delivery you will find out just how incompetent this company really is. I will be looking at other options moving forward because Walmart is full of flat out liars. Date of experience: May 11, 2024",1
Warin,SE,"Updated Sep 13, 2023","Once Upon A Time In AmericaI'm 68 years old. Once upon a time in America, businesses used to compete regarding who gave the best service.  In the 1960s someone came up with the idea of scrapping service attendants and making customers pump their own gas.  That turned out to yield more profit. Walmart has taken this concept to the extreme.  Not only have they done away with at first the baggers and then the checkers. They've outsourced deliveries AND customer service agents.  Walmart is a billion dollar company. They could afford to give MUCH better service.  But that would reduce profits. IMHO, they're greedy to the max.  Nevertheless, THAT'S why their service sucks.  LOWER SERVICE = HIGHER PROFITS.TIP: Use PayPal.  Never give Walmart your credit card information.  If you need a refund and Walmart tries to rip you off, you can complain to PayPal and they will retrieve your money. If you have already given Walmart your credit card data, go to the website and delete your card from their files.Date of experience: August 28, 2023",1
Pat Kell,US,"Dec 19, 2022","The InHome delivery never shows upThe InHome delivery never shows up. It’s ridiculous! Walmart plus is slightly better but not by much. I regularly have missing items. Walmart needs to get it together or stop offering these services.Date of experience: December 01, 2022",1
Lynda Shepherd,US,"Jul 9, 2023","Left food by trash candOverall, the grocery delivery works out ok. Lately, I've received the wrong order and been told my delivery driver had something to do so my order wouldn't be delivered until the next day. The worst experience was the last delivery. My husband is disabled. In the instructions for delivery, the groceries are supposed to be left at a certain door. . Most times the groceries are left at that door. The last time the groceries were left in the hot sun in my driveway next to my trash cans. Obviously my husband could not get to the groceries. By time I got home, all the perishables were unusable. I did receive a refund but I can't believe the driver would leave my groceries next to the trash cans.Date of experience: July 01, 2023",1
Michelle Shaffer,US,"Nov 2, 2023","I signed up for Walmarts 30 day trial…I signed up for Walmarts 30 day trial grocery delivery service. I tried for more than a week to get 1 delivery. The app sucks. It won't load wallet. I called customer service 30+ times and got the run. Around. I cancelled. I'm so angry and frustrated bc I needed food delivered as I'm fresh out of surgery and can't go anywhere.Date of experience: November 02, 2023",1
Sherrie,US,"Mar 9, 2023","I’ve waited three weeks to get a…I’ve waited three weeks to get a grocery order to go through only to be brought a portion of my items and damaged produce. It’s been worse and worse since last summer. On two occasions the drivers they hired simply took off with the products. Hire better people and pay them a living wage!!!Date of experience: March 09, 2023",3
Maureen Loft,US,"Dec 16, 2022","processing, processing, processing--- delayedI ordered a gift on Tuesday, paid to make sure it was delivered by ThursdayI was worried when all day Thursday it still showed processing.  Went to bed early-- still showing processing.Woke up to an item delayed text.In the time it spent processing, a heads up could have been given.  Target tells you within an hour or so for example if they can't fill your order.  So here I am having to request a cancellation and run to the grocery store for a last minute replacement gift.Date of experience: December 14, 2022",1
chris connally,US,"Jul 7, 2023","How are they still offering this…How are they still offering this service???  Twice in a row now they've delivered to the wrong address.   Impossible to reach anyone (store doesn't answer at all) and the toll free number is overseas and they said to call back after two days...it's a freakin' grocery order!   I don't think I want hamburger meat that's been lost for two days...   Got in my car and drove around the neighborhood and found it a street over.   They should be absolutely ashamed.Date of experience: July 06, 2023",1
Coco Puffs,US,"Aug 23, 2024","Ignorant!!I order from the Walmart app all the time since the ones near me are very dangerous due to homeless camps outside of them and a lot of theft and very dangerous activities (alaska type things) so as a woman by myself I don't feel safe so this is always my resort and it always has something missing or it takes 4 hours when I do the 2 hour express everytime because I have refrigerated things in there and they still get here warm!! They leave all the stuff outside of my apartment building and it often times gets stolen due to homeless, as to why I ask them to deliver it to MY door since they have codes to get in or they could just ask me to go down there. They are way to lazy to bring it to a safe spot and when I do get my products they are ALWAYS damaged and I always have substitutes for things I know they have in stock just because they are to lazy to ask a employee or walk around the store a little more 🙄 And of course this is the only option I have for awhile. It sucks and I wouldn't recommend it. Expecially since they don't have a way to report the drivers because it's a third party. Why not have your own walmart drivers? I could imagine they would make way more money! Date of experience: August 22, 2024",1
Kelly,US,"Dec 12, 2022","Worst delivery service EVERWorst delivery service EVER! After reading the other reviews, it’s clear subpar service is Walmart’s standard. I’ve tried several times over the last 6 months to be patient and understanding, but Walmart simply has poor business practices and unacceptable customer service. Definitely cancelled my Walmart + subscription, and will be getting my groceries from elsewhere, even if it’s substantially more expensive. I’ll pay to know I’m going to get what was offered to me.Date of experience: December 11, 2022",1
CJ of Atlanta,US,"Apr 28, 2023","MET THE MINIMUM FOR DELIVERYMET THE MINIMUM FOR DELIVERY. WAS NOT DELIVERED. HAD TO PICK-UP. 66% WAS TO BE A SUBSTITUTE. TWICE THE COST. SUBSTITUTE WAS NOT FOR LIKEABLE ITEMS ORDERED. WALMART DOES NOT HONOR THIER POLICY. 3RD TIME IS LAST TIME FOR ME. DROVE 22 MILES ROUND TRIP NOT TO RECEIVE WHAT WAS ORDERED.  WALMART SENDING ME SOMEWHERE ELSE TO BUY FROMDate of experience: April 27, 2023",1
Tammie Elkins,US,"Jun 16, 2023","Walmart kept my money and no groceriesPlaced a grocery order and 2 hrs later they sent a text for a substitute. I didn’t like substituting so I cancelled that one item. A few minutes later I get a text saying my whole order was canceled!!! A 250.00 order! I spoke to three different Walmart customer service people and all they could tell me was it was a technical error with that store and said my money would be returned in 7 days! 7 days! So we have went a week without groceries and I have a 6 year old! Did Walmart care! No! I see a class action lawsuit coming!!Date of experience: June 10, 2023",1
Therese Davis,US,"Apr 16, 2023","They did not call on my delivery and…They did not call on my delivery and just cancelled my order.  On Instacart Wegmans perfectly delivered everything.  Switch from Walmart to Instacart and save you money.Date of experience: April 15, 2023",2
Charles Kendrick,US,"Jan 28, 2024","Walmart history of changing suppliers has hurt quality of their brand baconSeems Walmart has recently changed Bacon supplier for their Great value Brand .  Previous bacon was awesome,  have recommended it to many people.  Now I have to changeDate of experience: January 27, 2024",1
Sarah,US,"Nov 5, 2023","If I could put 0 stars I wouldIf I could put 0 stars I would. Ordered a few things for delivery, received messages stating it would be delayed three times. The next day I was notified I would have to pick up the order. I have now been sitting in the pickup area waiting over 20 minutes for someone to bring my items. I learned my lesson and will never use Walmart delivery.Date of experience: November 05, 2023",1
Mike_ K,US,"Jan 19, 2023","Horrible customer servicehorrible customer service on a grocery order.  Issue not resolved and the website did not allow me to complete my order, not able to add or delete items from my order when there was still time left to do so.  Countless phone calls and chats to delete the order as the system kept giving me errors.  What a joke.  I have shopped at Walmart for over 19 years.  after this issue is resolved.  WALMART HAS LOST ME AS A CUSTOMER.  NEVER AGAIN.  They made countless promises to cancel my order and even promised to escalate the issue ..... fruitless  effort and they did NOTHING!  I was even given reference numbers to confirm cancellation. promised the order would be cancelled in 5 hours and NOTHING.This has been the most horrible experience I have ever had from a company.Date of experience: January 19, 2023",1
