Username,location,date,content,Rating
Christine Nidd,US,"Jul 14, 2021","The only positive thing I have to say about Rite Aid is that they are consistent in disappointing me.I learned to lower my expectations of Rite Aid, and still they don't measure up. I scheduled a COVID test at their drive in site and the web site and confirmation email said 1-3 days for results. AFTER waiting 15 minutes past my appointment and completing the test, they said 2-5 days. When I pointed out my confirmation said 1-3 days I was told they had no control over the lab. Well...that really isn't helpful. As everyone knows, in order to travel you need results for a sample within 72 hours or the test can't be used for travel. Rite Aid should be upfront about their inability to meet required timeframes so people have the opportunity to book with an organization that is more capable and accountable.Date of experience: July 14, 2021",1
Straighten up world!,US,"Jul 12, 2021","Not surprised anymoreDo not order anything online from them. Trust me. You’ll thank me later.Date of experience: July 12, 2021",1
Mary,US,"Jun 25, 2021","I will never use this pharmacy againI will never use this pharmacy again! They play with peoples lives when it come to filling scripts. When someone needs meds to live. When I ask for my husband's breathing treatment and they act like it is some drug that I could sell on the street. It's a breathing treatment for God sake. It's Friday and they say no because they need insurance approval! Shame on this pharmacy in Hasslett Michigan. SMH. Over and overDate of experience: June 25, 2021",1
Susan Diamond,US,"Updated Jun 25, 2021","Don't come here for Covid testing.Although I'm generally a loyal Rite Aid customer, I wouldn't recommend using their services (through Project Baseline/ Verily) for a Covid-19 test, if you have other options.It's been seven days since we did a ""rapid"" test for our son. After waiting for several days with no results from Project Baseline, we decided to do another test directly with our son's medical provider (Kaiser), and received the results in less than 24 hours. Despite following up in all the recommended ways, we still haven't gotten results from Project Baseline.The difference between these two experiences is stark. It was very stressful and frustrating to wait so long for results from Project Baseline, given that we're a year into the pandemic and most facilities in LA seem to have streamlined their processes to be more efficient by now. In particular, we were disappointed by the lack of clarity around how the timeline for results would be impacted by the fact that the test was done on a Friday. In all the communications before and during his test, no mention was made of the fact that the expected turnaround time referred to business days only. It wasn't until several days later when we inquired about the delay that we received clarification that weekends were not included when calculating the expected turnaround time.Had we known this, we would have gone through Kaiser from the beginning. I realize and am grateful that we have access to Covid related resources that many others in the world do not. However, I offer this feedback to make other consumers aware and in the hope that Project Baseline/ Verily might improve their processes.Date of experience: June 24, 2021",1
Vivian Grijalva,US,"Jun 21, 2021","Riteaid just lost a customerRiteaid just lost a customer.  Because they have preferred parking for people who have had covid vaccine.So now non  vaccinated  are beingPunished SMH!!!Date of experience: June 21, 2021",1
Abu,US,"Jun 13, 2021","Embarrassingly unprofessional and defensive pharmacistSeveral politely asked questions expressing concern about a privacy policy (the requirement to write out my full SSN on a COVID test request for my daughter) led to a peculiar overreaction from the pharmacist, incredibly unprofessional customer service, and a level of defensiveness that was very strange. He actually said at one point that he was uncomfortable giving my daughter her second COVID shot. I think this was because he didn’t like the fact that I called the Rite-Aid customer service # to ask about the policy. He seemed to think my attempt to clarify and understand the policy was criticism of his character, which it wasn’t. But in the end, he revealed his character, and it was quite embarrassing IMO to the Rite-Aid name.Date of experience: June 13, 2021",1
D Gates,US,"Jun 9, 2021","Above and beyondI have an adult disabled daughter who is on Medicare. I had a problem with her secondary insurance regarding one of her medications. The charge was denied. Over the next three or four days I had several conversations with Rite aide. Eventually it was resolved. Each time I spoke to someone in the pharmacy I was treated kindly and respectfully. (The issue was complicated) They knew my daughter, myself, and my husband. Each person I spoke to earnestly wanted to have the correct insurance information and that the medication charge was submitted correctly. I am very grateful for the way I was treated. (In the end the medication wasn't covered.)Date of experience: June 09, 2021",5
CK,US,"Updated Jun 8, 2021","I bought a Neutrogena Healthy skin…I bought a Neutrogena Healthy skin compact foundation SPF 55 at riteaid the day before and it was filled with little bubbles inside when I opened it. Could be an old stock. I returned it the next day. I told the lady, when I bought it the guy(cashier) asked me if I wanted the receipt, I trusted riteaid so I said No. I told her she could check my Riteaid card for proof and she said it doesn't work that way. The lady was not courteous, no smiles, no ""I'm sorry about that"". No customer service was what I felt. Take it or leave it was what I felt. She just said without a receipt i can only give you back the lowest price for that product in that month. I bought it for $15+ and only got back $7+. No way this product was sold for $7+ in the month of June. That is a big loss. If I would have lost a couple of bucks I would have been fine. But more than half of it is ridiculous considering next day return and never used. I even asked her to check the product but she said not necessary. I have never been asked if I wanted the receipt from any other establishments except for Riteaid and for a visa card print out. If your policy is to have a receipt to return goods then why tell/trained your staff to ask customers if they wanted a receipt or throw it out? Its already printed (was in his hands), just give it. Is it so that Riteaid can make money on customers like me if there's a return? First and last for me. Walgreens, these are the few reasons why Riteaid lost so much money and selling the company to you. Please do not adopt their ways of doing business.Date of experience: June 08, 2021",1
Bri C,US,"Jun 2, 2021","Dissatisfied and poor customer serviceDissatisfied and poor customer service. Wouldn’t accept good Rx Made me wait over 2 hours for prescription Plus overcharged meDate of experience: June 02, 2021",1
Charles Napo,US,"Jun 2, 2021","Do not ever order from riteaide.comDo not ever order from riteaide.com.  They kept my order on hold and when I tried to cancel it they sent it anyway and charge my credit card then they want to take their time reviewing the case when he should’ve returned my money immediately buyer bewareDate of experience: June 02, 2021",1
"Dione Messina, NYC",US,"May 11, 2021","1951 1st Avenue NYC NY 100291951 1st Avenue NYC NY 10029. Why is there no manager at this location? Why is there no security guard at this location? Shelves are empty. Shoplifting is rampant. I live next door and see people walking out of the store with shopping carts of unpaid goods. Why is it still open?Date of experience: May 11, 2021",1
Patricia Fields,US,"May 11, 2021","This company has no follow through a…This company has no follow through a display fell and injured me and they they did nothing for me last year. No one at this company would talk to me after the report was filed NICE. I DOUBT IT WAS EVEN PROCESSED. Wow .....They care about one thing Themselves... not the customers.... still have scars on wrist thanks rite aid for the scars. Not a safe place to shop.Date of experience: May 11, 2021",1
Julie Aguilar,US,"May 3, 2021","Rite aids pharmacist in Milford Ct is…Rite aids pharmacist in Milford Ct is rude, judgemental and all around just nasty. I switched pharmacies because of this. She speaks down to customers and should definitely find a new professionDate of experience: May 03, 2021",1
Zachary Shank,US,"Updated Apr 22, 2021","Very Welcoming & Clean, Wonderful PricesRite Aid is a very welcoming and clean environment. Their employees go out of their way to assist you in the best way possible. Rite Aid has amazing customer service, and they use exceptional effort to make sure all of their customers' concerns are needed. This store is really nice, and definitely better than CVS.Date of experience: April 16, 2021",5
Luii Chang,US,"Apr 13, 2021","Bad Customer ServiceI am permanent customer at rite aid on 8222 18th avenue store. I asked for help about my reward card and the cashier was rude. My friend and I can see his face like not wanted to help. Very bad customer service.Date of experience: April 13, 2021",1
Kevin Duffey,US,"Apr 10, 2021","Went their for a covid TestWent their for a covid Test. My son and daughter went to an urgent care and were given their results in 5 minutes. No joke, 5 minutes. 2 days later and I'm still waiting and I'm sick as a dog.Date of experience: April 10, 2021",1
Debra Petitclerc,US,"Apr 9, 2021","SHOCKED WITH 4X MARK UPI walked into what I thought was a Bartells on 6th ave and when I went to pay for a monthly prescription and was shocked to find out that not only am I no longer at Bartells but at Rite-Aid but was also shocked with a sticker price of $88 on a regular $22 prescription.  This is SHOCKING!!!   Its not for some expensive monthly prescription.. PLUS it was GENERIC..  when I asked the counter assistant to please check again, that I could NOT believe it went from $22 to $88  she checked and confirmed that it was indeed $88.   this is a RIP OFF... I will never step into that parmacy again.. and urge anyone who fills prescriptions at the 6th ave Bartells... find somewhere else to go,,, you may end up with the same sticker shock I did...Date of experience: April 09, 2021",1
Lulu ,US,"Apr 6, 2021","Worst pharmacy experience everWorst pharmacy experience ever, had my appointment at 4pm, still waiting for the vaccine at 4:50pm, people came after me been called in already, but me no, I had no idea what’s going on, no one would tell you why everyone here for the vaccine is in the waiting area, while they don’t seem busy about everything else, worst experience ever!!! I won’t come back this place in my entire life to get anything from hereDate of experience: April 06, 2021",1
E.P. Tavares,US,"Apr 3, 2021","The Rite Aid Pharmacy in King CityThe Rite Aid Pharmacy in King City, CA had over 24 hours to fill my prescription.  It still was not ready.  I was told that it would take 1-2 more hours before it would be ready if I wanted to wait for it.  I didn’t.  I only use this pharmacy as a last resort. I do not recommend using this pharmacy.  The checkers were pleasant and apologetic however.Date of experience: April 03, 2021",1
LESLIE SCHULT,US,"Updated Apr 1, 2021","SITTING IN DRIVE THRU 15 MIN.I think it's outrageous to have people pulling thru the drive thru to do covid tests. What abt the rest of us that can't walk all the way to the back where ALL the big pharmacies put their departments? Then we get stuck in line bc some people don't read directions well? Why can't they pull into a nearby spot? When they're done they can walk it over. Just another way customers get walked on.Date of experience: April 01, 2021",1
Leanne,US,"Mar 25, 2021","Bad serviceRite aid is mostly unremarkable. Selection is like any other store in the area.As for the service, the employees are often rude. One employee at the pharmacy was especially horrible. Very unprofessional. I am only giving one extra star because of the shelf stocker who actually helped me. I will not be coming back to rite aid. I would much rather go elsewhere.Date of experience: March 25, 2021",2
James Madden,US,"Mar 25, 2021","Switching to Rite AidI received my COVID vaccines from Rite Aid in Westlake, OH. They were great! The pharmacist and staff could not have been nicer, more efficient and professional. So I transferred my prescriptions to Rite Aid from CVS. I had used CVS for many years and they have gone downhill in the past few years. I'm sticking with Rite Aid.Date of experience: March 25, 2021",5
Susan Pollock,US,"Mar 20, 2021","I bought a mac fit watch from your adI bought a mac fit watch from your ad.  It lasted 14 days the plug in broke I really like the watch it worked great while charged but to charge it the band pulled apart it fit so tight it broke when we tried to get it apart.  Sue PollockDate of experience: March 20, 2021",1
CW,US,"Mar 10, 2021","Rite Aid will never get my business…Rite Aid will never get my business again. I have never experienced worse customer service. I ordered items online and they sent me the wrong order. Just to get an initial response took weeks. It's been ridiculous. The more I've contacted them, the worse their responses became, until they stopped responding at all. They made me feel as if I was the one inconveniencing them. I never did receive the correct order. An all-around awful experience.Date of experience: March 10, 2021",1
Stephen Jafargian,US,"Mar 9, 2021","RITE-AID SUCKSTHEY  SUCK  THEY DON'T CARE ABOUT THE CUSTOMERS  THEY JUST SEE   $$$$   SCREW THESE  SCUM BAGS  TAKE   YOUR SCRIPTS  TO  WALGREENSDate of experience: March 09, 2021",1
Beth D,US,"Mar 7, 2021","Rite Aid in LansfordRite Aid in Lansford, PA was clean, super efficient and the pharmacist and staff were friendly and informed. I visited to make a purchase and receive a vaccine.Date of experience: March 07, 2021",5
Skye,US,"Mar 6, 2021","0 starsIf I could give Rite Aid 0 stars, I would. I paid for my daughter's prescription 2 weeks ago, but they didn't have everything in stock, so I was told to come back today. Then, today they tried to charge me AGAIN for what I had already paid for. When I became upset, they had the nerve to lecture me on ""being respectful"" when it was THEM who were horrifically disrespectful. NEVER GO TO RITE AID. THEY CANNOT BE TRUSTED.Date of experience: March 06, 2021",1
Michael93406,US,"Mar 6, 2021","DO NOT GO TO RITE AIDAfter reading all of these terrible reviews I shall NEVER deal with Rite Aid. Who needs that bad experience?Date of experience: March 06, 2021",1
Tristin Frizzle,US,"Mar 4, 2021","TERRIBLE companyTERRIBLE company. Store shelves are always half empty. Staff is untrained and uninspired. Product selection is awful. RITE AID SUCKS.Date of experience: March 04, 2021",1
Ivonne Barrios,US,"Mar 2, 2021","This is the worse pharmacy I have ever…This is the worse pharmacy I have ever been.  They have no communication between employees making costumers go crazy every single time you pick up a pxDate of experience: March 02, 2021",1
clifford morris,US,"Mar 1, 2021","Try calling and your on holdTry calling and your on hold. know one picks up the phone. The Rite-Aid in New Cumberland can't get there act together.Date of experience: March 01, 2021",1
Lisa Smith,US,"Feb 21, 2021","I would give a zero if possibleI would give a zero if possible. These absolute liars are pathetic. Just won a Paypal dispute with them so now I leave my review. I ordered some items and they said they shipped. Tracking number went nowhere. I call after about 3 weeks to find out where my stuff is and they make up some crap that they sent it but it was sent back damaged. I never even got it! I said Ok I want a refund and they said they couldn’t until it got back to their warehouse. Total sham. Do NOT buy from this joint online. CrooksDate of experience: February 21, 2021",1
Beatrice Mitchell,US,"Feb 18, 2021","UnprofessionalI called in my prescription to be refilled 9am at the rite aid store on Fulton street and ralph ave. KThey said it would be ready by 3pm. I go to pick up my medicine at 4pm. They said the prescription isn't ready yet to wait 30 more minutes.  In 45 minutes I go back to see if it's ready only for them to tell me they dont have it. No curiosity call. Very rude and unprofessional. People with Thyroid disease can't miss a day without medicine. I had to go to another rite aide to pick up the medication.Date of experience: February 18, 2021",1
Elizabeth,US,"Feb 17, 2021","Thrifty Ice CreamI purchased the Thrifty ice cream on a Buy One Get One Free.  The texture is more like ice milk and it had a gritty texture, as if it had been left out and refrozen. I've only eaten out of one, so we will see if the second is just as bad.Date of experience: February 17, 2021",1
Tara Runnels,US,"Updated Feb 12, 2021","KingsleyThe Rite-Aid in New Lebanon is always clean. The workers always greet you when you walk in. I enjoy the Reward Card. My favorite thing about Rite Aid has the be the pharmacist. His name is Kingsley, and he always goes above and beyond for the customers. He is always smiling, and always keeps you up-to-date on shots. He is honestly one of the main reasons we continue to use Rite Aid.Date of experience: February 12, 2021",5
GeeVan,US,"Jan 27, 2021","Non matching prices on web and instoreRite Aid online store location listed several items for what I was looking for but when I went to the store in person not one item matched pricing of what they had  listed online. Just an example Acid reducer 20mg famotidine 50 ct was listed at $4.99, but when I went to store they charged $14.49, As I didnt have time to check it especially in a covid situation, it was much later I realised that every item I bought was totally off the chart. I even emailed my disappointment through their survey and got a prompt reply though from a nice gentleman . I decided to return some of them ( although I should have returned all of them but I felt bad in for returning items as I generally dont like to do business that way.)  The clerk didnt even ask why I was returning , perhaps she got word from that gentleman in OregonDate of experience: January 27, 2021",1
Josie LaMonto,US,"Jan 25, 2021","The Staff At the RiteAid On Division…The Staff At the RiteAid On Division St. North Tonawanda Are Great! Pharmacist All Of Them Wonderful,& the The People Who Check you out; They make you feel you matter! Great Team!Date of experience: January 25, 2021",5
Andre Thomas,US,"Jan 24, 2021","my name is Andre Thomas I am unhappy…my name is Andre Thomas I am unhappy with the service at the Rite Aid in Harlem at 118th and 3rd in Manhattan I had the cashier reached over the counter and signed something on the display after I use my OCT card this happened January 23rd 2021 another Saturday young lady reads over the counter after I use my Chase card on the screen it ask would you like to get money back she just pushed cancel and I did wanted to get money that day she had no right reaching over the counter and pushing that the cashier had no right signing a signature after I use my OCT card I don't know what gives them the right to think that they can treat a handicap person liked this and I did not ask them for help I did not need their help if I need help I would have asked them but I didn't is unfair and I did not appreciate it please give me a call at 646-303-0866 if you want to know more about what happened on that eveningDate of experience: January 24, 2021",1
Danny T,US,"Jan 23, 2021","I have ordered from riteaid.com several…I have ordered from riteaid.com several times. In the past three months I have been going back and forth over an order I place in which 4 out of the 12 items were wrong. They literally sent the wrong items. I reached out to them and received the return label. I returned the incorrect items They sent to me and it showed delivered 4 days after. I have been in contact with them three times in the last two months. I did exactly what They told and waited patiently and still waiting on my refund. DO NOT buy if you have an issue They will make you go round and round.Date of experience: January 23, 2021",1
April Burchfield-Brennan,US,"Jan 23, 2021","I am a 100% wounded vetI am a 100% wounded vet, I had 400 stitches across my back and down my leg and just had surgery 3 days ago..    My doctor sent in a partial prescription for Rite Aid to fill, until I could see him on Tuesday.    The pharmacy on Williams highway said that they would have to send my prescription to the other Rite Aid across town in Grants Pass. When they did so, they  Put it in the computer wrong and the other right aid would not so my prescription. I went back to the 1st Rite Aid and asked them to go into the computer and fix it, they said they could not do that and that I would have to wait until Tuesday, when my doctor was back in town.   My doctor wrote my prescription for a reason and Rite Aid messed it up. Then camo they were very rude to me and told me to take something off of the shelf. If my doctor thought comment with my 400 stitches across my back and down my leg with half of my ass muscle missing,  Tylenol would have been sufficient, He would have wrote the prescription for Tylenol! He didn't, he knew that I was going to be in excruciating pain. They left me for 45 minutes at the one Rite Aid and then when I had to travel to the other Rite Aid they had me wait another hour and a 1/2 and then finally at 10 minutes to 9:00 p.m., they called to tell me that there was nothing that they could do for me.  That I would now have to go to urgent care, which by the way, would put me at risk for Corona virus and what other Infections there are out there.They are incompetent and this is not the 1st time that I've had issues with them.    They refuse to tell me who put this in the system so that I could go to a higher up. I will be talking to the VA, my doctor, Facebook, and anybody else that will listen out there. Rite Aid is not the place to go for your meds or anything else. They do not care about the health of their customers and should be put out of business!!!!!Date of experience: January 23, 2021",1
Busting Bad Businesses,US,"Jan 10, 2021","Ordered a package onlineOrdered a package online. Over a ENTIRE month went by and I never got anything. Contacted customer service 4x, all 4x were beyond rude to me. Refusing responsibility and hanging up on me. I will be disputing this with the bank. Avoid this careless company at all cost.Date of experience: January 10, 2021",1
M Diebold,US,"Updated Jan 9, 2021","Terrible on answering the phoneTerrible on answering the phone.  I wanted to talk to the pharmacy.  I called and got the store answering outgoing message, and pushed 3 to talk to the pharmacy.  The phone rang 8 times then went back to the same message.  I'd push 3 again and go through the same process.  Over and over.  I also pushed 5 (talk to a store employee) and this was the same except the phone rings there 12 times.  I went through this cycle over and over.  How long did it last?  After 15 minutes I got in my car and drove to the store, while still connected.  They finally answered literally as I pulled up in the lot.  There were two clerks in the front (one was actually the manager) and I saw 1 customer.  No one in line.  I explained my issue with the manager and she said they must have been busy.  I went back to the pharmacy.  There were two people behind the counter, one helping a customer who was finishing paying.  There was also a customer filling out a form, but not occupying the pharmacists attention.  That's it - no line.  I asked why they couldn't be bothered to answer for 30 minutes, and the pharmacist told me ""believe it or not, there was just a crowd here a minute ago"".  Ok - she gave me the choice, and I don't believe it.  And I don't appreciate people lying to me.  Terrible customer service.Date of experience: January 09, 2021",1
jennifer ratza,US,"Updated Jan 3, 2021","why do I have to have a card to shop hereI have a Rite Aid in my town and some times I need something quick but I get reminded every time that since I lost whatever phone # I used to get a loyalty card I have to pay double the price for my items.I can either sign up again or enter every possible phone number or pay $3.00 for a .99 cent bottle of gator aid.stopped in knowing this yet again to pick up some quick otc meds only to walk out once again empty handed.how does this place stay in business?update went to Meijer picked out exact same 3 products Musinex green znd blue tabs Musinex cold znd flye bottle $56 rite aid with no valid phone # $37 Meijer with no valid phone number. Thank you Meijer for not forcing me to use a stupid rewards card to shop with you.Date of experience: January 02, 2021",1
Martin,US,"Dec 8, 2020","Three times I've been to the pharmacyThree times I've been to the pharmacy. Three times I've been charged for prescriptions I did not receive. No more I'm done. I have to be stupid to keep going back. NO MORE I'M FREE!!!!!!!!!Date of experience: December 08, 2020",1
Mark Ellis,US,"Updated Nov 25, 2020","I went to rite aid for a COVID test I…I went to rite aid for a COVID test I was told 2 to 5 days for results then told 2 to 7 days it has been 14 days and still no results. I now believe it was lost .Free or not this is unacceptable.Date of experience: November 20, 2020",1
