Username,location,date,content,Rating
Donna Hebert,US,"Oct 17, 2023","Delivery delayed=Not comingThe last 3 to 4 times I have placed large orders for grocery delivery, I have received a message it will be delayed past my 2 hour delivery window. After waiting another 2 hours I call customer service.  I am usually given another time, which sometimes is the next day, only for my groceries to still never be delivered. I then  call customer service again to request a cancelation.  In the meantime,  they have $400 or more on hold of my money, only to tell me it can be up to 7 days for it to be released. I now have no groceries and they are holding my money. Not to mention no matter what you order, you can bet they will not have many of the items in stock. I am in the extended 2 hour window AGAIN right now for today's order and not hopeful. I guess it is my own fault for trying again. My advice, don't waste your time or money on the monthly delivery subscription.  They have no problem leaving you high and dry. I needed those items today. Now tomorrow I will be going to another grocery store to get what I need. Sometimes it is not all about price and in this instance, definitely not about convenience.  Save yourself the headache and inconvenience. I do not even think they should be allowed to offer delivery service.Date of experience: October 17, 2023",1
Joan Christopher Ficklin,US,"Aug 24, 2024","Stay away from Walmart delivery!.My first delivery attempt with WM hours late and still no word. I'm cancelling and feel lucky. Never Again.Date of experience: August 23, 2024",1
Deborah,US,"Apr 11, 2024","This is primarily regarding the Walmart…This is primarily regarding the Walmart near me in Bridgeton, Mo. which has forced me to try another which is much further away making me now think the cost of gas and wear and tear on my car makes it futile.  Aside from receiving rotten produce like oranges and potatoes regularly, on several occasions I was shorted items they charged me for.  But recently it has gotten worse to the point I've been shorted half my order or the ENTIRE ORDER!  When I got .com on the phone they told me their was nothing they could do (LIE) and told me to go back to the store and talk to the manager. When doing so, the manager found the cart of bagged items in the back.  Another time I parked and waited and waited for an hour while seeing employees come out with carts to serve others waiting.  I looked at the mobile app and saw that they said I had picked up my groceries a half hour earlier.  I called .com and said I had not been given my groceries and they can check their cameras to see I was telling the truth and no one had ever approached my car.  After suffering them treating me like I was trying to get free groceries and they doubted that happened, they FINALLY refunded my card for over $200.  I don't know if the employee accidentally or purposely gave my groceries to possibly a friend? Anyway I'm DONE with Walmart grocery pickup at that location.  I will only shop Walmart if I happen to be going out to that other location which is ten miles further.Date of experience: April 10, 2024",1
Jinjah,US,"Jun 16, 2023","Walmart Get Your Act TogetherWalmart really needs to get their act together. I wish they'd use a service like Shipt to deliver groceries, those folks are awesome. I just watched (through tracking) the delivery guy leave the top of my street, where he was literally two minutes away, drive to the next town over. The delivery is already late. I finally got a message it would be here in a few minutes (it would have been), and now he's nearly half an hour away. This isn't the first time I've had issues with this service. Contract a good delivery service, please. I have no idea how many deliveries this guy has right now, but I know the ice cream and frozen stuff I ordered is just sitting in his car melting. Last time I ordered, I received our delivery AND someone else's. These folks just don't think or double check what they're doing. Lastly, you can be sure that at least one quarter of your order items will be out of stock. It's ridiculous.Well, back to edit this review. After watching the guy drive all over my city, he starts heading back my way, he's 5 min away and then I get a message it won't be delivered. So I'm betting someone else got it. Incredible. I'm done.Date of experience: June 14, 2023",2
POW,CA,"Jul 13, 2023","not FoodSafe food deliverynot FoodSafe food delivery. i got an online grocery delivery in Vancouver. came late by doordash at 11pm and all frozen items were warm soft and squishy (could squish some flat/into mush) and cold fridge items were warm. called since their tracking system seemed way off (told me it was delivered at 530 when it didnt come til 11) and they think food left the store at 4:20 and arrived to me at 11pm without a cold truck and no ice packs like other delivery services in summer heat and the doordash was late due to previous guys. foodsafe regulations are that after 2 hours (and 1 hours in hot summer weather) cold items left out are garbage and really they should have been in cold truck with ice packs like other delivery services such as Spud which take this seriously. their customer service is terrible and hard to reach and then i waited on hold for an hour trying to reach the manager which i never reached since the regular customer service ppl working there seemed clueless about foodsafe and their own tracking system and very hard to refund unsafe cold food that had been left out for over 6 hours in the heat. they treat it like this is clothing delivery and could make people sick.Date of experience: July 11, 2023",1
Natalie,US,"Feb 6, 2023","Wal-Mart went from A plus CS to C-Wal-Mart went from A Pils customer service to C- since the Grocery pickup started in Selmer Tn.. I use this option an love love love it! I went inside today for things I needed immediately and an employee doing the pickup orders ask me to move out of her way! I was stunned. took my time wanted to make sure I had the correct medicine box. She lets out a long huff of breath. Stunned again. I moved down by pain killers and could not believe she needed a box of lozenges 3 steps away from where she huffed at me. Then groceries section!! I had one tell me I should leave my cart at the end of the isle and get what I need so they’re not in our way. What? Stunned again. Obviously Selmer Tn. Pickers expect you to move out of their way!! I have to say though I’ve had very few mistakes on my pick up orders. But if I’m the customer pickers should move or wait not meDate of experience: February 05, 2023",3
Richard Larsen,US,"Dec 31, 2022","LONG TERM PROBLEM more than 3 yearsSame as half the rest of the time:   My order did not arrive.   Website showed my order was Shopped,  but the Driver showed up with only TWO items of my order,  which I refused.   Many times my orders are delivered to the wrong address (I have no idea where).    THREE YEARS of this,   and I am exhausted.   Tired of arm-wrestling WM to try and get my groceries.   Thanks for nothing!  P.S.:  I'M A CRIPPLE.Date of experience: December 31, 2022",1
Engle Coulter,US,"Aug 21, 2023","Walmart Glitchy RefundTried placing an order yesterday for $526.84 and at checkout, I kept getting the technical difficulties error and was told to try again later.  I did and got the same message two more times.  On the 4th and 5th try, my card declined.  I immediately checked my account, and that amount was displayed five times as pending transactions.  Why would Walmart charge my card with technical difficulties, because the checkout never cleared???!!!!! Of the five, only three refunds were showing.  I didn't see the other two and my account balance showed the new reflected lower balance.  I don't have my money or a food order to feed my family.  I called Walmart customer service and long story short; the agent called the billing department and came back and told me that another customer had the exact same issue and that I had to call my bank.  I said, well Walmart refunded me 3x already, why can't they refund these two?  The poor agent had no answers and was relaying the message from non-caring folks in billing.  I called my bank, and they can't do anything until the pending charges clear, and then the claims process can go through.  Meanwhile, I'm out $1053.68 and have no food for my kids for school lunch this week.  INSANE!  I'm so upset with you Walmart, fix this now, people need their money and their food.Date of experience: August 20, 2023",1
ShannonGalligan,US,"Jan 21, 2024","Tried Walmart pick up on Nob Hill…Tried Walmart pick up on Nob Hill today. Waited 40 min for a vitamin bottle. Such a small item took so long to be delivered to my truck. Before hand I had asked if I could pick such a small item up at the front desk. The answer was no. I know it wasn’t anyone’s fault it was packed. I only saw 2 people working a line of cars. Maybe they could higher a few more on busy night.Date of experience: January 20, 2024",1
Ladina  B,US,"Feb 6, 2023","I spend my last $69 and once again they…I spend my last $69 and once again they sent my order to the wrong apartments even tho I had DETAILED notes in the system! All the other times I did not get all my groceries! I AM DONE! now they saying they can take up to 10 days to get my money back! MY kids have nothing to eat today because of it!Date of experience: February 06, 2023",1
Terri Onderko,US,"Updated Jul 22, 2023","Walmart refused to refund $212 on order never received-Walmart.com refused to helpAfter hours of waiting for her extremely late grocery order, my handicapped, immobile, wheel-chair bound sister decided to go outside at 10pm to wait in the dark by herself on her driveway (in the country where neighbors are inaccessible) for her order. At 11pm while still waiting outside she gets a note from the driver saying he just dropped her order off at her house. He even sent her a picture of her groceries laying on someone else’s sidewalk, which was unrecognizable to her. Delivery NEVER arrived to her home, or she would have seen it arrive. Called Cust Serv to get her bill of $212.57 refunded and they told me she would NOT get a refund because ""it was delivered to the correct address"" per the driver’s GPS.  The driver obviously dropped it off at another house - who knows where.  The GPS was wrong and no convincing Walmart of this.  I even talked to a supervisor (it took me a total of two hours on the phone, most of it was holding time). It probably detected her neighbor’s house, who she does not know and can’t walk over there to check because she can’t walk and does not know their phone number, besides the fact it was at 11pm!  Walmart’s suggestion: ""your sister needs to contact the police department or her bank to try to get her $212.57 back!!” This is absolutely the worst way for Walmart to treat their customers - they should be ashamed of themselves!  She cannot afford to lose $212.57.  She is on disability. Do not work with these people - they are shisters.Date of experience: July 08, 2023",1
Temarie,US,"Nov 6, 2023","Walmart outright stole $744.00 from meOrdered $744.00 of groceries to be delivered. Never came. They said it was delayed then they said they had delivered it. Never received anything. Me and my kids sat and waited for our groceries and they never came. Sat on the phone with Walmart for 2 hours while they put me on hold and kept transferring me. Then they told me, it shows the groceries were delivered so they were. NEVER RECEIVED MY GROCERIES. They said I could contact my bank but that they would not fill my order or refund my $744.00!!!!  They are outright stealing from people. Why are they not being stopped from doing this to people? I’m just sick. It’s not like it was some milk and eggs. I’m a pregnant mom of 5 and don’t have $800 to throw away. Walmart is evil. Do not buy from Walmart especially delivery services.Date of experience: November 05, 2023",1
Mildred Bailey,US,"Nov 19, 2022","Walmart pickup bluesWe arrived at Walmart at 3:30 pm our pick up time was  from 3:00 to 4:00 pm.The 18 parking slots were full plus 2 more cars that had formed a line. We waited for those 2 cars to fill a pick up slot. More people kept arriving with no where to park. When the next slot became available we parked and checked in . We waited for 45 minutes before I decided to go in and pick up a few things. I went back to the car where my x Mother in law was waiting for the pick up order to be loaded into the car. It was finally loaded at 5:02 pm. It took a hour and a half for our order to be loaded. I can understand they are short on help but a hour and a half seems to me like a very long time to wait for an order to be loaded. If they had given a heads up to their situation we could have been more prepared for such a long wait.Date of experience: November 18, 2022",2
Deborah Jablonski,US,"Apr 1, 2023","Cannot update add subtract items on order.Cannot update add subtract, edit substitutions. Nothing. And a general pickup. Don’t like this at all.Date of experience: April 01, 2023",1
TN,US,"Jun 5, 2023","Walmart+ has No Transparency- Refuses to send 'support' chat transcriptWalmart deliveries have NOT shown up.  Walmart corporate REFUSES to itemize a receipt or even send a receipt for Walmart+ delivery subscription!  And Walmart online chat support refuses to send a TRANSCRIPT of your chat with them!  Totally unethical and non-transparent!Date of experience: May 31, 2023",1
Cynthia,US,"Apr 6, 2023","Today I placed an order for groceries…Today I placed an order for groceries and the driver as far as I’m concerned stole my order. I placed this order early this morning and received notification that the order would be delivered between 2 and 3 PM. The next notice I received was at 3:15 or so telling me that my order would arrive by 3:26 PM.  At approximately 3:28 PM. I received a notification that my order was attempted at a delivery , but it couldn’t be completed. I was home at the time watching on the map as the driver drove up and down my neighborhood street making U-turns and continuing to drive up and down the street until I got a next notification that an attempt was made.At no time did the driver call, or come to my apartment building and neither was I notified of a driver outside my building.  There are security cameras outside my building and throughout the building on EVERY FLOOR. so I can dispute if anyone came here.The only compensation I received from Walmart customer service is that of a $15 off coupon for anything on the website.  That does NOT negate the fact that I have NOTHING to feed my grandchildren who I keep 5 days a week!  I have to try to get one of their parents to leave work early WITH NO PAY to come bring them food or take them home!  Who compensates me or them for this loss?Do better Walmart!!! I’m going to cancel my Walmart+ subscription AGAIN because this has happened several times before with the same SORRY EXCUSES TO DO BETTER.  RIDICULOUS!!!!!Date of experience: April 06, 2023",1
customer,US,"Nov 9, 2024","It's amazing that someone that is a…It's amazing that someone that is a delivery person delivering food items would be so lazy or clueless to deliver my groceries to a house on a different block and drive right by me waving for my groceries, this was my first and last time doing this, I would imagine they have no training at all Date of experience: November 09, 2024",1
Nancy,US,"Updated May 10, 2024","Terrible experience todayTerrible experience today.  The order was delivered to the wrong apartment by Megan from the Baldwin Park, Ca store.  First, I called to talk to a rep, but they would only let me talk to their stupid, idiot ""artificial intelligence,"" which said to wait 48 hours--the food would spoil by then!  At least humans have common sense, unlike AI.  I tried more than once and will try again to get a refund on missing items and cancel my membership.We decided to look for the items.  It's a large complex, so we spent a lot of time walking around looking for it (this is the second time this has happened).  This was very stressful, especially with health issues.  I finally found it, with the tenant who lives there going through the items just outside her door.  I knew from past experience that she has some psychological or mental problems.  So, I asked if she had taken anything inside.  She said, ""No, it's all here.""  That was a lie.  There were many items missing that she had clearly taken.  We knocked on her door and waited, no answer.  However, she was looking out the window at us, obviously guilty of stealing.THIS IS THE LAST TIME THAT I EVER USE WALMART DELIVERY.  ALL BECAUSE THE DRIVER DELIVERED IT TO THE WRONG APARTMENT! USE ANOTHER SERVICE, NOT WALMART!!Update:Walmart refunded us for the order.  However, it wasn't worth the time, effort and insult of having a neighbor steal groceries.  There was a lot of time spent on figuring out amounts charged because the $ amounts of items ordered don't match up with the bank's list of charges (it's weird, I know).  There are many charges to go through.Date of experience: May 04, 2024",1
Barbara Davis,US,"Jul 27, 2023","Drivers are stealing orders!My daughter has 3 kids and ordered over $200 of groceries from Wal-Mart and waited 2 days getting the run around from Wal-Mart customer service. Being her car was totaled she couldn't get to the store. She had to argue on the phone for hours just to get her money back which she had to wait 2 days for that. They didn't try to expedite it or anything. The rep even told her ""I guess you and your kids will have to wait 2 days to eat"". Like who says that?! She waited for money and tried to order again. And again she didn't get her groceries. They told her someone had picked up her groceries already and it had been over an hour and she got no food again. Now they say they can't get in touch with the driver. THESE DRIVERS ARE STEALING PEOPLES ORDERS! I told her to stop using them. At some point these big companies need to learn if it's not for the customers they wouldn't be in business. I just wist for just 1 day everyone would stop shopping at these businesses.Date of experience: July 23, 2023",1
Lekishia Payne,US,"Aug 21, 2024","These people are notorious for…These people are notorious for delivering your order to the wrong address!!! Do not order online!Date of experience: August 20, 2024",1
Kim Bobbitt,US,"Jan 8, 2023","I wish I could give it a 0I wish I could give it a 0. They suck, to say the least. I live in NC and had my order delivered to FL. I called them and was told that they couldn’t refund my order. Please make it make sense. Why would I send an order for me and my children to another state? I really hope some changes are made in the near future. I definitely disputed the charge with my bank.Date of experience: January 08, 2023",1
Jasmine,US,"Jan 5, 2023","Please pick up Walmart is Costly by Jasmine Bell to find out moreThis company is despicable you can be a victim of crime in there store without them doing anything about it! Avoid at all costs.Date of experience: October 20, 2022",1
Mindware Consulting,US,"Feb 19, 2023","⚠️ On average, you WILL NOT receive 8 out of 10 items you order!! Read below!⚠️ Our company used ""Walmart delivery from store"" 25 times over a 2 week period, utilizing 3 different store locations and delivering to 5 different residences.  This resulted in only 2 out of 10 items ultimately being delivered at all. On every single order,  The driver stated the item was no longer available, and Walmart chose to leave the items off the order and not replace them with similar available items, as we requested when ordering.  When ordering wash cloths, sheetsets, towels, air mattresses, and many other common household items, they simply said item not available and didn't send anything. I don't need to tell you that Walmart is full of washcloths, towels, and bed sheets... They could have easily provided an alternate option rather than simply scratching it off the list and giving us nothing. If you depend on the delivery of your items, do not use this service. As a result, we lost clients and had chargebacks in excess of $9,000 from disgruntled airbnb clients who required the items when promised and ultimately walked out on the reservation when items promised did not arrive.  Even when items were in stock, drivers often just don't show up and leave the order in limbo for days beyond before automatically canceling the order.  There is no way to communicate with the driver and when you speak with Walmart support, they speak from a script and make false promises that do not get fulfilled. There is a reason everyone opts for Amazon....  But for same day delivery this was our only perceived option, which backfired in a massive way.Date of experience: February 17, 2023",1
RON RENTSCHLER,US,"Sep 30, 2024","Walmart promises a delivery for soon…Walmart promises a delivery for soon only to delay it often.Date of experience: September 28, 2024",1
customer,US,"Aug 14, 2024","Seem to frequently short orders or be…Seem to frequently short orders or be out of stock and not let you in time. Not really reliable at all.Date of experience: August 13, 2024",1
Carlette Mcfarland,US,"Jun 15, 2024","I don’t like thievesYeah, I will never ever in my life shop their Walmart delivery ever again. I paid for their plus membership. The first time it went fine. The second time they charge me $168 then they turned around and charged me $185.that same night $17 tip they went and took out $201.19 and then turned around and told me that my bank is the one that put it on a temporary hold that’s fraudulent. They are doing shady business I called and complained about it. The lady told me that it was my bank doing it and I told her that it wasn’t that I’ve spoke to my bank already and my bank doesn’t even know what I’m talking about, she said she can give me $17 back but she can’t give $201.19back because it’s on a temporary hold this is fraudulent and so many ways for number one their ad says that if you pay for plus membership, you can have your groceries delivered to you free that’s false advertisement because they turned right around and charge me a $1700 tip plus a $185 charge for food then took $201.19off my card and blame it on the bank and called it a temporary hold by my bank. They are full of it. Do not trust this system. They will rip you off. It’s not kind to take advantage of people and still from them. I just believe what you guys did to me was fraudulent and it was not OK and $201:19 of my money is gone I am poor and living a fixed income money is tied around my house and I shop at Walmart and Winco of all places to budget and to have something like this happened to me when I thought I was getting free Grocery delivery services not OK and they need to fix it. $201 might not seem like a lot to other people but it to me.😡😡😡😡😡😡Date of experience: June 11, 2024",1
David Kozlowski,US,"Oct 29, 2024","Worst grocery delivery experience everOngoing canceled deliveries later in the day after having been ordered 12 hours earlier.  Delivery persons lie about attempted deliveries.  Date of experience: October 28, 2024",1
Elizabeth Nudd Edens,US,"Mar 17, 2023","I have recently experienced what I can…I have recently experienced what I can only call a serious bait and switch operation when ordering groceries via store delivery or InHome from Walmart.It revolves around one product that I have been ordering regularly for 3 years.The Fancy Feast Filet Mignon dry cat food comes in 2 sized at Walmart. A 3 lb bag for $9.00 and a 7 lb bag for $16.98. When I ordered a 7 lb bag, I received a text saying it would be shipped rather than via delivery. That was no problem, litter is often switched as well. However, the delivery was a 3lb bag at a cost of $22.00 instead of the 7lb bag ordered, for $16.98.When I went back and reviewed my actual order, sure enough, it showed up as 7lb on the order, but 3lb in the cart! I had to ship it back with a printed label, but did get a refund.Yesterday I ordered another 7lb bag via InHome and that is what showed up in the cart. But an hour later, when adding to my order, sure enough, the cart then showed the 3lb size at the higher price! I cancelled the order. To see if this was merely a glitch, I ordered again today, this time 2 - 7lb bags and within an hour, the email confirmation for the placed order switched the 2 - 7lb bags to 2 - 3lb bags, but at the price of 2 - 7lb bags to be delivered. 3 times is not a glitch, it is an intentional switch-and-bait. This means that if I continue to order from Walmart, I will have no choice but to recheck the order an hour or so after receiving confirmation and go through it item by item checking prices and weight.Needless to say, I will simply stop purchasing from Walmart . I have no idea how many other items I have paid a higher price for, than I originally ordered. This is a very grave concern and I have tried to reach the store, to no avail. They simply don't answer the phone. I will try the corporation next.Best advice? DO NOT TRUST WALMART ONLINE GROCERY ORDERING. Amazon Fresh is a safer option.Date of experience: March 09, 2023",1
Maxwell Edwin,US,"Mar 2, 2024","Honestly I'm surprise what is happening…Honestly I'm surprise what is happening right now .Date of experience: March 02, 2024",4
Steve H,US,"Nov 21, 2022","Order food for my mother on hospice…Order food for my mother on hospice today at 8am said 12-1pm delivered now delayed at 8pm was advised to cancel the order by a member of management due to they had no drivers but was told all day it was being handled bad first experience I don’t recommend what so everDate of experience: November 20, 2022",1
