Username,location,date,content,Rating
Kevin,US,"Sep 12, 2022","Walmart ... is disintegrating into a mess.A LIST OF ERRORS FOR ONE ORDER:1. Delivered to the wrong address2. The ""Local Store"" says... they cannot take care of problem3. The ""Local Store""  will not take care of the problem for the customer, but pushed customer Into the unpredictable new line “Customer Service Department” where lies or misinformation is poured out by non-USA personnel. 4. The refund ( only part of the problem) was purposely given for a ""lessor amount""... error by accident. Place an online order as I have done a number of times over the last couple of years.  Delivery instructions requested that the order (as always) should be dropped off in front of my garage and only after they had texted just prior to dropping it off. The order was delivered to my old address, even though my account clearly shows only my new address.  No text was sent prior to delivery to the “wrong address”.  It was dropped off outside the service window we were required to fill out.They blocked the driveway of my old house with the order…   so the new owners of the house called me and asked what “I” Was going to do about it.The local store was called and they said they could do “nothing” … that I would have to call Customer Service.  They indicated that they will not not call their  own “Walmart Customer Service” , but I must call another number and wait for someone to pick up and speak with them ourselves.I called your “Customer Service dept” and Customer Service stated they could do nothing about the order they dropped off and… that the most they could do was give me a refund.  They lied about not having the resources to have the items picked up, they said it was Walmart's Policy to just leave it there… even if it is blocking someones driveway.Customer Service is farmed out to another country, and even from another country… they lies and said they do not have the resources in my area t pick up a mis-delivered order.  Or, even move it.Their ( Customer Service outside the USA) gives misinformation to the customer, and the customer likely either is believed by the naive or accepted out of complete exasperation.A list of errors:1. Deliver to the wrong address2.Local store cannot take care of problem3.Local store will not take care of the problem for the customer, but pushed customer Into the unpredictable “Customer Service Department” where lies or misinformationmanned by personnel from another country are given scripts for various issues with very littleauthority to actually take care of the problem properly.4. Refund purposely given for a lessor amount to cheat the customerThe beginning of the problem is that when a customer visits and logs in, the address is loaded into memory so that it can be used for delivery and identification when needed.  However, when an address Is changed during the same sign-in---  the programmer forgot to clear the memory location of the old address info and replace with the current info.  That is how the account shows the new address , but the info sent to the delivery personnel show only old info.  ( The order was placed after the sign -n and new address edit ).The balance of the errors are Walmart Policies and/or the perceived understanding of them..  along with…. an overworked and under trained management…which management has  little or no business foresight.The policies of Walmart and the software of Walmart used to be “state of the art” … now Walmart is regressing and will never catch up to companies like Amazon… in software or insightful business policies/plan.   Hello Amazon and companies like them.... Walmart will soon be gone.Date of experience: September 11, 2022",1
Fee,US,"Sep 11, 2022","I Guess I Will Eat in 3 Business DaysI ordered groceries for Saturday/Sunday dinner on Sept 20. Although the delivery person put them on the wrong place, I retrieved the order immediately. Upon bringing it inside, I saw this was not my order. I contacted customer service immediately. I am actually typing this as I await for a manager(now 12 minutes) on my second call. The first rep offered to refund me my money in 3 business days, and acted as if he were doing me a favor. Imagine that! Returning me my money for the products I never received. Well, I did not have another $80(I know that's not a lot to some of you), so I guess I will eat in 3 business days.Date of experience: September 10, 2022",1
Genesis Castellanos,US,"Sep 10, 2022","Delivery 24 hours late and counting.Currently waiting for a grocery delivery that was supposed to arrive last night. It is now 5pm the next day and it still says they are preparing my order. Called customer service and they said they are trying to find a driver. Stuck in limbo and not sure what to do.Date of experience: September 09, 2022",1
SE Patcheson,CA,"Sep 7, 2022","Not worth the troubleWhat can I say that hasnt already been said, deliveries are either late, wrong, or just completely lost, drivers are allowed to cancel orders with no reason, customer service does absolutely nothing to resolve issues, supervisors wont take customer calls, customer service repeatedly texts and emails in the middle of the night, absolutely no care or respect of their customers!  I know its cheap in terms of money, but the cost to your mental and physical health far outweigh any savings. My money will go to No Frills from now on. Shame on you WalmartDate of experience: September 07, 2022",1
Tim Drinkard,US,"Sep 7, 2022","Wal-Mart grocery never has products in…Wal-Mart grocery never has products in stocks anymore. Every time you place a order,  half the items they don't have. How can you call yourself a grocery store? Hello food lion even Kroger.  Wal-Mart you suck.Date of experience: September 07, 2022",1
Misty Capansky,US,"Sep 7, 2022","As I was leaving for errandsAs I was leaving for errands, I found bags of delivered groceries from walmart. Called local store. Was given 800 number. The rep told me to either keep it, donate it or throw it away!! I'm very frustrated to be told that the people that ordered this stuff would have to contact customer service to to say they didn't get their items! After reading these reviews,  these people will have to jump through hoops to get a refund. I decided to return them back to my local store. I really don't  need diapers or any of the other things. I will not be using this service. Dealing with this experience was a nightmare and I'm not even a customer!!!Date of experience: September 07, 2022",1
Rochelle Stahl,US,"Aug 30, 2022","App said it was delivered, but it wasn't Some issues with deliveries to student…Some issues with deliveries to student apartments and dorms. One delivery in Boise was left on the sidewalk in front of the easily accessible apartment complex instead of next to the specific apartment unit. No codes required. At Syracuse University app said it was delivered. We tried to track it down, but turns out never  actually delivered due to damaged box. I had to call customer service to find that out and get refund. Both times customer service was nice, but for the later I should have been notified and refunded before we spent so much time trying to track package. These were general merch plus non perishable food.Date of experience: August 30, 2022",2
Jennifer Lapsley,US,"Aug 26, 2022","I have had 3 orders in the past month…I have had 3 orders in the past month that didn't get delivered on the day promised (not even late...just didn't show up). With the most recent order, I had to contact customer service 4 times...each time promised it would arrive that day...to no avail. I've been using delivery since before COVID, but Walmart has hit a new low point. Their produce is horrible, so there's no point in putting up with horrible delivery.Date of experience: August 26, 2022",1
Magnus,US,"Aug 23, 2022","Osprey Fl Walmart.....curbside pick up…Osprey Fl Walmart.....curbside pick up does not exist...at least I can't get anyone to come outside. I thought id try curbside pickup but although I go through the check in procedure no one ever comes out to the car. I have even called the manager insuide the store and explained the dilemma and the order is still never brought out. I ended up cancelled both orders.Date of experience: August 23, 2022",1
Melissa,US,"Aug 23, 2022","Run Away!!!In northern VA - Run - Run - Run Away!  Cancelled my W+ membership last night (8/22/22). Signed up for membership several months ago and at first there was no issues with my grocery delivery orders then in May 2022 my grocery order was mysteriously delayed with no explanation or ETA when it might be delivered.  Tried calling the Wal-Mart store that was fulfilling order but no one will answer the phone - EVER!  I had to cancel order. I tried to place the order again 2 days later and this time it was delivered.In mid May became very ill and couldn't leave my house (no, it wasn't Covid) but for the rest of May, June and July of 2022 my grocery delivery orders arrived without issue.  Starting in Aug, Aug 7th to be exact , my grocery order was delayed again but no explanation as to why or when it might be delivered so had to cancel the order.  I tried to get that same order re-delivered on Aug 11 and again, during the time it was to be delivered I get another delay message and you guessed it, no indication as to what happened or when the order might be delivered so had to cancel that order.  Finally, yesterday, on August 22, I called to speak to some at the Help Center and this person said he would give me a Promo of $15 and to give it another try.  So I decided that 'just one more time' I'll try and place an order for the 3rd time so I placed the order around noon on Sun (to be delivered between 6 & 7 PM) and when I check the order status it shows it's still being prepared.  By 6:40 PM I receive a notification of order delayed and no explanation or new ETA when or if order would arrive.  I call the Help Center and tell this person that 3 times in a row this month my grocery orders are getting delayed with no explanation or any new delivery time.  The Help person looks into the order and sees that the Delivery driver cancelled the delivery.  How is that even allowed???  I told the Help person I had tried to call that store a couple times but no one will ever answer the phone.  I told the Help person at this point to cancel my membership and that I also wanted a refund of my Aug membership fee of $12.95 so he said he'd do both plus escalate the issue to this particular store.So my guess is that these drivers shop around to see where they can get the biggest tip on a delivery and arbitrarily cancel any other grocery delivery order they don't want to take but I told the Help person that these drivers should never even have the option to cancel a delivery order.  Also, I told the Help person that for my yearly Amazon membership includes delivery with no tip needed and I've always received my Amazon deliveries without ever an issue so no more wasting my time with WalMart.  I'm done, done, done!!!!Date of experience: August 23, 2022",1
Clarence SwaggCeejay,US,"Aug 21, 2022","Walmart is making billions They Don't Care About UsOkay so I'm not going to go all in detail in this review but they need to shut down this Walmart grocery all together. Because it's terrible. This is my 3rd time ordering online and every time it's delayed. And they don't even tell me why. I've chatted with customer service about it and all I got was a $15 dollar off my next order. Which it delayed again. They need to get ride of it. It's pointless. I'm so annoyed right now it's not even funny. I really need to speak to the boss or at least corporate. Cuz this is absolutely ridiculous. And what I don't get is what's the point with all these bad reviews if Walmart don't even do anything about it they probably don't even read these reviews. Walmart is a billion dollar company they don't have time to read the reviews because they simply don't care they're making their money anyways.Date of experience: August 21, 2022",1
Michael,US,"Aug 21, 2022","I have tried 5 days in a row to get…I have tried 5 days in a row to get grocery delivery from my local store 3 miles away. They are useless. Something has changed. Class action lawsuit might correct their incompetence. I've been using my local grocer now and get delivery within 2 hours. meanwhile walfart is raking in the bucks for membership fees. I am disabled and do not drive. They don't care anyways.Date of experience: August 21, 2022",1
Timothy Langley,US,"Aug 15, 2022","Didn't receive order lost overc30…Didn't receive order lost over 30 dollars in points, worst service. Walmart 12.00 membership non refunded. Don't do membershipDate of experience: August 15, 2022",1
Jay Ollie,US,"Aug 13, 2022","If I could give a lower score I wouldIf I could give a lower score I would. The workers aren't running cash registers anymore so pick up and delivery should be quick and accurate. One day maybe they will start appreciating customers again. Seems they have forgotten we are why they are open.Date of experience: August 13, 2022",1
Rande,US,"Aug 12, 2022","I thought the missed or no delivery was…I thought the missed or no delivery was just me but these reviews are confirmation that I won't be renewing membership. This sucks because I used to get my orders ontime but lately they delay, cancel or don't deliver.Date of experience: August 12, 2022",1
Tabitha Adame,US,"Aug 12, 2022","Getting a refund is a pain!At first I liked the delivery service. But once or twice they'll deliver with items missing. That's annoying enough, but then it's like pulling teeth to get a refund! No more. Instacart sucks, too, but at least you can get an immediate refund/credit when the morons they keep hiring screw up your order...Date of experience: August 12, 2022",1
P. Dubyah,US,"Aug 9, 2022","C'mon Walmart!  Get your crap together!Lost orders, delayed or no deliveries, days for refunds!  This is not the way to run a business!  How can people who live in India and have the worst English skills ever actually help with a problem???  I stopped using Walmart's delivery.  Their service really went down the sh*tter, and I'll never do it again, nor would I even CONSIDER the Walmart+ service!Date of experience: August 09, 2022",1
Mister Seminole,US,"Aug 6, 2022","NightmareWho had the bright idea to outsource customers service to a third world country for all grocery delivery orders? They need to have their head examined. For the fourth week in a row, I can’t get a pickup time to grab my Walmart groceries. Last week, I had the plus membership and cancelled it as the deliveries were delayed by multiple days and then never arrived. Yesterday, I thought I’d try your pickup service, surely Walmart can’t screw that up too. Wrong. No one at the Bay Pines St. Pete, Florida Superstore even picks up the flippin’ phone. I’m going back to ALDIs. The Walmart grocery pickup/delivery app service is offensively horrible.Date of experience: August 06, 2022",1
Katherine Murray,CA,"Aug 6, 2022","Sadly I cannot give a less then one…Sadly I cannot give a less then one star because Walmart on-line shopping and delivery service is THE WORST.The prices do not even make up for the terrible service.Date of experience: August 06, 2022",1
Gail,US,"Aug 5, 2022","Walmart does not support their home…Walmart does not support their home delivery service- for the last 4deliveries They failed to deliver the groceries within the time slot were late by hours.  Once they just canceled the order!Date of experience: August 05, 2022",1
snoofle yumyum,US,"Aug 5, 2022","For the first few months it was GREAT…For the first few months it was GREAT and very convenient for a family that has no transportation or friends to help out. I am also diabetic and low income so it was helpful to have same day delivery of affordable healthy foods. Also we’re on a budget and fixed income. So at first this made sense, as we were saving a TON of money compared to the places in walking distance that sold groceries. Then over the last 6 wks or so things have been very weird. First we started having issues with billing. The pre Auth would drop off days later and not be finalized. Then a final total would come out a week later. Which can be confusing if u don’t notice it. Then I started having things double charged and random smaller charges that I had not authorized coming out. I have had to file THREE(3),yes..THREE(3) disputes for charges in the last two weeks with my bank as walmart would not refund. Most recently, the straw that broke the back, was an order completed at 2 pm and paid for. It was pulled, completed and waiting to be delivered. However it was never delivered. I spoke w someone at the location that said they couldn’t do anything with it u til the online order was reinitiated. However no one could take the order off of hold ether at the store or at the customer service center. I finally spoke w someone forthcoming at the cs center he told me that they have control at the store level once the order has been submitted. He also told me there has been a slew of recent complaints that are similar in regards to billing and non delivery. I have now cancelled my monthly subscription to W+. I’ll no longer use them and am going to go ahead and start using Instacart as we often need food delivered per our situation. Just think twice before going with a huge corp that doesn’t give a sh$*t about one person.Date of experience: August 05, 2022",2
Kim L. Murphy,US,"Aug 4, 2022","I tried out their 30 day delivery…I tried out their 30 day delivery service they didn’t show up twice Order was canceledthe third time they were an hour late. So I never ordered again. Clarksville TennesseeDate of experience: August 04, 2022",1
Tired,US,"Aug 1, 2022","Horrible customer serviceHorrible customer service. Placed an order and a preauthorization placed on my card. Walmart delivered two separate orders which they changed on their own. Items listed as available for pickup or delivery but get an email stating it's being shipped at a later date.  Called customer service as they had two different charges charged, not authorized. Call first time and got someone with very broken English and couldn't understand her. Called again and got a Mary that had very broken English as well. Attempted explain the issue and she kept say okay. Asked for a supervisor and placed on hold for 28 minutes, then call was disconnected.  Call again and got a José with very broken English as well which refused to allow me to speak to a supervisor and being argumentative stating I need to talk to him. He finally placed me on hold supposedly getting a supervisor, came back on in approximately five minutes and told me I had to speak to him. I told him I was reporting him and his rudeness as he replied ok. Hours of on the phone attempting to resolve money being taken and STILL NO resolution!!@ I'm beyond livid!!Date of experience: August 01, 2022",1
Lisa,US,"Jul 21, 2022","Way to many missing items from my order. …There are too many items that are coming up missing.  If Walmart doesn't have what you order in stocks, the will notify you and ask if you want a replacement.  This time half of my order was missing when my groceries were delivered.  Walmart may need to keep a closer eye on these delivery drivers.Date of experience: July 21, 2022",1
Joe Lane,US,"Jul 20, 2022","I have been shopping Walmart Groceries…I have been shopping Walmart Groceries online for about 4 years. I used to love it and lately I noticed that some item have been inflated. In googling, ""is Walmart charging extra online than in store and found out that ""yes"" in 2022 they have been. I will not do online anymore. Have been going to Aldis and Kroger to do my shopping. Sorry Walmart, not OKDate of experience: July 20, 2022",2
STEVE LANDON,US,"Jul 19, 2022","I get angry almost every time I shop at…I get angry almost every time I shop at Walmart. Now I have reached the point when I will no longer do business with Walmart. Walmart does not care about you and as a 1000 pound gorilla, they do exactly what they want. I am handicapped and I recently started using the grocery pickup service. Sunday, July 17th, I arrived for a pickup order. I followed instructions and waited and waited. I started feeling unwell so I went back home, 1 mile, for a few minutes and came back. I waited 1 hour and still no groceries. I talked to someone at corporate customer service and got a refund. I had to go in the store to get 2 items I really needed. I almost collapsed becasue I should not have been walking in the store on that day. That's what I thought grocery pickup was for! This store at Montfort/Dallas has a long history of problems and no one was answering any phones at any extension on that day. 10 minutes after I arrived in the parking spot I received a text message that order had been picked up. I've seen that before, every time I have used grocery pickup. It's a lie. Never received any groceries at all in 1 hour of waiting. I will say that the corporate customer service rep was helpful and processed a refund. What about delivery?  Walmart's delivery is a joke - been there , done that. Walmart delivery is the worst of the worst. The only positive department at Monfort store is the pharmacy - always efficient and courteus. That being said, I am done with Walmart and will move my prescriptions. Yes, Walmart has great prices and great selection but one has to be willing to be abused to get the low price.Date of experience: July 19, 2022",1
Mikki Barrett,US,"Jul 17, 2022","WALMART IMPLEMENT CHANGES PLEASEI have been ordering groceries online from Walmart intermittently for about 4 years now. My orders have been intermittent because of the service. I try the Walmart+ program then become dissatisfied, stop it and then try it again later in hopes that improvements have been made. There are many positives to online ordering from Walmart: Prices are the same as in store, I can order anytime 24/7, product selection is fairly good and most importantly to me, I save a great deal of time. Recently, the cons are outweighing the pros though: Items are being substituted when I requested they be excluded from substitution, i.e., I requested Star ham salad and received chicken salad instead (chicken and ham salad are not even similar), quite a few products are not available but are listed on the site, and delivery is often shoddy because they use other delivery services. I have had deliveries that have never arrived and conversations with drivers who have been incredibly rude.  Today, I had to request a refund for an inappropriate substitution and was informed that now Walmart is offering InHome delivery provided by their employees who will put your food away in your kitchen.   In theory this is great but they also are charging an additional $7 a month to do this bringing the cost to $138 a year for the service AND you still have to make a purchase of $35 for them to deliver free. As a single woman who is not cooking for a family, I prefer fresh produce and other foods that are not shelf stable which requires I shop more frequently, sometimes 4-5 days a week.  Requiring that I spend $35 to have these products delivered free every time is cost prohibitive. I generally spend in the neighborhood of $15-$20 for the ""quick shops"" and buy shelf stable items a couple of times a month so basically I'm ordering from Walmart 2 times a month and personally shopping about 12 times a month at a local market close by.  That's an additional   $75-$100 weekly that could be used at Walmart if they did't have a $35 minimum purchase! I applaud Walmart for starting their InHome service but they need to drop the minimum purchase requirement before I would consider paying them an additional $7 a month.Date of experience: July 17, 2022",2
Marna Smith,US,"Jul 12, 2022","For the most part I like this serviceFor the most part I like this service.  The delivery people (except for one time) have always been really nice and friendly.  I have been using this service for about 2 1/2 years now and only once was there a problem. (They delivered my groceries to the wrong place).  It was a real hardship that I had to wait for 7 days to get my money refunded.  Would be better if they just credited the customer and let them order again.  My biggest comaint is on the produce.  The people doing the shopping must just pick up whatever.  I have more than once gotten lettuce/salad bags that were past the date and I had to throw them away.  And that here lately they are out of ALOT OF ITEMS!!Date of experience: July 12, 2022",3
Tina,US,"Jul 9, 2022","The delivery drivers rarely ever read…The delivery drivers rarely ever read the drivers notes. I always ask for my stuff to be delivered under the carport but 9 times out of 10 they put it on my front steps. Maybe their training doesn't tell them to read the driver notes!!Date of experience: July 09, 2022",2
Patricia,US,"Jul 9, 2022","Horrível I just cancel my membershipHorrível I just cancel my membership! 2 days in the row rescheduled my stuff! And I request my money back take 7 business days to get it! Sometimes thy forget about refund your money and you have to keep call them. I hate Walmart delivery!Date of experience: July 09, 2022",1
