Username,location,date,content,Rating
NP,US,4 days ago,"Same as others hereSame as others here. Tried the Walmart plus and ordered groceries. They did not deliver, said they would come the next day, delayed again. I cancelled both the order and my Walmart plus. Very disappointing experience, would not recommend.Date of experience: January 09, 2025",1
Christopher Dale,PR,6 days ago,"Walmart grocery delivery is a scam. Walmart order on a Sunday. They put it off until Tuesday and guaranteed DELIVERY between 10-12.  Never arrived and after 3pm when contacted, they guaranteed a driver just left with groceries.  100% lie. Waited over 8 hours for groceries never even attempted delivery.  They play intentional games when you call in. Worst customer service I've ever experienced.  Put on hold for 15-20 minutes at a time.  THE WALMART GROCERY DELIVERY IS A COMPLETE SCAM. ZERO INTENT TO DELIVER GROCERIES AND ZERO ACCOUNTABILITY FOR DISGUSTING SERVICE FORCED ON VICTIMS/CUSTOMERS. Date of experience: January 07, 2025",1
Christine Sappington,US,2 days ago,"Customers beware Customers beware. I have been getting Walmart delivery now for about 3 years and I just found out it's not even through Walmart. It's through a third party company, so when you're ordering online and you think that these Walmart workers are coming to your home, it is not. Walmart is a third party company that Walmart has hired has no affiliation with. Who's coming out to your home. I looked up the company online.All you have to do is have a driver's license and a vehicle.They're not doing background checks or anything, and they're giving them your information.This is ridiculous.BewareThey're giving out your information to a third party company that you are not aware of when you get delivery.It is not from walmart is from a third party company.All your orders are all your information.Your home address your phone number and everything is being released to this third party company and that is exactly why so many orders are messed up, it's not even through Walmart. If you call pick up, they will tell you that it's not even through them that they don't even they can see that you made order, but it's another company that's actually coming. In the store, doing the shopping paying for it delivering it to your home. They have no control of it even. This is ridiculous.I've been shopping with them for how long they've never even told me this.I'm just now aware of it.It is ridiculous beware that they're giving your information out to a total different third party company that they have no affiliation withDate of experience: January 10, 2025",1
v Simm,US,"Jan 4, 2025","Curbside pick upCurbside pick up. Point of curbside pick up, correct me if I'm wrong, order online then drive up and have groceries loaded into your car. Wal-Mart version- Pull up and When employee walks up: Can you help me load the groceries? (Note appears in 20's)Me: There is a 35 pk of water. I have an old neck injury from an accident. I'll hurt my neck. The employee then says he'll load water and can I help. I am getting things and he is too. He puts items on top of my eggs and bread. There were employees within earshot no help. If he is not capable of loading then he should be given another position. And he had runny nose and sniffing so now I was close.Date of experience: January 03, 2025",1
Richard Larson ,US,"Jan 2, 2025","They forgot items the last two timesThey forgot items the last two times. The first was just a couple of things, but yesterday’s delivery was missing about half the order; a total of 16 items. Although not acceptable, I can understand overlooking an item, but 16?  I cannot fathom that. They are crediting our account and then we have to reorder. We’ll give them one more chance. Date of experience: December 31, 2024",1
Sheila Kirsch,US,"Dec 28, 2024","Love the delivery service just don't like the late alert that an item I really needed is unavailable!  What I like about delivery is not having to leave my house,what I don't like is getting an alert that one or more of my items weren't available and by the time they alert you it's too late to add to the order. I don't understand with their technology why they can't tell you when u select that item that it's out of stock. Noooo they let you order it,needing that item then you get a message saying it's not available. Come on Walmart you can improve this issue!! Date of experience: December 28, 2024",3
Kay Sledge,US,"Jan 4, 2025","Fifty Fifty Chance You Get Your Order Ordered my items shipped so there was a reasonable chance I would get them. Anything coming from the store always has a problem. They changed it to delivery from the store and my items were 'delayed'. I'm supposed to keep checking back for updates. I can't cancel and get a refund...which I would not see for up to 2 weeks.....until delivery. So they hold my money and my items until they decide not to and I can't do anything about it. This is just the latest issue with walmart delivery. Ordering items for a meal and having to wait to see what actually shows up; being told something is not available and going into the store only to find it fully stocked with that item; and, getting produce items that look like they were in the clearance bin, are just a few of the ongoing issues. Does walmart even care about the lousy service out of this store? Smdh!Date of experience: January 03, 2025",1
Danielle Jackson,US,"Dec 24, 2024","HorribleHorrible. Beyond horrible. Canceled my order 5 times. I have 5 different holds on my credit card. Customer service is horrible, can’t even understand what they are saying. Been waiting for my order and the rep stated to me that she didn’t know the Walmart telephone number to check. They constantly hang up in my face. Not one time have they tried to fix the issue or anything. Would not recommend my enemy to purchase anything delivery through this trash company. Stop using AI and actually do your job.Date of experience: December 23, 2024",1
J Jensen,US,"Dec 27, 2024","Walmart is a DISASTEROrdered Walmart grocery delivery for my son with autism, who does not drive. They are currently 3 hours late from the latest window time, when I call them they have no personal service, just a machine that says they have up to 48 hours (!!!) to deliver the order past the promised time, then I can cancel it. WHAT?? Why would I want to cancel it, my son needs food!! I want a REFUND of the Walmart+ fee! What a ripoff!!!Date of experience: December 26, 2024",1
angry customer,US,"Updated Jan 4, 2025","walmart deliveries  are a SCAM !!walmart grocery deliveries  are a SCAM !!! don't use this service you will regret it 💩Date of experience: January 02, 2025",1
Drip Tee,US,"Dec 29, 2024","Very annoying to deal with Very annoying to deal with stayed that they attempted to drop off my order but no one ever came to my home.So they took it back to the Store. This happened twice in a row Yesterday and today And don’t get me started on how your order will always have  missing items.You will never get your full order Date of experience: December 29, 2024",1
Shannon Weatherby,US,"Dec 24, 2024","Absolutely the worstAbsolutely the worst. Constantly canceling. Not receiving all my items then it takes forever to be refunded. Leave the delivery to Amazon.  I'll never use Walmart delivery again Date of experience: December 23, 2024",1
Anthony Mongell,US,"Dec 15, 2024","Actually deliver the groceries instead…Actually deliver the groceries instead of delaying then canceling all the time.  That's why I paid for a membership.  Then i have to wait 10 days to make sure that you didn't charge me. I don't think that this is even worth the subscription, probably going to cancel after this..Date of experience: December 15, 2024",1
Sharon Hanes,US,"Dec 11, 2024","We tried the free trial membershipWe tried the free trial membership, and made an order for grocery delivery. They delivered the groceries to the wrong address, dropped them off at a random door, and then couldn’t help us with the problem. That was Sunday, and we are still waiting for the money to be refunded. We received NO groceries, and our money is still tied up in the refund.  They sent us a $25 credit on our next order for $45 or more. Why would we risk that again? Beyond aggravating Date of experience: December 08, 2024",1
April,US,"Dec 15, 2024","Ordered gift items for…Ordered gift items for Christmas.Whatever unsmart driver left my gift under the mailbox to be stolen to begin with angers me but   one of them was a gift card. Somebody used it, and Walmart still made me pay for it. And then the rest of the items I have to wait for a refund. That's going to be after Christmas, which was expensive to begin with so now i'm going to have to rebuy that with bill money. They just don't have their customers back. I canceled my walmart subscription after this. Date of experience: December 15, 2024",1
DOUGLAS CORWIN,US,"Nov 27, 2024","Worst place on earth for home deliveryWorst place on earth for home delivery.  Spoiled food, missing items, claiming delivered when not and stupid AI Bots to ignore legitimate complaints.  Waited home more than once to have delivery cancelled... Buyer beware as this company doesn't care about customersDate of experience: November 27, 2024",1
Consumer,US,"Dec 5, 2024","I had the Walmart membership for almost…I had the Walmart membership for almost a year, their drivers often will mark orders as “Attempted Delivery” when they don’t actually try. Same day deliveries are not up to par. Don’t pay for the membership as I believe it is a waste of money.Date of experience: December 04, 2024",1
John Gray,US,"Dec 12, 2024","Don't waste your timeDon't waste your time. Go to Amazon prime for grocery delivery... The drivers steal your items and they will leave without actually attempting to make the delivery... Good luck with a refund, takes multiple days and up to a week... RunDate of experience: December 10, 2024",1
Manny Stewart,US,"Dec 10, 2024","Im beyond irritated honestlyIm beyond irritated honestly. I ordered some BeatStudio3 Headphones on thanksgiving (Nov 28.) They were supposed to be here Dec. 1. It was delayed for a week. But my friend got hers 2 days after ordering. Now I refunded and ordered again, I thought maybe it was the weather. No. NOW! It’s delayed again. And I can’t get a refund until Dec. 14??? It’s December 10th. This is crazy. I don’t recommend ordering with Walmart at all.Date of experience: December 10, 2024",1
Brooklyn Rose,US,"Nov 5, 2024","Earn cash back using the Walmart+ app and save on fresh groceries daily. As a Walmart+ member, I enjoy the benefits of free same-day delivery on groceries. Walmart always has the lowest prices and great deals throughout their store— not to forget about their Walmart Cash. Shopping through the Walmart+ app allows me free range to shop on the go, receive great deals and bank some extra dollars in my pocket. Walmart grocery always offers great prices on fresh groceries with same day delivery with the Walmart+ app. *Subscription required* Date of experience: November 01, 2024",5
Lisa Ryan,US,"Oct 30, 2024","Delivery Guy Ignored Delivery Note & Sign at House The guy delivering my Wamart grocery order today not only ignored my online delivery instructions but left order next to sign that reads, 'Please do not leave deliveries at this door'. To make matters worse, my food smelled of some kind of car freshener or perfume.  This is 2nd time this has happened and now Walmart has shortened the time period for reducing driver tip; allowing tip to be increased however. Ughhhh! I always tip but no more!Date of experience: October 29, 2024",1
Happy,US,"Dec 23, 2024","Only problem is half the order is again…Only problem is half the order is again missing.  Alexander in Boca what did you do with my dinnet?  If you were hungry I would have fed you. Date of experience: December 22, 2024",1
Latonya Williams,US,"Dec 12, 2024","Great Idea But Doesn't Deliver!I joined Walmart Plus because I liked the convenience of having my groceries delivered and took advantage of the 49 a year promo. I wish I would have read these reviews because out of the four orders only one of them delivered all my items. I usually print out the list and go through one by one and they are always missing at least a few and I have to go back to the store. Sometimes I didn't get a 12 pack or two of soda and one time my 24 pack of water bottles. How can you miss this?? SHM. The last straw was when I missed 12 items. I called customer service and I had to read off one by one all the items missing for a refund. None of the reps speak English well and my drivers are hispanic and can't speak English well at all. I requested my refund and took back my generous tip. The rep said they have 4 times to mess up an order before they are removed. Also, I had to be transferred to another department for a refund with cancellation. I will just go back to instore or curbside. I never have issues with curbside. I also stopped doing restaurant deliveries because of missing items. These companies have to issue refunds.Date of experience: December 12, 2024",1
Heather Smith,US,"Dec 1, 2024","not very good for a home delivery they…not very good for a home delivery they never get my order correct I pay for express shipping in three hours or less and it didn’t come for six hours. They never can find my building even though they’ve been here 100 times they never bring the groceries up to my apartment. I always have to go down and get them and they’ve left them down in the lobby, they never are  ringing my buzzer To let me know that they’re here. I have had to call several times because I got nothing. I ordered and missing items and late items. It’s just a mess and they need to do something about it but then they’ll blame the drivers. The drivers will blame the people who bag the items there’s never anybody taking any responsibility and then they try to give you these or $15 credits in order to use them you have to double the amount so they’re not even giving you anything . Date of experience: November 30, 2024",1
Patti Powers,US,"Dec 6, 2024","If I could give no stars I wouldIf I could give no stars I would.  Ordered some items for my stay in AZ while my son is going on vacation.  I ordered several items and when my son sent me the picture of what was received it was two onions and a bunch of bananas.  Obviously not even close and the bag had someone else's name on it. NEVER AGAIN and i ended up being charged $6.02 when credit hit my bankDate of experience: November 29, 2024",1
Ernest Bethencourt,CO,"Dec 6, 2024","WorthlessNot worth at all. With or without walmart plus their delivery service is worthless. I have yet to receive a package on time. Some take weeks. Their customer service is even worst if you can get thru the automated service at all. I'd rather pay a bit more and not get charged for an item not delivered and impossible to get customer service.I can't even get my money back!DON'T pay for walmart plusDate of experience: December 06, 2024",1
Jeff Weiderman,US,"Dec 8, 2024","Got a delivery todayGot a delivery today, order was left in a snow bank, not where near me, I'm a one legged man in a wheelchair . gotta love the delivered picture of the tore up bags covered in snow.Date of experience: December 08, 2024",1
Mary Thomas,US,"Oct 15, 2024","I had 2 orders today with Walmart deliveryI had 2 orders with Walmart delivery. One order had a substitution but the person checked out seconds after notification and when I tried to disapprove it said too late. Substitution was not similar and more costly. Shopper then offered to leave it behind then didn't.  Next order charged for hot rotisserie chicken and wasn't delivered.  Only option was credit so there went my dinner plans. They should offer to make it right by fixing the issue with the items. These has happened  repeatedly with the Rome NY WalmartDate of experience: October 14, 2024",1
tiffany Van Gelder,US,"Nov 24, 2024","never order food that needs to be in fridge or freezer it sits i. their car for to longnever order anything perishable. on average the order is picked up and i don't receive it until 2 hours later. ice creammelted warm milk and cheese frozen food items defrosted meat is warm. it's good for item not needing the fridge or freezer. when i called them to get a refund they want me to return the items to the store for a refund. makes no sense at all. i have been told by customer service they have bags to keep things cold or frozen. all say no when they deliver my itemsDate of experience: November 22, 2024",1
Colin Doyle,CA,"Dec 5, 2024","Every order has items missingEvery order has items missing, even though it claims they were processed and on their way. Obviously the delivery drivers are stealing items. Date of experience: December 03, 2024",1
Elisabeth Garreth,LV,"Oct 1, 2024","Do not trust Walmart company if you…Do not trust Walmart company if you decide to work with them through any affiliate program like Skimlinks, Awin etc. 1. They owe me 63€ commissions.. 2. You will never receive even these small commissions because they do not pay Skimlinks and as a result Skimlinks and other networks do not pay you. They don't answer emails, they deceitfullyuse affiliates to gain more customers and are not honest company. What a disappointment!Date of experience: October 01, 2024",1
Kimberly Mayer,US,"Dec 5, 2024","I made an orderI made an order, and what a mistake this has been.  I ordered fresh chicken.  I was overcharged (they rang in the bigger package twice, for just over $4 overcharge). And it was delivered 12/4 and it expires 12/5! That is NOT FRESH as promised.  One day to use up 6.5 pounds of chicken doesn't work for me, and those should be discounted packages--not full price! SO I went on the app to do a refund, and I now have to drive the said chicken to the store.  THIS DEFEATS THE ENTIRE PURPOSE OF PAYING THE DRIVER TO DELIVER IT TO ME!!!!!!!! I now have to drive 20 minutes there and another 20 back home just to get the refund FOR THEIR SCREW UP.  I am so angry that I paid for a membership to be this angry!  My advice: DO NOT GET WALMART DELIVERY. IT ENDS IN EXTREME DISAPPOINTMENT. Date of experience: December 04, 2024",1
Christopher Lewis,US,"Oct 28, 2024","Old food Overall, it's a very convenient service. However, I will probably cancel it. You need to be able to edit the tip based on order problems. My buns get smashed and they seem to send the food closest to expiring. After two orders, I see a pattern of delivering the oldest food on the shelves. Why do I want six buns that go bad in two days? Or a salad that expires in two days?Date of experience: October 27, 2024",3
james c,US,"Nov 12, 2024","So  I like to order my groceries online…So  I like to order my groceries online with Walmart .  Several days ago , knowing I would order on the 12 th  I earned a $ 15 gift card for taking online surveys .....so I opted for a Walmart gift card to cover the delivery charge . Placed the order ...the grocery order $ 119 was charged to my EBT card ......the cash [ delivery and tip ]  they took out of one of my credit cards .....not the gift card .   Turns out that SOP for Walmart .....they know the gift card is "" captured money "" .  You have to spend it there.......so they access OTHER $$$ from your credit or debit card .    These multi billion dollar firms don't need to play chintzy games .......they should be dealing straight up for the customer . Date of experience: November 11, 2024",2
Candace Voss,US,"Jul 23, 2024","Two hour delivery window for perishable groceries??Walmart delivery is now expanding the time slots for deliveries to two hours instead of actually doing something constructive like implementing their own in-house drivers and trucks.It just must be too expensive for this multi billion dollar company to handle...or the CEO is asleep at the wheel..Your customers do not want to wait two hours while your third party drivers run around with their perishable food items in the heat in non-refrigerated cars, most of them lacking GPS..Wait until the food poisoning lawsuits begin...Wake up, Walmart!Date of experience: July 21, 2024",1
Known but to God.,US,"Oct 27, 2024","Twice now I caught them delivering my…Twice now I caught them delivering my order to a neighbor and fortunately was able to catch it in time. Twice also, they delivered someone else's groceries to my house. On another occasion, the groceries were dropped off and had the smell of gas. It lingered in the house for hours. This is what you pay an extra fee for. And they 'con' you into giving the driver a 4$ tip when you make the order.Date of experience: October 27, 2024",1
Josephine Headley,US,"Sep 15, 2024","We ordered catfood Friday the 13thWe ordered catfood Friday the 13th. It should have been delivered Saturday. It was out for delivery but we got nothing. Saturday night about 900pm got a email saying it was delayed. This is unacceptable. We needed that catfood badly. We will never do business online with Walmart again. There is something wrong with Walmart. Poor business. Not dependable. We are pissed offDate of experience: September 13, 2024",1
Ellen Sweatt,US,"Oct 25, 2024","If I could give triple zeros I wouldIf I could give triple zeros I would. This is not a service it is a dis service. I had an order from one Walmart location delivered to a different person’s address and it took about a week to get it straightened out. A few weeks later I tried ordering from a different location and paid cash(debit). The order was close to 200$ they drop it off at a Different location took a photo and then will not give me my money back because they insist it was delivered correctly. I tried telling them the photo was Not my door but not only will they not listen to me my bank has to dispute it which could take 90 days. I hate Walmart. Do not use these morons unless you like stress in your life.Date of experience: October 12, 2024",1
Elizabeth Grant,US,"Jun 9, 2024","I have resolved to prepare for the worst every time I order!I have come to expect bad service from Walmart gorcery delivery... it is just so darn convenient and cheap I cant give it up!!! I have had a whole 24 pack of soda not be delivered, deliveries over 24 hours late and terrible substitutions. Walmart is just Walmart and I don't think the customer service nor thr delivery accuracy will improve any time soon. SO, when I order, I half expect for something to go wrong and prepare myself! With that said I lOVE me the Walmart shipping side of Walmart, but that's a different review for a different time. Date of experience: June 03, 2024",3
Wanda,US,"Jul 10, 2024","Walmart has expanded to a 2 hour delivery window Since Walmart has expanded to a 2 hour delivery window do NOT order cold/frozen items.  They claim to care about food safety - really Walmart?  My groceries left the store around 3:10pm. The driver made several stops before finally getting to my house 1 hour later!!  I asked the driver if they are carrying coolers, considering it’s 95 degrees outside, for the cold items. The response was NO.  So, my items riding around in a hot trunk for an hour. I will be greatly reducing my Walmart orders now. Most likely will just cancel my membership as well - no longer worth it. Date of experience: July 10, 2024",1
amanda croley,US,"Aug 16, 2024","once again my order has substitutions…once again my order has substitutions that as money to the total. It brings it up to what they originally took from your account. What ever items are missing my daughter goes in the store and finds every item. If you have been over charged it takes anywhere from one week to two months to receive a refund, and it has become really hard to understand the people in customer service.   Date of experience: August 15, 2024",1
Dennis,US,"Apr 11, 2024","Went to local store in Hohenwald tn did…Went to local store in Hohenwald tn did my shopping which is has become almost impossible due to them moving where items are no longer in any logical aisle orders.  But when I went to check out the clerk shoved the cart back at me almost knocking me down I immediately left the store as the clerk didn’t even apologize. This is the last time I will ever go to this Walmart Date of experience: April 11, 2024",1
Donna,US,"Jan 23, 2024","Bad produceWalmart plus delivery is great and convenient. Drivers are good and timely. The produce started out also great but after it put out the local grocery store Walmart sends you old produce not only rotten but actually brown and inedible. Shame on Walmart. If stores close this is why sad.Date of experience: January 23, 2024",2
Dolores Malish,US,"Jun 30, 2024","Mold on Grocery ItemMy order ending in the numbers 1154 that was delivered on Friday, 6/28/24, contained a package of lasagna that had mold on the food. I took pictures. I do not own a car, so my choices were to exchange the item by taking the bus to the store in the Texas heat, paying for a round trip in a ride share, or waiting for Walmart to redeliver the item. I thus tossed it and took the financial loss. Based on my combined experiences with Walmart Plus Delivery, I am of the opinion that if something seems to good to be true, it probably is. I plan to cut my losses for the yearly Walmart Plan and switch to the more expensive Amazon delivery plan in the near future.Date of experience: June 28, 2024",2
