Username,location,date,content,Rating
Anna,AU,2 days agoInvited,"Easy purchaseEasy purchase, great product and customer service!Date of experience: January 11, 2025",4
Pamela J. Stewart,CA,6 days agoInvited,"Came within the dates they saidCame within the dates they said, and is in excellent condition.Date of experience: January 07, 2025",4
Lisa,US,6 days agoInvited,"Exactly as described, like new!Got here in time for Christmas, in like new condition Date of experience: December 25, 2024",5
Andrew,AU,"Jan 6, 2025Invited","My watch arrived on time and in…My watch arrived on time and in pristine condition - highly recommendedDate of experience: January 06, 2025",5
Taneyah  Brann,AU,"Jan 6, 2025Invited","Great refurbished devicesLots of options, very quick delivery, happy with the state of the item. Date of experience: January 05, 2025",5
Patrick,US,A day agoInvited,"Fast shipping and phone in excellent…Fast shipping and phone in excellent condition. Date of experience: January 12, 2025",5
Michael,AU,A day agoInvited,"Great product with a great priceGreat product with a great price. Delivery was very quick.Date of experience: January 12, 2025",5
Annette,AU,2 days agoInvited,"Fast deliveryFast delivery.   Phone as per description.Date of experience: January 11, 2025",5
Betty Goh,SG,2 days ago,"Phone was not factory reset and they…Phone was not factory reset and they left a sim card in the phone.Date of experience: January 01, 2025",3
Anthony,US,"Jan 6, 2025Invited","item came quicklyitem came quickly, working well, and in nice conditionDate of experience: January 04, 2025",5
Sheila Van Gisbergen,CA,2 days agoInvited,"Fast deliveryFast delivery, phone in excellent shapeDate of experience: January 11, 2025",5
Bernadette,AU,5 days agoInvited,"I am very happy with the iPhone 13I am very happy with the iPhone 13 I received would recommend Date of experience: January 08, 2025",4
RV,NZ,"Jan 6, 2025Invited","received wrong colour phone casereceived wrong colour phone case. In process for refund now. Date of experience: January 06, 2025",3
don,US,A day agoInvited,"phone and all the things exposed were…phone and all the things exposed were as stated.Date of experience: January 12, 2025",5
sunil balan,AU,2 days ago,"Very reliable and professional customer…Very reliable and professional customer service and products. Highly recommended for your gadgets.Date of experience: January 01, 2025",5
Linda,US,4 days agoInvited,"The ability to exchange my watch batteryDate of experience: January 07, 2025",4
Oskar,NZ,2 days agoInvited,"It came quick and was like brand new…It came quick and was like brand new best qualityDate of experience: January 12, 2025",5
Jonathan,CA,19 hours agoInvited,"Great QualityDate of experience: January 12, 2025",5
Timothy,US,A day agoInvited,"Phone looks like a brand new one fresh…Phone looks like a brand new one fresh out the box!!!!Date of experience: January 12, 2025",5
JEB,US,5 days agoInvited,"Received my phone fastReceived my phone fast. Transferred my data and, boom! Everything works great.Date of experience: December 20, 2024",5
Ed,CA,15 hours agoInvited,"fast serviceDate of experience: January 06, 2025",4
Amanda,AU,"Jan 6, 2025Invited","Arrived ahead of expected timeArrived ahead of expected time, great quality. Date of experience: January 06, 2025",5
Lola,AU,7 days agoInvited,"Easy and QuickEasy to follow website and quick and efficient serviceDate of experience: January 07, 2025",4
Neisha,CA,6 days agoInvited,"The customer service is fine however my…The customer service is fine however my product was defective Date of experience: January 07, 2025",3
YAMAN,CA,An hour agoInvited,"Really good,almost new.Date of experience: January 13, 2025",5
Joyce,AU,6 days agoInvited,"Fast reliable serviceFast reliable service. Arrived before Chrissy as promised Great condition Date of experience: January 07, 2025",5
Madds,AU,4 days agoInvited,"Delivery was very quickDate of experience: January 09, 2025",4
Hayley,AU,"Jan 6, 2025Invited","Fast package arrivalThe package got delivered really quickly Date of experience: January 05, 2025",5
Nini,CA,4 days ago,"SCAMFalse claim about the condition of the phoneDate of experience: January 08, 2025",1
Carol,AU,5 days agoInvited,"Item as ExpectedQuick deliver and item arrived as advertised.Date of experience: January 08, 2025",5
Lorena,NZ,4 days agoInvited,"LorenaI ordered a iPhone 13 Pro Max and it’s working as a new one. 10/10Date of experience: January 09, 2025",5
TBen,NZ,A day agoInvited,"It arrived quickIt arrived quick Date of experience: January 12, 2025",4
customer O,AU,"Jan 6, 2025Invited","Trustworthy Fast, efficient, product as described Date of experience: January 06, 2025",5
Chris,AU,"Jan 6, 2025Invited","great experienceproblem free, quality productDate of experience: January 05, 2025",5
Wendy Millikan,US,2 days agoInvited,"Always had great luckAlways had great luck Date of experience: January 11, 2025",5
Patricia,AU,2 days agoInvited,"ReliableReliable, prompt service. Item arrived in expected condition.Date of experience: January 11, 2025",4
Devi,SG,1 days agoInvited,"Received in good conditionDate of experience: January 12, 2025",4
Danny,AU,4 days agoInvited,"Item delivered as ordered and on timeItem delivered as ordered and on time Date of experience: January 09, 2025",5
Les Schiller,US,4 days ago,"They did everything they promised they…They did everything they promised they would do!Date of experience: January 06, 2025",5
darrin,CA,6 days agoInvited,"Phone came quick and was as describedDate of experience: January 07, 2025",5
Daniel,AU,4 days agoVerified,"The product was not what up to standard.The product was not what up to standard. Date of experience: January 03, 2025",2
Don Schlitt,CA,Updated 2 days ago,"Order number CA34278Order number CA34278 Date of experience: January 08, 2025",2
Danish,AU,7 days agoInvited,"Nice product deliveredNice product delivered Date of experience: January 07, 2025",5
jack,US,4 days ago,"Interesting processInteresting process. the warranty was important in making decision.Date of experience: January 06, 2025",4
Lewis,NZ,"Jan 6, 2025Invited","Great serviceGreat service Date of experience: January 06, 2025",5
lynne,AU,2 days agoVerified,"Easy orderingEasy orderingArrived earlier than expected.Date of experience: January 11, 2025",5
Olushola,CA,"Jan 6, 2025Invited","Great timingGreat timing Date of experience: January 06, 2025",5
Lucy Williams,AU,4 days ago,"great prices!Easy to purchase! Great Prices!Date of experience: January 05, 2025",5
Gavin,AU,"Jan 6, 2025Invited","good serviceDate of experience: January 06, 2025",5
Fay,US,5 days agoVerified,"Great merchandise and quick delivery.Date of experience: January 01, 2025",5
Karla,GB,2 days agoVerified,"As expectedReceived as expected. Quick deliveryDate of experience: January 11, 2025",4
David,AU,2 days agoInvited,"Great products and a great price.Date of experience: January 11, 2025",5
Gabriel Bussi,ES,"Jan 6, 2025Invited","Trustworthy and fastEverything as advertised.Date of experience: January 06, 2025",4
Sam,AU,6 days agoVerified,"Good product and very good service.Date of experience: January 07, 2025",5
Osnat Ella,NZ,18 hours agoVerified,"Fast and good ThanksFast and good Thanks Date of experience: January 03, 2025",5
James,AU,A day agoInvited,"It was so easy.It was so easy. Date of experience: January 12, 2025",5
Jago,NZ,2 days agoInvited,"Excellent valueExcellent value Date of experience: January 12, 2025",5
Alistair Lethlean,AU,6 days agoInvited,"Simple and got what I paid forDate of experience: January 07, 2025",5
Calistus,CA,3 days agoInvited,"Prompt deliveryPrompt delivery Date of experience: January 10, 2025",4
Jaidyn,AU,6 days agoInvited,"Great customer serviceDate of experience: January 07, 2025",5
Sarah Partridge,AU,2 days agoInvited,"Great experience.Great experience. Date of experience: January 11, 2025",5
kI,AU,2 days agoInvited,"Great ExperienceGreat Experience Date of experience: January 11, 2025",5
Anjorin Oluwamayowa,NG,5 days agoInvited,"It was smoothDate of experience: January 08, 2025",5
Valerie Love,US,"Jan 6, 2025Invited","Great productGreat product! And a good way to buy greenerDate of experience: January 05, 2025",5
Teun,AU,"Jan 5, 2025Invited","It's all very easy.Date of experience: January 05, 2025",4
Nicole,NZ,"Jan 5, 2025Verified","Easy to use websiteEasy to use website, fast delivery Date of experience: December 21, 2024",5
Sheryl  Fox,CA,"Jan 5, 2025Invited","Helpful customer service Helpful customer serviceDate of experience: January 05, 2025",5
Pawel Tulin,US,"Jan 5, 2025Invited","Service and product quality are very…Service and product quality are very good. Price is acceptable. Customer service is proper and responsive.Date of experience: January 05, 2025",5
Andrea,NZ,"Jan 5, 2025Verified","Quick and easy to find my new phone and…Quick and easy to find my new phone and then get it delivered, free of charge.  Came earlier than I was expecting - which is always good!Date of experience: January 05, 2025",5
Victor ,AU,"Jan 5, 2025","Most frustrating customer service…Most frustrating customer service ever.... I emailed back and forth explaining that there must be some kind of glitch regarding addresses. My PayPal address is my old address, but my reebelo address is the correct one. After purchasing, I received an email and it had my old address on it. I emailed explaining if they can simply change the address, but to no avail, they reccomended cancelling the order and re order again. Now I'm currently waiting here like a sitting duck for them to re list the specific phone I was gonna buy. I don't know there should be a better system in regards to confirming and clarifying the address or an easier way to change your address after you've paid. Clearly I'm not a scammer trying to change the address because sending an email to customer service using my email address that I ordered with. Extremely frustrating. It's made me reluctant and turned me off from ever buying from reebelo again. Date of experience: January 04, 2025",1
Eric,CA,"Jan 5, 2025Invited","Nice cellphone, fast shippingNice galaxy S21 ultra phone without any visible scratch. Shipping was even faster then expected delivery date. After a few days, battery seems good.Date of experience: January 05, 2025",5
Anon,NZ,"Jan 5, 2025Invited","Iphone 14Easy to use website, product arrived in a timely manner, product was in great condition. Date of experience: January 05, 2025",5
Norman,US,"Jan 5, 2025Invited","Great transactionGreat transaction! Will purchase again.Date of experience: January 05, 2025",4
Joseph,US,"Updated Jan 6, 2025Invited","Lots of options on the websiteLots of options on the website. Clear information about quality of the item. Tracked shipping. Date of experience: January 03, 2025",5
Happy MI buyer,US,"Jan 5, 2025Invited","Product quality and speedy shippingDate of experience: January 05, 2025",5
EYOB,CA,"Jan 5, 2025Invited","Good packing,fast delivery and product…Good packing,fast delivery and product is as expected 👌.Date of experience: January 05, 2025",5
Milena Burridge,AU,"Updated Jan 6, 2025","Worst customer services 😡Since October 10th till now I still don't have a phone that you said you repaired. I said from the beginning to repair or replace and you didn't do either. You said the vendor fixed it and I said I didn't want it back but wanted a refund. I was worried it wouldnt be fixed still. You said it was to late the vendor as sent it back. You sent it back and wow yep I was right it still wasn't fixed. I'm still wanting for a explanation as to why you sent a phone back that still wasn't working properly and you never answer the question.You service is appalling.I would like to state if you had fixed the phone the first time like you said you did I wouldn't have had to send it back again. Before the physical damage you are referring to wouldn't of happened if you returned me a phone that was in working condition. Again you are not taking accountability for not fixing the phone in the first place.Date of experience: October 10, 2024",1
Bill,AU,"Jan 5, 2025Invited","Quick delivery of phone. Good productQuick delivery good product. Great service Date of experience: January 05, 2025",5
Viki,AU,"Jan 5, 2025Invited","Quick deliveryQuick delivery, great condition! Date of experience: January 05, 2025",4
Sp,AU,"Jan 5, 2025Invited","So far so goodSo far so goodFraction of the price of a new phoneQuick deliveryDate of experience: January 05, 2025",5
Over The Edge Customer,US,"Jan 5, 2025Invited","Great buying experience.Good price, accurate description, fast shipping.Date of experience: January 05, 2025",5
MICHAEL P KENNY,US,"Jan 5, 2025Invited","Great!It was a great service. Date of experience: January 05, 2025",5
Georgia,AU,"Jan 5, 2025Invited","So so good, battery just a little limitedActually looks like new! Looks like it has never been used. So good. It feels like I have a brand new phone. It came with a strong screen protector and phone protector too AND charging cable which is lovelyI paid top price to get the best battery and it is at 91% of its original capacity which is as advertised. For me the only compromise buying this way second hand is it feels like it run outs each day with normal useDate of experience: January 05, 2025",4
Veronica,AU,"Jan 5, 2025Invited","First time purchaseI was able to comfortably choose a phone to suit my needs as the website was easy to navigate.My purchase was shipped immediately and delivered within the notified time frame in excellent condition. Date of experience: December 02, 2024",5
Kodie,AU,"Jan 5, 2025Invited","Quick delivery and great productDate of experience: January 05, 2025",5
Steven,CA,"Jan 5, 2025Invited","overall good purchase experiencereceived my package on the first day of the provided delivery dates range.Date of experience: December 27, 2024",4
Matt,US,"Jan 5, 2025Invited","Great deal Price, quality, speed of delivery Date of experience: January 02, 2025",5
Kya,NZ,"Jan 5, 2025Invited","Perfect phonePerfect phone Date of experience: January 05, 2025",5
Britt M,US,"Jan 5, 2025Invited","Great ExperiencePrice was great. Phone showed up quickly and was great quality. Easy eSIM transfer and phone set up. Great experience!Date of experience: January 02, 2025",5
Aliyah,US,"Jan 5, 2025Invited","Great QualityEverything was a smooth process. Date of experience: January 02, 2025",4
Stefanie,AU,"Jan 5, 2025Verified","Good quality and fast shipping.Good quality and fast shipping. Date of experience: January 04, 2025",5
Dana,CA,"Jan 5, 2025Invited","Easy peasy… supper DuperDate of experience: January 04, 2025",5
Amanda,US,"Jan 5, 2025Invited","MiniGreat phone that is the perfect sizeDate of experience: January 04, 2025",5
Aki,AU,"Jan 5, 2025Invited","quick servicequick service. ThanksDate of experience: January 04, 2025",5
Robin,US,"Jan 5, 2025Invited","Smooth and easySmooth and easy. Customer service was helpful. Date of experience: January 04, 2025",5
Nadine,US,"Jan 5, 2025Invited","Phone was in excellent condition and…Phone was in excellent condition and arrived quickly.Date of experience: January 04, 2025",5
NICOLE DOWLING,US,"Jan 5, 2025Invited","Easy to purchase and great customer…Easy to purchase and great customer support Date of experience: January 04, 2025",5
Neil Ludwig,US,"Jan 5, 2025Invited","Milwaukee 2889 4 1/2 in GrinderItem as described good packaging and quick shipping.  I knew purchasing this itwas refurbished but it seems to be working well. I do recommend this seller  & thanks for the extra month warranty. Date of experience: January 04, 2025",5
DANIEL,US,"Jan 5, 2025Invited","I think the experience was greatI think the experience was great, I was able to buy a functioning phone in good condition for cheaper than normal! The only thing I would say that would’ve made the experience 5/5 would be better packaging, I heard the new phone rattling around and even though I knew it would be okay since it was in plastic, it felt underwhelming. Other than that great experience!Date of experience: January 04, 2025",4
JOHN,US,"Jan 5, 2025Invited","Missing all product guidesDate of experience: January 04, 2025",4
Arman,US,"Jan 5, 2025Invited","I got the premium and the battery was…I got the premium and the battery was at 98% and in pristine condition! Do yourself a favor and grab you a new watch for a great price. Date of experience: January 04, 2025",5
Nikki,AU,"Jan 5, 2025Verified","Do not buy -Sold an International Model Be very wary of purchasing a phone from here. The iPhone 13 that I received was an international model and at no point was it stated that the phone was a US model. Within a week of owning the phone, I noticed the back screen was cracked and I had not dropped the phone at all. I was only just able to take it to the Apple Store to get it repaired and I was told it was an US model which changed the type of repair. It would cost $570 to repair the phone, instead of $150. I contacted Reebelo about being sold something that was not Australian and got told nothing would be done. I’d recommend paying the extra money and buying a brand new phone from a reputable companyDate of experience: November 15, 2024",1
lulu,AU,"Jan 5, 2025Invited","The delivery took awhileThe delivery took awhile, but once the item arrived it was great. Product is as described. Date of experience: January 04, 2025",4
Ann,AU,"Jan 5, 2025Invited","Apple iPhone 12, 64G premium conditionMy Apple iPhone 12 was received within a few days of ordering.  The quality of the phone is as Reebelo advertised and I certainly purchase again from them. Thank you for this great experience.Date of experience: January 04, 2025",5
Dustin,CA,"Jan 5, 2025Invited","Great place for a new phone Wish I had known about reebelo sooner, great prices and options! It’s our second device from reebelo and I’ll continue to buy from here in the future! The phones were delivered in recyclable packaging and fast. Date of experience: January 04, 2025",5
Patric,US,"Jan 5, 2025Invited","The purchase process was greatThe purchase process was great. Contacting someone about shipment issues wasn't. Can this be approved?Date of experience: December 30, 2024",4
Catherine,US,"Jan 4, 2025Invited","Refurbished phoneWe had a great experience getting a refurbished phone for our daughter.  The prices were great and it shipped quickly!Date of experience: January 04, 2025",5
Zachariah,CA,"Jan 4, 2025Invited","Quick and easyQuick and easy! Laptop was in great conditionDate of experience: January 04, 2025",5
Chael,AU,"Jan 4, 2025Verified","Ten out of tenPhone arrived in as-new condition extremely quickly and cost me $800 less than a new phone, couldn't be happier!Date of experience: January 02, 2025",5
LEIGH ANN,US,"Jan 4, 2025Invited","Plenty of inventory to choose from at…Plenty of inventory to choose from at competitive prices. So far, phone seems to working good. Date of experience: January 04, 2025",4
Rene,US,"Jan 4, 2025Invited","Love the product and everything works.Love the product and everything works. Date of experience: January 04, 2025",5
Elinaz Manoochehri,AU,"Jan 4, 2025Verified","Samsung Galaxy, Z4I recently purchased a phone from Reebelo, and the process was incredibly easy. The phone arrived on time, just as promised. I’m very satisfied and would definitely recommend this website to others!Date of experience: January 04, 2025",5
Copeland,US,"Jan 4, 2025Invited","Perfection, I will NEVER go to a ‘Apple Store’ Ever Again!!!!Perfect! Not a Scratch or Ding, I’m really Surprised. I got the “PREMIUM” option of the iPhone 11… the phone works as New, might as well Be, you can’t tell the difference 😊 I’m definitely coming back for a few iPads & browse there store for anything else I haven’t thought of. I Seriously Recommend this Store, I wish I would have known of them sooner :)Date of experience: January 04, 2025",5
FG,US,"Jan 4, 2025Invited","Quality product delivered as advertised.Quality product delivered as advertised. Date of experience: January 04, 2025",5
Arpita,NZ,"Jan 4, 2025Invited","Great communicationGreat communication, good pricing, very well customer service!Date of experience: January 04, 2025",5
Paula Langhurst,US,"Jan 4, 2025Invited","Refurbished iPhone, Performs like brand newReceived the iPhone I ordered quickly.  It is in excellent shape, far exceeding my expectations.  It was a smooth transition to set up the new phone using my old phone.  Everything works perfectly on it!  Thank you for offering such amazing deals!Date of experience: January 04, 2025",5
Gabrielle,US,"Jan 4, 2025Invited","Deceptive listingThe listing for a fitbit band was very deceptive-- I thought I was buying an actual fitbit. After a couple of email exchanges with customer support, I received a full refund and did not have to return the item. Date of experience: January 04, 2025",4
Dagan,US,"Jan 4, 2025Invited","Fast shippingFast shipping Date of experience: January 04, 2025",5
Joshua,US,"Jan 4, 2025Invited","Reasonable phone and priceThe phone and price were reasonable.Date of experience: January 04, 2025",4
Sarah,CA,"Jan 4, 2025Invited","Prices were good and phone is in good…Prices were good and phone is in good shape Date of experience: January 04, 2025",5
Ricardo,US,"Jan 4, 2025Verified","ExcelletMy iPhone is exactly as describe Date of experience: January 04, 2025",5
Walter,CA,"Jan 4, 2025Invited","Quick deliveryQuick delivery. Better price compared to other sellers.  Date of experience: January 04, 2025",5
Sophia,CA,"Jan 4, 2025Invited","Happy with my purchase! Very happy with the iPhone I purchased. Bought it in excellent condition and it’s like a brand new phone! Battery life is amazing and shipped so fast! Would recommend. Date of experience: January 04, 2025",5
Khadija,CA,"Jan 4, 2025Invited","Super fast delivery and good products It was delivered so fast and the product actually look so good and new Date of experience: January 04, 2025",5
Elizabeth,US,"Jan 4, 2025Invited","Great shipping and great dealDate of experience: January 04, 2025",5
Marie-Eve,CA,"Jan 4, 2025Invited","Great product and fast deliveryGreat product and fast delivery Date of experience: January 04, 2025",5
Christopher,US,"Jan 4, 2025Invited","Great CompanyGreat quality product! Fast shipping! Date of experience: January 04, 2025",5
Marcos Moran,US,"Jan 4, 2025Invited","Phone is PERFECTPhone is PERFECT! No scratches anywhere and the battery is great. Date of experience: January 04, 2025",5
Frederic,CA,"Jan 4, 2025Invited","Quite happy with the purchase and the…Quite happy with the purchase and the delivery. Date of experience: January 04, 2025",4
Michael,US,"Jan 4, 2025Invited","The phone arrived quickly and in great…The phone arrived quickly and in great condition. Shipping my trade-in device was effortless. It was a painless experience, start to finish. Date of experience: January 04, 2025",5
Wei chang,SG,"Jan 4, 2025Invited","Purchase was smooth and items send as…Purchase was smooth and items send as described. Date of experience: January 04, 2025",4
Abdiwali,AU,"Jan 4, 2025Invited","Happy I’m happy with the product and delivery…I’m happy with the product and delivery timeframeDate of experience: January 04, 2025",5
Scott,AU,"Jan 4, 2025Invited","Good priceGood price. Fast deliveryDate of experience: January 04, 2025",5
Amy,GB,"Jan 4, 2025Invited","Quick and easy deliveryDate of experience: January 04, 2025",5
Kiah,AU,"Jan 4, 2025Verified","fast deliveryfast delivery, good product :)Date of experience: January 04, 2025",5
damien,AU,"Jan 4, 2025Invited","Quick deliveryQuick delivery. Great productDate of experience: January 04, 2025",5
Kelly ,AU,"Jan 4, 2025Invited","Really Happy!Really happy with our Reebelo phones! Easy process, quick delivery and the phones themselves were excellent and priced so fairly. Highly recommend.Date of experience: January 04, 2025",5
marie,AU,"Jan 4, 2025Invited","great phone Good phone and great conditionDate of experience: January 04, 2025",4
Chris,NZ,"Updated Jan 6, 2025","MisleadingThey shipped me the wrong phone, when I nlet them know, they were hard to get an answer from, and in the end said I could keep it, and said nothing about anything to pay. A month later, when I was committed to the new phone (having set it up, bought a cover, etc), they informed me I could either pay more than $400 extra or return the phone for replacement with the one I originally ordeed. When I sought to negotiate (as this is totally unaccpetable for a vendor) they were polite, but completely refused to take any real responsblity for not communictaing properly, and would not negotiate at all about amounts to pay. Very frustrating.  Date of experience: December 17, 2024",1
David,AU,"Jan 4, 2025Invited","Quick simpleQuick simple. Good condition phone. Date of experience: January 04, 2025",5
sudi,AU,"Jan 4, 2025Invited","Good priceGood price good product Date of experience: January 04, 2025",5
Wayne Tolmie,AU,"Jan 4, 2025Invited","I paid a little extra to get a premium…I paid a little extra to get a premium quality iphone and when it arrived I thought it was a new iPhone not a mark on it and the battery health was 100 percent. I am more than happy with the deal thanks Reebelo.Date of experience: January 04, 2025",5
R.,US,"Jan 4, 2025Invited","I'm very happy with my MacbookI'm very happy with my Macbook. It works great. Date of experience: January 04, 2025",5
Christine,AU,"Jan 4, 2025Invited","Great Value Good experience, fast delivery and phone was in excellent condition.Date of experience: January 04, 2025",5
Barrie,AU,"Jan 4, 2025Invited","Timely cheapDate of experience: January 04, 2025",5
Neil Wright,AU,"Jan 4, 2025Invited","Fast delivery.Fast delivery. Date of experience: January 04, 2025",4
