Username,location,date,content,Rating
Winzell Bluefort,US,"Mar 1, 2024","Overpriced and poor customer serviceOn January 15th I placed an order for a $1,700 pre built pc (before taxes). It was a gift for my brother whose birthday was 3 weeks away from the time the order was placed. Well 3 weeks have gone by and they haven’t even began building my PC. When I contacted customer service they informed me that they were slow due to the holidays… keep in mind I placed this order 20 days after Christmas! I ended up requesting a refund but they charged me over $300 for fees and I never even received the PC. They were quick to take my money but the refund took weeks for them to process. NZXT is a joke of a company that sell cheap overpriced parts. They do not care about their customers and will milk any money from them as they possibly can.Date of experience: February 01, 2024",1
Marry Jane,KW,"May 6, 2024","My replacement of glass panel finally ship...My replacement of glass panel finally getting ship after few months of waiting.Date of experience: May 06, 2024",5
harry lopez,US,"Updated Jan 12, 2024","4 times a charm rightEDIT: this is my ticket number, I doubt anyone will do anything but I can hope. 1837102.     4 times a charm right? 4 repairs all different issues on 2 different pc’s and the customer service is horrible they act like it’s normal, manager Sergio is the worst person I have ever dealt with when it comes to customer service. No empathy, sympathy or respect. Threatened to ban me because I was asking him to do the right thing and understand that I can guarantee there isn’t 1 Nzxt customer that’s gone through this! I honestly think it’s being done on purpose but either way this is my 4th time sending my pc in for something they did wrong and blaming on shipping. I absolutely will never recommend this company and one day all of the shadiness will come to light I have proof that I’ve been ignored and treated horrible as a customer I will also be talking to a lawyer to have this investigated because I really think I’m being singled out.Date of experience: December 09, 2023",1
Jeff Honey,US,"Dec 29, 2023","TerribleTerrible, I’ve been trying to contact NZXT due to my Player one Prime immediately crashing after a week of usage, and I checked all the system hardware through command prompt, cleanup, memtest86, to no avail, customer service closed my ticket without emailing me. I would not recommend this company to anyone.Date of experience: December 28, 2023",1
Austin Bell,US,"May 15, 2024","Only had my computer for one month and…Only had my computer for one month and it was almost 4k. I had to send it back because it stopped working. Put in original packaging and then they emailed me days later.. I didn’t follow the rules for sending it back so they voided my warranty and sent me back a broken computer. They sent the return label first and separate so I didn’t catch this yes but really this is so BS. Now I’m realizing how crap this company is. I never would have bought anything from them if i knew this was first going to break within 30 days and then have them treat me like this. It’s taken weeks to deal with them and total nightmare.. not worth it. Date of experience: April 30, 2024",1
mike hock,EG,"Jan 26, 2024","i had an issue with my kraken m22 and…i had an issue with my kraken m22 and they shipped me a new aiothey were super friendly and they fixed my issue right away, they really made my day, I love them. ❤️Date of experience: December 10, 2023",5
Giuseppe Licari,DE,"Apr 13, 2024","Perfect StorePerfect Store, Little Bit on the expensive site but definitely worth it!Date of experience: April 12, 2024",5
Matthias Lehner,CH,"Dec 3, 2024","They rip off their customerThey rip off their customer. Just watch the video from gamers nexus about NZXT and you know what not to buy.Date of experience: December 01, 2024",1
Gordon Hof,DE,"Jan 31, 2024","Good qualityNice products, good quality. And in case you have any problems, there is a really nice support which helps you with your problem.Date of experience: January 29, 2024",5
Annie Williams,US,"Dec 23, 2023","My son will have nothing to open on…My son will have nothing to open on Christmas. I have called with no options to speak to a person. I have logged multiple support tickets through email and live chat with no response. My 12 year old is going to be crushed. There is a clear spot on their site that states 6 business days from order to ship for custom builds. I placed this order based on this information. They charged my credit card and *then* sent me an email that the shipping date is January 3 and based on what I’m reading here that probably won’t happen either. I requested contact from their support so I could either pay a rush fee or consider another option for my son’s Christmas gift with no response at all. So, now a 6th grader gets to watch his sibling and cousins open gifts on Christmas morning and he will not. Also, he goes back to school January 3, so no fun time with his new very expensive computer on his break.  I worked in software for years and I understand nothing is perfect and sometimes circumstances are out of your immediate control, but not answering your customers at Christmas time and owning the bad news is pretty cowardly and generally bad business. I certainly hope the product is worth the disappointment we will feel on Christmas morning.Date of experience: December 23, 2023",1
Fredrik,SE,"Dec 3, 2024","Do not buy anything from this companyDo not buy anything from this company! Go watch Gamers Nexus about their scams!Date of experience: December 03, 2024",1
Filipe,PT,"Dec 7, 2024","ScamToo much to tell, watch Gamers Nexus' YouTube video on them and stay away.Date of experience: December 06, 2024",1
Danny C,US,"May 22, 2024","After 3 years my cooler LEDs gone outAfter 3 years my cooler LEDs gone out. I sent it to NZXT for warranty and they did get back to me that it was received. However they seek to be sitting on their thumbs for over a week now and the status has not changed or progressed. I feel that I have made big mistake sending it back to them. I could have lived with a couple of dead lights. Needless to say, I will NEVER BUY ANYTHING FROM NZXT in the future.Date of experience: May 22, 2024",1
Niels Buch,DK,"Dec 30, 2023","NZXT H1 clogging. NEVER AGAINNEVER AGAIN!Bought a NZXT h1 v1 in July of 2020. It is such a pretty case and I was happy the first two years. In the third year the AIO cooling suddenly started to worsen, until suddenly not working. Of course I only figured out it was the coolant inside the AIO that started to clump and clogged the cooler a month after my warrant was gone. It is a custom-made cooler from NZXT, so I contacted support to see if they might SELL me a replacement, and they said no. Now I have a 400$ dead weight on my table. While NZXT customer support is very friendly NZXT's customer-guideline are terrible for the customers and for rights-to-repair! After this I searched Reddit to see it is a normal problem with their coolant in the H1's AIO, and they only sell you a new one, if you have the clout to get enough people to care. All my friends and colleagues now know my stance. Never buy from NZXTDate of experience: September 27, 2023",1
Consumer,CA,"Jan 2, 2024","Great brand and customer serviceGreat brand and customer service! Will go out of they’re way to send you a replace piece or part for the product. Just great service all aroundDate of experience: December 01, 2023",5
Pierre-Antoine,FR,"Updated May 27, 2024","9 months still no working unit UPDATEDSecond time the PSU of my H1 unit broke down. Reported it 9 months ago. Replacement approved 6 months ago. I'm still waiting, NZXT refuses to give a timeline for it or alternatives, just ""we don't have the PSU in stock"". They are very prompt to reply to emails, so I can't say the customer service people are bad, but the customer service policies of the company are just the worst I've ever experienced. This is just shameful.Update 03.05.24: thank you for response, here is my ticket number 1823345 hope this gets resolved asapUpdate 13.05.24: just to tell this crowd it's not because because you see a company replying that anything happens. Been 10 days, no word whatsoever.Update 27.05.24: final update, after 10 months now, I am now promised a 64 pounds money back... Which doesn't cover the cost of a PSU for the needed power and size even from their own company. An absolute disgrace, worst after sale service I've ever seen, will never buy from this company again and you shouldn't either. If something goes wrong with your product you will get the shaft for sure. Date of experience: April 24, 2024",1
Phill Suter,US,"Feb 11, 2024","Absolutely terrible it took it a month…Absolutely terrible it took it a month and a half to get here and it lasted 2 weeks and the cpu and ram was faulty within 2 weeks had to get it fix for $500 that is terrible how do you send a faulty cpu and ram sticksDate of experience: February 07, 2024",1
Tyler Wright,US,"Updated Apr 17, 2024","Lack of resolution for a mistake made by NZXTLack of resolution for company mistake. I'm disappointed in my experience with NZXT simply due to the lack of reasonable resolution offered. I purchased a custom built PC (a north of $3,000 PC) and when it arrived it was built in the wrong case. I quickly contacted support and was met with a friendly and seemingly helpful agent that apologized for the mess up and said he would start a support ticket for resolution. Their suggested resolution was to either give me a $70 credit and 3 RGB fans that was supposed to be in the case i ordered OR to return the PC and have me pay a restocking fee. Since this is not the case i wanted, i asked that recieved the credit, 3 fans, and that the other 4 fans in my case be replaced to match (less than a $100 request) and was quickly denied. This PC is for work and without it would be an issue, so sending this PC back and asking them to build me the correct one was much further of an inconvenience. Im writing this truly disappointed that a less than $100 request to mildly accommodate their error was denied on a $3,000 purchase. This tells me they do not care about the end user.In response to NZXT's reply my ticket number is support request (1927020).It has been a week since updating this review per NZXT's request to contact me and I have not received any contact. Date of experience: April 01, 2024",2
philbob_thirty,DE,"Feb 25, 2024","Max is the bestMax gave me the best possible experience there possibly can beDate of experience: February 22, 2024",5
Mateus Cardoso,SE,"Apr 24, 2024","Great after salesI had a amazing experience with the brand when I needed spare parts.Date of experience: April 23, 2024",5
Mikrados Sgeek,FR,"Feb 15, 2024","Great customer support/serviceBought some hardware few years ago, my product as broke.Then I started the warranty path and guys was really nice!Its was clear and fast! They shipped me a brand new one.Date of experience: February 14, 2024",5
Chris,GB,"Sep 4, 2024","They close support tickets without…They close support tickets without addressing the issue raised. Poor products and service.Date of experience: September 04, 2024",1
Brandon,US,"Jan 6, 2024","Truly have not seen a company this bad, I had to create this profileHad to delete my 1st review because it got much worse.. I placed an order 11/30 for a 4k computer that was supposed to ship on 12/21. 12/21 comes and goes, and I reached out to their support on 12/22 (Tick#1843088). The culmination of that conversation ended with the employee wanting to know if I wanted to cancel my order since they could not meet the demand, and delivery, and they did not have the proper equipment three weeks after I placed my order. Check a week later on 12/27 (tic#1848368), and still no clue about what the problem is, but gave me an estimated date of 1/5, and due to the problem, upgrade me to next-day delivery (separate from my $230 shipping). I try reaching out on 1/3 (tic#1856415) but I wait 2 hours and and there is no response or answer from their help team. I again try on 1/4 (Tic#1859122) and after 20+ min leave the chat. On 1/5 I finally get customer support to check on if its shipping or not because why not I am already waiting (tic#1860295) and come to find out that the label had been printed since the previous day, but it had not shipped. I also found that they did not upgrade me like they said they would, and they missed the pickup to do anything (FedEx still didn't report the pickup). For my headache, NZXT wants to provide me a $50 Amazon gift card, and a $30 worthless screwdriver kit. Only reason they have 1 star is because I cannot provide anything less. Be aware that you might go through the same, and not even have received your order like me.Date of experience: January 05, 2024",1
Cory DeGroot,US,"Updated May 17, 2024","Unusable software, abysmal customer servicePurchased an all in one liquid cooler for my computer only to find out that required software for it causes constant crashes and even corrupted my display driver somehow. When customer service was contacted, they refused to even acknowledge the problem despite 5 years of threads of people having this exact problem. The representative tried to blame me, saying any number of problems with my computer build could cause the problem. Except uninstalling NZXT CAM completely fixes the problem, removing your ability to cool your computer in the process, rendering the cooler useless. Follow up with customer service after informing them I may only receive a partial refund from a third party to check my options for proper resolution and was given a metaphorical middle finger. I’d be embarrassed to offer customer service and software this subpar, especially on a premium product. Edit: Receiving the same copied and pasted response as everyone else solidified my opinion of NZXT. I’ve returned all NZXT items. No further communication is required or desiredDate of experience: April 24, 2024",1
Mason Barr,US,"Dec 30, 2023","Great communicationGreat communication! Great build for my son! Thanks again NZXT!Date of experience: December 20, 2023",5
Heather Young,US,"Jan 6, 2024","Inaccurate Order Status, Delayed Order, Lack of Communication, and No CompensationMy wife and I ordered PCs on the same day (December 14th). I ordered mine several hours before hers. Mine was a player two with a couple of upgrades. Hers was fully custom. We expected our builds to take some time due to the holiday order volume. However, after not receiving any updates on our order for 2+ weeks, we both reached out and were told there were no delays and it was expected to ship by January 8th.However, her build was expedited as was her shipping at no cost. Her order is now expected to be delivered early. On top of that, she received an $50 amazon gift card from NZXT.I was told last night that my order was delayed and that they are unable to expedite the build of my PC. They also said I would have to pay extra in order to expedite the shipping. At this point, I was ready to pay extra because I was tired of waiting. When I asked how much the cost would be, I received a generic email in response that did not answer my question. I’ve seen several other stories from people saying that once their order was delayed, their shipping was upgraded.This has been an extremely frustrating experience. I get the holiday delay but for there to be a blatant unfair treatment between orders has really ruined my excitement about getting my first PC. I don't think I will be ordering from NZXT in the future after this.My ticket numbers in case NZXT sees this:(1854851)(1860851)And BLD order number:501501Date of experience: January 05, 2024",1
Ромашка,US,"Dec 19, 2023","Why 1 starWhy 1 star? Because I didn’t receive my oder and any updates for a MONTH. Their support is just the most stupid thing Ive ever seen. So basically its past the shipping date and I did not get ANY notifications.Ok, I texted support a WEEK AGO, and what? No answer. So I started to spam with tickets and what? One unique “supporter” named Dakota was just cancelling the tickets and that’s it🥰But I decided to ask from different account and you know what? They answered me IN A MINUTE. Is it a game like Russian roulette for them to ignore some people and bless with their answers others?But anyway that answer was a bs cuz they just sent me links to track my order, and yeah, the last update was a month ago saying “order placed” which means we took your money now have patience and we don’t care anymore. This 1 star is only regarding their stupidest and the most useless support you have ever seen, I just wanna cry and say all of the swear words I know cuz it’s all pain. I mean Christmas mood is totally destroyed cuz I gonna spend my only days off alone with vodka instead of playing with my internet friends. I just wanted to show all the pain in my soul so don’t be mad at me plz, I know Im behaving like a Karen right now, Im just…crying insideIt’s a just a pain when you save up for the whole year and now it seems like you’ve been scammedI will send another review of product and it could be 5 stars if only I will ever receive the PC, I hope it gonna be in another month at least…PLEASE hear me out oh GodDate of experience: December 18, 2023",1
Dylan Michaels,PL,"Updated Aug 5, 2024","Big Build, Big ProblemsI ordered a very expensive build with some major issues. Mainly, dealing with their customer support. My build was an AMD 7900X with 32GB DDR5 and a RTX 4080 TUF. I had originally asked them to ship the card separately because of risk of damage with the GPU being so heavy. They told me their packaging should suffice, and they denied my request and sent it out. As expected, the GPU was dead on arrival. I had to send the card back, they confirmed it was dead and sent me a new one. Fast forward about a year, my motherboard dies. They were pretty helpful, and got me a label printed out for shipped and asked me to send back the full PC. I explained what happened with the GPU and their packaging, and I requested to send the graphics card separately or not at all since the GPU was fine. They denied my request, again, to ship the GPU separately even though the issues was with the motherboard. Even with the immense amount of money this has cost them already, they just don't believe the GPU can be damaged in shipping for some reason. It's been a week, and they haven't even entered my PC into their repair queue yet. With that, they will send the PC back and I might even get a dead GPU again. They should allow the customer the option to ship GPU separately.Update: I should be getting the PC back today 8/5. They said it was as I expected, damaged during shipment and they had to replace the GPU, RAM, and motherboard. CPU also had issues. This was shipped back in their original packaging provided. Hopefully they shipped back to me with better packaging and no damage, will find out later today.Date of experience: July 23, 2024",2
Ilias,BE,"Mar 13, 2024","They gave me a free replacement part…They gave me a free replacement part for my air cooling Date of experience: March 11, 2024",5
Jackson Martin,US,"Updated Jul 11, 2024","I bought an AMD N7 B650E  on 4/18/24…I bought an AMD N7 B650E  on 4/18/24 for my son's birthday.  It arrived on 4/25 in time.  He had to get a couple of other parts so we built the computer and it wouldn't even connect to the monitor.  We had to go to Best Buy to get it diagnosed $200.00 out of pocket for them to tell me the mother board was bad.  Called customer service they were going to replace but I had to send the other one back first.  I sent their customer service an email to just refund.  Since my son didn't want to be down for that long best buy offered to put in a mother board for us.  That my son now wants to keep.  There was no reply on my request but about 15 days later we get a replacement motherboard not a refund.  I called customer service (Phillipines) and they said no to the refund.  I wasn't sure if we were fully communicating so I opened a customer support ticket with my full request.  Still got a NO for the refund request ""since this happed back in April""  well due to shipping time, birthday present and build time it is hard to meet their 30 day refund timeline.  I guess for them to be lenient and take back their unopened product was just too much to ask from a 300M per year company even though it was due to their crappy product that I had to spend an additional 200.00 and even wanted a refund.  So be careful of any timelines and don't expect customer support to go off script or accept any responsibility from their side.  Also I was going to add this review to their site but it is not letting me add on at this time but I will keep trying...NZXT asked about a ticket number.  My original order # was 531428 My last Customer Svc ticket was 1981820Date of experience: April 16, 2024",1
Glynn Alexander,GB,"Updated Mar 14, 2024","Z73 has failed after a motherboard…Z73 has failed after a motherboard upgrade, getting 'cpu overheating' error from my motherboard. Of course I took it all apart in order to check whether I had accidently done something wrong, contacted them for an RMA and found out their default position is to imply you are a liar and ask for video and photo proof of the issue. My pc is in pieces so what they expect is for me to rebuild it, then boot it, putting my cpu at risk, whilst filming it until my pc panics again to give me the same error and then dismantle it all again. A warrenty of 2 years is worthless if the condition of that is that you have to prove you are not lying as that is literally what this policy implies since I described the problem, told them what I had done to try to fix it, even suggested it could be trapped air, to which they said no because I'd hear it, I showed them the pc all in pieces to prove it is obviously having an issue of some kind.. what a stupid dumb policy, especially because with my skills, everything they requested I could just fake, including the video, but unfortunetely I am honest... JUST GIVE ME MY BLOODY WARRANTY!The ticket this this discussion was closed by your rep 1903331 but there is another open that has not reached the point of telling me I have to supply 'evidence' 1901591UPDATE 14/03/24 - This review will still stand because the arsehats did not reach out and did absolutely nothing to change my concerns.Date of experience: February 27, 2024",1
Rich,US,"Updated Jan 5, 2024","Shipping/Customer Service SystemI’m seeing a lot of the same reviews, so I will pile on. They advertise a 10-15 day build rate (with shipping upon completion)However, after purchasing they will then email you saying that their advertised timeline is incorrect due to holiday almost IMMEDIATELY. It’s a tad bit scummy, in my opinion.Then, on estimated day of shipment, the day came and went with no update. After multiple tickets being opened, just for them to immediately close it and attach to a “completed ticket” I finally got through their multiple hour wait time on the phone. I was promised an expedited build process+shipping for them failing to adhere to the timeline they set henceforth, just for the shipping day to come and not get either of those promises.While NZXT has amazing products, they easily have the worst customer support system.This is in no way an attack on the wonderful people I spoke to in the phone, but the system they use as a whole.Just awfully bad customer service. I order a product well in advance for Christmas, just for it to not be schedule until almost the new year. If it wasn’t for the quality of product they pushed out, I’m sure few people would still conduct business with them on the scale of broken promises they send out.The best part is? They’ll send a generic response and ask for my ticket numbers, then do absolutely NOTHING to correct the situation.EDIT- Ticket #s: 1816912 1836710 1837701Update to the edit: They never reached back out, as I figured. It’s just a shame that the company with this quality of product (I did finally receive it, and I love it) just can’t seem to do right by the customers.Date of experience: December 19, 2023",1
