Username,location,date,content,Rating
Hoàng Quân,VN,"Oct 11, 2021","having the best giveaway <3Date of experience: October 11, 2021",5
fóяizs веисе,HU,"Oct 11, 2021","I have Oukitel K10000I have Oukitel K10000, which is still an amazing phone to me. Has it's age, but still a phone to trust everywhere.All I wish is some same Elegant 10000+ mAh phone to be released by Oukitel, with nice camera and freeze-free processor for smooth operations.Date of experience: October 11, 2021",5
Mr Banda,MX,"Oct 11, 2021","Simply amazimg!Simply amazimg!, the best rugged pgone until nowDate of experience: October 11, 2021",5
James,US,"Oct 9, 2021","I really like the look of their phones!Date of experience: October 09, 2021",5
Bojan Kukić,DE,"Oct 9, 2021","Amazing noiceeeDate of experience: October 09, 2021",5
Ian,CA,"Oct 8, 2021","Awesome phone and productsDate of experience: October 08, 2021",5
Jeffrey Mcquaid,US,"Oct 6, 2021","I own 2 phones from this amazing…I own 2 phones from this amazing company  awesome phones for a super price.Date of experience: October 06, 2021",5
Radoslav Petrov,BG,"Oct 5, 2021","I like the way OUKITEL smartphones are…I like the way OUKITEL smartphones are built, because they are durable, have big batteries and some unique functions. OUKITEL is an interesting brand with a vision, which in my opinion will lead to their global success as number one manufacturer one day.Date of experience: October 05, 2021",5
Max Talalaev,RU,"Oct 4, 2021","Tough, durable battery.Every OUKITEL smartphone compensates everything that is lacking with superb battery time and extremely rugged protection qualities. Perfect for my uses.Date of experience: October 04, 2021",5
Scar Black,US,"Oct 3, 2021","I like your phone but I don't like that…I like your phone but I don't like that the glass for the camera is not shatter proof.Date of experience: October 03, 2021",4
YourBoy Kco,JM,"Oct 2, 2021","i love the night visions the most and…i love the night visions the most and the fact that its a rugged device I break phones easilyDate of experience: October 02, 2021",4
Gaston Aguirre Talavera,MX,"Oct 1, 2021","exelent resistance capacity priceDate of experience: October 01, 2021",5
Alex Dubon,US,"Sep 30, 2021","Outkitel make the best rugged phones in…Outkitel make the best rugged phones in the world I recommend them to my friendsDate of experience: September 30, 2021",5
Pointer War,RU,"Sep 29, 2021","AwesomeSo far seems to be pretty cool by characteristics and stuff.Date of experience: September 29, 2021",5
Berhamin Hadjidulla,PH,"Sep 27, 2021","Awesome phone and features are awesomeDate of experience: September 27, 2021",5
Richard Skuse,US,"Sep 26, 2021","great rugged phoneDate of experience: September 26, 2021",5
Vishal,PK,"Sep 26, 2021","It is nice it gives me a free mobile…It is nice it gives me a free mobile phone 🙂.Date of experience: September 26, 2021",5
Emma Ava,TR,"Sep 25, 2021","BeautifulBeautiful, Successful, Innovative, What else, Good luck.Date of experience: September 25, 2021",5
Syed Rayan Malik,PK,"Sep 25, 2021","All in One Phone.I love this phone its amazing Specification, specially nigh vision feature, its amazing and the best nigh vision ive ever seen. i also like its ultra wide shot, and also battery is impressiveDate of experience: September 25, 2021",5
Alexander Silas,US,"Sep 25, 2021","Oukitel products are very nice and…Oukitel products are very nice and durableI wish I will be getting discounts from themDate of experience: September 25, 2021",5
Nesrine Sisi,DZ,"Sep 24, 2021","I love it oukitel is very goodDate of experience: September 24, 2021",5
aymen apoca,DZ,"Sep 24, 2021","A monster of a phone from r realA monster of a phone from r real, a big screen and a huge battery that can keep up with ur daily heavy usageDate of experience: September 24, 2021",5
Edwin Ramos,PH,"Sep 24, 2021","im currently using WP7im currently using WP7, and if im very satisfied with its performance how much more with the WP15 or 17. im just hoping that oukitel will have a physical store outlet here in the Philippines.Date of experience: September 24, 2021",5
נועם אברהם מאור לילה,IL,"Sep 24, 2021","I am expecting that this will be an…I am expecting that this will be an amazing phone!Date of experience: September 24, 2021",5
Donald Shai,ZA,"Sep 24, 2021","I really like OUKITEL Rugged phonesI really like OUKITEL Rugged phones, currently using WP7 now i want upgrade to WP15/17, Keep the good work.Date of experience: September 24, 2021",5
abel pinnavaria,AR,"Sep 24, 2021","Big battery good camera and ruggedDate of experience: September 24, 2021",5
Victor Truque Quesada,ES,"Sep 24, 2021","It really is a super strong smartphoneDate of experience: September 24, 2021",5
Sergiu Iordache,RO,"Sep 24, 2021","Perfection !Date of experience: September 24, 2021",5
Leonardo Steuernagel,BR,"Sep 24, 2021","Oukitel has great cell phonesOukitel has great cell phones, lots of battery, great endurance and great hardware. They are rugged cell phones that efficiently fulfill their purpose!Date of experience: September 24, 2021",5
Dugo Cellona,KW,"Sep 24, 2021","this  is  cool  i want to  try  hope …this  is  cool  i want to  try  hope  to win... tyDate of experience: September 24, 2021",5
David Marshall,GB,"Sep 24, 2021","Great rugged mobilesGreat rugged mobiles, got one to use at work.Date of experience: September 24, 2021",5
Scimmiati di Tecnologia,IT,"Sep 24, 2021","Top smartphoneDate of experience: September 24, 2021",5
Sizanur Rahman,BD,"Sep 24, 2021","This model look quite niceDate of experience: September 24, 2021",5
Jesus Rojas,MX,"Sep 19, 2021","Excellent phone with good performance.Date of experience: September 19, 2021",5
Edwin Pobre,PH,"Sep 19, 2021","Great PhoneGreat Phone. So Rigid yet Performs well.Date of experience: September 19, 2021",5
Arthur Campbell,US,"Sep 19, 2021","Great stuffGreat stuff, they don't make any junk !!Date of experience: September 19, 2021",5
wdwquad,US,"Sep 19, 2021","Heavy dutyHeavy duty, perfect for the guy that need's a tough phone. Great for the job site..Date of experience: September 19, 2021",5
Thomas Lee,US,"Sep 19, 2021","Superb performamnce!Date of experience: September 19, 2021",5
Maria Ldm,RU,"Sep 18, 2021","Good phonesGood phones. Just wonderfulDate of experience: September 18, 2021",5
- Joao Santos,PT,"Sep 18, 2021","good quality productsDate of experience: September 18, 2021",5
Umair ahmed,PK,"Sep 18, 2021","I love oukitel smartphone because of…I love oukitel smartphone because of its camera quality and durability. I have been using their smartphone since 2019 and I would recommend any one who would need all feature in single smartphoneDate of experience: September 18, 2021",5
Saúl Barco,MX,"Sep 18, 2021","PerfectAll their products have a great manufacturing quality and are very durable, I really recommend the brand to anyone looking for something of quality at an affordable priceDate of experience: September 18, 2021",5
Winner huamantalla reyes,PE,"Sep 17, 2021","good and qualitygood quality products with high characteristicsDate of experience: September 17, 2021",5
Jes Sie,PH,"Sep 17, 2021","Very Good rugged phone that build to…Very Good rugged phone that build to last.. high-end specs that is very essential in our everyday use.Date of experience: September 17, 2021",5
Yasir Zadajli,OM,"Sep 17, 2021","Quite a nice xperianceQuite a nice xperiance, easy to useDate of experience: September 17, 2021",5
William Fancar,ID,"Sep 17, 2021","Great brandGreat brand, need to be globally branch, especially for countries on southeast Asia.Date of experience: September 17, 2021",5
Hichem Hilal,DZ,"Sep 16, 2021","thank you for this giftDate of experience: September 16, 2021",5
Gia Hào Nguyễn Trần,VN,"Sep 16, 2021","Very goodVery good, bruhhDate of experience: September 16, 2021",5
peeg KP,GH,"Sep 16, 2021","Absolutely perfectDate of experience: September 16, 2021",5
Дмитро Завтонов,UA,"Sep 16, 2021","One of the best smartphone…One of the best smartphone manufacturers.Date of experience: September 16, 2021",5
Jerry Rodriguez,PH,"Sep 15, 2021","Amazing rugged phonesOne of the best company to offer a rugged, and high class smartphone for a cheap price.Date of experience: September 15, 2021",5
yamuna koirala,NP,"Sep 13, 2021","this is the best investment i have ever…this is the best investment i have ever madeDate of experience: September 13, 2021",5
Benjamin,ID,"Sep 13, 2021","EpicTrustable and pretty epic.Date of experience: September 13, 2021",5
Jennifer Raska,US,"Sep 12, 2021","Nice site!This is a fun siteDate of experience: September 12, 2021",5
Dannis Lee,MY,"Sep 12, 2021","WP15 very good to useDate of experience: September 12, 2021",5
Wan,MY,"Sep 11, 2021","Lets go follow OUKITEL u all surprise…Lets go follow OUKITEL u all surprise gift for u allDate of experience: September 11, 2021",5
Ijaz Chauhdary,PK,"Sep 11, 2021","Very very very very very Good PhoneDate of experience: September 11, 2021",5
Deni Nurwahid,ID,"Sep 9, 2021","OUr KIt ELectronicDate of experience: September 09, 2021",5
armand moscoso,PH,"Sep 8, 2021","best phone at it's price..Date of experience: September 08, 2021",5
Phan Anh Hào,JP,"Sep 7, 2021","Very well i like itDate of experience: September 07, 2021",5
Yavor Yankov,BG,"Sep 7, 2021","very good i like itDate of experience: September 07, 2021",5
John Dickson,US,"Sep 7, 2021","Nice performance!i like it!Date of experience: September 07, 2021",5
