Username,location,date,content,Rating
Bigs,GB,"Jan 3, 2025","Not bad I ordered the wrong size cooler, return took a while, but was resolved in the end without issue. I couldnt find the rma number, which i later found out its hidden within a shipping label qr code that i couldnt access. They should write the rma numbers clearly in a reply email in future to save confusion. Date of experience: January 01, 2025",4
Jaybo,CA,2 days ago,"Hello, customer support, are you there?I have an AIO cooler that sounds like the pump is about to die me.  Very loud and rattly.   Put a ticket in 5 days ago and haven't heard a single message back yet.  5 days is beyond what I expect is reasonable to at least get a reply from customer support.  I get that you may be busy, but seriously - put a note saying what expected reply time is, or at least reply to people to say you will get to them soon. Ticket 2110637Date of experience: January 06, 2025",2
Felix Bacher,AT,6 hours ago,"Good costumer service and great products!Great and fast costumer service. The only pc part supplier I havent had an issue with!Date of experience: January 08, 2025",5
Eric,US,2 days ago,"NZXT = Worst Customer Experience EverI purchased a PC recently and immediately recognized that the order had 2 hard-drives when I actually only wanted 1 hard-drive.  I promptly put in a change request through their website within 1 hour of purchase and received a response from NZXT that they received my request and is processing it.  I did not hear from customer support until 7 days later, after they shipped the product with the 2 hard-drives, to tell me there is nothing they can do after the product has shipped.  Their customer support is ATROCIOUS.  I haven't even received the computer yet and I'm wishing I went with a different company.  Why even go with this company when there are so many others around with better customer service?Date of experience: January 11, 2025",1
Ashraf,ZA,3 days ago,"Excellent serviceTook a bit of time to respond, but got sorted extremely quickly. Excellent service from NZXT. Really top notch 👌🏼👌🏼👌🏼Date of experience: January 08, 2025",5
CREED.,US,"Dec 27, 2024","Amazing Customer Service!This was my first time buying a PC and I'm so glad I chose NZXT. When my order arrived, I was distraught because I was sent the wrong unit, but after some investigating (thank you to Ash and Gabe) it was all sorted out! Not only did the issue get resolved, but I ended up with an upgraded unit that was even better than the one I originally ordered!! What started as kind of a mess turned out to be a blessing in disguise, and now I have a total beast of a PC!! NZXT really went above and beyond for me and I'm so grateful!!Date of experience: December 06, 2024",5
Eduardo Pimentel,GB,"Updated Dec 22, 2024","I received a positive customer service, but they changed the spec of parts whislt not changing the name or SKU, creating a situation of incompatible parts being shipped to me 3 times before I could geI received a positive customer service, but they changed the spec of parts whislt not changing the name or SKU, creating a situation of incompatible parts being shipped to me 3 times before I could get the correct version.I like the products, but there is an image and customer treatment issue which has been in the news that needs to be resolved to regain trust in the brand as a whole.Update: Issue number: 2081398I was helped by Lennard, who was the saving grace of the whole interaction with the NZXT customer supportDate of experience: December 13, 2024",3
Eli Taurel,US,"Dec 20, 2024","Custom BLD Order I placed a custom build order on November 30th and received it today, so here's a review of my experience.Overall, it was a very positive experience.  The customer service was excellent; the day after placing my order, I requested a change to my AIO cooler from a 280mm to a 360mm, and customer support was able to quickly take up my request. My scheduled shipping date was December 9th, but it shipped on December 13th.  Not a bad delay at all, considering I ordered near Christmas and requested a part change.I was nervous because NZXT uses FedEx for shipping, but my PC arrived on time. Upon receiving the computer, everything was nicely packaged, and I was relieved to find no damage.  After plugging it in, everything worked perfectly. I was happy to find minimal bloatware and that the latest Nvidia driver was pre-installed. The cable management was awesome too which is a plus. I purchased a different NZXT PC a few years ago, and it was an awesome computer. It lasted me years and I bought this one to replace it. I'm happy to see NZXT is still doing good.Date of experience: December 19, 2024",5
Laura Davies,GB,"Dec 13, 2024","Ordered in the Black Friday periodOrdered in the Black Friday period, did have to wait a bit longer than usual but after and email conversation with Jan I was put at ease. Arrived today. For those wondering if they are a scam as I’ve read on here it’s not, they have just been busy with the Black Friday rush Date of experience: November 28, 2024",5
Ryan,US,3 days ago,"Solid Customer ServiceNo complaints, very helpful. Date of experience: January 09, 2025",5
Nathan,US,"Dec 18, 2024","Great support experienceRecently had a great experience with NZXT support. Had an issue with a 4 year old Z73 AIO cooler where the pump died and I was getting really high CPU temps. I emailed support and got a same day reply in under 4 hours with someone to help me troubleshoot my issue. After I was sure the AIO was dead I emailed back a few hours later and in under 24 hours from my very first email I was offered a free replacement with no hassle. My support agent was Adriana and all communication was professional and friendly, I was offered any assistance I needed in getting the return together and had constant status updates on when they could see it in the mail, when they received it, and when the replacement was sent out. On top of that because they didn't make the same model of AIO anymore they upgraded me to the current top of the line AIO to match the tier of what I had purchased 4 years ago even though the current one is slightly more expensive. Overall I'm very happy with the speed at which my issue was handled, the friendly communication from support, and the no hassle replacement. I have purchased NZXT AIOs for each PC I have built and if support stays this good I will continue to buy them. Date of experience: December 17, 2024",5
Heorhii Muradian,DE,6 days ago,"Online Support doesn't work!Support request number 2104207I wrote to you in support 9 days ago and you just ignore me!Date of experience: January 07, 2025",1
Bob Kåre,NO,"Jan 2, 2025","Litterly a SCAMLitterly a SCAM. Worst place to buy or rent a pc. Utwlizing every koppholder in the book and fake advertisment..Date of experience: January 02, 2025",1
Customer,US,"Dec 19, 2024","Lost PCI purchased a rush-build PC from NZXT because I was so excited to receive my dream gaming setup. Unfortunately, the PC arrived dead on arrival (DOA). I sent it back for repairs, but I was unable to sign for the return delivery. The PC was sent back to NZXT, and somehow it was lost.What’s most frustrating is that I never got to see my PC again, and I was still charged the full $3,600 for a product I never had the chance to use. I was crushed. It was gut-wrenching to know that I had put together so much money for my perfect PC, only for it to disappear without resolution. I hoped for better accountability and support from a company known for its dedication to gamers.Date of experience: December 19, 2024",1
Carley,US,"Dec 16, 2024","Complete rebuild on my computer with an upgraded versionFirst I’ve had some problems with my pc, and after a few repairs. Nzzt replaced my whole computer and upgraded it at no cost. I’m so thankful they were able to help me. 10/10 I would tell anyone to but from them again. I have only had issues with my first pc but my second and third have had no problems so far.Date of experience: December 16, 2024",5
margaret chege,US,"Dec 20, 2024","Order # 586586 placed on December 6.Order # 586586 placed on December 6.No word on shipping contacted customer service on 12-19- 24 morning and was told it could ship on December 20 however this is not guaranteed. I called again in the afternoon and there was still no guarantee it would be shipped. I requested for order to be canceled and was told that a confirmation email will be sent..No email was sent l will be contacting the bank.This is no way of doing business charge the cards and keep the orders beyond the set shipping date. My order was meant to ship on 12-16.Date of experience: December 19, 2024",1
Andrea Libardi,IT,"Dec 19, 2024","EXCELLENT CUSTOMER SERVICEEXCELLENT CUSTOMER SERVICEI've accidentally broken a piece of my case and they sent to me a new one without additional costs Date of experience: December 18, 2024",5
Sarah,US,"Dec 22, 2024","I purchased my son's PC for his…I purchased my son's PC for his birthday present on 11/27/24 with an expected delivery date of 12/12/24. I have been tracking it several times a day, and it shows it has been at a FedEx location 30 minutes from my house since 12/10/24. I have submitted a ticket and called several times to figure out what is happening. The company says it should arrive shortly. They apologized for the delay in my purchase and will contact me within 48 hours. Well, that never happened. This PC was the only thing my son asked for on his birthday, and now it looks like it will never arrive. This is absolutely ridiculous. I paid nearly $1300 for a PC from a company that is not transparent or trying to rectify the issue. I will be canceling my purchase and contacting my bank and the BBB. Date of experience: November 27, 2024",1
Dean Bazzard,GB,"Updated Dec 23, 2024","Initially very disappointed with NZXTVery disappointed with NZXT so far. I ordered a gaming PC for my sons Christmas present back on the Thursday 28th November with an estimated delivery of 5 working days. 3 week later no update and the status of the order remains unchanged. I've contacted their support via email and the web site and the only answer I've been given is that they don't know. The one time I was able to speak to a human on the phone, they couldn't provide a reason why the PC is late or even an estimate.Very concerned that NZXT are going to ruin a little boys Christmas.If anyone from NZXT reads this the support ticket number is 2083957.Please do better NZXT, your paying customers deserve more from you.UPDATE 20th December.NZXT closed my support ticket without providing any update but created a new one 2096106 for no reason. This is really shocking, I called them yesterday and they either don't have the ability to track where and what stage the order is at or they just lieUPDATE 23rd DecemberFinally got an update from NZXT two days ago, the PC is built after waiting on a GPU and they also sent a free NZXT keyboard, it's all been delivered today which has delighted my son. It's a shame their customer support and communications haven't been up to expectations but the PC is greatDate of experience: November 28, 2024",3
Eva Gomez,GB,"Dec 20, 2024","No computer, no updates, and no communicationI ordered a computer on the 26th November, with a dispatch date of 3rd December. After much chasing I was told it would be shipped on 16th December. Still no computer, no update and no communication. Here is the emai I received after questioning the delay and the lack of communication:Hey,The reason is mainly the high order volume and some stock related issues.An email should have went out and a bunch did but due to the ammount there were issues, so that some people didnt get an email is 100% on us and we need to do better there.I'm about to cancel my order.Date of experience: December 19, 2024",1
Dan,US,"Dec 10, 2024","Better website experienceThe PSU i wanted was ran out from multple sites, so i went ahead and bought it from the company who makes them (NZXT). Bought it on the 5th and saw that i had an order number 585992. checked on it everyday(first time building a pc so was excited) till today 10 Dec 24. Website said it was still received but hasn't processed or shipped. I went ahead and bought another PSU from Amazon and its already arriving tomorrow. BUT the customer support agent who helped me cancel is a solid guy. appreciate him apologizing and giving me a timeline of a refund. Date of experience: December 05, 2024",2
Clinton Morris,US,"Dec 21, 2024","This is a great company it has great…This is a great company it has great customer support and they delivered my pc on time Date of experience: December 13, 2024",5
Luna,AT,"Dec 1, 2024","Crappy case fans and rental scamsBought a case some years ago and the default fans are just horrible. They are loud and are bad at blowing air, and vibrate a lot.And now also the PC rentals, which are advertised as “rent to own”, while you don’t own anything, and the subscription terms/policy are just horrible and massively anti-consumer. The advertising practices may even be illegal.. There is no chance I can recommend NZXT to anyone.Date of experience: November 04, 2024",1
Luke,GB,"Oct 11, 2024","Extremely good customer support!Extremely good customer support! I bought the Kraken X63 over 4 years ago and looked to upgrade my motherboard but it wasn't compatible with the X63. There's an AM5 adapter mount but wasn't available in the UK. Reached out to their customer service who within hours had confirmed that it's only available for purchase in the US and sent me the AM5 Adapter mount free of charge! Very quick and impressed with this.Date of experience: October 11, 2024",5
S Townsend,GB,"Dec 4, 2024","After GamerNexus reviews of NZXT rental…After GamerNexus reviews of NZXT rental idea, I am shocked, I was planning a large payout on a gaming pc to build myself looking at NZXT parts for my build.But now I am staying away from their products plenty of other ""reputable"" companies out there to buy from.Date of experience: December 03, 2024",1
Casper,GB,"Dec 1, 2024","Bought 2 Kraken AIO Coolers from NZXT…Bought 2 Kraken AIO Coolers from NZXT and they both failed just outside of warranty. I had to take my entire computer apart as a result. Maybe I was just unlucky? But a quick look online showed this was happening to an alarmingly large amount of other customers which made me very suspicious. I will no longer buy anything from NZXT moving forwardDate of experience: November 14, 2024",1
Val Smith,US,"Dec 23, 2024","lack of parts it was waiting for 6…lack of parts it was waiting for 6 months and was no where else to buy itFinally receive free replacement from NZXT. ThanksDate of experience: December 22, 2024",4
Jim Harris,GB,"Dec 7, 2024","This will probably be deleted when they…This will probably be deleted when they cull all these bad reviews, however, in my opinion is not a good company. My personal experience, as a customer of NZXT is thay are very bad at being a transparent and are not an honest business. Everything in this review doesn't breach the TrustPilot terms, so lets see what happens. Date of experience: October 15, 2024",1
lemn8,NL,"Updated Dec 5, 2024","Watch last Gamer Nexus episode about…Watch last Gamer Nexus episode about NZXT Scam. It's soaked in fraud and targeting young kids through influencers.Update/Answer: That doesn't cut it! Only logical reaction would be closing the factory. This scandal is beyond repair.Date of experience: December 01, 2024",1
A.Customer,GB,"Dec 1, 2024","SCAM rental PC's, Predatory MarketingThey have a ""pay monthly"" option for pre-builds which is actually a PC rental program - despite the fact it looks like a spread the cost feature, the specs for this subscription ARE NOT the same as the PC if you're buying it, despite it having the same name. The cost of renting these builds is more expensive than a predatory loan and the contract has impossible to fulfill standards for returning the PC. They have employed an army of social media influences who seem to target these products at CHILDREN. Disgusting practices, avoid at all costs!Date of experience: December 01, 2024",1
Jeremy Jk,NL,"Dec 1, 2024","Horribly anti consumer .Their latest practices are absolutely digusting anti consumer with the 15.000 $ rent pcs , not to mention their fire hazard cases in the past they failed to fix on time. This brand is now blacklisted by techjesus himself, gamer nexus. That should tell you to never ever buy from this brand.Date of experience: December 01, 2024",1
Jason Watts,US,"Dec 1, 2024","This is a scam.This is a scam.The rental portion of this company is a giant scam. The quoted computer speced hardware and delivered hardware are something that is incredibly different. On top of this, your normal rental agreement cannot be broken and they will just keep on charging you.   Date of experience: November 29, 2024",1
Aaron Folden,US,"Updated Dec 20, 2024","Not the NZXT of old. Beware I had bought 2 Player Three Prime machines, top of the line and 2 sets of keyboard and mouse.I didn’t have these 5 days and I had to send back both PCs to tech support because they keep rebooting after waking up from sleep and no troubleshooting seems to have fixed the issue.I had 1 keyboard and 1 mouse that ended up faulty and I am now sending them back for replacements.It’s really disappointing that this is happening because I had been saving for these machines for about a year.Edit 12/17: Ticket #s - 2076901, 2078095Edit 12/19: Still no replyEdit 12/20: Received email from FedEx that one the PCs shipped. Great news! The other one has a label but the peripherals are no where be seen other than “you were approved for replacement”. I called NZXT to get a status on what the issue(s) were with the PCs and it was indeed the motherboards. They were both replaced with the exact model. I will report back once I’ve tested them for myself.Date of experience: December 02, 2024",2
Brent Baer,US,Updated 6 days ago,"Ordered a PC on 11/22Ordered a PC on 11/22. Website said this model would ship in a week or 2. It is now Christmas eve and it hasn't shipped. The same model was even on sale on 12/13 and said ""ships 12/15"". Seems as though they want your order/money and lie about lead times on purpose. Really putting a damper on Christmas. Kid is going to be bummed when he opens his primary gift and it is a picture of a PC that may arrive at some point. I ordered 5 weeks early to avoid this scenario. Received the below reply and emailed Support with my ticket number several hours ago and no reply. If you found my order how do you not have my contact info to send me a tracking number? Pretty sure you are lying to make yourselves look like you came through for Christmas. I guess I will know for sure at the end of the day when we are past the time for a possible FedEx delivery. Update 2: The PC did end up arriving on XMas Eve. Setup was easy and kid was happy. Changed to 2 stars but can't get over the poor communication and exaggerated build times. Date of experience: December 21, 2024",2
Ren Maeda,US,"Jul 26, 2024","Amazing Customer Support!I had several problems with the RGB Fans on my case over the span of my 2 years owning it, And their customer support has been AMAZING. They probably have the best customer support out of any company I have talked to and they work live on phone, chat, or support tickets. Their Warranty windows are also much longer than other companies. For the price, I would absolutely recommend NZXT Cases and coolers (Not so much peripherals)Date of experience: July 05, 2024",5
Dave K,MA,"Jul 30, 2024Verified","Customer Support ExperienceI recently encountered an issue with the combo jack on my NZXT H5 Flow case and reached out to their customer support. I was amazed by how fast they were, they got back to me in less than a minute, they were incredibly helpful, they tried everything they could to resolve my issue and they didn't hesitate to send me a replacement part. Thank you NZXT <3.Date of experience: July 16, 2024",5
Giulio B.,IT,"May 17, 2024","i've bought a case H5 elite and 4 RGB…i've bought a case H5 elite and 4 RGB f120 fans. My pc looks dope, but unfortunately 1 fan stopped working and i reached customer care...probably the best experience ever: fast, clear and precise reply, very kind and helpful operator. Got problem solved in no time. GG!Date of experience: May 16, 2024",5
Azul De Bianka,US,"Apr 25, 2024","Excellent customer serviceExcellent customer service. My first NZXT product, an Z63 NZXT Kraken 280 RGB 280mm AIO CPU Liquid Cooler with Customizable LCD Display, went belly up. The pump stopped pumping after 8mo. of use. I turned my rig on and it shut itself off. WHAT!? After tinkering to get into the BIOS, I noticed the temps at 88+ and rising. Troubleshooting revealed it to be pump failure. The customer service rep knew exactly what was going on after I explained it to him. He knew a replacement was the only resolution. He made the experience extremely painless. Also, it helped that I had my purchase order. Thanks, NZXT!Date of experience: April 17, 2024",5
James,US,"Mar 22, 2024","Excellent serviceBought a PC case, my first NZXT product. Had a couple questions about it and decided to call their help line. Not only did I get to talk to a live, lovely, helpful person who really knew their stuff, I was just honestly blown away by the great customer service I received. Regular email updates after our phone call, as-and-when they located certain parts. Can't remember the last time I had such a positive experience with a company. Ace.Date of experience: March 21, 2024",5
Monika,GB,"Updated May 2, 2024","Best Customer Service I have ever experiencedI have ordered Player Two: Prime from NZXT. The PC was built and shipped the next day and delivered ahead of schedule. Runs like a beast and looks so beautiful - I can't believe how far tech has come and how neatly built the PC is, a true work of art.What has prompted me to come and leave this review, however, is the fantastic customer support I received. I contacted NZXT a few times while setting things up. Max was incredibly helpful - every query was answered and solved within minutes and I was impressed with how quick, friendly and professional the service was. Overall I am so glad I chose to order from NZXT and I wholeheartedly recommend them. Date of experience: April 29, 2024",5
Michał,CH,"Jan 22, 2024","Unbelievably amazing customer supportUnbelievably amazing customer support! I bought a used NZXT Kraken X53, but the seller didn't have a connection cable (without which the X53 is mostly useless). I contacted NZXT support asking for a pinout of such a cable, so that I could make it myself but... they just sent me such a cable free of charge! I really didn't expect that.Date of experience: January 22, 2024",5
Mike,GB,"Updated Dec 8, 2024","Give them a miss - better companies out there.Cannot understand what NZXT are trying to do to gaming.  Ripping off customers with their anti consumer practices.I will NEVER buy a product of theirs again, and will NEVER recommend them as I have in the past.Edit.  Wow, all I see is fingers pointing everywhere saying it wasn't us, or it's us for not understanding that you were trying to rip us off. All you've done is prove that you don't care.  It's all about money. It's about fleecing us gamers for what you can, by giving us as little as you can (get away with).  I will use my wallet to do the talking.  I hope everyone that reads this does the same.Date of experience: December 01, 2024",1
Chris Burgan,US,"Dec 26, 2023","I've built all my own computers since…I've built all my own computers since 1997. But due to my career and back pain decided to treat myself to a pre-built this time. I won't go into the full story but I screwed up and duplicated my order. NZXT customer service was so nice and helpful getting me a refund even when my work got busy and they had to make a second shipping label. The build quality is impeccable, perfect cable management, and I love the selection of high end parts to choose from. I was able to build the exact machine I had planned in my Amazon cart and didn't lose half a Saturday putting it all together and installing all the software. We'll worth the small premium over buying the parts myself.Date of experience: November 21, 2023",5
Juan Pablo Orrego Contador,CL,"Apr 23, 2024","Great customer serviceMy couple years old NZXT C750 PSU blew up, but customer service was extremely helpful and refunded me the cost. The PSU has good reviews so I probably got unlucky which is why I won't remove any stars due to the failure.Date of experience: April 23, 2024",5
Ash,GB,"Dec 3, 2024","Predatory scammers. They knew what they were doing. Predatory scammers that are trying to rip people off who didn't know better with their PC rental scam. They've even got loads of influencers on social media to spread lies and misinformation about the rental program with statements like ""rent and own"" or ""no strings attached or contract"" both of which are lies, you don't own and have no chance of ownership and their is a contract. Date of experience: December 02, 2024",1
TTF Donovan,GF,"Dec 3, 2024","Big rental scamRental scam, subscription way too expensive for cheap pc builds, if they can scam people like this, I do not even recommend their products!Date of experience: December 02, 2024",1
Zach L,US,"Feb 29, 2024","Great PC, great customer support!I’ve had my NZXT pc for a few years now and just ran into my first issue, it wouldn’t connect with my monitor. I called customer support and they were very helpful, they guided me through fixing the loose ram sticks and everything is working again!Date of experience: February 29, 2024",5
