Username,location,date,content,Rating
Erik Selander,SE,"Dec 11, 2021","im 100% sure the positive reviews are…im 100% sure the positive reviews are fake. i got the oukitel wp5 pro and it would get really hot while charging. it would display a warning of this that urged mw to remove the battery. this would happen after an hour of charging sometimes and sometimes after 15 min. i would stop charging at this point and wait for it to cool down. after about two weeks of purchase the battery is dead. the phone will not start and i cant get a a reply from oukitel customer service regarding this issue.Date of experience: December 11, 2021",1
Rodney Allsopp,GB,"Sep 5, 2022","Oukitel C21Oukitel C21, £127 direct from China. No tax or duty to pay, post paid. Absolutely wonderful reliable phone.Dropped it many times, including accidentally spinning it through the air on to concrete.No damage. Great camera, and video.Superb internet connection.I am an old man, and it is easy to operate.Date of experience: September 05, 2022",5
Oleg D.,GB,"Mar 18, 2023","OUKITEL WP15OUKITEL WP15 is the Best phone ever for my personal needs. I have it since 1 Marc 2022. One year in use, amazing performance, good battery life, and a bit heavy, but I love it. Recommend it to those, who is traveling, as it has amazing battery life, waterproof, dustproof, shock resistant. It can charge other devices. Bought it from official Oukitel from AliExpress. Never had any issues, can't complain. Next mobile device, when I need replacement, is going to be Oukitel again, but different model.Date of experience: March 18, 2023",5
Hiking Viking,CH,"Mar 29, 2024","Don't buy OukitelWhat a piece of crap. I bought a K15 Pro, and from the start, the WIFI connection has been working on/off , and the connection is very weak. Another flaw is, that when someone calls me, the phone rings, but doesn't show callers name or that someone is calling. This phone is total waste of money and time. Date of experience: March 29, 2024",1
TERESA,GB,"Jan 4, 2024","I'm extremely disappointed so far with…I'm extremely disappointed so far with the lack of service and accountability from this company. I ordered a TR7 ruggable for my partners present on 14 December yet it still hasn't arrived. I have contacted the company numerous times however keep getting a generic response via email stating its in the end transition please be patient, it is a Chinese new year call back again. There is no online customer services please call again. The tracking number I have received is not being recognised by any of the courier sites yet oukitel states its in transit. I do not believe they know what has happened to my parcel and that is why they are fobbing me off. I'm still waiting. I will be contacting them again today but I am not happy with the couldn't care less customer service. I appreciate its over the Christmas period but if they had some concrete information to give me about me parcel that would validate where my parcel is I would be more rest assured. I have had mixed messages feom start to finish about the whereabouts of my parcel.Date of experience: January 04, 2024",1
Jason,GB,"Updated Dec 6, 2021","Don't bother.WP5 pro started out OK as a cheap tough smart phone. Now about 18 months old it is a constant nightmare. Touch screen completely freezes constantly when you are typing. Camera is good WHEN it decides to focus.  Volume control requires pressing with a ball point pen but the power button is so sensitive it switches off during phone calls because it's right where your fingers hold the phone and just brushing it instantly shuts the phone down, there's no "" are you sure "" prompt. Really classy when you're on an important call. It was worth trying for the money but Nah. Oh, the dual sim slots are bit dodgy too, one of mine kept saying no sim so now I have a single sim phone and this was very early on not after a lot of hours of use. Every time I try and contact Oukitel their default response is to show me ads selling their new phones !??Date of experience: November 20, 2021",1
Harlan Hudson,US,"Sep 15, 2024Verified","Great serviceEmailed the company for a replacement screen after my 10 year old broke it after 2 years of nokes and bumps screen arrived to the UK in 5 days fitted the screen and my 10 year old is very happy againDate of experience: September 09, 2024",5
chantelle edzai dzwowa zinyemb,ZA,"Oct 17, 2023","I ordered a phone on the 6th of…I ordered a phone on the 6th of October…I ordered a phone on the 6th of October , until now nothing have been delivered and they do not answer any calls. This is very poor service from the owners of this shop.Nothing will stop me from labelling them as scammers!!!!!!!!!!!!Do not online buy from this poor shop!!!!!!Date of experience: October 17, 2023",1
Ecotech,ZA,"Jan 5, 2023","Oukitel takes your money and you receive nothingI will amend my review if and when I receive the order. We purchased a tablet on the Oukitel online store on 6th December 2022. We were told stock was available, we paid EFT, only to be told there was never any stock available, and that we should have 'reserved' the item verbally when placing the order. If any of you have tried to talk to Oukitel, you will know it is almost impossible. They simply don't answer the two phone numbers on their website. Email responses are few and we are given the run-around with excuses. Oukitel has taken our money and to date has not produced what we paid for. Unless this changes, I strongly advise that they are a scam.Date of experience: January 04, 2023",1
Margaret  GALLAGHER ,GB,"Nov 21, 2024","Want the best  service with the best …Want the best  service with the best  gadgets  Look here You won't want another company  againDate of experience: November 21, 2024",5
M Shannon Peterson,US,"Aug 11, 2024","Top quality Thankful that I found this company ! Their products are high end and tip quality and they make sure your satisfaction is met. Very professional and helpful and the staff is super friendly.Date of experience: August 11, 2024",5
BK_Michael,PH,"Aug 18, 2024","Runs a giveaway for fake reviewsRuns a giveaway, instructs people to leave a review in trustpilot LOL. Not a behaviour you can trust your money with!Date of experience: August 18, 2024",1
Edward Jackson,US,"Dec 18, 2024","Awesome PhonesGreat phones with lots of features Date of experience: December 17, 2024",5
ac,US,"Dec 3, 2021","Don't waste your moneyGot the new wp17. The phone is huge and heavy. The camera quality is terrible especially for selfies. Messed up some of my apps and now I can't get into them at all. Oh and the biggest problem is the MICROPHONE DOESN'T WORK TO MAKE CALLS OR RECORD AUDIO. This will be going back and I will spend more money for a better phoneDate of experience: December 03, 2021",1
Picnic Entry,US,"Dec 7, 2024","Budget friendly and great customer…Budget friendly and great customer serviceDate of experience: December 06, 2024",5
Ronja Härig,GB,"Jan 4, 2024","I bought an OUKITEL OKT3 tablet a few…I bought an OUKITEL OKT3 tablet a few months ago. I had never heard of the company. I was a bit dubious because of this. I decided to purchase it, however, and I was astonished at how fantastic it is. It came with a screen protector, cover and a stylus, also a 3 pin charger. It works extremely quickly and the battery life is great. It's better than my Samsung tablet. In fact, it's such a great tablet that I bought another one.  Real bargains at only £175 and £150. I would highly recommend these tablets to anyone.Date of experience: January 04, 2024",5
Roumen Dontchev,BG,"Nov 6, 2024","Good phones.I bought an Oukitel some years ago for my daughter and she was satisfied with its quality.Date of experience: November 06, 2024",5
D M,GB,"Updated Jun 20, 2024Verified","Don't bother with this useless phone company who don't care about there customers.…3rd update. These imbeseals sent mail asking for details then now are blanking me, just shows the way they they deal with there customers when a problem arises, or they would of answered this review and they haven't. 2nd update..beware because this so called reputable company after me supplying a screenshot that they have a picture of the phone of mine that broke a week after going out of warranty, say they don't have it for sale anyore, yet I sent a picture of it for sale on there website, so the are either liars or they have items for sale with no intention of sending the product out and steal the costs from you, so beware.Update.. steer clear from these this is why....they are now lying to me saying they can't replace my broken phone because they don't sell them anymore, yet they are on there website for sale, so not only do they not keep to there word but they are untrustworthy,Don't bother with this useless phone company, I got a wp15 and a week after the warranty ran out my phone died, I contacted oukitel and they said it sounds like a soft/hard ware problem, after 19 email, and if I wanted to go to there official website they would give me a voucher towards a new one, again 3 months later, so I did I told them which one suited my last one and they said they would arrange a $5 voucher.What good is $5 nowadays, now I see why people buy apple/Samsung or one or two other decent phone companies.D M.Date of experience: May 13, 2024",1
Ali Hamza,SE,"Apr 17, 2024","Microphone and fingerprint sensor stop working I have shopped a Oukitel phone model name  ""Wp17"". The microphone of the phone was not work properly and after few day the fingerprint sensor stop working. Date of experience: January 10, 2024",1
Ryan Gan-Drennen,US,"Nov 5, 2024","Great customer service and excellent…Great customer service and excellent products! I love their watches and can't wait for the new C58 PRO phone to come out!Date of experience: October 27, 2024",5
customer craig hogg-wilson,GB,"Sep 25, 2024","My wife bought me the oukitel rugged…My wife bought me the oukitel rugged wp23 mobile for my birthday in may this year I dropped it once and the screen cracked so I replaced the mobile screen and dropped it again on a carpet and it cracked again don't buy this so called rugged mobile the screen is rubbish it is not protected at allDate of experience: June 27, 2024",1
Mark Schultz,US,"Jan 11, 2024","I am very disappointedI am very disappointed. I purchased a Ouikitel WP13 after much research and review.it had much of the facets I thought were good. Although not cheap it was a reasonably high end priced phone. After only about 2yrs the SOUND and speakers have just GONE! No sound, no speakers, no notification sounds, totally silent! No Cellular repair shops can figure it out and remedies on Internet have not worked. I was told I should buy another phone.It is likely the speakers are no good. I am left with little options. I will try to contact Ouikitel but I expect no positive aid, I have been  unsuccessful with past dealings with Chinese based manufacturers and sellers in the past. I strongly recommend that you do not purchase a product from Ouikitel. They advertise themselves to be a rugged darn near unbreakable phone and yet the sound and speakers are kaput after very little time and no incident which could have caused such a major setback. So I now have a silent phone. Well, hearing challenged people have to deal with this everyday, I will, for the time, have to do so too. This does show it is not good to purchase an item which has no customer support in the USA.Date of experience: January 01, 2024",2
G Tudor,AU,"May 16, 2023","Oukitel Terrible customer service Unreliable productI bought the WP21 - this phone appealed to me and it was under $500 - so far so good.  Delivery took abouhe or Australia,  The phone has NOT worked properly since i bought it.  The microphone does NOT work so the phone is quite useless as a phone,  It doesnt vibrate either but that wouldnt have mattered if the microphone worked.  I bought the phone from the Oukitel company via AliExpress.  I attempted to contact Oukitel through that medium - they wanted a video of the phone but failed to give adequate instruction how that could happen or how it would help.  The time spent on this meant that a refund though aliExpress was no longer possible,  I have attempted to contact Oukitel on their alleged main phone line - incorrect number.  I have attempted to contact the list of people nominated using WhatsApp - NO RESPONSE,  I have sent emails and attempted to start a chat and have NO RESPONSEThe phone has potential - from my perspective the size and durability I like. I dont trust the waterproof claim because of the issues i am having - Oukitel have NO idea about customer service and are doing incredible damage to the Brand.Date of experience: January 28, 2023",1
Mitt El Hadj,DZ,"Dec 23, 2024","I like #oukitel sooooo muchDate of experience: December 23, 2024",5
Zolisa Memani,ZA,"Nov 13, 2024","I would like to test this device and…I would like to test this device and give my review for South African community. This is the first time I've heard about this phone and would like to try it 🙏🏾Date of experience: November 13, 2024",5
kimyoungjea,KR,"Nov 25, 2021","WP5 TESTWP5It has been in use for 5 months.The volume button rarely works.I'm worried about when it'll be ruined.Scratch easily occurs in liquid crystals, too.I am worried.There are also software errors.Date of experience: November 25, 2021",1
carlos de caires,IT,"Oct 26, 2023","i Paid for the product the day 4/10 day…i Paid for the product the day 4/10 day 24 still not arrived and they just put a number for tracking but the number never drop a result, avoid it is a scam companyDate of experience: October 03, 2023",1
Julia Novok,RU,"Nov 27, 2024","Very interesting brandVery interesting brand. The design and functionality of smartphones is good.Date of experience: December 20, 2023",5
Agarici,IT,"Nov 28, 2021","As this is not my first on Oukitel…As this is not my first on Oukitel smartphones,I have to repeat that my experience with this device comes thru my colleague that has one that often he handles me on work.He has it for more than a year and no problem for now.The battery last well for more than a two days of work use,average camera,he doesn't need it much,good touch screen with good resolution,so is the conn. wifi and bluetooth.Date of experience: November 28, 2021",5
GEOFFREY PENA,US,"Dec 11, 2021","I have had my oukitel wp17 for about 2…I have had my oukitel wp17 for about 2 months now and everything works fine camera is decent great battery great reception and the night vision camera works pretty good. I live in St George Utah. This is the second oukitel but I purchased I bought the wp 10 5g and was testing the underwater camera and I didn't close the charging port all the way so water got in the inside so I had to send it back they gave me $250 back of the $350.I paid for it Due to me having it over 120 days. So my experience with oukitel cell phones has been pretty positive so far. The water damage was my fault.Date of experience: December 11, 2021",5
Vrijspel,BE,"Mar 12, 2023","One month after order, no delivery, no reactionOrdered a powerstation from them. Delivery time on website was 3-7 days. We are now one month after the order and... no powerstation in sights, no reaction. I'm starting to think I lost over a 1000€ on a scam.Date of experience: March 12, 2023",1
xxxx,DE,"Updated Jan 6, 2022","It is the worst company you can…It is the worst company you can imagine. Don't trust all the other feedbacks. They are possibly fake in my opinion.I recently ordered a phone, payed it but never received it !!! I've been waiting nearly 3 months. Oukitel said it is a logistic problem. Oukitel said my phone is maybe in NL and i should take care of it by myself. I should travel to NL (i'm living in Germany !!) and search there for it !!!! No further help from the company at all. No service etc.Very bad company !!Date of experience: January 06, 2022",1
Rex,US,"Dec 9, 2023","I recently purchased a tablet from this…I recently purchased a tablet from this company. I tried emailing them (4 times) without success. They totally ignored my emails.Date of experience: December 01, 2023",1
Brook Wild,US,"Sep 14, 2024Verified","So far so goodI've only had the phone for a little over a week and so far it has lived up to it potential! It been decades since I've used an android plat for so I'm still figuring it out...so far so good. The battery life is AMAZING.Date of experience: September 05, 2024",5
Dominick Garcia,US,"Nov 22, 2021","One of the best rugged phone to buyI have been looking at buying a phone from them for a while now and I think I just might buy one to be honest with you, and it is the Oukitel WP15. It comes with a 15600mah battery, it has a Mediatek Dimensity 700 5g CPU with a Mali-g52 GPU. It comes with 8gb of LPDDR4x RAM with 128gb of UFS 2.0 storage all of a price of $400USD. Is it a good phone with descent performance, yes. Is it going to be 10 times better than this $40USD phone that I'm currently typing on, yes. So yeah definitely giving a 5 star until otherwise.Date of experience: November 22, 2021",5
Steve Forbes,US,"Jan 3, 2023","This is an update to my last update.This is an update to my last update.Please, do not purchase ANYTHING made by Oukitel! I have no idea if the company still exists. I have sent messages asking for resolution to two very expensive and very broken phones for almost a year. Not once have I head from them! They only take your money and leave you hanging out to dry. They have no honor at all!From here on, we will not purchase any phone made by a Chinese company UNLESS it is actually backed up by a Japanese company. We used to have two wonderful phones from Kyocera and they worked perfectly. That was until Verizon decided to no longer support them and wanted an insane amount of money for newer models.The lesson learned from this is that there are no HONEST Chinese manufacturers and that one should not purchase any products from them directly. Find an honest vendor in another country and deal with them. Banggood and Oukitel are anything but honest. Yes, Banggood did respond initially but, they dropped out shortly after our problems began. I wrote about that previously. Oukitel has never responded. Therefore, as far as we are concerned, they should be avoided at all costs. I know that we will never do business with either company ever again.Date of experience: January 03, 2023",1
Ron Bockman,US,"Oct 20, 2023","Bought a Oukitel WP1515 in March 2022Bought an Oukitel WP15 in March 2022, came with Android 11, phone was released in 2021, it is now October 2023, still on android 11, seems that Oukitel does not update the OS. The phone has been very good for me, only needs a charge every 5 days. Very heavy, not convenient to carry in the summer months, winter shirts allow me to carry it in shirt pocket. I find it to be a good, reliable device. Paid $229 shipped from a Chinese vendor, took a month for delivery. I got a good deal. Don't think I'll buy another Oukitel only because they don't update the OS. I do like this phone.Date of experience: October 19, 2023",4
hernandez,DE,"Dec 26, 2023","I bought the Oukitel RT7 Titan Tablet…I bought the Oukitel RT7 Titan Tablet and I can not be happier! The very best Tablet I have bought in my entire life. The longest battery life and great pictures from its Sony Lenses. Highly recommend product to buy if you need something special of the best engineering  quality!!!Thank you OUKITEL and thank you for all the answers you give me through Ebay Germany. All the best to you and keep that great work up.Hernandez. in Ebay I am -  papa_alfredoDate of experience: October 17, 2023",5
Tim Fur,CZ,"Nov 24, 2024","All in lineI haven't encountered any problems since my order.Date of experience: November 24, 2024",5
User,US,"Updated Nov 20, 2021","I have purchased from Ouikitel 2 times…I have purchased from Ouikitel 2 times before. The first time, I purchased a C17 Pro and honestly very scummy business. 2/3 of the ""cameras"" on the device were FAKE and the speaker sounds like garbage. Recently I purchased a C21 Pro and all 3 cameras appear to be real and the company seems to be getting better over time but I find it very sketchy they have lied to customers in the past and used the classic Chinese fake camera scam. Not to mention their email support is non existant, they simply don't reply.Due to this sketchy past experience I cannot fully approve of this company but they seem to be getting better over years but that is no excuse to scam customers to get to the top and hope karma catches up with them.Certain device UI features could be improved to. They don't seem to fully polish things so I tend to run into small/big issues that are literally unfixable since they would require updates from Oukitel that will never happen. They seem to release new devices non stop which is probably a bad sign showing that they just water down their company with never ending devices they won't care for in the future.The company also appears to use ""giveaways"" to milk in more reviews from people who have clearly never purchased anything from them before. If Oukitel is truly a genuine trusting company, I expect them to get it together because we all know nobody will probably ever even read this.Date of experience: November 20, 2021",3
Peter Leening,NL,"Mar 3, 2022","The worst compagny and phoness you can…The worst compagny and phones you can get. I bought a wp10 after a few months he lost signal and restart several Times a our. After chat by ali whith them i tried a lot of things they said i must send the phone back for another one. I wanted my money back, they promised it but they should credit the Ali fee and costs of the repay, not fair but i agree because we are already several months further. I send it back (cost 50eu from the Netherlands). By tracking i see that the phone already arrived 3 weeks ago. Asked for it with the response i should wait a few days because it didn't arrived yet at their warehouse. I said it arrived already, now they are saying it shouldn't arrive because their city has problems? so it will come back maybe but will not arrive at theirs.... They response good but will do anything to give no service/ guarantee. The phone is there, but they say it isn't and give no the city blame.... Phone, money, delevery costs everthing is gone.... That people are not like i know Chinese compagnies! They are steal the money and more of you!Date of experience: March 03, 2022",1
mark,AU,"Dec 13, 2024Verified","Easy transationDate of experience: December 13, 2024",5
jim crabtree,GB,"Jul 5, 2022","this oukitel c21 is absolutly…this oukitel c21 is absolutly RUBBISH... it wont work its flashing and wont let me do anything with it its only good for the dustbin aaaarrrrrggggggggDate of experience: July 05, 2022",1
Paul “Superdoc” Rhodes,GB,"Jun 30, 2024","Customer service was excellent for meI bought my WP30 Pro via Amazon in the middle of February 2024 and was very happy with the performance and exceptional battery life - unfortunately the side button lost its ""click"" and failed recently which, though not impacting the ability to use the phone, did make the back screen inoperative.I reported this to Oukitel and had a new replacement phone exactly a week after reporting the fault. I was relieved that there was none of the usual have you tried this and that before accepting it was a hardware fault - instead from my description Oukitel simply agreed to replace the unit straight away.Of course it was a bit disappointing that the button failed but these things happen and I don’t see failure of the buttons on Oukitel goods being reported elsewhere so think I was just a bit unlucky.Date of experience: June 25, 2024",4
KS,GB,"Nov 29, 2024","Best phone I've ever ownedBest phone I've ever owned, it works beautifullyDate of experience: November 01, 2024",5
Tony Ardito,GB,"Nov 19, 2023","Zero customer care from OukitelWe all understand that technology can fail or be below our reasonable expectations but Oukitel does not address product issues of any kind. They are a practically impossible company to contact and having tried to interact with them directly via email and also four of their what'sapp agents only one bothered to respond with a very curt ""Pls write to store directly"" this is very poor and deeply unprofessional. My purchase was made through Amazon and I am in the process of returning the device which was claimed to be 100% waterproof as well as rugged yet in a wet working environment, condensation was able to build inside resulting in a completely dead phone. If you would like to see full transcripts of my communication attempts with Oukitel please feel free to message me on Facebook, just search Tony ArditoDate of experience: November 16, 2023",1
Edward,US,"Dec 8, 2024","great all my oukitel products have been great, Always work great Date of experience: December 08, 2024",5
