Username,location,date,content,Rating
Zoey Dzen,UA,"Oct 28, 2020","Fast reaction and solution to our problemThanks for the quick help and advice, Britney!Date of experience: October 28, 2020",5
Ciprian Herbei,RO,"Oct 26, 2020","The reported problems were resolved…The reported problems were resolved promptlyDate of experience: October 26, 2020",5
Idris,MA,"Oct 26, 2020","ZEMEZ!!ZEMEZ!!! Good job, I like my website.....Big thanks to Britney (Templates monster), great job, Finally i can breath.Date of experience: October 26, 2020",5
Kris Goossens,BE,"Oct 26, 2020","Very helpfullVery helpfull! Fixed all the problems, even when they were not easy to locate! Thank you!!Date of experience: October 26, 2020",5
Tony,ZA,"Oct 23, 2020","Patient and helpful servcieJason was very patient and got me a solution in no time. Much appreciated!!Date of experience: October 23, 2020",5
Ibra Greatman,FR,"Oct 20, 2020","I highly recommend to those who want a…I highly recommend to those who want a fresh and modern website, my client is very satisfied, I just had some problems with importing plugins and demo contents, but by contacting technical support, Britney answered me and solved the problem in 1 minute.Date of experience: October 20, 2020",4
Artem Bogdanov,RU,"Oct 20, 2020","Zemez, Inc. - cool guys!Very cool guys! The best technical support! Very polite communication! All issues are resolved very quickly and professionally! Zemez, Inc. - the most positive, the kindest, the most professional! We are very pleased with the work with these guys!Date of experience: October 20, 2020",5
Maria S.,GR,"Oct 19, 2020","I contacted customer service for…I contacted customer service for license activation for all my websites.  Representative did it in seconds. Thank you very much!Date of experience: October 19, 2020",5
Marcello Iannarelli,IT,"Oct 19, 2020","Zemez provided me a very good technical…Zemez provided me a very good technical assistance.Date of experience: October 19, 2020",5
Syed Jamil Aziz,PK,"Oct 15, 2020","Speedy & Amazing SupportSpeedy and amazing customer support done by their team and Britney was the one handling my case, professional and amazing support :)Date of experience: October 15, 2020",5
Shayna Burke,US,"Oct 14, 2020","Britney provided excellent customer…Britney provided excellent customer service and knowledge.Date of experience: October 14, 2020",5
Chris,AT,"Oct 13, 2020","Perfect and quick Service!Perfect and quick Service!I recommend this Service!Date of experience: October 13, 2020",5
Fragrance Pub,US,"Oct 13, 2020","Great Extended Support ServiceI was very satisfied with their extended support service, it was the best $59 I ever spent. They did a very good job.Date of experience: October 13, 2020",5
Mkayla Combs,US,"Oct 12, 2020","Extremely satisfiedExtremely satisfied. Perfect in addressing my issue. Appreciate it.Date of experience: October 12, 2020",5
Quest Net,EG,"Oct 12, 2020","she is helpfulDate of experience: October 12, 2020",5
Darren C,CA,"Oct 6, 2020","Britney has always been a great helpBritney has always been a great help to me with updating my Monstroid theme and other questions I send her way.Date of experience: October 06, 2020",5
Beat Richli,CH,"Oct 5, 2020","Very solid support.Date of experience: October 05, 2020",5
Jacco,NL,"Oct 2, 2020","Quick and good help by BritneyDate of experience: October 02, 2020",5
Ziva Olup,SI,"Oct 2, 2020","Britney from Tamplate Monster helped me…Britney from Tamplate Monster helped me to solve the problem.Date of experience: October 02, 2020",5
Dionisis Tsantekidis,GR,"Oct 1, 2020","The best and very very helpful and…The best and very very helpful and kind!!!!Date of experience: October 01, 2020",5
Kishawi Zaid,AE,"Sep 30, 2020","I love their customer serviceI love their customer service, especially Britney. She answers all my questions with care and without being rude. I know customers like us gets too much of a headache sometimes, but there's always two sides of a coin. We also get a headache being stuck on something, so we ask for help.Despite that, Britney guided me and gave me detailed answers. Thank you.Hoping you would continue to give this kind of service. :)Date of experience: September 30, 2020",5
Merlin Nino,DE,"Sep 28, 2020","Great supportGreat support, very helpful and uncomplicated! Thank you so much!Date of experience: September 28, 2020",5
Sascha Klein,DE,"Sep 21, 2020","Great support - again and again!I bought now already the 5th template and I always get a very good support after sales regarding all type of issues or questions.No standard answers, always precise and helpful support until a solution is found.That is exactly what I as freelancer need, that I can be sure to satisfy my customers as well!Date of experience: September 21, 2020",5
Cindy,CA,"Sep 18, 2020","Britany was very helpful and extremely…Britany was very helpful and extremely fast at understanding my issue and pointing me in the right direction.Date of experience: September 18, 2020",5
Jay Johnson,US,"Sep 18, 2020","Britney from Template Monster was very…Britney from Template Monster was very helpful!Date of experience: September 18, 2020",5
Patrick Horn,DE,"Sep 18, 2020","Always quick and helpfullAlways quick and helpfull. Great support and fast response. Thanks a lot!Date of experience: September 18, 2020",5
Александр Кушнир,RU,"Sep 17, 2020","JetPlugins activationI had problem with JetPlugins activation. During the chat problem was solved within 5 minutes. Thank you, MeganDate of experience: September 17, 2020",5
Bianca King,AU,"Sep 16, 2020","Excellent after sales serviceI purchased the Granul - Sport Event Multipurpose Modern Elementor WordPress Theme. It was straightforward to install and had all the features I was seeking. I had a small issue after installation when the testimonial section was not aligning correctly, and I contacted for help via the chat. I got hold of Megan who was able to resolve the issue within a couple of minutes. I had spent about four hours trying to fix the issue myself before I contacted, and my only disappointment is that I didn't do this sooner! Fantastic service!Date of experience: September 16, 2020",5
Sofia Sanchez,MX,"Sep 9, 2020","Great support!I had several issues with my cpanel, hosting, sql, etc, but Felix was always there to help me, pointing me in the right direction until the problem was completely solved, couldn't have done it without himDate of experience: September 09, 2020",5
Sanjay Persad,TT,"Sep 8, 2020","Great service and swift responses.Date of experience: September 08, 2020",5
Matteo Bortolin,ES,"Sep 7, 2020","Quick and profesional supportI have bought the theme Monster2 and each time I needed some technical help the support from Zemez it was very profesional and quick. And also the Theme is very powerfull!!Date of experience: September 07, 2020",5
Ben,FR,"Sep 6, 2020","Good and reactive supportDate of experience: September 06, 2020",4
Alexander Håkansson,SE,"Sep 4, 2020","Awesome supportAwesome support! Thanks Megan for a superfast licensing issue.Date of experience: September 04, 2020",5
Abimes Concept,FR,"Updated Sep 2, 2020","I need help for install a theme parent…I need help for install a theme parent woocommerce from Britney, she give the good process for resolve fast the problem... Thank you very much Britney !Date of experience: September 02, 2020",5
Lenny,VE,"Sep 2, 2020","Britney totally helped me with…Britney totally helped me with everything i needDate of experience: September 02, 2020",5
Ajda,SI,"Aug 31, 2020","I received quickI received quick, clear and helpful reply to a technical support issue regarding WordPress instalation. Thank you Britney.Date of experience: August 31, 2020",5
Tyler LaChapelle,US,"Aug 28, 2020","Fantastic Live Support!Britney was phenomenal at helping me resolve my issues and explaining what was going wrong. I appreciate how quickly this got resolved compared to going back and forth through a ticket like I was originally trying to do.Date of experience: August 28, 2020",5
Nicky van Wyk,ZA,"Aug 28, 2020","Awesome serviceAwesome service. Thanks for the quick response.....Date of experience: August 28, 2020",5
Jamiel Boling,US,"Aug 27, 2020","Pretty amazing in working out the issue…Pretty amazing in working out the issue and being positive about helping. The timeframe between messages was at least a day but I had some extra time so it didnt impact me too much.  Thank you!Date of experience: August 27, 2020",5
Marwan Diapari,CA,"Aug 26, 2020","Britney, an awesome helperBritney, my helper today was totally awesome, less hassle when talk to her. She has what it take to be a good helper. thanks for the help todayDate of experience: August 26, 2020",5
Marek Kępiński,PL,"Aug 26, 2020","Problem with inactive plugins solved…Problem with inactive plugins solved quickly by Britney and Megane. Thank you!Date of experience: August 26, 2020",5
Gordon,ES,"Aug 26, 2020","Quick and helpful response from…Quick and helpful response from Britney, thanks for your help!Date of experience: August 26, 2020",5
Leonard Van Der Merwe,ZA,"Aug 25, 2020","Megan has actually helped me more than…Megan has actually helped me more than once, when I get stuck in wordpress or the themes. Thanks for helping and also recommending options to my clients, that will allow me to keep my clients happy and satisfied.Date of experience: August 25, 2020",5
Bob Bagamery,CA,"Aug 25, 2020","Megan at TemplateMonster helped…Megan at TemplateMonster helped immensely!Date of experience: August 25, 2020",5
Melan Perera,GB,"Aug 24, 2020","Great help from Jason!Date of experience: August 24, 2020",5
Juan Camilo Amaya (Juan Camilo Amaya),CO,"Aug 21, 2020","The high-quality of Zemes support is pricelessDue to Covid-19 I had to build by my own my website for my businesses.Despite that i already was familiar with this kind of jobs, there were multiple issues that I had to face, and  without the outstanding support of Megan Moore and the Zemes Team, definitely I would have struggled to overcome the multiple drawbacks.Definitely and without a doubt, no matter if you are a rookie or a senior on digital marketing and websites building, hire the premium support from Zemez should be always a must. On the other hand, i recommend buying on template monster. The combined support of Zemez and template monsters will provide you full confidence for making major purchases without second thoughts.Date of experience: August 21, 2020",5
Gabriela Enache,US,"Updated Aug 21, 2020","The team makes this product the bestAny problem you might encounter with your website, the team from Zemez will put their capes on and be your heroes. Special thanks to Megan and Britney.Date of experience: August 21, 2020",5
Gregg,ID,"Aug 21, 2020","Zemez Technical Support - Top-Notch ServiceZemez, Inc has really good templates. I purchased the Moonflower Theme from them.  I not only love the template, but I REALLY LOVE THE TECHNICAL SUPPORT provided by them.The technical support is 2nd to none.  They are the best and just TOP-NOTCH.  Megan from technical support is so friendly and super knowledgeable. She is so technically savvy.  She fixed my website template issue in less than 2 minutes because she knew exactly what the issue was right away after I described it to her.  MEGAN is AMAZING. I can't say enough about Zemez, Inc and their top-notch technical support service provided by Megan.  She is super awesome!!!!Date of experience: August 21, 2020",5
Imane Arrach,MA,"Aug 20, 2020","Seriously THE BESTSeriously THE BEST ! I neded their help more than 4 or 5 times, and at my surprise they always replay as soon as i ask for help every single time. Britney Viljoen is one of the support team, she's really patient and helpful. I JUST LOVE HOW THEY ALWAYS HELP ME! THANK YOU!Date of experience: August 20, 2020",5
Rajkumar Lashkar,IN,"Aug 19, 2020","The support provided is excellentThe support provided is excellent. Very responsive and patient. All the problems addressed promptlyDate of experience: August 19, 2020",5
WavMixer,US,"Aug 18, 2020","This theme has many wonderful featuresThis theme has many more features than I need but will add them as needed in the future. Support is also top notch!Date of experience: August 18, 2020",5
Mike Jansen,US,"Aug 14, 2020","Love These GuysI needed a Wordpress Theme for a home remodeling client and they had one that was really nice.  I purchased it and I was a bit over my head putting it together.  I did have to pay the setup fee but they responded to my inquiry fast and turned around the website all in about an hour.  You dont see much of that these days.  Awesome Job!!Date of experience: August 14, 2020",5
Mel Morris Team,PH,"Aug 12, 2020","Fantastic SupportI had problems while I reinstall my theme on my website. And Britney help me solve it in just minutes. I love how fast and reliable your support is.Date of experience: August 12, 2020",5
Valeria Cocha Retiz,AR,"Aug 11, 2020","compatibility issues between the template and 3rd party pluginsI had compatibility issues between the template and 3rd party plugins, and couldn't use Elementor. This was resolved by the support agent Britney, she was very helpful and friendly. It also helped me with the activation of the parent theme, which could not display some icons.Date of experience: August 11, 2020",5
Cinthya Garza,MX,"Aug 11, 2020","Helped me in all my doubtsDate of experience: August 11, 2020",5
MARCO PARIGI,IT,"Aug 11, 2020","Great template but fantastic supportGreat template but fantastic support. They helped me develop the site exactly as I wanted!Thanks againDate of experience: August 11, 2020",5
Семен Дементьев,RU,"Aug 6, 2020","Thanks MeganThanks Megan! In less than 5 minutes she helped me.Date of experience: August 06, 2020",5
Henk Bouman,BE,"Aug 5, 2020","Excellent helpThank you Britney for your quick  responses on my install problems... everythink works in good order thanks to your professionalism, Henk, ItalyDate of experience: August 05, 2020",5
Mathieu Garcia,FR,"Aug 3, 2020","Trust them with your eyes closed!Very powerful and beautiful templates, and quality support! Very responsive when you need their help!I recommend !Date of experience: August 03, 2020",5
Shree,GB,"Jul 31, 2020","Thank you very much BritneyDate of experience: July 31, 2020",5
Gustav Gustav,CA,"Updated Jul 29, 2020","Thanks Megan for everything you did for meI want to thank Megan for her help and support.I want to thank the team working on my site.I want to thank you for the 25% discount for installing my store.I am waiting for you to contact me by email so that I can make the payment.I want you to show me a model of a religious site, pleaseAugustinDate of experience: July 29, 2020",5
Frank Brown,US,"Jul 29, 2020","Great ExperienceI had a great experience with Template Monster installing a template store and supporting me finalizing the design.Date of experience: July 29, 2020",5
Ilias Valindras,GR,"Jul 28, 2020","The best team out here!!Zemez is the best team out here!! Best support ever!! Everytime I need their help they are always responding super fast and resolving my issues.I would like to see a Monstroid 2 ""Theme"" (with Oxygen Builder) for better loading times and cleaner code.Date of experience: July 28, 2020",5
Alvaro Cormenzana,ES,"Jul 24, 2020","very good after-sales serviceDate of experience: July 24, 2020",5
Hector Miranda,MX,"Jul 23, 2020","Megan is great!Date of experience: July 23, 2020",5
Waqar Ahmed,CA,"Jul 23, 2020","Great customer supportI have always had amazing help and support from the Monstroid2 team, specially Britney, she's amazing, helpful and knowledgeable.Date of experience: July 23, 2020",5
Dennis Foy,US,"Jul 23, 2020","I'm a user of the Jetelements plugin…I'm a user of the Jetelements plugin and the support they provide is great.  Highly recommend themDate of experience: July 23, 2020",5
Reto Frei,CH,"Jul 22, 2020","Great Support.Britney, the support Agent gave me a perfect hint how to solve the problem. Great!Date of experience: July 22, 2020",5
Yuri Advance,SK,"Jul 21, 2020","They helped me.They helped me.My problem have been solved.Super.Date of experience: July 21, 2020",5
Stefano Stopponi,IT,"Jul 21, 2020","Alice's support was very helpful!!Alice's support was very helpful!!! She solved my problem in few minutes! Great Customer Care!Date of experience: July 21, 2020",5
Joje,SE,"Jul 20, 2020","Updated an old dl link they didn't have…Updated an old dl link they didn't have to. Great customer service, thanks!!Date of experience: July 20, 2020",5
Kristian D'An,US,"Jul 16, 2020","Great customer serviceGreat customer service! I had issues installing the plugin myself but their support was amazing and I got it all done within an hour of the purchase. Great template and support.Date of experience: July 16, 2020",5
Peter Mudenda,ZM,"Jul 16, 2020","Britney is a great support tech very…Britney is a great support tech very patient and willing to assist even when you are about to give upDate of experience: July 16, 2020",5
Sadiyah,RE,"Jul 16, 2020","good supportAlise is a pretty good support, very responsive !Date of experience: July 16, 2020",5
Tung Dang,VN,"Jul 15, 2020","Good supportDate of experience: July 15, 2020",5
Jamel MALEK,TN,"Jul 7, 2020","Good serviceGood ServiceDate of experience: July 07, 2020",5
Per Hagen,NO,"Jul 6, 2020","Terrible service from ZemezI bought Woostroid2, and updated Elementor. Everything broke down, and TWO weeks later Zemez has still not fixed the matter. Terrible live chat support, and slow ticket resolution.Date of experience: July 06, 2020",1
Claudio,GB,"Jul 2, 2020","Fantastic template and team competent…Fantastic template and team competent and quick to respond, recommended.Date of experience: July 02, 2020",5
Lynn S,US,"Jun 25, 2020","Great answerGreat answer. Solved my problem with an easy fix. Thanks.Date of experience: June 25, 2020",5
Victor Muller,CH,"Jun 24, 2020","Excellent supportExcellent support, quick reply and very clear with the explanations.Date of experience: June 24, 2020",5
jessy verger,US,"Jun 20, 2020","Some information may be missing in the…Some information may be missing in the documentation, if that's so just contact the theme developers, they resolve your doubts really quickly. Excellet costumer service and theme design!Date of experience: June 20, 2020",5
Marco Romero,MX,"Jun 10, 2020","Excellent serviceI have been supported all the time by the amazing support team. Your valuable support has been important in completing the job. Excellent service, thank you very much.Date of experience: June 10, 2020",5
JM,ES,"Jun 9, 2020","Excellent support!Felix has always helped me quickly and efficiently with quick and easy explanations. I have had several problems with the theme that I bought and with the website that I am developing. Thanks to Felix I have been able to solve them all. I recommend them!Date of experience: June 09, 2020",5
Franz,LI,"Jun 5, 2020","Alice from Zemez Support helped me.Alice from Zemez Support helped me a lot.I made a mistake by ordering the wrong Monstroid2 Template. She was very helpful and all problems were solved.Nice to have so excellent service people.Date of experience: June 05, 2020",5
Gustavo Cardona Ramirez,CO,"May 18, 2020","I like so much the service and templateDate of experience: May 18, 2020",5
waa,US,"May 10, 2020","Throughout the website building process…Throughout the website building process these folks have been so helpful. They are knowledgeable and expert in their field.Date of experience: May 10, 2020",5
Next Curve Productions,US,"May 8, 2020","Superb customer supportI recently had my new website installed and Zemez, Inc provided an outstanding support for me which probably saved me hundreds of dollars in developer costs. Holly was amazing. I highly recommend them!Date of experience: May 08, 2020",5
Jim Rohrbach,US,"May 5, 2020","Holly patiently took care of more than…Holly patiently took care of more than one issue I had on my web site -- she went above and beyond the call of duty.  Thank you Holly!Date of experience: May 05, 2020",5
Karen Sawyer,US,"May 4, 2020","Very pleased with my experienceThe team worked hard to find a replacement product that would work for my needs, and walked me through all the steps necessary to get up and running.Date of experience: May 04, 2020",5
Lks,ES,"Apr 16, 2020","Great template but the best thing is…Great template but the best thing is the support and the kindness of its technical support.  I am in trouble with the installation but support (Felix) helped me from the first minute.  I recommend it to everyone!Date of experience: April 16, 2020",5
Thom Bush,SG,"Apr 14, 2020","Got a quick response and an effective…Got a quick response and an effective and well explained solution to ny issue. ThanksDate of experience: April 14, 2020",5
jose antonio Dominguez,US,"Apr 13, 2020","thank you so much for everythingthank you so much for everything , Excellent work and patience, i called super smart lady  ""always have answers""Date of experience: April 13, 2020",5
Phil Barrere,FR,"Apr 11, 2020","Jacob very quick in his ability to…Jacob very quick in his ability to solve problems. I am very happy with the support. Thank youDate of experience: April 11, 2020",5
Elividon,AU,"Apr 10, 2020","My problem was resolved in no time!My problem was resolved in no time! Dakota was very smart and to the point.Date of experience: April 10, 2020",5
Marco Lungo,IT,"Apr 10, 2020","Dakota was efficient and quickly…Dakota was efficient and quickly understand my problem, resolving my issue. Great!Date of experience: April 10, 2020",5
Martin Kaule,DE,"Apr 3, 2020","Great service and fast reaction!Good contact with the support team and competent assistance.Date of experience: April 03, 2020",5
Zoltán Szabó,HU,"Apr 3, 2020","Amelie resolved my problem with the…Amelie resolved my problem with the stopped mobile gallery. Thanks!Date of experience: April 03, 2020",5
