Username,location,date,content,Rating
MiChael Chan,HK,"Aug 11, 2021","Thanks for Britney's great helpThanks for Britney's great help, step by step to help me know how to fix the technical problem.Date of experience: August 11, 2021",5
Pankaj Jangid,IN,"Nov 17, 2021Redirected","How can I customize the product page…How can I customize the product page with different home pages and also the shopping page..Please help me from thisDate of experience: November 17, 2021",2
Marek,CZ,"Apr 27, 2021","I needed helpI needed help. You helped me even though I was not eligible for support. You're great. I look forward to another purchase.Date of experience: April 27, 2021",5
Leon,NL,"Sep 14, 2022","Super quick and helpful support…Super quick and helpful support whenever I had an issue with their product. Thank you!Date of experience: September 14, 2022",5
Vicki Harper,GB,"Jan 11, 2021","Britney was so very helpful and patent…Britney was so very helpful and patent with me and explained everything! Thank you very much Britney 5 Stars!Date of experience: January 11, 2021",5
Lucas Saraiva,PT,"Nov 25, 2022","A+++++ Theme and 5* SupportGreat support helped me trough everything that i needed . The theme is A+++ quality. Good job Guys... Honest review from PortugalDate of experience: November 25, 2022",5
Carine Groutars,NL,"Apr 12, 2021","Britney was a great helpBritney was a great help! She quickly solved the issue I had building and editing posts on our websiteDate of experience: April 12, 2021",5
Björn Engermann,DE,"Nov 25, 2020","great support by BritneyBritney helped me immediately for an issue of licensing! Thank you very muchDate of experience: November 25, 2020",5
mph,NL,"Sep 28, 2021","CrocoblockGreat help in fixing my problem with header and footer made with crocoblock by Britney!Date of experience: September 28, 2021",4
Daleen Media DavidHarex,DE,"May 25, 2021","Very fast and effective solution by…Very fast and effective solution by Britney. Thank you so much. Bye for now and allways again!Date of experience: May 25, 2021",5
"Diana Brown, on behalf of Fawzi Shaya",US,"Dec 11, 2020","Britney was very fast and helpful in…Britney was very fast and helpful in resolving my issue!Highly Recommend *****Date of experience: December 11, 2020",5
Andreas,DE,"May 31, 2021","Thank you for your excellent supportThank you for your excellent support. All questions are answered and the solutions are all great.Date of experience: May 31, 2021",5
Gabriel Marulanda Castaño,US,"Jul 30, 2021","Zemez tech support always help me and…Zemez tech support always help me and find a solution for what I need.Date of experience: July 30, 2021",5
Georges,AU,"Dec 1, 2021","Fast, professional and super friendly supportFast, professional and super friendly support as always! Well done Team Zemez!Date of experience: December 01, 2021",5
Bryce Morrison,US,"Feb 26, 2021","Britney was REALLY fast for the…Britney was REALLY fast for the TemplateMonster support, and was quick in resolving my issue.Date of experience: February 26, 2021",5
Sebastjan,SI,"Jul 29, 2021","Help on a common issueBritney helped me on a common issue, so it was quickly resolved.Date of experience: July 29, 2021",5
Jack B,CA,"Mar 18, 2021","More great service from BritneyPatient, polite, always ready to answer my dumb questions.  Britney is awesome!Date of experience: March 18, 2021",5
PI,PL,"May 19, 2021","Britney helps meBritney helps me, I received all information we need. Thank youDate of experience: May 19, 2021",5
Ninah Baatenburg de Jong,NL,"Feb 3, 2021","Very good, fast and problem solving helpVery good, fast and problem solving help. But it is a pity that there are often bugs in the plugins of the themes.Date of experience: February 03, 2021",4
Trever Bostrom,US,"Aug 2, 2021","The support's live chat function was helpfulThe support's live chat function was quick & responsive. Britney was extremely helpful!Date of experience: August 02, 2021",5
Fahd Nait Ali,AE,"May 7, 2023","The best serviceThe best service. they will make sure you are not left alone and will support swiftly and efficientlyDate of experience: May 07, 2023",5
Nelson Sagastume,US,"Aug 5, 2021","Great support received from Britney as…Great support received from Britney as always, Support Agent from Template MonsterDate of experience: August 05, 2021",5
Karim Guettache,NL,"May 24, 2021","Helpful support from britney with activating licenseBritney was very helpful and we quickly resolved the issue of activating the license of my jet pluginsDate of experience: May 24, 2021",5
Midrara Trading,SD,"Dec 22, 2020","I spoke with Britney Support Agent,I spoke with Britney Support Agent,she has been very useful on how to install.Date of experience: December 22, 2020",5
James Halpert,US,"Mar 2, 2023","Awesome!Awesome!They have great templates and briliant support! Thanks a lot)Date of experience: January 19, 2023",5
Roman Andreev,RU,"Feb 5, 2021","Support AgentSupport Agent, Britney. Best of the best, of the best)She can help me in one a difficult question. Now i`m hapy)Date of experience: February 05, 2021",5
Filipe Barbosa,FR,"Feb 11, 2021","Great Support Team !Great Support Team !Great help and very quickly answers...Special thanks for Jacob!Date of experience: February 11, 2021",5
Jack Gutierrez,PE,"Jul 27, 2021","britney was a great help solved a…britney was a great help solved a problem I had with a  template .thank you very much for the time given.Date of experience: July 27, 2021",5
baruna scsc,ID,"Oct 12, 2022","ThanksThanks , Good Service Verry Fast And Recomended zemez.ioDate of experience: October 12, 2022",5
Sergio Doglioli,IT,"Apr 28, 2023","GreatGreat! No other words. Fast reaction, good solution.Date of experience: April 28, 2023",5
KREWI MEDICAL,DE,"Dec 22, 2021","ALWAYS A GREAT HELPALWAYS A GREAT HELP! Seriously they are the best supporters!Date of experience: December 22, 2021",5
Jennifer Spaeth,CA,"Jan 6, 2021","Helped me update theme all the way…Helped me update theme all the way through installation.Date of experience: January 06, 2021",5
Brad,US,"Oct 27, 2022","Excellent SupportI was having an issue with my theme relating to currency selection, and the support I received was excellent. Highly recommended.Date of experience: October 26, 2022",5
A. Verónica Pérez Montiel,MX,"Feb 17, 2021","Excellent serviceExcellent service! Megan was of great assistance. Nice job!Date of experience: February 17, 2021",5
Jeff Wajda,US,"May 26, 2021","Fast & Helpfulfast and helpful support via their live chat with activation issue.Date of experience: May 26, 2021",5
Justin,US,"Feb 16, 2021","Britney nailed itBritney nailed it - solved our issue in a matter of seconds.Date of experience: February 16, 2021",5
Miguel Duarte,PT,"Feb 5, 2021","Britney helped me very quickly!Britney helped me very quickly!Now i can continue my work!Thank You BritneyDate of experience: February 05, 2021",5
Customer,FR,"Dec 29, 2021","Good serviceGood service, quick response to a solution to my problem.Date of experience: December 29, 2021",5
FABRIZIO,IT,"Aug 25, 2021","great service and service supportgreat service and service support. They solved all my problemsDate of experience: August 25, 2021",5
nms,US,"Feb 11, 2021","The chat is greatBritney answered my questions very quickly and pleasantly!Date of experience: February 11, 2021",5
Emelyne Munezero,CA,"Feb 19, 2021","Great supportI needed help with CSS and the support was excellent! They answer quicky,Thank you !Date of experience: February 19, 2021",5
Martina,CZ,"Sep 27, 2021","Dantastic customer serviceThank you for your fantastic customer service. Very fast problem solving and friendly operators.Date of experience: September 27, 2021",5
Andrea,IT,"Jul 12, 2023","Always available to helpAlways available to help, good support staff!Date of experience: July 11, 2023",5
César Donovan,DO,"Nov 26, 2020","The for its excellence in supportThe reason why I buy Zemex templates is because in addition to being modern and can be easily adapted, the technical support service is excellent and that for me is the most important thing, since when you have a problem you don't have to wait days to solve it, they give you attention via chat which is great.Date of experience: November 26, 2020",5
Luca,IT,"Jun 13, 2024","Cherry Services List pluginCherry Services List plugin in Beclinic Template causes critical issues affecting Site Health.Date of experience: June 13, 2024",1
Suzan Cicek,GB,"Jan 6, 2021","Megan always help me with my theme…Megan always help me with my theme design she is number one xxDate of experience: January 06, 2021",5
Luis Alfonso Córdoba,PA,"Sep 22, 2022","Diligent and friendly supportDiligent and friendly support and attention. This aspect is important when buying a template.Date of experience: September 22, 2022",5
LB,US,"Jul 16, 2021","Britney was a great helpBritney was a great help! Answered all my questions thoroughly.Date of experience: July 16, 2021",5
alper bingöl,TR,"Apr 30, 2021","Thank you so much to BritneyThank you so much to Britney for her support. Thanks to my problem solved.Date of experience: April 30, 2021",5
Anup Singh,IN,"Jun 30, 2021","5* Support5* Support. Megan helped me identify the problem.Thank you.Date of experience: June 30, 2021",5
Yutub Wkok,SV,"Oct 29, 2022","Good pilot serviceGood pilot service, account safe and money safe ❤Date of experience: October 29, 2022",5
Jason Gelfand,US,"Jan 8, 2021","Problem with my Theme and Britney was…Problem with my Theme and Britney was able to help me fix in 5 min.Date of experience: January 08, 2021",5
Gilles Duboux,CH,"Mar 12, 2021","Britney was wonderfulBritney was wonderful. She helped me so much. Bravo, and many thanks to her !Date of experience: March 12, 2021",5
Bruno Vieira,PT,"Mar 25, 2021","I didn't have any questions either1. Everything was quick.2. Everything is accurate.3. The prices are adequate.Date of experience: March 25, 2021",4
Tim,SG,"May 24, 2024","Good product and even better supportDate of experience: May 24, 2024",5
MaHe Solutions OG,AT,"Apr 6, 2022","Thanks for the fast and efficient…Thanks for the fast and efficient service-support! Great!Date of experience: April 06, 2022",5
Eleni,GR,"Dec 9, 2020","Great support!Thank you Britney For the support! You are awesome!Date of experience: December 09, 2020",5
Alexander von Känel,CH,"Dec 21, 2020","Britney was quick to solve the problemBritney was quick to solve the problem. Thank you Britney.Date of experience: December 21, 2020",5
The Honeyhound,AU,"Jul 7, 2021","Britney was very suppotive and helpful.Date of experience: July 07, 2021",5
Andrew Hazelton,CA,"Feb 10, 2021","Great Product & Support!Love the Monstroid2 theme & they have some great support!Date of experience: February 10, 2021",5
Patrick Zuluaga,AU,"Nov 26, 2020","RealiableQuick and responsive and got it fixed the first time around!Date of experience: November 26, 2020",5
Robbster,NL,"Apr 12, 2021","Megan provided an instant solution!Date of experience: April 12, 2021",5
Hola Tenerife,IT,"Feb 15, 2021","Great support with Britney.Exceptional support, with problem solving. evaluation of the patient and concreteness in solving the problem. Contact Britney. For consistency and excellent communication with the customer.Date of experience: February 15, 2021",5
SUZAN CICEK,GB,"Jan 22, 2021","Britney always helped me a lot thank…Britney always helped me a lot thank you to herDate of experience: January 22, 2021",5
Mateusz Grabowski,PL,"Jul 13, 2021","PerfectGreat help, everything went well thanks to Britney. greetingsDate of experience: July 13, 2021",5
Ami,US,"Feb 17, 2023","Actual people who know their stuff!Even if I am not sure what I did wrong they fixed it for me! Love the theme and love the people. Thank you!!Date of experience: February 17, 2023",5
Khalid BIn Ahmed,BD,"Jan 11, 2021","Great AssistanceShe is amazing, Help me a lot. I'm really benefited.Date of experience: January 11, 2021",5
Stimen,DE,"Nov 28, 2022","Only pros!Support is very friendly and fast. The themes look awesome!Date of experience: November 22, 2022",5
Bbttc,PF,"Dec 18, 2020","Quick answerQuick answer! Very effective with BritneyDate of experience: December 18, 2020",5
Gene Levin,US,"Feb 19, 2021","Great Support from BritneyGreat Support from Britney. A+ Thanks.Date of experience: February 19, 2021",5
H. B.,NL,"Jun 30, 2021","Awesome support!The support (Britney) helped me very fast and great! 5 Stars!Date of experience: June 30, 2021",5
Luca Sanarica,IT,"Mar 2, 2021","Britney number one!!Britney number one!!! thank you so muchDate of experience: March 02, 2021",5
Apostolos Giannas,GR,"Dec 3, 2020","Perfect support!Perfect support!Thank you very much.AposDate of experience: December 03, 2020",5
Michele Baldassarre,IT,"Mar 4, 2021","Excellent supportProfessional and fast to solve important problems and answer any question.Date of experience: March 04, 2021",5
Bruce,US,"Feb 5, 2021","Britney was very helpful!Date of experience: February 05, 2021",5
Juan Vazquez,US,"Nov 10, 2020","I was assigned to Megan for technical…I was assigned to Megan for technical support. She was very patient regardless my lack of knowledge. I'm just trying to learn and adapt and she understood that and helped me with no problems at all. She solved my website's issue in seconds.Best service I've had in a while. Thanks a lot MeganDate of experience: November 10, 2020",5
Bistra Klisarska,BG,"Jul 26, 2021","Quick and helpfulThe support came quick and was really helpful! Thanks!Date of experience: July 26, 2021",5
Steven,NL,"Nov 4, 2020","I have been working on a template from… Template Monster, Monstroid 2.0I have been working on a template from Templatemonster since many weeks now to make it exactly how it needs to be. I am not that experienced, but with the great skins from Template Monster I came a long way. However to make it work, I needed additional help to install, and fine tune the template. Britney from the service team has been super supportive. She helped me countless times via chat and even logged in my panel to look for the bugs and help me fix it. She was generous with her time, and very patient. Thank you Template Monster, Thank you Britney, you are amazing.Date of experience: November 04, 2020",5
Fabio,IT,"Nov 5, 2020","This is a very valuable company that…This is a very valuable company that deliver high quality products! Then I also tried the Live Chat support and the agent was incredibly quick and precise helping me with a technical question about the wp theme I purchased. I really recommend their product!Date of experience: November 05, 2020",5
Sam Clark,GB,"Apr 20, 2021","Excellent ServiceHelped tremendously with installation, I cannot recommend them highly enough.Date of experience: April 20, 2021",5
Rafa Sala,ES,"Jan 27, 2021","Resolved all my problems very quicklyResolved all my problems very quickly. Amazing customer support service.Absolutely recommended.Date of experience: January 27, 2021",5
mark fold,PY,"Nov 13, 2020","superheroes do exist!!!imagine you call support and they already know your problem and fix it before you even finish typing out what you need. That is monster template and that's what Britney done for me today!..superheroes do exist!Date of experience: November 13, 2020",5
Gustavo,BR,"Sep 27, 2023","top - Solved the problems in just a few hoursDate of experience: September 25, 2023",5
Tuvia Heller,IL,"Nov 3, 2020","Reliable professional serviceI have worked with Zemez for almost two years and the experience has always been the same- EXCELLENT SERVICE. My latest request was where I needed help in changing something in CSS that I could not straighten out myself. Whereas most of my service requests have involved tweaking, there were many times in the beginning of using the Monstroid2 Template that I just needed help in understanding the template which is very user friendly. There were several times that what I thought was simple turned out to be not so simple. So instead of solving the problem using chat, a job ticket was opened and in a short period of time I got the answer(s). This is a company that you can rely on for 24/7 support. Pleasant and professional.Date of experience: November 03, 2020",5
Ру Зе,RU,"Dec 22, 2020","BritneyBritney, thank you for your help! Everything is fast and to the point)Date of experience: December 22, 2020",5
Jessica Latten,US,"Nov 20, 2020","Britney paid attention to detail and…Britney paid attention to detail and was able to determine that my issue needed to be escalated. I appreciate her for the extra effort she put in towards helping me solve my issue.Date of experience: November 20, 2020",5
LUIS ROBERTO RHOADS,MX,"Jan 21, 2021","Great service¡¡Date of experience: January 21, 2021",5
Bxyz Xxx,ID,"Oct 30, 2022","Best service middleman ❤️❤️❤️Date of experience: October 30, 2022",5
Astontek Aston,US,"Apr 28, 2022","AmazingIt has all you need for your website.Date of experience: April 28, 2022",5
Елена Андреева,RU,"Nov 16, 2020","Thanks Britney!Talked to Britney's manager. The question was resolved quickly, helped to update the plugins and the previously purchased site template. Thanks Britney!Date of experience: November 16, 2020",5
Consumer,FR,"Sep 22, 2021","Britney from Zemez is absolutely efficient ...Britney from Zemez is absolutely very professional and efficient, I recommend Zemez and especially Britney.Date of experience: September 22, 2021",5
INGREDA,ES,"Feb 2, 2021","Thank you Britney!!!!Date of experience: February 02, 2021",5
Sven Mihm,DE,"Jun 24, 2021","fast and reliableThanks....very fast help with a template.well doneDate of experience: June 24, 2021",5
Louis F,US,"Nov 13, 2020","Britney was amazing!Britney was amazing. She was able to get me what I needed and the support in a few clicks! I had been struggling for days on my own.SHE is amazing!Date of experience: November 13, 2020",5
sherlwinc,VE,"Feb 23, 2021","Very Good Support!!Date of experience: February 23, 2021",5
Foreverlive Secret,UA,"Jan 30, 2021","This is the best support in my life!!!Date of experience: January 30, 2021",5
czarek lesz,PL,"Mar 5, 2021","Britney its goodDate of experience: March 05, 2021",5
Prince PrinceRe,GR,"Nov 3, 2020","To the point answers to my questionsTo the point answers to my questions. No whatsoever delay. I am very happy with (Britney) who was in the support chat. Problem solved.Date of experience: November 03, 2020",5
Iker Pacheco,ES,"Mar 9, 2021","Fast and PerfectDate of experience: March 09, 2021",5
Alayn Arambula,US,"Apr 29, 2021","Fast and efficient!Date of experience: April 29, 2021",5
Said Ben Sallah,NL,"Dec 20, 2021","Great support!Great support!I definitely suggest Zemez!Date of experience: December 20, 2021",5
OY,DK,"Jan 6, 2021","It was great help from Britney.Date of experience: January 06, 2021",5
Eryngium,ES,"May 26, 2021","Very goodVery fast answer and good help.Date of experience: May 26, 2021",5
Craig Basford,US,"Mar 4, 2021","Britney was great helpDate of experience: March 04, 2021",5
Joanna,PL,"Feb 5, 2021","Britney is the best :)Date of experience: February 05, 2021",5
Roy Oostweegel Entertainment,NL,"Jan 5, 2021","Britney was the best!Date of experience: January 05, 2021",5
Sam Daykin,GB,"Apr 23, 2021","Incredibly swift and professional…Incredibly swift and professional customer support, would recommend to anyone.Date of experience: April 23, 2021",5
Noman,IT,"Jan 11, 2021","Britney was nice and professionalDate of experience: January 11, 2021",5
Robert Lalic,DE,"Nov 6, 2020","Great jobGreat job! Magan helped me in seconds. And Problem was fixed!Thank you Magan :* Stay healthyDate of experience: November 06, 2020",5
Oleg,UA,"Nov 4, 2020","Quickly solved the problem with the templateQuickly solved the problem with the template. Very grateful Technical Support - Britney Viljoen.Date of experience: November 04, 2020",5
Aleksander Grudziński,PL,"Aug 18, 2022","Best of allAbsolutely amazing. Fast, accurate, nice, patient.Date of experience: August 18, 2022",5
kemal has,GB,"Nov 12, 2020","Britney helped me a lot she is number…Britney helped me a lot she is number 1**** I will recommend template monster to everyone.Date of experience: November 12, 2020",5
SubjectX,SI,"Nov 12, 2020","This was fastest problem solving…This was fastest problem solving support I ever contacted in my 15 years of IT work.Date of experience: November 12, 2020",5
Kris,US,"Nov 11, 2020","Great jobGreat job! Britney helped me resolved a update download issue in a few seconds.Date of experience: November 11, 2020",5
Trần Đức Tâm,CZ,"Oct 30, 2020","I had a LOT of problems but the support…I had a LOT of problems but the support always helped me and saved a day!Date of experience: October 30, 2020",5
Jesús,ES,"Feb 17, 2021","Excellent service from BritneyDate of experience: February 17, 2021",5
Alberto Tascon,ES,"Nov 30, 2020","reat experience and serviceDate of experience: November 30, 2020",5
James Twist,GB,"Nov 23, 2020","icons issue resolved very quicklyicons issue resolved very quickly, thanksDate of experience: November 23, 2020",5
Paul King,NZ,"Jan 11, 2021","Problem resolvedProblem resolved, much appreciated!Date of experience: January 11, 2021",5
Jen,US,"May 28, 2021","good experience good supportDate of experience: May 28, 2021",4
Mira,CH,"Jan 13, 2021","FastFast, effective support!Date of experience: January 13, 2021",5
Rui Stüpp,BR,"Jan 7, 2021","Very Good Thank youDate of experience: January 07, 2021",5
AP,US,"Jul 2, 2021","Great helpGreat help! Very fastDate of experience: July 02, 2021",5
Mark,US,"Mar 3, 2021","Megan is the best!Date of experience: March 03, 2021",5
DIGIST,MA,"Nov 20, 2020","Excellent serviceExcellent service, thank you ZemiezDate of experience: November 20, 2020",5
Yunus Oflu,DE,"Feb 24, 2021","the best the best the bestDate of experience: February 24, 2021",5
Lars Halvard Grimsrud,NO,"Nov 18, 2020","Thanks for the help Britney!Date of experience: November 18, 2020",5
siro siro,ES,"Sep 28, 2021","Perfect support¡Date of experience: September 28, 2021",5
Hélio Fonseca,BR,"Feb 26, 2021","Britney's excellent service.Date of experience: February 26, 2021",5
Anton Dvornikov,RU,"Nov 4, 2020","Its a good supportDate of experience: November 04, 2020",5
Stijn Claessen,BE,"May 24, 2021","Excellent support!!Date of experience: May 24, 2021",5
mark braam,NL,"Nov 4, 2020","Feeling like I have been scammed!I sent several emails last Friday but so far no response. It's just how this company deals with its customers and I also feel strongly that I've been conned. Below is an overview of the mail contact.05-06-2020Thank you for the details from hosting provider. We checked it, and it works correctly for us.We have all the needed details at the moment. Our developers are working on the theme creation at the moment. 20-06-2020Our developers are working on the theme creation and data migration at the moment.The project should be finished completely by the end of the August.18-06-2020The project should be finished completely by the end of the August. Our techs have already installed free modules. Please provide us with the modules that you want us to install onto your website.27-08-2020I am sorry for the delayed reply!Our techs can provide website URL and details for you to check on Monday.Also, please provide us with the modules that you want us to install on your website.08-09-2020I am sorry for the delayed reply!It took much more time for your project manager to migrate your data. The reason was a bunch of duplicated lines which caused the error each time in the migration process.There are more than 170 custom blocks on your website. Those are being recreated by your project manager at the moment.That is why the website will be ready 1-3 weeks later. We are sorry for the inconvenience caused by delay.Your project manager will create access for you, so that you will be able to see how that looks now.21-09-2020I completely understand your concern!We are sorry for the delay, as there were some issues with the test server setting up.You will be sent the website URL tomorrow, once all the option will be set up.Meanwhile, please check how the filters will look on your website: There are no filters on your webshop, so we decided that this will look more suitable.Also, here is a new view of how it looks when you choose the category: c/ul6802Let us know if you wish to save these changes.24-09-2020We are sorry for the delay, there were some issues while installation on a live server.Use this link to see how your website looks at the moment: manves.eu/ We are working on your plugins implementation and website stylization at the moment.06-10-2020Please, accept our apologies for any inconvenience in communication.The approximate time needed for the project completion is 1 month according to your project manager statement.We hope that everything will be set up within this time.In case there are some difficulties or delays - we will definitely let you know.27-10-2020We are sorry for the inconvenience.I am just passing the information that your project manager provides me with.Unfortunately, there were some bugs found while migration data. The project manager is resolving these issues currently. It should be done by the end of the week.Please do not worry, your project will be completed soon. this is the mail traffic and now I get no response at all. I think I had enough patience but I think I lost my money !!Date of experience: November 04, 2020",1
Leos Wolny,CZ,"Oct 29, 2020","Great and Pro productsI really like your products. Nice styling, professional, easy to use. Good service and support. Thank you!Date of experience: October 29, 2020",5
Radoslav Ganev,BG,"Oct 28, 2020","Excellent service!Date of experience: October 28, 2020",5
Viola,DE,"Oct 28, 2020","Vera fast and excellent support.Date of experience: October 28, 2020",5
