Username,location,date,content,Rating
robin dobson,GB,"Dec 22, 2024Verified","The order arrived 1 day early less than…The order arrived 1 day early less than 3 days and well packaged. We already own a larger tablet from Oukitel and find it works very well and is well made. We now have a rugged 8"" tablet which is very good quality for the price paid and works well. Battery life is good and you can hold it in one hand ok as it is well balanced  even though it has a large battery. it looks the part stylish and rugged. I would say by the look and feel of it that it would survive a drop and on examining the charging port/ sim opening that it would definitely be waterproof. I am more than happy with both my Oukitel purchses.Date of experience: December 17, 2024",5
Signora Nawal,IT,"Dec 21, 2024","I haven't tried the products of this…I haven't tried the products of this brand (oukitel) yet, which seem good from reading the comments. I hope to try one of their products soon and give my honest opinion and share it on this page and on social media.Date of experience: December 20, 2024",5
Aidallogoni,AL,"Dec 10, 2024","Oukitel P1 just purchased in 11.11…Oukitel P1 just purchased in 11.11 sales with good discounts and is amazing .Bought purple 💜 Oukitel P1 it has a lot of great futures .A real bargain price with huge storage 8 GB RAM+256 GB ROM big enough to install many applications.I mostly wanted it because it's android 14.0 which means better system and faster data and because it supports 5g network .The smartphone is lightweight and beautiful design it arrived with screen protector and a spare one also the case . Recommend it and the store service too Date of experience: December 07, 2024",5
Pixie,GB,"Dec 12, 2024","⚠️⚠️⚠️ W39 Worst phone I have bought ever!!⚠️⚠️⚠️  W39 Worst phone I have bought ever!!! ⚠️⚠️⚠️After months of STILL waiting for a return label and refund, but yes you guessed it... Nothing.amazonoukitel.com Where's my REFUND?????⚠️⚠️⚠️⚠️⚠️ No return label or refund, even though in the email to my daughter they stated full refund. November 7th . Still no refund and no reply to messages.December 12 yes you guessed it. No refund!!! Date of experience: July 13, 2024",1
Paula Cruz,PT,"Dec 21, 2024","I own a mobile phone and I'm very happy…I own a mobile phone and I'm very happy with it, it's fast and I love the photos taken with the phone. Date of experience: January 15, 2024",5
Ajmal O,PK,"Dec 6, 2024","Oukitel is name of quality Oukitel is name of quality Oukitel manufacturing both rugged and sleek smartphone and tablets.In Budget price , with advanced features. Oukitel P1 is perfect.Date of experience: December 06, 2024",3
Robert Wallen,DE,"Dec 11, 2024Verified","Great RT7 Titan, bad tabletstand. Maybe productiondefaultBought the RT7 Titan. In my opinion the best Tablet I've ever had. Only the Tabletstand ist to weak. Itself ist very massiv but the hinge ist not strong enough in a angle of more of about 100 or 110 degrees. Ordered a new one for proudly 45,00 USD. Looking forward for the new one. I hope it will better working. P.s.: My save-coupon was not accepted. Very pitty.Nevertheless many greetings an thanks for the great RT7Date of experience: December 11, 2024",5
George Chen,TW,"Updated Dec 30, 2024Verified","You ssales clark help me to add Taiwan…Your sales clark help me to add Taiwan area. Truly helpful! Great shopping experience!❤️Date of experience: December 16, 2024",5
Mindy Sharp Gaines,US,"Dec 10, 2024","Oukitel Phones are the bestOukitel Phones are the best! I'll never buy another phone. They're very sturdy & reliable. The customer service is great. I love the camera as wellDate of experience: December 10, 2024",5
Mark Grancy,PH,"Dec 18, 2024","Devices that exceeds expectationsDevices that exceeds expectations. Plus great costumer service. Easy recc!Date of experience: November 09, 2024",5
Mr Gerald Freeman,GB,"Nov 23, 2024","Bought Oukitel c51 to replace recalled…Bought Oukitel c51 to replace recalled phone it's best phone I have owned it's fast, battery lasts all day recharge speed great, call sound best I've owned, downloads quick and installed fast purchased at £74.99 best value out there  highly recommended Date of experience: November 21, 2024",5
Neuromancer,GB,"Nov 17, 2024Verified","Quick delivery and great phoneQuick delivery and great phone. Easy to set up and get going, this rugged phone offers more than others at a higher price. And the battery capacity means you're not charging it every day like others I've had (even using it extensively at work gives me three or four days before it drops below 50% charge)Date of experience: November 11, 2024",5
Ntsako Mashele,ZA,"Dec 6, 2024","The phone is a good mobileThe phone is a good mobile, it's not slow unlike other phones and I'd like to thank the company that made this phone,thank you  oukitelDate of experience: December 06, 2024",5
Hector Zablach,BR,"Nov 30, 2024","I've stumbled into this manufacturer in…I've stumbled into this manufacturer in the last few days and all in all, it really seems like a contender for a new phone.Date of experience: November 29, 2024",3
clouds,US,"Oct 31, 2024","To whom may concernTo whom may concern: My name Valencia Lindsay. I'm having issues my phone bio menu not letting phone go pass bio menu because manufacturer didn't make phone with bios menus. Thanks Date of experience: December 31, 2023",1
Carmel Callan,GB,"Dec 15, 2024","No problems with products as of yetNo problems with products as of yet, Good quality. Quick deliveryDate of experience: September 19, 2024",4
Bjørn Frengstad,NO,"Nov 19, 2024","Stay away from OukitelStay away from Oukitel! They are thieves/frauds and are ONLY out for your money! They don`t care about you as a customer and will not do ANYTHING to help you if something happen to your product, regardless what happens (""Missing"" phone, product not working and you have a warranty, but they will not respect that) even if you paid for the warranty. Shit support/tech, doesn`t have a valid name for address for refunds in Europe, package will not be picked up and they are ""sorry"". I have had an ongoing case with a phone bought in the spring of 2024, that got a malfunctioning battery since July 2024, and was sent to them for a refund/new phone 15th of September and it got returned back to me, even though they had tracking and could have picked it up. Another phone ""disappeared"" in transit/shipping in 2019, and their exact words were, and I quote; ""Shit shipping"". I have lost/wasted a total of over 600 dollars, and they don`t care and don`t want to help. Stalling process and drag time so you give up. Please, save your money, and the hassle, and stay away from them. Do not do business with them.Date of experience: September 15, 2024",1
Frank Stuart,US,"Dec 7, 2024","Excellent Price and QualityReading up on these phones shows that they are of excellent quality and are priced better than comparable models from other companies.Date of experience: December 05, 2024",5
Swoozy D,SK,"Nov 6, 2024","So far no issues So far no issues just had to replace battery because i used it very heavily. Parts are available and relatively cheap, updating phone os is little bit harder but if you are tech savy its doable. You get what you paid forDate of experience: November 05, 2024",5
Don Lyle,US,"Oct 13, 2024Verified","Didn't expect the Q&A requirement.The process was acceptable and reasonably easy to use, but the questionnaire slowed the process. Those questions could just as easily been asked in this e-mail.  Unfortunately, I felt like I was a prisoner of the questions and could only be released to complete my order when I answered them.Date of experience: October 13, 2024",3
Malcolm Jarvis,GB,"Oct 18, 2024","Oukitel what's not to like If I had purchased any my oukitel  phones for Thier market specification value I might have been a little disappointed.I've not purchased one for more than a £ 100 yes that's all.I've owned top model windows phones ,I phones, Nokia and Samsung and after 24 to 30 months they needed replacing at what cost £ 600 700 800 1000 .!!!!!!Research the model u like read reviews take your choice and pay your money If however you get a duff one order another at the price you could order three and still be quids in oh and all of my oukitel phones have lasted over 24 months No brainer Date of experience: October 18, 2024",4
Jonathan Ribner,IE,"Apr 28, 2024","What happened to Oukitel?What happened to Oukitel?After nearly ten years of using and recommending Oukitel products, I recently purchased the WP23 which turned out to be a disaster. The phone needs constant rebooting and the battery drain between 20% and zero is so quick you can watch the numbers drop.Anyone can make a mistake, but Oukitel customer service is nonexistent. I've emailed over a dozen times without any response at all. I really enjoyed the design, performance, battery life and strength of their previous phones, but unfortunately, it's time to find a new company that values their loyal customers. Oukitel, I truly hope you get a grip and improve.Date of experience: April 28, 2024",1
Asgor Reidaa,ES,"Nov 8, 2024","Good quality/price ratioSmartphones with a good quality/price ratio. I have had two smartphones and these have worked well, although their battery failed after two years. A good brand if you are not looking for the best features, but rather a reasonable price.Date of experience: November 08, 2024",4
Andreas Theodoulou,CY,"Dec 7, 2024","hard and toughhard wearing durable mobile phones with all the features you needDate of experience: December 01, 2024",4
Kimberly Pemberton,US,"Dec 22, 2024","Awesome thanksAwesome thanks Date of experience: December 22, 2024",5
Chalky,GB,"Updated Jan 28, 2024","Disappointing purchase C21 Pro (2021) model phone.I purchased C21 Pro (2021) model in March 22 £136 after research for this relatively unknown company was positive. Was an expensive phone but believed worth the money. Sadly not. January 24, Less than 2 yrs old I am faced with buying another phone as can no longer charge via USB as the phone connection is not working.Thought a 2021 model phone would give me the option of wireless charging. Sadly not.Date of experience: January 26, 2024",1
Ahmed Ma,EG,"Dec 21, 2024","Trusted brandDate of experience: December 21, 2023",5
Peter Hawkins (H&H Family),GB,"Sep 4, 2023","Scam company - No warrantyScam company. Bought a phone via Amazon.co.uk, which states 30 days return period, then contact manufacturer for warranty returns. 2 months owning the phone, it overheats and burns the screen, and is now inoperable. Oukitel website warranty form does not work, sent multiple emails with no answer. After threating further action, got a reply saying go back to Amazon as warranty is only for phone bought directly from their website. AVOID.Date of experience: September 04, 2023",1
Melvin Hardy,US,"Nov 19, 2024Verified","Oukitel has a confidence building e-commerce platform.I find the Oukitel product line both competitive, and a quality leader in that product line.  I have an early version of their OT5 tablet.  Next I will try their mobile phone.  Date of experience: November 18, 2024",5
S Dixon,GB,"Apr 8, 2024","Untrue product specifications on Oukitel websiteI bought an Oukitel WP19 phone because their website states that the camera records 4K video @ 30 fps. It doesn't, it records 2K video and Oukitel have failed to apologise to me for their error.I initially intended to return the phone but because their returns procedure is complicated and they wanted me to return it to a third party company, I didn't feel confident in doing so. I'm now stuck with a phone I wouldn't have bought.Date of experience: April 08, 2024",1
Alin Pricop,RO,"Dec 10, 2024","OUKITEL is my favourite brandOUKITEL is my favourite brand, it has many good produscts in it's lineup!Date of experience: December 10, 2024",4
Jason Atreides,GB,"Nov 7, 2024","W28E.W28E.Not a bad phone, unless you need to use the internet.It will not stay tethered to the internet at all and is extremely annoying.Date of experience: November 07, 2024",1
Mitch Yunes,CA,"Jul 3, 2024","Unfortunately i never received my…Unfortunately i never received my products RT7 and BT80 smart watch.Buy just a brand name it might be a little more money but you will have better quality service. I am in the process of a dispute with credit card company and paypal.Let's see how Oukitel handle the dispute. Date of experience: June 24, 2024",1
MorePatrioticThanYou,US,"Apr 24, 2023","Bought a WP-17 phone last July on…Bought a WP-17 phone last July on Amazon.  Originally thrilled bc it had my two biggest desired qualities of looong battery life and very rugged (I am a klutz)   Downsides: controls not very intuitive. Didnt read my samsung memory card. Phone speaker stopped working after 8 months, though I can still play music and use the phone if I use the external speaker. Waiting to hear feedback from customer service now...Date of experience: April 24, 2023",3
M. Gob,US,"Updated Feb 1, 2023","Flaky and unreliable ,so far.But came through with the refundI ordered a portable power station from Oukitel in late Nov.2022,they took my money,claimed that my order had been placed,and gave me an estimated delivery date. Now almost two months after that date they’ve finally responded that they can’t deliver to my state(HI).I’ll let you know how this ends and how easy or difficult it ends up being getting my money refunded.OK ,they were pretty good about refunding my money with no hassle once they finally realized their screw up(still no excuse for holding my money for 2months before they decided they wouldn’t ship to Hawaii).Date of experience: January 28, 2023",1
Escrimodor 9,GB,"Jun 8, 2023","Absolutely terrible - Buyer bewareAbsolutely terrible. I got a Tablet that looked pretty good but several of the features simply do not work as advertised. I contacted Oukitel via their website and followed the returns procedure. They simply ignored me. Zero contact and their policy refuses to accept returns without them first giving consent. They then don't give consent and you are ""..... out of luck""Do not buy from this company.Date of experience: May 01, 2023",1
Sidney Wright,US,"Sep 14, 2024Verified","Unbelievable deal, great phone.Had it for 3 weeks now, no bugs or hiccups. I think the thickness doesn't include the camera bump, but still it's 'thin' given the battery size. Also the weight is no issue, I'm used to it already and don't even notice it in my pocket. I'm not a gamer, but performance is excellent on all the apps I do use (browser, maps with GPS, camera, YouTube, social media...) Comes with a protective TPU case, but didn't need it. Got into a minor motorcycle accident with it inside my jacket, not a scratch. The Oukitel launcher/skin is pretty basic but meets my needs, though I don't know why they didn't just use the standard Android launcher. Very happy with this phone, and amazed at the price.Date of experience: September 12, 2024",5
ayham,SA,"Dec 6, 2024","My experianceOUKITEL quality is not matched by any other brand I tried. I am sure it will be one of the top sellers in futureDate of experience: July 18, 2024",5
Iren Legkoff,RU,"Nov 29, 2024","I recommend the brandI recommend the brand. Stable and reliable operation of the Android system. I also like the control of the smartphone.Date of experience: February 16, 2024",5
Kevin O'Brien,US,"Jan 8, 2024","The Oukitel OT5 tablet I purchased a…The Oukitel OT5 tablet I purchased a month ago has problems. It doesn't play videos correctly. The settings app keeps closing down. If I try to install an app it says storage is full even though only 19% of storage is used, and it tells me to go to settings which then closes down. I have reset the tablet 3 times with the same problems each time. Oukitell told me to upload videos showing the problems, which I have 4 times along with pictures. They act as though I have not complied and keep telling me ""no returns, no refunds."" Oukitel is refusing to honor their 2 year warranty. Beware Chinese companies. The warranties and service are non-existent.Date of experience: January 07, 2024",1
Natalia Duachenko,UA,"Dec 16, 2024","OukitelOukitel, super brand 🔝 Perfect 🔝Date of experience: December 16, 2024",5
Ana Lika,AL,"Aug 10, 2024","The only brand I fully support Last year bought oukitel Wp19 and I've been in love with the endless battery .I am forgetting where I left my chat because I am charging it once in 6 days and I use it a lot .But since is 220000 mAh battery you can literally go for a trip without needing to charge.Is a bit heavy this is the only thing I ask @oukitel to upgrade in the future and more women thin design smartphones but the CPU is something else without forgetting cameras I really like Oukitel and want more...Date of experience: January 10, 2024",5
Shahrizal Rizal,MY,"Jun 9, 2023","Hi. I am unlucky buyer.Hi.. I shahrizal from Malaysia. My oukitel wp22 that I buy a month ago suddenly can't charge. I trying to contact the dealer but I got a no positive or useful feedback. Someone please give me a true one for me to contact which I can get the truth information to check my phone problem and repair immediately so I can use my phone again.Date of experience: June 09, 2023",1
Gerhard,ZA,"Apr 17, 2022","Been robbedSo I've ordered a c21 pro payed 3000 Rand and still have not gotten it this has been 3 weeks ago I. Reached out to them asking what's going on get told lies and I get no feed back now on what's happening with my order I'm now fearing I might have been robbed they do my t mail me like I've requested don't reply on my WhatsApps and lies to me if I do get through to themDate of experience: April 17, 2022",1
Petros Loukas,GR,"Nov 30, 2024","Great value for outside activities good…Great value for outside activities good battery and endurance,probably gonna look again in the future for more performance updatesDate of experience: November 27, 2024",4
Wendy Howie,RS,"Apr 27, 2024","DO NOT BUY THIS COMPANIES PRODUCTS!I gave the Wp23pro phone to my son for Christmas and it lasted less than 3 weeks. The sign in screen stopped working and the phone would not re-set. I have spent 3 months e-mailing OUKITEL and aside from computer generated replies their after-sale support is non-existent!The phone was thus a complete waste of money. Date of experience: April 27, 2024",1
Goran Jajčinović,HR,"Sep 29, 2024Verified","Well pronounced calm productWell pronounced calm product. Exact description of and features of mobile phonesand mobile phone features. Price discount. Fast and safe delivery.The mobile phone is of high quality and according to the product description. Very satisfied! Thank you Date of experience: September 23, 2024",5
Carrotoverlord,DE,"Jul 26, 2023","never againbought a wp21 ultra, it turned off randomly and it took ages before i could even send it back.when i finally got the address it got returned by the post cuz it had a battery in it.tried to ship it again and same result when i told them about it and asked if they had a more local repair shop or anything i could send it to they told me it was my problem and i could just resell it.great tips resell a phone i know for a fact has problems, so yeah i wasted 500€ on a literal brick.Date of experience: May 03, 2023",1
Morten Kostøl,NO,"May 25, 2024","Don't try to order to North part of Europe!I ordered an RT7 rugged tablet, first i got an confirmation mail, then after 2 days i got a new confirmation mail from a actual person.After 4 days i got another e-mail from another person, that the color i wanted was unavailable. I wrote. Back that i could have another color, i got a thank you and confirmation that they would ship the other ASAP. So far everything seems fine, than after another 4 days (8 days from first order confirmation) i got an email that they could not send to Norway, although they state on their page that they ship here, and they asked me to cacel my order. Instead of cancelling i asked them for the reason, next day they cancelled my order themselves, and wrote the reason was the pad i ordered was to heavy to send to Norway, and gave me a 5$ gift card 🤣Date of experience: May 25, 2024",1
José Carlos Silva,BY,"Apr 11, 2024","OUKITEL terrible experience Bought an Oukitel C32 less than one year ago.The phone is barely charging due to bad connection of charging port.GPS also not usable with Google maps and it takes ages to turn on outside There is no warranty and no support from this company. I sent an email for support, receive an answer from them to fill tha phone details and it was the last time I listen from them.Now they spam my inbox with new offers.Disgraceful company. Date of experience: April 11, 2024",1
Mike Hehir,GB,"Oct 17, 2023","Oukitel C35Oukitel C35, very bad wifi, buggy auto-connect, random reboots, performance seems a lot slower than claimed specs. Reviews by and large look fake. No response from Oukitel so returned to Amazon.Date of experience: October 18, 2023",1
Phillip Jones,GB,"Mar 29, 2024","I want yo give you a tipI want yo give you a tip. If you buy from this company,  buy from Amazon and Ebay using PayPal. Then if anything goes wrong you are covered with returns and money back guarantee. Don't buy from the website as it seems there's no communication.Date of experience: March 29, 2024",1
Paresh,GB,"Nov 7, 2023","Absolutely joke of a companyWp22 great phone until screen cracked and nobody can fix it.Contacted Oukitel customer service they told me they can't help and that I should contact the person (Amazon) and when I go to Amazon it tells me to go to oukitel web site. So much for shockproof phone. Don't think I'll be investing any more in this company.Date of experience: November 07, 2023",1
David Galich,US,"Nov 24, 2024","BuiltBuiltThe phone was built to last. It was one of the WP series and it was water resistant. I took some underwater pictures. It was rugged.Date of experience: November 24, 2024",4
Ignitus,GB,"Dec 13, 2021","Avoid at all costs.I ordered 2 phones from their site in August 2021 (almost £600) - they were (conveniently) lost in Royal Mail system. I supplied them with screenshots proving they were still ""in transit"" - but they claimed Customs had them, despite Customs telling me they don't keep mail back. I also contacted Royal Mail, who said they were ""lost in the system"" and advised contacting the seller for a refund.I have been trying since October 2021 to get it resolved - Oukitel said it was Aliexpress who had to sort it - and Aliexpress decided on 10th December 2021 to give my money to Oukitel - despite proof (via screenshots) being given of non-receipt. They claimed ""no evidence was given"" - despite numerous messages to both parties.Both claimed they would help, but both have ripped me off. Avoid at all costs.Date of experience: December 13, 2021",1
cleo sids,AU,"Dec 6, 2024","Great quality phonesGreat quality phones, great range at affordable pricesDate of experience: November 27, 2024",5
shellie clark,CA,"Dec 5, 2024","A great Company with awesome products…A great Company with awesome products and even better customer service!Date of experience: December 01, 2024",5
Roman,GB,"Oct 2, 2022","Their smartphones are only as good as…Their smartphones are only as good as they work. And when they stop - you are on your own, pal! No customer support, no communication, no local outlet to send it back to - they just don't give a toss about their customers...Date of experience: October 01, 2022",1
Sean Murray,IE,"Updated Apr 7, 2022","Bought the phone and now regret itBought the phone and now regret it. I am not a sophisticated user of phones, just need basic apps to work and to be able to answer calls - this phone does not do that - it will allow me to answer some and will drop others. It is ""clumsy"" to negotiate the apps. I contacted their support desk 10 days ago - have had no reply. I suppose you get what you pay for but this phone does not meet the basics regardless of price. Will not be going near them againDate of experience: April 07, 2022",1
Carl,AT,"Oct 31, 2023","The phone never arrivedBought a phone though it never arrived. Company doesn't want to refund money. They use SWISHIP (scam company) as their delivery agent which simply steals all the phones and marks items as delivered.Date of experience: October 26, 2023",1
Piotr Nowak,GB,"Updated Feb 19, 2024","The speakers are extremely powerfull, the sound is true & very clearIt takes 25 days to ship the item from China to the UK. I saved £30 comparing to Amazon, but I had to escalate to PayPal to force them to finally ship the item .There is no communication with the company at all, none, so better be prepared & use PayPal.5G Oukitel RT7 10-Inch 32000mAh Battery IP68 IP69K Android 13 Rugged Tablet (24+256GB) is definitelly worth the money. The screen has great resolution & is bright more than enough wnen you use it at home. The speakers are extremely powerfull, the sound is true & very clear, unlike from any tablet or laptop you can dream about. The design is also brilliant, it looks & feels in your hands like a Chinese tank. It does comunicate great with BT router, unlike for example Umidigi Bison rugged smartphone.Date of experience: February 14, 2024",5
