Username,location,date,content,Rating
Uzma,AU,"Jan 6, 2025Invited","Good arrival despite holiday periodGood arrival despite holiday period. One complaint is that they should probably include actual photos of the device rather than a condition guide, also shipping was arranged. I paid for two items at once to be shipped but the other was shipped separately? I've yet to be refunded after cancelling the order.Date of experience: January 06, 2025",3
Alty,AU,"Jan 6, 2025Verified","Very straight-forward transactionVery straight-forward transaction. I ordered an iPhone 15 Pro in Premium condition and it came mostly without scratches (there was a small one in the screen that you cannot see with a screen protector installed). The battery seems to be in excellent shape as promised.Date of experience: January 06, 2025",4
Peiton,NZ,21 hours agoInvited,"Quick arrival and amazing quality and service Arrived very fast and the phone is like brand new. Amazing service will recommend.Date of experience: January 07, 2025",5
Nasif,CA,20 hours agoInvited,"Impressed. My purchase’s condition (refurbished IPhone 15 Pro 512GB) met and even surpassed expectations. I’ll definitely be coming. Date of experience: January 12, 2025",5
Glenyse,AU,2 days agoVerified,"Love the repurposing of a pre loved…Love the repurposing of a pre loved unit. Quick delivery to the door. Would recommend this company. Date of experience: January 04, 2025",5
Kailas,AU,16 hours agoInvited,"GreatGreat! Super easy to purchase and the phone was dispatched and delivered within 3 days. Date of experience: January 12, 2025",5
Raymond McCaslin,US,14 hours agoInvited,"Everything from start to finish was…Everything from start to finish was done quickly, easily, imperfectly done.Date of experience: January 08, 2025",5
Andrea Harper,AU,6 days ago,"Hanging on to a $1300 refundThey couldn’t provide the phone that was ordered off their website so I cancelled the order (30th December). Still haven’t provided a refund and are pretending to not understand the emails sent demanding our money back. You wonder why there is no phone number? This is why. There should be an option for zero stars. Will be contacting the bank for a chargeback. Date of experience: December 30, 2024",1
Bruno,US,2 days agoInvited,"Some scratches and defectsSome scratches and defects, but great price and nothing on the screen. We'll see how it holds up and if they do a decent job with the warranty if needed. Date of experience: January 08, 2025",4
ian,AU,"Jan 6, 2025Invited","Competitive and fast delivery.Competitive and fast delivery.would be great to get a clearer picture of the battery life & screen condition. As it turned out the battery life is great, tho the screen has a lot of marks on it, which I'd not expected, as I typically use a protector. Date of experience: January 06, 2025",4
chainsaw,AU,4 days ago,"These is about the fifth time I have…This is about the fifth time I have brought a mobile phone from Reebelo and each time I have been happy with phone there service and the time it got to me. I don’t mind telling people how good they are as they have been very good to me.Date of experience: January 06, 2025",5
Penelope,AU,7 days agoVerified,"Like new, Quick deliveryQuick delivery. Extremely happy with the phone. Flawless. Feels like new. I still haven't seen other websites with better prices for the same phone. Highly recommendDate of experience: December 30, 2024",5
Sarah,AU,6 days agoInvited,"The macbook turned up really fast The macbook turned up really fast , great quality excalty like a new one. Definitely will be purchasing electronics from hereDate of experience: January 07, 2025",5
Ange,NZ,7 days agoInvited,"It was so easyIt was so easy, really good quality too. Product and delivery were bang on, would definitely recommend.One very happy customer!Date of experience: January 06, 2025",5
Janice,AU,2 days agoInvited,"Good range of phones that I was…Good range of phones that I was interested in. Easy transaction. Prompt delivery. Date of experience: January 07, 2025",4
Ross,NZ,2 days agoInvited,"Affordable pricesAffordable prices - Quick service. Accurate for what you get (quality wise)Date of experience: January 12, 2025",5
Adam Tyler,AU,"Jan 6, 2025","DO NOT USE REEBELO THERE PRODUCTS ARE FROM A SECONDARY COMPANY AND NOT REEBELO DO NOT USE REEBELO THEY ARE THE WORST COMPANY IVE EVER DEALT WITH THAT INCLUDES CENTRELINK! AFTER PURCHASING A ‘excellenct condition’ IPHONE WHICH CAME FROM A SECONDARY COMPANY AND NOT REEBELO. BY DAY 10 MY SCREEN BEGAN LIFTING OFF FROM THE IPHONES BODY. THE NEXT DAY THE SCREEN THROUGH UNEQUAL PRESSURE OF NOT BEING CORRECTLY INSTALLED AND SECURED TO THE IPHONE BODY CRACKED. ADVISED THAT ALTHOUGH IN AN OTTER BOX CASE THEY WOULD NO LONGER COVER IT UNDER THEIR WARRANTY! NOW I HAVE A ‘excellent condition reebelo’ IPHONE WITH A BATTERY LIFE OF 2 HOURS FROM 90% CHARGE AND A BACK CAMERA THAT WHEN IN USE STATES AND I QUOTE ‘Important Camera MessageUnable to verify this iPhone has a genuineApple camera’SO AVOID AT ALL COSTS STICK TO THE BIG TELCOS AND APPLE.REEBELO ARE THE DEFINITION OF THE DODGEY SECOND HAND CAR SALESMAN SELLING YOU SOMETHING THAT IS NOT AT ALL WHAT THEY SAY IT IS!@reebelo_official @reebelo.au @apple  @acccgovau @acccproductsafety Date of experience: December 18, 2024",1
Bruno Neves,AU,"Jan 6, 2025","Bought an iPhone 14pro max “premium” on…Bought an iPhone 14pro max “premium” on their website. The phone itself was looking good. however the screen is not working properly, stops working out of the sudden. iPhone freezes and is not even possible to switch off. Clearly is a internally damaged phone. I’ll return the phone, my problem is: I paid more for a premium phone (5% of their range, at least is what they say) and CLEARLY no one evaluated the phone properly. Also it’s impossible to contact them directly. Date of experience: December 11, 2024",1
Zainul Arifin,SG,3 days agoVerified,"Reebelo is a reliable and east to use.Reebelo is a reliable and user -friendly platform. Simple and the prices they offer is very competitive.  Date of experience: December 29, 2024",5
Ben W,AU,6 days ago,"False advertisingFalse advertising. Don't believe the 'premium' category. The phone I bought was falsely advertised as being 'premium' but came with low quality replacement components.The screen is a cheap LCD, not an oled as the iphone 12 was released with. This was not specified anywhere in the listing. The back glass was a cheap replacement that broke from a minimal contact of being in my pocket with my keys. I have an iphone 13 to compare it to in this regard, which has sustained much higher impacts with no damage at all.The battery that was advertised as new is also faulty, exhibiting erratic behaviour.I am extremely disappointed with the product and it is not at all what was advertised.When I contacted them for a repair or replacement they said that the cracked back glass voided the entire warranty and weren't interested in hearing about the falsely advertised 'premium' phone with cheap parts that was delivered.Date of experience: November 13, 2024",1
Jonathan,US,13 hours agoInvited,"So far so goodSo far so good. Only been using the phone for 2 days. Easy ordering process. We'll see how it goes. Date of experience: January 12, 2025",5
Eva,US,18 hours agoInvited,"It was very fast shipping and great…It was very fast shipping and great customer service for usDate of experience: January 12, 2025",5
Charles,AU,A day agoInvited,"It was all pretty painlessIt was all pretty painless, the computer was delivered ahead of schedule and it works well.Date of experience: January 12, 2025",4
Brittany,US,3 days agoInvited,"Best way to get money for old broken phonesThe process was really easy. I have many old, broken phones that I couldn’t trade in anywhere, but Reebelo was willing to take them and sent money quickly. Date of experience: December 16, 2024",5
shemlinex muchai,AU,Updated 8 hours ago,"So I innocently bought an iPhone 14pro…So I innocently bought an iPhone 14pro as a Christmas gift on 19th Dec 2024(I know I was late so I assumed id maybe get the order a little after the day). Together with the phone I also bought a screen protector.1)Only the screen protector seemed to have a tracking ID on the 23rd. I don't think much of this and assume both items must then use the same package or parcel. 2)I also notice I used a wrong suburb code for my address when I shipped my order. Its too late to correct the address from rebeelo so I get in touch with the couriers; Aus post; with my one tracking ID.3)The aus post can be annoying to reach and be in touch with which I finally do on 07/01/2025 with valid info that my package was in lost and found warehouse but no way it had any kind of phone inside since it was a letter and the weight was too low.4)That confirmed my fear that the package/ parcel shipped out was just the screen protector! For 3 weeks now!5)So did my phone even get dispatched? Rebeelo got to my case and with their quick response I found out they had not posted my phone's tracking ID. Thats the only issue with them, they don't post tracking IDs of shipped out items separately. I think its a bug on their dashboard, 3 stars only because the customer care team responded to my emails promptly. Hopefully I get my phone no later than tomorrow now that they emailed my phone's tracking linkUpdate: 13/01/25I haven't received any useful information from the team despite sending out emails on the ticket. Clear this case ASAP the confusion can be stopped by the sender of the parcel. Date of experience: January 10, 2025",1
Lisa Stokes,AU,"Jan 6, 2025","I previously wrote a good reviewI previously wrote a good review. But have realised now my phone has issue making phone calls out, I got one that stated excellent condition. They want me to return it but then I am without a phone for a while 🤷‍♀️Date of experience: January 01, 2025",1
Georgia MmKay,AU,5 days ago,"Excellent customer experience and easy returnsTheir customer experience is excellent. My order had a quality issue and the returns process was extremely easy, hassle free, and they covered the cost. Date of experience: January 08, 2025",5
MURRAY,AU,2 days agoInvited,"PURCHACE CONFIDENCE delivery ,choice of condition of…Prompt delivery ,choice of condition of a used product and confidence that I was never going to be ripped off when buying something this expensive.Date of experience: January 11, 2025",5
Bob,US,12 hours agoInvited,"Easy to orderEasy to order, fast delivery and phone was better than I expected.  Date of experience: January 05, 2025",5
Julie,US,2 hours agoInvited,"QualityI was satisfied with the shipping time and quality of the phone Date of experience: January 13, 2025",5
John O'Connor,AU,2 days agoVerified,"There was a scratch on the screen even…There was a scratch on the screen even though the phone was appraised as in excellent condition.Date of experience: January 04, 2025",2
Sherrye Olney,US,5 days ago,"I was nervous My second time ordering,  I messed up and accidentally duplicated my order (do not do a te-order even if it's still showing in your cart)   I reached out via email, they were not able to cancel the order BUT, I returned the product in it's unopened FedEx package and refunded my money sooner than expected.   I was nervous because they didn't have a working phone number,  but they responded immediately and I will definitely buy from them again. Date of experience: December 26, 2024",5
Peter Mace,AU,7 days ago,"no  contact availlableHave a problem with a US phone sold to me in Australia I am un able to contact Reebelo in any form there is no phone number and email does not workDate of experience: January 04, 2025",2
Tina Kuzniacki,US,2 days agoVerified,"Received exactly what I ordered.Received exactly what I ordered.Beautiful phone, works great.Date of experience: January 11, 2025",5
AK,AU,5 days agoInvited,"The phone i got is working amazingly…The phone i got is working amazingly and is such an amazing purchase. Will definitely come back.Date of experience: January 08, 2025",5
Taisa,US,2 days agoInvited,"GreatGreat, everything working perfectly fine and came in a timely manner. Date of experience: January 11, 2025",5
Miellee,AU,A day agoInvited,"Well the phone is absolutely AMAZING…Well the phone is absolutely AMAZING it’s like new although it’s missing one star only because I wish the packaging was just a bit more like safe as in maybe putting in some of those packing sponge things and just making it tight in the box just to insure the phone doesn’t get damage but other than that I LOVE IT.Date of experience: January 12, 2025",4
Barbara,US,A day agoInvited,"Nice phones at nice pricesNice selection of phones at fair prices. Arrived quickly and in great shapeDate of experience: January 12, 2025",5
Frustrated,US,7 days ago,"LOUSY CUSTOMER SERVICEI ordered an iphone 14 pro but got the wrong charging cord with it. Here I am 20 days after alerting them and they have yet to either send the proper cord or refund the amount of the cord that I will go buy myself. Date of experience: January 06, 2025",1
Wendy,US,2 days agoInvited,"Great experience..Great experience... Ordering was simple, the tracking updates were accurate and the time we receive the product was exceptional.  Date of experience: January 11, 2025",5
Ryan,AU,"Jan 6, 2025Verified","My daughter was wanting an updated…My daughter was wanting an updated phone and was very happy with the result. Lots of variety and great if you're happy to have a refurbed product. Highly recommend!Date of experience: January 06, 2025",5
Molly Brunt,AU,5 days ago,"Horrible “brand new battery”The phone came in “ok” condition I payed for good I couldn’t imagine how bad the acceptable one would be but the major problem I have is that I payed for a “brand new battery” and sure it says %100 battery health but the battery doesn’t last at all the percentage literally goes down 3% every 30 seconds and mind you I payed around $59 for the apparent new battery even in the settings it’s telling me “your battery’s health has significantly degraded” and it’s telling me I need to go get it replaced. I at least deserve a refund for the “new battery” so i can go get it replaced by apple themselves. Never buying from rebeelo again I do not recommend Date of experience: January 08, 2025",1
Angela Smart,NZ,1 days agoVerified,"So fastSo fast, superior product. Exactly what we wanted.Date of experience: January 12, 2025",5
Michelle Pati,AU,5 days ago,"Phones are faulty and does NOT COME IN…Phones are faulty and does NOT COME IN “perfect condition”. Brought a new phone and it has overheated multiple times in 1 day of having it. I do not recommend. AT ALL.Date of experience: January 07, 2025",1
Amandeep,ES,A day agoInvited,"The product I received is very nice n…The product I received is very nice n in great condition. Service is very quick. Date of experience: January 12, 2025",5
Joy,CA,19 hours agoInvited,"The package arrived on time and the…The package arrived on time and the package looks band new.Date of experience: January 12, 2025",5
Dan,AU,1 days agoInvited,"Excellent condition product and fastest…Excellent condition product and fastest than expected postage. Very happy with it. Date of experience: January 12, 2025",5
John Knelias,AU,A day agoInvited,"Highest qualityThis is my third purchase in the last 4 years. My iPhones have always been of the highest quality. Date of experience: January 12, 2025",5
Josh,US,20 hours agoInvited,"Phone came in like new conditionPhone came in like new condition. Looks like new. So far I am happy with my purchase.Date of experience: January 12, 2025",5
Shiloh Holtzman,AU,7 days ago,"Misleading Product Descriptions and Poor Customer ServiceI am extremely disappointed with my experience with Reebelo. I purchased an iPhone 14 Pro in ‘excellent’ condition for over $1,000, only to receive a device with a chipped camera and multiple scratches on the screen. This is far from the condition advertised.When I reported the issue, I was offered a mere $35 partial refund, which is insulting given the condition of the phone and the amount I paid. After further communication, I requested a fair partial refund reflecting the true value of the phone, as I rely on my phone for work I did not want to replace it. Despite my clear explanations, the process has been unnecessarily time-consuming and frustrating, with no resolution yet.Reebelo has failed to deliver on its promises and has demonstrated poor customer service. I cannot recommend this company and will not be purchasing from them again.Date of experience: January 03, 2025",1
Yvon,CA,10 minutes agoInvited,"Easy to deal with ReebeloEasy to deal with Reebelo, fast deliveryDate of experience: January 13, 2025",5
Boon,SG,7 days agoVerified,"Great experienceGreat experience, item as good as new with original warranty. Recommend to consider for future purchases. Thank youDate of experience: December 29, 2024",5
Michael,AU,6 days agoVerified,"We got exactly what we orderedWe got exactly what we ordered, perfect condition and delivered on time. Great products.Date of experience: December 31, 2024",5
Ross,AU,"Jan 6, 2025Invited","Bought an IPhone 13 miniBought an IPhone 13 mini premium and it’s like brand new! No scratches, clean and battery is 100% health. We’ll definitely buy again from Reebelo. Thanks!Date of experience: January 06, 2025",5
yna,SG,"Jan 6, 2025Verified","good servicereceived my cable in just a few days, ordering from reebelo is always seamless and quick! Date of experience: January 06, 2025",5
James,AU,16 hours agoVerified,"Quick easy and great qualityDevices delivered quickly and were excellent qualityDate of experience: January 12, 2025",5
Nicholas,US,6 days agoInvited,"Pretty good communicationPretty good communication.  Shipping was a bit slower than expected but still not bad.  Date of experience: January 07, 2025",4
anne ronaldson,NZ,3 days agoInvited,"prompt and efficient service and free…prompt and efficient service and free delivery And it helps the e waste -  what no to likeDate of experience: January 10, 2025",4
John,AU,10 hours agoVerified,"Quite happy with the quality and price…Quite happy with the quality and price of the devices we've purchased.Date of experience: January 13, 2025",5
Skylar,CA,Updated 3 days ago,"Wrong phone came in, not first issueI’ve had some minor issues with receiving items of lesser quality than I ordered (with no compensation or notification of such, before or after the fact), but this last order was the last straw for me. I had to replace the last iphone I got from Reebelo because it shattered (my fault, not theirs), so I figured I’d replace it with another red iphone 12, but this time I got the battery upgrade. Two weeks go by, I realize it’s the day my shipping estimate showed, and my phone has NOT been shipped out. Reach out to customer service — turns out the estimated shipping date given at checkout is NOT an arrival date, it is an estimated DISPATCH date, and they were very cut and dry about informing me of such, as if I should have known when that isn’t made clear at all. Fast forward to today, about a week later. My phone arrives. I’m excited because I love hacing a red iphone and the one I am currently using had to be put in a skin case to keep the glass from falling off, meaning my phone was completely hidden. Immediately upon opening the box, something seems weird — there’s a screen protector and a bumper case that I didn’t order in the box on top of the phone box. Weird, but I’m not about to complain.Until I realize the next few things: the phone box itself was never taped or held shut in any way, and the bubble wrap was not very tight in the box. It ABSOLUTELY could have flown out at any time, but fortunately didn’t. The charge and SIM tray pin were both left in the box directly against the screen, which FORTUNATELY didn’t get scratched. And to top it all off: it’s not even the phone I ordered. Instead of the nice, red iphone 12 I ordered, I got a black one, which I suspect is why I got the screen protector and bumper case alongside it without being charged. I have yet to hear back from customer service, but I suspect the suggested fix will be to send the phone back and have a replacement shipped out. If I had any faith that that would take less than a month, I’d likely take the offer, but I can’t go more than another few days with a shattered phone, so I’m just going to have to suck it up and use it. Edit: After further inspection, I discovered that I also did not get the 100% battery capacity upgrade that I ordered and the phone case is for an iPhone 12 Pro Max — the phone is an iPhone 12, so it doesn’t even fit. No response from customer service as of yet in regards to any of this, either. Date of experience: January 09, 2025",3
Matthew,AU,2 days agoInvited,"Great process & prompt deliveryGreat process & prompt delivery. Thank youDate of experience: January 12, 2025",5
Calvin Wharton,CA,18 hours agoInvited,"Easy to find the phone I was searching…Easy to find the phone I was searching for and speedy response. Date of experience: January 12, 2025",5
Adam,AU,17 hours agoInvited,"Quick deliveryQuick delivery, great iPhone 14 ProDate of experience: January 12, 2025",5
cam,QA,A day agoInvited,"A pleasure to do business Great prices, simple purchasing and fast delivery. Date of experience: January 12, 2025",5
DB,US,2 days agoInvited,"Good experience Prompt shipping and item was as described. We'll shop here again next time we break a phone. Date of experience: January 11, 2025",5
Guy Hozavsky,AU,2 days agoInvited,"Great productsGreat products. Bought an iPhone 12 and iPad 9th gen and both work wonderfully. Very happy. Date of experience: January 12, 2025",5
Magdalena Herreshoff,US,7 days ago,"DO NOT buy from ReebeloDO NOT buy from Reebelo. Reebelo uses vendors from all over the U.S. and their Customer Service is outsourced and inflexible. I bought an iPhone 11PRO on November 11, 2024 and didn’t receive it as promised. Customer service said they would look into it but they were taking a long time. I figured out from the invoice that it was coming from Texas. I found their phone number for the vendor and talked to someone in a warehouse who said they had sold the phone to someone else and initiated a credit which I received same day. I then ordered again from Reebelo an iPhone 12 Pro which came from vendor Cellfeee in NY. When downloading my data, the phone immediately overheated. Reebelo had me return it after clearing out all data and sent me a replacement from same vendor Cellfeee that immediately overheated as well and the phone stated battery was severely degraded. Reebelo wanted me to clear it out again and sent it back to them. This is all on my time to clear it out, pack it up and take it to UPS Store which is not nearby. I requested instead a refund for the battery replacement for $89. They refused. Cellfeee had offered $30 which I countered with $45 for half the cost. Now Cellfeee says it cannot do anything and that I have to return it to them to make a decision on the condition of the phone. They don’t care that the fault lies on their side. Customer Service sends out canned messages. I have decided to keep the phone and replace the battery at my cost. I made a BIG MISTAKE dealing with Reebelo and its vendors.Date of experience: January 06, 2025",1
Sharon,NZ,A day agoVerified,"Very smooth transactionVery smooth transaction, product excellent and as described.  Date of experience: January 12, 2025",5
Stephanie,CA,Updated 5 days agoInvited,"Laptop arrived quickly and in excellent condition My laptop arrived quickly and was well packaged. It was exactly as described.Date of experience: October 18, 2024",4
Charles,US,A day agoInvited,"best place to get used phonesIve bought two phones and a laptop from this site its simple easy to use.Date of experience: January 10, 2025",5
Deborah,US,2 days agoInvited,"Price and Customer service Great price, cheap extended insurance, great product.Date of experience: January 11, 2025",4
Sam,CA,16 hours agoInvited,"Great phone delivered quicklyPhone was in mint condition. Very happy.Date of experience: January 12, 2025",5
Shiva,US,17 hours agoInvited,"Device turned out to be greatDevice turned out to be great. Recommend.Date of experience: January 12, 2025",5
Mollie,AU,5 days agoVerified,"Just completely seamlessJust completely seamless and the product is working well so far Date of experience: January 08, 2025",5
Luvina,US,7 days agoInvited,"When it arrived it looked brand new I…When it arrived it looked brand new I purchased it for my grandson and he loves it Date of experience: January 06, 2025",5
Tom,US,6 days agoInvited,"Got exactly what I wanted for less than…Got exactly what I wanted for less than new. It came quickly and couldn’t be happier!Date of experience: January 07, 2025",5
Mark,AU,5 days ago,"IphoneiPhone received speedily and in great condition Date of experience: January 08, 2025",5
Juli Marshall Cole,AU,A day agoInvited,"Great prices, lots of optionsReally easy, lots to choose from, lots of options at a great price Date of experience: January 12, 2025",5
customer,NZ,2 days agoInvited,"Easy fast and cost effectiveEasy fast and cost effective Date of experience: January 12, 2025",5
Ryota,SG,7 hours agoInvited,"shipment itself was delay but support…shipment itself was delay but support team investigate immediately and recover very fast.Date of experience: January 11, 2025",5
Marko,AU,A day agoInvited,"Smooth and very fastSmooth and very fast! Didn’t expect such a good service Date of experience: January 12, 2025",5
