Username,location,date,content,Rating
Gary,GB,"Updated Mar 13, 2024","Problematic build from NZXT fully refunded. I purchased an NZXT Player Two Prime (black case version) PC on Sat 24th Feb 2024. The PC was delivered on the 28th Feb 2024.On un-boxing:I had some initial concerns as there were packing materials on the inside of the PC tower.This included a rubbery polystyrene like piece, supporting the case end of the graphics card (possibly treated), a sticker on the AIO CPU Cooler, saying to plug in SATA before use, and a piece of cardboard over the internal fan, facing the Graphics card at the bottom of the case. Also they had forgotten to remove the statically attached film from the inside of the glass panel.On the black version of this NZXT case, the glass is a dark tempered type, making it very difficult to spot those packing materials. I called NZXT (I got through straight away), and I was told to ignore the sticker on the AIO Cooler as it was merely for protection during shipping.I was disappointed with the documentation provided with this PC, as there was no mention of this internal packaging, also all the other paperwork was just generic part assembly, no technical information on the actual components inside.Important Tips:If you buy this PC, please get yourself an anti-static wrist strap and cable that goes to a specialised wall plug (if your local mains supply has an earth).  I luckily already had this equipment costing me about £25. Also remove the outside plastic with the case sealed (not opened), and if there’s plastic on the inside, take the side panel into another room to remove it, and earth yourself again before going anywhere near the open PC case.This PC’s Specs as confirmed in the conformation email:CPU: AMD Ryzen™ 7 5800XGPU: NVIDIA® GeForce RTX™ 4070 Ti SuperMemory: 32GB (2 x 16GB) DDR4 3200 MhzStorage: 1TB NVMe M.2 SSDMotherboard: B550Cooler: NZXT Kraken 240 RGBPower: 750W GoldCase: NZXT H5 EliteSoftware: Windows 11 HomeParts verified by MSI Control Center (Software that I installed myself):Gigabyte B550 AORUS ELITE AX V22x 16 GB DDR4-2400, Unknown TEAMGROUP-UD4-3200Graphics: RTX 4070 Ti SUPER 16G VENTUS 2X Series, 16376 MBDrive: NVMe KINGSTON SNV2S1000G, 931.51 GBOn using this PC:It took me sometime to find software, that could tell me what some of the internal components of this PC actually were. (AIDA Extreme was pretty useless, as were most common tools.)I had seen that the MSI logo was printed on the RTX graphics card, so I thought I’d give MSI’s Control Center a go. I soon realised that the DDR 4 ram was not running at the proper speed.Both MSI’s software and Windows 11 reported a ram speed of 2400 Mhz, instead of the 3200 Mhz it was supposed to be running at.Prior to that discovery I had been running some bench tests using Cyberpunk 2077.When I compared this PC’s results to other 4070 Ti Super Graphics Cards, I noticed this MSI “RTX 4070 Ti SUPER 16G VENTUS 2X Series, 16376 MB"" ran 40 FPS slower than the MSI VENTUS 3X Model (refers to the number of fans) in an online comparison at 1080p.Then I noticed occasional texture issues, like a rippling or shimmer effect in the game, which did not occur on my old PC with an RTX 3060 Ti card installed, or online in any YouTube video. (A percentage of lower frame rates can be caused by using a comparatively weaker CPU, the rest of the poor performance was most likely the RAM not running at full speed.)A very minor niggle was that the “NZXT Kraken 240 RGB” is actually eject-able under Windows 11 USB, (there’s an unofficial guide online on how to fix this).Tip: I have a strong feeling this PC would look much better in white after seeing the black version. I found the black versions dark glass negatively impacted on the lighting inside (especially the coolers display), and with no lights on the graphics card or below it, I wasn’t impressed by it.Conclusion:I sadly had to return this PC for a refund, as I was unwilling to troubleshoot this PC given its price tag. I was sent an email with a pre-paid returns label (I had to print) to use via DPD’s drop-off service. It took slightly less than a week, after it’s arrival back with NZXT to be notified of my refund, and nearly a day and a half later it was back in my bank account.Date of experience: February 28, 2024",3
Invicta Crimson,US,"Mar 31, 2024","I wast about to buy a player 3 but…I wast about to buy a player 3 but after reading these reviews I belive I will try esle whereDate of experience: March 31, 2024",2
Justin Villegas,US,"Apr 26, 2024","Their customer service goes above and…Their customer service goes above and beyond, they are doing such an amazing job when it comes to dealing with customer issues, I had to get my kraken z73 replaced because of the pump going bad after 4 years, it was still under warranty and the person helping me made the process easy, she was so helpful and patient, helped me get my Kraken z73 replaced for a new unit without a single issueDate of experience: April 26, 2024",5
BakeSmash,US,"Updated May 27, 2024","Very Poor ExperienceIt's been almost 3 months, 25 emails, 4 telephone calls, and I'm still waiting for my stick of RAM. The initial call was promising, quick, and painless. However, every subsequent interaction has been frustrating.1. Poor Communication:After the initial call, several confusing emails were exchanged about the status of my RMA. I was unaware that I needed to send the device in first, as this crucial detail was never clearly explained to me. It seemed like basic information that should have been communicated upfront. I have never done an RMA, for anything.2. Lack of Clear Instructions:After I shipped the one faulty stick of RAM, a month later, I discovered they expected 2 sticks. I guess they are grouped in pairs? Again, I had no idea. A simple instruction outlining what items needed to be shipped and the process moving forward would have prevented this misunderstanding.3. Delayed Responses:Each email exchange is taking several days, sometimes even weeks, for a response. This unnecessary delay drags out the entire process. I found myself waiting long gaps between emails just to understand the basic expectations.4. Inconsistent Follow-ups:Despite multiple calls to customer support, I am repeatedly told someone will reach out to me. However, no one does. I called and spoke to customer support three times so far, and each time, I was assured that someone would contact me. This has never happened, neither by phone nor by email.5. Warehouse Delays:After shipping the 2nd stick of RAM, I was informed of warehouse delays (Keep in mind, this is already 2.5 months into the interaction). Weeks have gone by without any updates, further prolonging the already lengthy process.6. Automated Emails:I received aggressive automated emails threatening to close my ticket if I didn't ship the part within a certain timeframe, despite already complying.After three months of waiting and continuous misunderstandings due to the lack of communication and clear expectations, I am over it. I even asked for my equipment back to purchase the new RAM myself. I'm sure it's cliche to say this is ""the worst customer service experience I've ever had.""... but that is all I can say at this point.NZXT: RA240291854Edit: NZXT, your generated response is a nice touch. More empty promises. Company is such a scam.Date of experience: February 27, 2024",1
Kacper,PL,"Updated Feb 6, 2024","NZXT doesn't provide warranty support!NZXT doesn't provide warranty support!@update: as you wish, ticket number: 1883856Date of experience: February 02, 2024",1
Sandy I,US,"Updated Dec 19, 2023","First and last time buying anything…12/19 - I just contacted FedEx and your company may still be able to expedite my shipment being that it’s still in their warehouse in California. Instead of responding with these automated “apologies”, why don’t you have someone from your team do the right thing and call FedEx!!! RESPONSE TO NZXT: multiple ticket numbers as I kept reaching out for someone to help me. Ticket numbers as follows: 1826629, 1834200, 1834515, 1834813. I begged and pleaded for the staff to help me. This was a gift for my son that I have not seen in 6 months, and he specifically requested this a PC from your site. As a business owner of 27 years, I’ve never hesitated to go above and beyond for my customers. It would’ve taken someone 5 minutes of their time to contact FedEx as I called FedEx several times as well, and they kept telling me the merchant had to call them. The experience with NZXT was very distasteful to say the least and to purposely not want to help your customer is appalling. First and last time buying anything from this site. Super delay in shipping the PC as I placed the order on November 24th. I contacted them a few times and explained that I needed it for Christmas. They shipped it out this morning with regular ground shipping with a delivery date after Christmas! I contacted FedEx and they informed me that the merchant still had time to call them and have the shipping changed. I literally begged these people to call FedEx and change the shipping, even offered to pay for the expedited shipping….kept getting the same response, “unfortunately, the time window has closed”. I’m telling them over and over that FedEx was willing to change the shipping with no empathy from these people. Putting your best foot forward and doing the bare minimum for your customers goes a long way, but instead you’re being connected to a “representative” that’s giving you generic BS responses. The best part about this company - if I want to go buy another PC to have in time for Christmas, they will charge me fees of roughly $250 to return the one purchased from them ;) Happy Holidays to the staff at NZXT!Date of experience: December 15, 2023",1
Hybert,US,"Feb 27, 2024","Do NOT trust their pre-built PCsI was looking to build/buy a budget PC that had 3-4 DisplayPort/HDMI ports. I came across NZXT's pre built PCs and they immediately caught my eye. The Player: One is their cheapest option so I looked at that first. The GPU was a Geforce RTX 3050 and the images on their website didn't show the back of the PC so I decided to chat to them live.I started with the chat bot, who told me, ""The GPUs we offer for our pre-built gaming PCs typically have two to three DP (DisplayPort) connectors and usually a single HDMI connector. However, the exact number can vary depending on the specific model of the GPU.""Then, the bot sent me a link to their FAQ the also stated, ""In almost all of the GPUs we offer, they have two to three DP (DisplayPort) connectors and usually a single HDMI connector. Examples of these connectors are shown below.""JUST to be 100% sure, I left them an email asking how many DP/HDMI ports the Player: One PC would have and they said ""The PC usually comes with 3 DisplayPort and 1 HDMI connection on the graphics card. In rare cases, this can also be 2 HDMI and 2 DisplayPort connections, but we can not provide details about that before the PC is built, as the components can change based on our availability.""I was now CERTAIN that I would be getting 3-4 ports on my GPU, at least 2 of them would be DisplayPorts and the rest would be HDMI ports.Lo and behold, the PC I receive has 1 DisplayPort, 1 HDMI port, and 1 DVI port on the GPU. HUH??? After 3 sources told me one thing, I get something completely different???I was quite annoyed and contacted their support to see how this could get resolved. I asked if swapping the GPU for the correct one would be possible and they said no. I then asked for a refund and they said I would not get a full refund, and would have to pay for the assembly, shipping, and windows.So I don't get my money back because you lied to me about what I would be getting? You gave me something I did not buy which is extremely annoying because the ONLY reason I chose NZXT was because the price for the PC with the 4 ports on the GPU I needed was great, but it turned out to be a complete lie.I did not get what I paid for, and I now have to pay for what I don't even get! What a joke!Date of experience: February 26, 2024",1
Roland Krueger,DE,"Dec 19, 2023","Good ProductsGood Products, and they look great. Good service. Can recommend.Date of experience: December 19, 2023",5
Marcel Frank,DE,"Mar 25, 2024","Perfect products paired with an great…Perfect products paired with an great support. Date of experience: March 25, 2024",5
Diego “Deo” Uzcategui,US,"Feb 28, 2024","Great products and great customer…Great products and great customer service. Date of experience: February 27, 2024",5
Pat Garrett,US,"May 13, 2024","DO NOT BUY A PC FROM NZXT!!!!I know people don't read a lot of this but at least read the next part.There is a reason they aren't accredited by the BBB (Better Business Bureau) and have and F rating with a 1.36/5 star review. seriously go look.I bought a PC from then in August of 23. by December the pc started having overheating issues and in January I had to send it in for repairs. the customer service tech told me it would take 3-5 business days (that was a lie). there website said 7 business days (lie). 13 business days later my pc was finally being shipped back to me. they told me pc was damaged during shipping (lie). they said the case, gpu, cpu, and motherboard all had to be replaced. if all of those were damaged from shipping the odds of my pc even starting would have been astronomical let alone actually working pretty decently for 4 months. that's how I knew they were lying. So, I get my pc back and the end of January. now here we are 3 months later, and I am having issues with my gpu. talked to a customer service rep and asked to talk to a supervisor and they said one would contact me for the end of the day (lie) this was 05/09/24. the same customer service contacted me and said they would refund my initial shipping cost and I need to send my computer in to be fixed. a supervisor never contacting me, and I didn't ask the rep to talk to one for me. I replied asking for the info to send my stuff back and that I still wanted to talk to a supervisor. I have sense been ghosted and haven't heard anything back. It is blatantly clear this company only care about keeping their profit margines high and if you get send a dog water PC like I did they aren't going to fork over any money to actually fix it, they are just going to switch out the trash parts they used initially with even more garbage parts.My Advice:1. Don't buy a pc from NZXT (correct choice) 2. Buy a pc from NZXT (wrong choice) if you do buy a pc from this company make sure you get the largest warranty they have. Second, download OCCT (stress test/ benchmark program) and I would say run a test weekly to make sure your pc is running how it should be. Consider it like hoping on to your favorite game to do a weekly quest. hopefully this never happens to anyone else but when your pc starts failing test contact their customer support team and send it back to be fixed and if you have to keep doing that until your warranty expires. they clearly would rather spend more money fixing their own mistakes then to actually make a good pc from the start.Date of experience: May 12, 2024",1
Jared Rabideau,US,"Jan 18, 2024","Very helpful and responded very quicky.Date of experience: January 18, 2024",5
Mr s maddison,GB,"Mar 13, 2024","Worst customer service going A company willing to sell you expensive items but not willing to sell you replacement parts leaving you with expensive paper weights.I bought a brand new 240mm nzxt kraken RGB for £160 now by fault of my own I pulled slightly to hard on the breakaway cable that plugs into the base of the aio understandably ebuyer who I purchased the item through said that they can't sk much as it was user error which is fair enough so I got in touch with nzxt UK directly where I was told that they will not sell me a replacement break away cable as the only ones they have are "" reserved for warranty"" so I am literally left with a completely dead aio 4 days after buying it all becauas nzxt can't be bothered to sell me a cable.Date of experience: March 12, 2024",1
Kliencie,PL,"Mar 19, 2024","Great Customer SupportGreat Customer Support. Thank you.Date of experience: March 12, 2024",5
John D,US,"Dec 19, 2023","Fantastic quality and responsive…Fantastic quality and responsive customer service. Too rare these days. 👍👍👍👍👍Date of experience: December 18, 2023",5
Anon,RO,"May 13, 2024","Great productsGreat products, great customer service!Date of experience: May 13, 2024",5
Jared Lehman,US,"Dec 30, 2023","NZXT is the best in the businessNZXT is the best in the business. I’m very happy with there businessDate of experience: November 03, 2023",5
Cooper Roberge,US,"Nov 14, 2024","the best customer servicethe best customer service Date of experience: November 13, 2024",5
Alexs Boyle,GB,"Mar 8, 2024","Great products great customer serviceDate of experience: February 24, 2024",5
Leah Tibbets,US,"Apr 24, 2024","Their customer service is very helpful!Date of experience: April 24, 2024",5
Sandro Riley,SE,"Jan 19, 2024","The key is to remeber that things dont…The key is to remeber that things dont last forever.Date of experience: January 19, 2024",5
Jesse,DE,"Dec 2, 2024","Complete scam of a companywatch the video on Gamers nexusDate of experience: December 02, 2024",1
Samuel Rojas,US,"Mar 8, 2024","Great service and fast Instantly helped me and got a hold of me fast Date of experience: March 08, 2024",5
Feras Suleiman,AE,"Jan 2, 2024","Best after sale service you could ever…Best after sale service you could ever haveDate of experience: January 02, 2024",5
David,MX,"May 17, 2024","everything good everything correct..everything good everything correct... and I'm glad.Date of experience: May 01, 2024",5
jsdjifjskx,GB,"Mar 20, 2024","good pcgood pc, arrived in two daysDate of experience: February 23, 2024",5
Peter Atkinson,GB,"May 18, 2024","Good help and support and good productsGood help and support and good products Date of experience: May 18, 2024",5
gooby,US,"Jul 21, 2024","So i bought a pc in 2019 for around 4…So i bought a pc in 2019 for around 4 thousand and since it came the leds never worked and it had so much buggs and issues i tried fixing it myself but as i dont know much about computers i just used it like this since 2019 i have dealt with crashes and slow fps on every game minecraft gets no more than 120 i contacted them since the start and they just didn't seem to care they're replies were with a purple shrek emoji and fast forward today my lil brother got his first budget pc for around $800 and this pc is 10x faster than mine and is just crazy how ive dealt with this much problems the grapics card has been broken since the pc came if i step too hard on the ground the pc will crash its been like that since day 1 i have so much issues like the ram i tried fixing the pc myself once and the ram was not pushed in all the way idk if its because i ordered this with a 1-2 day shipping but it's just so much and seeing my lil brother have a budget pc that is running perfect just brought me back to the website i have a i9 9900k and a 2080 ti just sucks that i was the unlucky 1 cause 4k for a pc was very hard for me but i wanted it and ig some of us will be unlucky this is my first ever review too lolDate of experience: July 21, 2024",1
Jake,US,"Mar 24, 2024","fantastic case and even better customer…fantastic case and even better customer service.Date of experience: March 23, 2024",5
Joshua Powers,US,"Apr 19, 2024","So Skidi was fast and easy to doDate of experience: April 19, 2024",5
Isaiah Higbee,US,"May 16, 2024","Always a great experienceHelped with radiator issue.Date of experience: May 16, 2024",5
Henry Turner,US,"Dec 1, 2024","Scam dont buyDate of experience: November 28, 2024",1
Giuseppe Giliotta,IT,"Feb 7, 2024","Top assistance👌Date of experience: February 07, 2024",5
Ketch,FR,"Jan 11, 2024","amazing support!Date of experience: January 11, 2024",5
Loc Doan,CA,"Dec 1, 2024","Scam corporationDate of experience: November 30, 2024",1
Jon Hicks,US,"Apr 5, 2024","Unbelievable professionalismDate of experience: April 04, 2024",5
Fatmir Shukaj,AT,"Dec 18, 2023","I had a very pleasant experience with…I had a very pleasant experience with nzxt support ( product also)Date of experience: December 08, 2023",5
duncan brown,GB,"Dec 18, 2023","Top companyWhat great company that cares about they customers five stars all day long from meDate of experience: December 18, 2023",5
mboyo cress,US,"Dec 18, 2023","Top notch customer serviceGreat products, Great website, EXCELLENT CUSTOMER SERVICE.  Could not be more pleased. My concerns were addressed promptly and remedied very quickly.  The customer service dept communicated every step of the way.  Great companyDate of experience: December 12, 2023",5
Cristo,US,"Dec 16, 2023","They’re doing their best for usIt did take a while to get a response but I’m just glad they confirmed my order wasn’t neglected. Giada was very kind and straightforward about my issue so I’m not upset and I think you guys need a well deserved break after all you’re going through with this holiday. Hope you all have a great holiday.Date of experience: December 16, 2023",5
Anne Koneru,US,"Dec 16, 2023","Great experience working with customer serviceQuick response time. Knowledgeable staff.Date of experience: December 15, 2023",5
gary powers,CA,"Dec 14, 2023","Reviews were goodReviews were good, components are of good quality, price for what I ordered was good, computer was delivered on time, undamaged and was easy to set up. Packaging was excellent.Date of experience: November 14, 2023",5
UnrealSalty,US,"Dec 12, 2023","NZXT Support ReviewI'm sorry but I have to review NZXT but for it's support.I recently had bought a 5000$ machine off them that came with a faulty GPU, after back and fourth which lasted about 1-2 months by the way, guaranteed 6+ days per email response and on top of that calling them for support directly on their phone line will not do ANYTHING.I had provided my ticket number in another review which was '1802111' and they said they will make it their top priority, I doubt they did anything lol.Apart for a bogus ""We don't work on weekends sorry"" and than proceeding to not respond from a monday to the next monday is just ridiculous.They asked for me to send the faulty GPU itself to them so they can review it in person without sending me a replacement.. I feel like I'm being messed with intentionally, so I'm suppose to not use my computer whilst for now I have had week responses. This would 100% take over 3-4 months just to be able to get my GPU back, can you imagine 3-4 months without a computer you work on. Honestly, NEVER am I buying off NZXT again.I am still waiting on a response, it's been 6 days since I last heard from them.I'm expecting at least half of what I paid for aswell as a GPU replacement.I bought a PC for eventually it crashing several of times, losing some documents and work and so many more issues which has been happening.Complete BOGUS on NZXT side, I do not recommend. If I could rate lower, I would.Date of experience: November 17, 2023",1
Andrew O'Brien,US,"Dec 12, 2023","Terrible customer service availability…Terrible customer service availability . Not off to a good start despite the PC apparently working fine . The issue was how to open the case and remove the inside packing. You would think that was simple but Google revealed many people stumped with the same question . I called  support line only to hear that due to a high volume of calls there was no one available and I should use their chat bot (not a good sign) . I called a couple more times and eventually got in to their queue . After 30 minutes on hold , I accepted their call back option . In fact I called twice and left my number for a call back . Some 21 hours later , no call back ! I solved the issue via a post from a person with same issue .Date of experience: December 11, 2023",3
LIONEL PAVOZ,FR,"Dec 12, 2023","Products are very well made and full of…Products are very well made and full of fonctions. one fan fail and after market is very professional.Date of experience: December 12, 2023",5
