Username,location,date,content,Rating
Ulysses,DE,"Dec 20, 2024","Kein Support via TemplateMonsterKein Support via TemplateMonsterWir haben seit über 6 Wochen ein Ticket offen bei TemplateMonster.com.Kein Support, immer nur vertrösten. Wir können aber nicht weiter arbeiten.Letzte Nachricht vom 03.12.2024:----------Please accept our sincere apologies for the delay. We understand your frustration and apologize for the inconvenience caused by it.Our team has been diligently working on th reported the issue with the page transitions on your website, but the problem is more complex than initially anticipated, and standard solutions have not been effective. We are committed to resolving this as quickly as possible and are currently exploring alternative approaches.While we cannot provide an exact timeline at this moment, please rest assured that we are prioritizing this issue and will keep you updated on our progress. Your patience and understanding are greatly appreciated.Please do not hesitate to contact us if you have any questions, we will be glad to help you!----------Erstattung wurde beantragt, denn das geht überhaupt nicht, wie dieses Unternehmen sich verhält.Absolut keine Empehlung.Date of experience: December 03, 2024",1
Armia Ghali,NL,"Dec 25, 2024","Scammers I do not recommend them.Date of experience: November 27, 2024",1
Steve Blisko,US,"Feb 17, 2021","WP Elementor Not EditingHad an issue with WP elementor. Tried to reach out to Elementor staff but no response. Contacted Template Monster support (Brittney) via chat. A problem that was plaguing us since last Friday was fixed on 10 minutes. Cannot say enough about Brittney's professionalism and responsiveness.  Truly impressed. SteveDate of experience: February 17, 2021",5
Customer,GB,"Updated Aug 22, 2024","The good, the bad and the very ugly......Firstly, the theme we bought is very good, Vendy Pro.  Suits our needs perfectly and has helped our business.  I don't want to leave them but as you'll read, we might have to.The support used to be amazing but then something happened and they have become slow and quite unresponsive to emails.  I recently renewed my support for Vendy Pro on themeforest.  However, I noticed that theme has not been updated there but has been on other platforms. (templatemonster).  I have asked why the update has not been updated here and no-one answers.  I feel cheated and have wasted my money.We have finally moved on and would recommends that nobody gives them any business.  This is not how you treat loyal customersDate of experience: August 08, 2024",1
BBQ Brands,US,"Mar 11, 2021","Great service and worth asking for helpI had some random small issues from a theme I purchased that delayed my website from being complete. The customer support rep I receive was named Brittany and she was very professional and fix just about everything during our chat session. One thing requires a ticket but I feel very confident it'll be taken care of.Date of experience: March 11, 2021",5
Kourosh Nivesse,FR,"Jan 27, 2024","Really disappointed by this theme where…Really disappointed by this theme where customer service is extremely unresponsive (48 hours for a reply). And the theme is really poor quality.As I have an artistic activity, I wanted to increase the speed of my site and increase its visual appeal.It was a terrible mistake to use this theme, which gave me a site speed of 9/100, which drastically reduced my conversion rate.Then, charging around thirty dollars for 3 free applications that can easily be found on the shopify store is really a load of rubbish.Pure anarchism and I will do my utmost, if reimbursement not made to shout loud and clear at what point your platform allows crooks to sell ""service"" that does not have a regulationDate of experience: January 20, 2024",1
Eze Kingsley,NG,"Mar 29, 2023","Great support and beautiful themeI purchased their mobileX theme and I must say I am really impressed with their incredibly responsive support. Support went far and beyond just to make sure the theme was running smoothly and to my specifications. I'll surely consider Zemez products for my next project. Thanks a lotDate of experience: March 27, 2023",5
Виктория Панская,UA,"Oct 1, 2021","Perfect themesI would like to share my experience using the Shopify theme from Zemez named Vendy. This is a really great web solution. It has a lot of smart features, diverse variations of Homepages, and the Lookbook option is quite a thing for any fashion store, in my thinking. Zemez team makes a great job! They create marvelous ready-made designs that are constantly updated.Zemez team makes a great job! They create marvelous ready-made designs that are constantly updated.Many thanks to the tech support team. Always friendly and professional approachDate of experience: October 01, 2021",5
Kits and Cogs,US,"Mar 18, 2021","Fast and accurate supportAfter spending hours researching how to disable showing stock quantities and trying various combinations of custom css and changing the inventory  settings in WooCommerce without success I finally reached out to Zemez. I was not even sure if it was a theme issue or not but figured it would not hurt to ask the question. I wish I had contacted them sooner. Not only was their response quick but they were able to provide me with the custom CSS that I would not have been able to discover on my own. Great support!Date of experience: March 18, 2021",5
Julia Blake,UA,"Aug 9, 2023","Fast Response TimeI have purchased one of Zemez themes at TemplateMonster marketplace. Once I needed help with the installation and had some other customization questions, Megan helped me a lot and really quickly. Thanks to a professional team my site is up and running well. Thanks!Date of experience: July 23, 2023",5
Wdk,ES,"Jul 26, 2023","Unprofessinal Company. Do not use.Do NOT use this company. Their refund policy is trash. If you are not sure about the theme you want you have no chance for refund. Many other companies offers refund so I suggest going with another company than Zemez. I installed the theme and I didnt like it all. Hard to work with, problems and time consuming. I gave up after a day trying it and then bought another theme from another company and finished my site in a day.But they still wouldn't refund me even days after the purchase so 169 usd in the trash. Very unprofessional to treat customers like this.Date of experience: July 26, 2023",1
Lefteris Kamontos,GR,"Updated Jun 3, 2021","Joke assistance!At my first issue they replied and resolved it. After that i had a few other issues and i still have, but they never replied. I tried to chat with Zemez indicating that from the 12th of May i have two open tickets but they told me to contact the template author and open a Ticket!!! Their jet plugins are giving critical errors to my website but they dont care. Avoid them!!Date of experience: May 07, 2021",1
Lucie Svobodová,CZ,"Dec 3, 2020","EXCELLENT AND VERY HELPFUL SUPPORTThe theme is awesome and the support is even better! They were always willing to help and answered very quickly. I also appreciated their screenshots which made it really easy to understand, even for a beginner like me.It was the best choice to get their theme. The support was really EXCELLENT, and thanks to them creating a website became a great experience, thanks!!!Date of experience: December 03, 2020",5
Mara,PH,"Jun 7, 2023","Great customer supportI recently used Zemez to set up a theme for my Shopify store, and I must say, it made editing a breeze. Their theme provided an intuitive and user-friendly interface, allowing me to customize my store with ease.What impressed me the most was their exceptional customer service. Whenever I encountered any issues, especially with plugins that accidentally overwritten some code files, Zemez was always happy to help. They were responsive and promptly addressed my queries.Overall, I highly recommend Zemez. They're an excellent choice if you're looking for a reliable and supportive team to assist with you.Date of experience: June 07, 2023",5
Mikki Swanson,US,"Mar 16, 2021","Britney was awesome!I was helped by Britney today and it's been a great experience!  Despite being assisted via Chat support, it didn't feel impersonal at all.   Thanks so much for helping me with my problem so quickly, Britney! :DDate of experience: March 16, 2021",5
Cindy,BE,"Mar 1, 2022","awesome theme, best support ever !Having some difficulties but support managed to reply to all my tickets within a few minutes ! What a great service !The website is very clear, easy and userfriendly (not taking my own dumb actions in account ofcourse :-)Date of experience: March 01, 2022",5
Vici,HK,"Jul 12, 2023","I have some issues when i set up the…I have some issues when i set up the theme. The Zemez support team is very helpful and very patient to explain all the details with the images how to solve out the issues. I am very impressed with their great support and the efficiency they responded to my email. Highly recommend this !Date of experience: July 12, 2023",5
Sandra Miller Waldrop,US,"Dec 21, 2020","Help with out of date templateI updated my Wordpress and ""broke"" my ability to edit pages. I knew this template was getting out of date. Zemez provides support for Template Monster products. They were able to put in a patch to allow me to edit until I can update my website template. Very happy customer.Date of experience: December 21, 2020",5
Laura's Art Design,CA,"Jun 13, 2023","I had a few issues Installing the theme…I had a few issues Installing the theme and the Team Zemez were so patience with me and offer solutions every time. I finally was able to install it and everything is running perfect. They are great! Service is amazing. Highly recommendedDate of experience: June 12, 2023",5
JAMES K. JUNG,US,"Dec 28, 2020","Thank you Britney!I am a web designer and I purchased a Wordpress template through Template Monster. I had a problem installing the theme to my platform until customer service connected me to Zemez and Britney who helped solve my problems. Britney is super helpful. She was patient and proactive with my issues. Sometimes these inquiries need highly interactive communication and Britney was always there for me when I was trying to solve the issue step by step. I had to purchase a service to be fair to further solve my issues but I am super satisfied with Britney's fast problem solving and kindness. Thank you!Date of experience: December 28, 2020",5
Arto Abraham Tudjarian,BR,"Dec 26, 2020","Best one ever!Hi there, my companie is in Brazil, São Paulo, i didn't believe the suport could help me, but i was wrong! And they did, and has been wonderfull!!!We are getting a professional website as big companies have. Thank you so much!!!Date of experience: December 26, 2020",5
Manuel,NL,"Updated Dec 3, 2020","Support service is great!The theme is very good, but the support service is excellent! They are always willing to help you with any problem you have, Alice always helps me solve any problem and gives me many solutions. Highly recommended!Date of experience: December 03, 2020",5
Ariel Woolf,IL,"Updated Jun 7, 2021","Rude, unprofessional and unhelpfulContacted them because for some reason they responded on the ticket I had opened on TemplateMonster regarding a theme I purchased. Only after a day of chatting did they clarify that they have no connection to the theme and that everything and anything they do would be custom as they are not related to the theme. It was not clear why they were on my ticket, and they seem unfamiliar with basic ecommerce concepts like layered navigation.Also, the FB messenger rep was rude and unhelpful.Unimpressed.Date of experience: June 07, 2021",1
MARTIN MUNDUA,FR,"Feb 5, 2021","Elementor supportI could not load Elementor to update my site and used the live chat function on template monster and was speedily helped by a very responsive live agent (Britney). Very satisfying support. Thank YouDate of experience: February 05, 2021",5
Karel Oscar,NL,"Dec 29, 2020","Britney ViljoenBritney Viljoen, support agent at template monster has been helping me setting up my website, she is the textbook example of what customer support should be! Thanks again for your support!Date of experience: December 29, 2020",5
VanguardPC - André,PT,"Feb 23, 2024","Theme WordpressI purchased a theme from this company, and I needed support, which was resolved within the same day.Great Professionals, very quick response and very helpful!I recommend!Date of experience: February 23, 2024",5
Mr.Lee,TH,"Jul 19, 2021","Much appreciate contribution from Britney…Much appreciate contribution from BritneyI encounter with content in ""Home"" page didn't change after press update She support quickly and clear.ThanksDate of experience: July 19, 2021",5
Petra Bockus,CA,"May 21, 2021","Installation issues resolvedI was unable to install my recently purchased and downloaded wordpress theme. Britney, support agent, took me through step by step and resolved the issue completely with much patience.Date of experience: May 21, 2021",5
tina golding,GB,"Sep 17, 2021","Zemez are a remarkable team.Zemez are a remarkable team that provide great templates that are comprehensive and use all the unique qualities of Shopify. I had some design issues that needed their support which was provided in a timely and efficient manner solving all my problems. Unreservably recommended.Date of experience: September 17, 2021",5
Ben Taylor,GB,"Feb 7, 2023","Can't say enough good things about Zemez!I've had a few issues that I needed help with and the team has just been incredible. Nothing is too much of a problem and I couldn't be happier with the theme and service provided.Date of experience: February 07, 2023",5
Vasilis,CY,"May 30, 2022","The best Website Services company in the entire WORLD!!!The Zemez team is the best at what they do, and SUPER DUPER helpful!!!Take it from me, these guys are professional to the core!I had an issue with my website.. BAM! The Zemez team fixed it right away!!I cannot recommend them higher enough!!Super thrilled with their service!! - You will too!!!Date of experience: May 30, 2022",5
Stefan,RS,"Apr 20, 2021","Thank you Britney with implementationI had problems with implementing theme and importing demo content. With a little help of Britney i had it fixed in a matter of minutes.Fast and responsive support.Date of experience: April 20, 2021",5
Marie,FR,"Feb 20, 2023","Zemez support is very efficientZemez support is very efficient, always finds solutions in a short time. I've tested other supports, and nothing compared to Zemez's. Thanks !Date of experience: February 19, 2023",5
Mr ARTEM SYZKOV,UA,"Feb 18, 2021","Great respect for such a service!Whenever I have a question or any difficulty, the support team quickly, efficiently and courteously helps to resolve them.Great respect for such a service, guys! :)Date of experience: February 18, 2021",5
Jada Jones,US,"Jul 2, 2021","I needed to understand the process of…I needed to understand the process of adding new pages to my website and I was afforded the opportunity  to discuss this with Britney and she delivered just as i needed. ThanksDate of experience: July 02, 2021",5
T. Koroglu,US,"Oct 22, 2021","Great supportI am a layperson trying to set up a webshop for the family business and it was very crucial to receive tech support that is prompt, supportive and communicated easy understandable to me. I got it all here!Date of experience: October 22, 2021",5
Paul Musee,KE,"Jun 11, 2021","Great help wih theme installation and pluginsI just got quiet some great help from Britney. She really sorted me with a problem about theme installation and plugins. Thanks so much Britney.Date of experience: June 11, 2021",5
Halia,UA,"Oct 6, 2022","the best supportthe best support, they helped with everything, the site template(Monstroid2) is very flexible, you can customize it as you like.Date of experience: August 31, 2022",5
Kartick Gopaul,MU,"Aug 24, 2022","Zemez team is quick and reliableZemez team is quick and reliable. Had some issues installing the theme, upon their intervention it was all sorted in a swift.Date of experience: August 24, 2022",5
Sharon Thomas,GB,"Mar 29, 2021","Used them on a Prestashop module issue.Used them on a Prestashop module issue.Others failed to resolve the issue, but these guys fixed it.Perfect work, highly recommend.Date of experience: March 29, 2021",5
Manouk jr Der Stépanian,CH,"Jul 19, 2021","Amazing service from BritneyAmazing service from Britney! I add a lot of questions and she showed patience and efficiency.Really appreciate that kind of servicesDate of experience: July 19, 2021",5
Oleg,NL,"Jan 5, 2021","Thank you for fast en goaldriven support!Thank you for fast en goaldriven support! Britney solved two of my problems today and therefore I am very happy with provided support.Date of experience: January 05, 2021",5
Roelof Vredeveld,NL,"Mar 6, 2023","Perfect help!Never experienced such a great help from a template builder! Please keep up this great way or working!Date of experience: March 06, 2023",5
Shaun Barratt,GB,"Mar 4, 2021","I cannot fault the customer service…I cannot fault the customer service that I received on this occasion.Britney dealt with my problem effectively and in a prompt manner. I am extremely happy with my experience.Date of experience: March 04, 2021",5
CamilleKenton,US,"Mar 1, 2021","Britney was fantastic customer supportBritney was fantastic customer supportThank you, Britney, for helping me with my website issues.  I was quite stressed until you resolved my issues. I appreciate your support very much. Very professional and efficient.Date of experience: March 01, 2021",5
Rvigen,ID,"Mar 8, 2021","Positive impressionsI can't say that I've experienced the excitement of this service - but everything works, everything works and that's certainly great news.Date of experience: March 08, 2021",5
kitesafe.de,DE,"Mar 11, 2021","Every now and then I need supportEvery now and then I need support - and get it!All the staff is pretty friendly, fast and helpful; today I got in touch with Britney a few times and within no time --> from issue to solution.Thanks Zemez!Date of experience: March 11, 2021",5
GoEmed,US,"Dec 29, 2020","Amazing Customer serviceAmazing, Excellent service. Britney was very helpful. Got my questions answered in minutes. Thanks again, Britney!Date of experience: December 29, 2020",5
Michael,CH,"Mar 1, 2021","Britney was of great helpBritney was of great help. The Zemez team wasn't able to help me for everything, but the customer service is globally really good :)Date of experience: March 01, 2021",5
Michail Panagoulias,GR,"Dec 16, 2020","The response of support was fast and to…The response of support was fast and to the point. As well as solving our problem they even showed how they achieved it so we know how to solve the issue in the future.Date of experience: December 16, 2020",5
Charles Verghese,AE,"Jun 17, 2021","Flexible Zemez's Eco-Tech TemplateGreat template (Eco-Tech) & very flexible.  More importantly, the support team answered my queries and to my satisfaction.  Would highly recommend themDate of experience: June 17, 2021",5
Franco M,ES,"Dec 15, 2020","Very professional support!I was very happy with the support from this provider, The template is very nice and I have to admit that Mrs. Britney from the support helped me a lot. Highly recommended!Date of experience: December 15, 2020",5
D C,US,"May 17, 2024","World Class Support!Support for this page is out of this world. Extremely helpful, nice and patient. Site looks great and I was able to modify everything that I needed to make my site just how I liked it.Date of experience: May 16, 2024",5
Tom,GB,"Feb 10, 2022","The template we downloaded is really…The template we downloaded is really good. The support received from Megan was great too, would highly recommend.Date of experience: February 10, 2022",5
Colin Sullivan,US,"Updated Feb 4, 2021","Fantastic Service!Jacob was friendly and professional, and he solved my issue very quickly! I've always had great experiences with Zemez.Date of experience: February 04, 2021",5
Piotr Muszyński,PL,"Aug 11, 2021","Great supportBritney helped me a lot with 2 things that I could't do and they were crucial for my site. Fully professional support from her.Date of experience: August 11, 2021",5
Manfred Kraus,DE,"Jul 25, 2023","Zemez theme and Zemez support can only be recommended...In the beginning I had tried free theme for my Shopify store until I decided on a theme. When I wanted to buy a license of the selected theme from Zemez, I unfortunately bought it on an unauthorized site and had problems with the optimization of the site.Since the support of the unauthorized site could not help me and I came across the website of Zemez by searching for support on the web, I asked Zemez for support and learned that I bought a theme without a license.  Since I have businesses and I didn't want to use an unauthorized license, I purchased a license of the theme from Zemez and installed the theme in my Shopify store.For any question that arises about the theme, I have received a response from Zemez support with the solution. Also, when deciding which variant of the theme is best to use, I was given excellent advice by Zemez support, not only with a recommendation but also with the reason why to use this proposed theme. What stands out above all is that with the reply emails I received not only the text but also screenshots with explanations. The theme from Zemez and the support from Zemez can only be recommended.Date of experience: July 25, 2023",5
David Pence,US,"Feb 5, 2021","Megan was fast and on targetMegan was fast and on target.  Got me back up and running with my website plugin error in minutes.  Love great tech support.  Please make sure she is well cared for and stays forever!Date of experience: February 05, 2021",5
Costa Kambo,AU,"Updated Dec 21, 2022","No support whatsoeverI would like to start off by saying their is no support option where im able to speak to someone right away to help me set up my store ive looked everywhere been waiting on facebook messenger for hours also over 6 hours on the contact your author section on template monster and on instagram they told me we cant help you on here go onto fb messenger and as stated no reply their and this is all after i purchased their theme early this morning.Updated response and final.I would like to express my dissatisfaction with the purchase of the Pet Store Shopify theme. I was informed of the price of $108, however, upon completion of the purchase, I saw that $165.98 was debited from my account. There was no indication on the checkout page that this was the cost in AUD, and even Template Monsters support did not state this. When I needed help with any support questions, the only option available was to create a ticket and wait three days. I brought this issue up with Shopify, as I wanted to be sure it was not my own fault, and received a quick response as they stated it was theme issues not Shopify after all Shopify is the biggest platform in the world. My customer experience has been unpleasant, and from what I have seen, many others have had a similar experience. Your theme has major issues and your customer service should be available 24/7 for customers all over the world. Chat options should be available to provide quick responses, rather than waiting nine hours for a reply. Due to this experience, I request a full refund as soon as possible. You have not only taken my money, but also my time. I would appreciate swift action in this matter.Date of experience: December 20, 2022",1
Gordon Biersch,HK,"Mar 8, 2021","This is a great teamThis is a great team, answered questions and responded promptly, all my questions were resolved, Thanks a lot.Date of experience: March 08, 2021",5
Nicole Carter,ZA,"Dec 15, 2020","Great experienceGreat experience, had the pleasure of chatting with Jacob Donavan.He was super quick to answer any questions, very reliable and so helpful great service with wonderful results.Date of experience: December 15, 2020",5
Anas Maghraoui,MA,"May 25, 2021","Zemez assistance was so helpfullZemez assistance was so helpfull, and walked me step by step to set up my website, thank you!Date of experience: May 25, 2021",5
Maryam DY,AU,"May 17, 2021","Britney was really helpful and helped…Britney was really helpful and helped me to answer all the questions i had in regards to the template design.Date of experience: May 17, 2021",5
Fiona McGuire,IE,"May 3, 2021","I have received the most amazing supportI have received the most amazing support from these guys. there was an issue with the first template I bought from them and they went out of their way to solve it for me. I cannot rate them highly enough. Great service!Date of experience: May 03, 2021",5
Lorenzo Mastroluca,IT,"Jun 15, 2021","I just got a lot of help from BritneyI just got a lot of help from Britney. She really solved me with a plugin licensing issue. Thank you so much Britney.Date of experience: June 15, 2021",5
Onyx Technologies,CA,"Dec 11, 2020","Britney solved it in 5 minsBritney solved it in 5 mins! Seriously, lost 2 days on an issue and Britney solved everything in 5 minutes. Kudos Britney! Thanks!Date of experience: December 11, 2020",5
Chris Freeman,US,"Dec 2, 2020","Thanks for the helpThanks for the help. It was late night and i was exhausted. Could not find the answers on the web, and Alice got my access to the old files and the correct settings. Awesome, back in business!Date of experience: December 02, 2020",5
Mohamed Ajana,MA,"Jan 27, 2021","Amazing and available supportAmazing and available support, solved all my issues and keeps answering fast and helping me with my website, higly recommand them.Date of experience: January 27, 2021",5
